Ref,Spider,Name,Address,City,State,Zipcode,Country,Phone,Website,Hours,Brand,WikiData
8984708,baskin_robbins_in,Baskin Robbins,"Ground floor , MGF Metropolitian Mall , MG Road ( Metro Gate- 2), Gurugram, H.R- 122002",Gurgaon,Delhi/NCR,,IN,+91 95998 04595,,,Baskin Robbins,Q584601
8984693,baskin_robbins_in,Baskin Robbins,"Baskin Robbins, Ground floor, DLF City Centre, Sec-28, MG Road, Gurgaon - 122002",Gurgaon,Delhi/NCR,,IN,+91 98109 03171,,,Baskin Robbins,Q584601
8984877,baskin_robbins_in,Baskin Robbins,"LGF-D-30, Sushant Shopping Arcade, Sushant Lok Phase -1, Gurgaon, Haryana-122002",Gurgaon,Delhi/NCR,,IN,+91 99991 33751,,,Baskin Robbins,Q584601
8984694,baskin_robbins_in,Baskin Robbins,"Baskin Robbins , Ground Floor , DT Mega Mall , DLF Phase 1, Golf Coarse road, Opposite Sikanderpur Metro station, Gurgaon, Haryana 122002",Gurgaon,Delhi/NCR,,IN,+91 98109 03171,,,Baskin Robbins,Q584601
8984696,baskin_robbins_in,Baskin Robbins,"A-2, Qutab Plaza, Commercial Complex, DLF City Phase-1, Gurugram, Haryana-122002",Gurgaon,Delhi/NCR,,IN,+91 93104 30331,,,Baskin Robbins,Q584601
8984880,baskin_robbins_in,Baskin Robbins,"Under Sector 42-43 Metro Station, Golf Course Road, Next to Gardini. GurgaonÊ",Gurgaon,Delhi/NCR,,IN,+91 97174 10666,,,Baskin Robbins,Q584601
