Ref,Spider,Name,Address,City,State,Zipcode,Country,Phone,Website,Hours,Brand,WikiData
O-001,aristocrazy_es,Aristocrazy Las Rozas Outlet,,Madrid,Madrid,,ES,+34 916 40 58 72,,Mo-Su 10:00-21:00,Aristocrazy,Q117802848
ASICS Factory Outlet Las Rozas Style,asics_eu,ASICS Factory Outlet Las Rozas Style,,Las Rozas,Madrid,,ES,+34 916 50 09 14,,,Ascis Factory Outlet,Q327247
ASICS Factory Outlet Las Rozas Village,asics_eu,ASICS Factory Outlet Las Rozas Village,,Madrid,Madrid,,ES,+34 674 88 13 11,,,Ascis Factory Outlet,Q327247
26901,burgerking,Burger King,,Las Rozas,Madrid,,ES,+34 628 74 94 14,,Mo-Th 12:00-23:30; Fr-Sa 12:00-01:00; Su 12:00-00:00,Burger King,Q177054
239225,crocs_eu,Crocs Outlet Las Rozas Madrid,,Las Rozas de Madrid,Madrid,,ES,,,,Crocs,Q926699
https://local.fedex.com/#1018306270,fedex,,,Las Rozas De Madrid,Madrid,,ES,,https://local.fedex.com/es-es/las-rozas-de-madrid/rozlm,,FedEx,Q459477
https://local.fedex.com/#1031994017,fedex,,,Las Rozas De Madrid,Madrid,,ES,,https://local.fedex.com/es-es/las-rozas-de-madrid/roz6e,,FedEx,Q459477
https://local.fedex.com/#1031994218,fedex,,,Las Rozas De Madrid,Madrid,,ES,,https://local.fedex.com/es-es/las-rozas-de-madrid/roz3v,,FedEx,Q459477
https://local.fedex.com/#1018306145,fedex,,,Las Rozas De Madrid,Madrid,,ES,,https://local.fedex.com/es-es/las-rozas-de-madrid/roz1t,,FedEx,Q459477
177,mcdonalds_es,Pinar de las Rozas,"Centro Comercial Pinar | Ctra. Nacional VI, Km. 22",Las Rozas,Madrid,,ES,+34 916 37 36 57,,Mo-Su 10:30-23:00,McDonald's,Q38076
S270,vans,VANS Outlet Madrid Las Rozas,,Madrid,Madrid,,ES,+34 916 40 09 05,https://www.vans.com/en-us/stores/madrid/madrid/s270,Mo-Fr 10:00-21:00; Sa 10:00-22:00; Su 10:00-21:00,Vans,Q1135366
