Ref,Spider,Name,Address,City,State,Zipcode,Country,Phone,Website,Hours,Brand,WikiData
vba_377g,department_veterans_affairs,Integrated Disability Evaluation System (IDES) Site at Naval Medical Center San Diego,,San Diego,CA,,US,+1 619-532-6635,,,Department Veterans Affairs,Q592576
vba_377h,department_veterans_affairs,VA Regional Benefit Satellite Office at Naval Medical Center San Diego,,San Diego,CA,,US,+1 619-532-5122,https://www.benefits.va.gov/sandiego/,,Department Veterans Affairs,Q592576
https://restaurants.subway.com/#14913539,subway,Subway Naval Medical Center,,San Diego San Diego,CA,,US,+1 619-696-0005,https://restaurants.subway.com/united-states/ca/san-diego/34800-bob-wilson-dr,Mo 06:00-24:00; Tu 07:00-22:00; Fr-Sa 00:00-22:00; Su 08:00-22:00,Subway,Q244457
1433091,usps,NAVAL HOSPITAL,,SAN DIEGO,CA,,US,+1 619-532-8491,,Mo-Fr 09:00-13:00,United States Postal Service,Q668687
,visa,,,SAN DIEGO,CA,,US,,,,,
