Ref,Spider,Name,Address,City,State,Zipcode,Country,Phone,Website,Hours,Brand,WikiData
1039795,alamo,Gaziantep Airport Domestic Terminal,,Gaziantep,,,TR,+90 342 582 11 50,,,ALAMO,Q1429287
1039796,alamo,Gaziantep Airport Intl. Terminal,,Gaziantep,,,TR,+90 342 582 11 50,,,ALAMO,Q1429287
GZTT61,enterprise,Gaziantep Airport -  Domestic Terminal,,Gaziantep,,,TR,+90 342 336 77 18,,,Enterprise Rent-A-Car,Q17085454
GZTC61,enterprise,Gaziantep Airport -  Intl. Terminal,,Gaziantep,,,TR,+90 342 336 77 18,,,Enterprise Rent-A-Car,Q17085454
73593654,moneygram,POSTA VE TELGRAF TESKILATI ANONIM SIRKET,,GAZIANTEP,,,TR,+90 342 571 30 01,,Mo-Fr 08:30-17:30; Sa-Su 00:00-24:00,MoneyGram,Q1944412
1039819,national,Gaziantep Airport Domestic Terminal,,Gaziantep,,,TR,+90 342 582 11 50,,,NATIONAL,Q1424142
1039820,national,Gaziantep Airport Intl. Terminal,,Gaziantep,,,TR,+90 342 582 11 50,,,NATIONAL,Q1424142
,visa,,,GAZIANTEP,,,TR,,,,,
