Ref,Spider,Name,Address,City,State,Zipcode,Country,Phone,Website,Hours,Brand,WikiData
73764056,moneygram,IBN AL HAJJ FOR EXCHANGE - IBB BRANCH,,IBB,,,YE,+967 4 441 766,,24/7,MoneyGram,Q1944412
73770561,moneygram,ABDULLAH IBN AL WKAEL FOR EXCHANGE - IBB,,IBB,,,YE,+967 4 426 700,,24/7,MoneyGram,Q1944412
73770574,moneygram,ALTAJ MONEY FOR EXCHANGE - IBB BRANCH,,IBB,,,YE,+967 4 428 305,,24/7,MoneyGram,Q1944412
73770587,moneygram,AZZAM AL ALAWI FOR EXCHANGE - AL HUDAYDA,,AL HUDAYDAH,,,YE,+967 3 350 019,,24/7,MoneyGram,Q1944412
73833848,moneygram,AL FARIQ FOR EXCHANGE - HAJJAH BRANCH,,HAJJAH,,,YE,+967 7 250 703,,24/7,MoneyGram,Q1944412
74105371,moneygram,TAWASUL ONLINE FOR EXCHANGE - ALBAYDA BR,,ALBAYDA,,,YE,+967 1 542 299,,24/7,MoneyGram,Q1944412
74122448,moneygram,ADWA AL AMAL FOR EXCHANGE - DHAMAR BRANC,,DHAMAR,,,YE,433712,,24/7,MoneyGram,Q1944412
70699904,moneygram,ALMORISI FOR EXCHANGE COMPANY - DHAMMAR,,DHAMMAR CITY,,,YE,427120,,24/7,MoneyGram,Q1944412
