Ref,Spider,Name,Address,City,State,Zipcode,Country,Phone,Website,Hours,Brand,WikiData
https://vertretung.allianz.de/agentur-a.grimmeissen/,allianz_de,Allianz Versicherung Arnulf Grimmeißen GENERALVERTRETUNG,,Fremdingen,,,DE,+49 9086 90003,https://vertretung.allianz.de/agentur-a.grimmeissen/,,Allianz SE,Q487292
https://vertretung.allianz.de/agentur.uhl/,allianz_de,Allianz Versicherung Engelbert Uhl GENERALVERTRETUNG,,Fremdingen,,,DE,+49 9086 90000,https://vertretung.allianz.de/agentur.uhl/,Mo-Fr 08:00-16:30,Allianz SE,Q487292
30238,sparkasse_de,Sparkasse Donauwörth Geldautomat Fremdingen,,Fremdingen,,,DE,+49 906 781781,https://www.sparkasse.de/standorte/geldautomaten/sparkasse-donauwoerth-geldautomat-fremdingen-30238,24/7,Sparkasse,Q13601825
11440,sparkasse_de,Sparkasse Donauwörth Geschäftsstelle Fremdingen,,Fremdingen,,,DE,+49 906 781570,https://www.sparkasse.de/standorte/filialen/sparkasse-donauwoerth-geschaeftsstelle-fremdingen-11440,"Tu 09:30-12:30,14:00-16:00; Fr 09:30-12:30,14:00-16:00",Sparkasse,Q13601825
,visa,,,FREMDINGEN,,,DE,,,,,
https://www.vr.de/standorte/F/raiffeisen-volksbank-ries-eg-geschaeftsstelle-fremdingen-10240.html,vr_bank,Raiffeisen-Volksbank Ries eG Geschäftsstelle Fremdingen,,Fremdingen,,,DE,+49 9081 80196250,https://www.rvbankries.de,,,
