Ref,Spider,Name,Address,City,State,Zipcode,Country,Phone,Website,Hours,Brand,WikiData
73527426,moneygram,THIEN GOLD SILVER ONE MEMBER CO. LTD -,,HAU GIANG,,,VN,+84 293 3993 297,,Mo-Su 07:00-23:00,MoneyGram,Q1944412
73566225,moneygram,PHUONG HOANG GOLD SHOP BUSINESS SERVICE,,HAU GIANG,,,VN,+84 968 949 212,,Mo-Su 07:00-23:00,MoneyGram,Q1944412
73613673,moneygram,HUYNH VAN BAC PRIVATE COMPANY - #L37 - H,,HAU GIANG,,,VN,9100002933879211,,Mo-Su 07:00-23:00,MoneyGram,Q1944412
73621872,moneygram,HOANG DUNG GOLD SHOP CO. LTD - #N39 - H,,HAU GIANG,,,VN,+84 914 761 434,,Mo-Su 07:00-23:00,MoneyGram,Q1944412
73635318,moneygram,TINH PHUONG GOLD SHOP PRIVATE COMPANY -,,HAU GIANG,,,VN,+84 989 671 917,,Mo-Su 07:00-23:00,MoneyGram,Q1944412
73655819,moneygram,KIM NGOC XUAN TUYET GOLD SHOP CO. LTD -,,HAU GIANG,,,VN,+84 293 3866 861,,Mo-Su 07:00-23:00,MoneyGram,Q1944412
73655369,moneygram,KIM SON LONG THANH GOLD SHOP PRIVATE COM,,HAU GIANG,,,VN,+84 293 3868 232,,Mo-Su 07:00-23:00,MoneyGram,Q1944412
73656630,moneygram,KIM LAN GOLD SHOP PRIVATE COMPANY - #MJ9,,HAU GIANG,,,VN,+84 293 3572 300,,Mo-Su 07:00-23:00,MoneyGram,Q1944412
73656643,moneygram,KIM BINH GOLD SHOP PRIVATE COMPANY - #N1,,HAU GIANG,,,VN,+84 293 3874 377,,Mo-Su 07:00-23:00,MoneyGram,Q1944412
73656627,moneygram,KIM NGAN GOLD SILVER SHOP PRIVATE COMPAN,,HAU GIANG,,,VN,+84 293 3559 939,,Mo-Su 07:00-23:00,MoneyGram,Q1944412
73682617,moneygram,NGOC TUAN PRIVATE COMPANY - #L66 - HAU G,,HAU GIANG,,,VN,+84 838 356 605,,Mo-Su 07:00-23:00,MoneyGram,Q1944412
73689665,moneygram,NGOC MAI JEWELRY ONE MEMBER CO. LTD - #,,HAU GIANG,,,VN,+84 293 3986 172,,Mo-Su 07:00-23:00,MoneyGram,Q1944412
73690243,moneygram,NGUYEN LAM GOLD SHOP PRIVATE COMPANY - #,,HAU GIANG,,,VN,+84 293 3849 279,,Mo-Su 07:00-23:00,MoneyGram,Q1944412
73691899,moneygram,DONG HUE DONG BAO PRIVATE COMPANY - #H75,,HAU GIANG,,,VN,+84 293 3871 339,,Mo-Su 07:00-23:00,MoneyGram,Q1944412
73714103,moneygram,NGUYEN THI LE HANG PRIVATE COMPANY - #MM,,HAU GIANG,,,VN,+84 293 3569 010,,Mo-Su 07:00-23:00,MoneyGram,Q1944412
73759618,moneygram,NGUYEN VAN THUONG PHUONG GOLD SHOP PRIVA,,HAU GIANG,,,VN,+84 293 3565 168,,Mo-Su 07:00-23:00,MoneyGram,Q1944412
73760720,moneygram,ANH XUAN LIMITED COMPANY - #P57 - HAU GI,,HAU GIANG,,,VN,+84 293 3875 040,,Mo-Su 07:00-23:00,MoneyGram,Q1944412
73850669,moneygram,MINH NGHIA MY HANH GOLD SILVER CO. LTD,,HAU GIANG,,,VN,+84 762 959 595,,Mo-Su 07:00-23:00,MoneyGram,Q1944412
74339972,moneygram,KIM YEN GOLD SILVER ONE MEMBER CO.LTD -,,HAU GIANG,,,VN,+84 939 888 924,,Mo-Su 07:00-23:00,MoneyGram,Q1944412
73698960,moneygram,BA NANG GOLD SHOP PRIVATE COMPANY - #ML0,,HAU GIANG,,,VN,+84 918 495 486,,Mo-Su 07:00-23:00,MoneyGram,Q1944412
