City,Place Name,Zipcode,Name
Boeng Salang,western_union,,unknown,MANITA
Boeng Keng Kang Ti Bei,western_union,,unknown,BOENG TRABAEK BRANCH
Boeng Kak Ti Pir,western_union,,unknown,CAMBO ECHANGE
Phsar Depou Ti Bei,western_union,,unknown,HUY SOKLIDA
Ou Ruessei Ti Pir,western_union,,unknown,KIM CHETHA
Tonle Basak,western_union,,unknown,CAMBODIA POST- AEON
Mittapheap,western_union,,unknown,LY MEY
Chey Chummeah,western_union,,unknown,CAB- RIVERSIDE I OUTLET
Phsar Kandal Ti Muoy,western_union,,unknown,CAB- RIVERSIDE II OUTLET
