Ref,Spider,Name,Address,City,State,Zipcode,Country,Phone,Website,Hours,Brand,WikiData
69cfb4e1-da83-43ab-9720-e6c50b2acc39,scania,Scania Hispania S.A. Delegacion Leon,,Leon-Santovenia de la Valdoncina ,,,ES,+34 987 34 64 51,,Mo-Fr 08:00-19:00; Sa 08:30-13:30,Scania,Q219960
ES_EXT_2984,totalenergies,LAS ARENAS,,VALVERDE DE LA VIRGEN,,,ES,,https://store.totalenergies.fr/en_EN/ES_EXT_2984,,Cepsa,Q608819
ES_EXT_2985,totalenergies,E.S. ICARIA,,VALVERDE DE LA VIRGEN,,,ES,,https://store.totalenergies.fr/en_EN/ES_EXT_2985,,Cepsa,Q608819
EXT_CE_02527,totalenergies,ROBLEDO DE LA VALDONCINA II,,VALVERDE DE LA VIRGEN,,,ES,,https://store.totalenergies.fr/en_EN/EXT_CE_02527,,Cepsa,Q608819
EXT_CE_02533,totalenergies,ROBLEDO DE LA VALDONCINA I,,VALVERDE DE LA VIRGEN,,,ES,,https://store.totalenergies.fr/en_EN/EXT_CE_02533,,Cepsa,Q608819
