Ref,Spider,Name,Address,City,State,Zipcode,Country,Phone,Website,Hours,Brand,WikiData
8985057,baskin_robbins_in,Baskin Robbins,"Baskin Robbins, Plot No 7, Ground F, loor Beside Seeds School, Opp South Park Apartment, Gulmohar - Nallagandla Fly Over Road, Serilingampally, Hyderabad 500019",Hyderabad,Telangana,,IN,+91 88867 99977,,,Baskin Robbins,Q584601
https://www.dominos.co.in/store-locations/hyderabad/srilingampally,dominos_pizza_in,Dominos Pizza SRILINGAMPALLY,"Upper Ground FloorPlot No. 85, Survey No. 103 1, SRILINGAMPALLY (ANDHRA PRADESH), HYDERABAD, Telangana - 500019",Hyderabad,Telangana,,IN,+91 22 2632 6699,https://www.dominos.co.in/store-locations/hyderabad/srilingampally,,Domino's Pizza,Q839466
https://www.dominos.co.in/store-locations/hyderabad/nalagandla-hyderabad,dominos_pizza_in,Dominos Pizza NALAGANDLA HYDERABAD,First Floor Plot NO 9 C Nallangandla Village Under GHMC Serilingampally Mandal Opposite Apama Cyber Ranga Reddy District Hyderabad Telangana-500019,Hyderabad,Telangana,,IN,+91 22 2632 6699,https://www.dominos.co.in/store-locations/hyderabad/nalagandla-hyderabad,,Domino's Pizza,Q839466
08c24ec0f67523afc468a51ff82fdcf8,western_union,M S SRI LAKSHMI COMMUNICATIONS,,Rangareddy,TELANGANA,,IN,(+91) 40-8106933577,https://location.westernunion.com/in/telangana/rangareddy/08c24ec0f67523afc468a51ff82fdcf8,Mo-Su 09:30-23:30,Western Union,Q861042
cf2d232e09a4807695794d57275b5cf6,western_union,MUTHOOT FINANCE LTD,,Serilingmapalli,TELANGANA,,IN,+91 40 2301 0199,https://location.westernunion.com/in/telangana/serilingmapalli/cf2d232e09a4807695794d57275b5cf6,Mo-Su 07:00-19:00,Western Union,Q861042
