Ref,Spider,Name,Address,City,State,Zipcode,Country,Phone,Website,Hours,Brand,WikiData
9,kfc_my,KFC SG DUA,"No 559, Jalan Sungai Dua Sri Saujana 11700 Penang",,Penang,,MY,+60 4-653 0172,,Mo-Su 08:00-23:00,KFC,Q524757
14,kfc_my,KFC BAYAN BARU,"No. 34G, Jalan Mahsuri, Bandar Baru Bayan, 11950 Bayan Baru Penang ",,Penang,,MY,+60 4-645 6575,,Mo-Su 08:00-24:00,KFC,Q524757
19,kfc_my,KFC BANDAR BARU FARLIM,"16D Lebuhraya Thean Tek Farlim Business Centre, 11060 Bandar Baru Farlim, Penang",,Penang,,MY,+60 4-835 0947,,Mo-Su 08:00-23:00,KFC,Q524757
29,kfc_my,KFC MIDLANDS,"Lot 488B-G-45, Midlands Park Centre, Jalan Burma, 10350 Pulau Pinang",,Penang,,MY,+60 4-217 0709,,Mo-Su 11:00-22:00,KFC,Q524757
31,kfc_my,KFC INDERAWASIH,"Ground & First Floor No.12, Medan Kikik Satu Taman Inderawasih 13600 Prai, Penang",,Penang,,MY,+60 4-398 8834,,Mo-Su 11:00-22:00,KFC,Q524757
37,kfc_my,KFC PADANG LALLANG,"NO 1390 Jalan Padang Lallang, Taman Sri Rambai, 14000 Bukit Mertajam Pulau Pinang",,Penang,,MY,+60 4-530 4677,,Mo-Su 10:00-22:00,KFC,Q524757
48,kfc_my,"KFC JELUTONG, PENANG","37 - J , Lot 20 Jalan Lenggong 11600 Pulau Pinang",,Penang,,MY,+60 4-280 4590,,Mo-Su 10:00-19:00,KFC,Q524757
57,kfc_my,KFC KEPALA BATAS 2,"No 2 Lorong Usahawan 2, Pusat Perniagaan Kepala Batas 03200 Kepala Batas Penang",,Penang,,MY,+60 4-575 2329,,Mo-Su 10:00-23:00,KFC,Q524757
102,kfc_my,KFC TELUK KUMBAR,"Lot No. 40, Changkat Bukit Belah, Telur Kumbar 11920 Bayan Lepas",,Penang,,MY,+60 4-649 1645,,Mo-Su 12:00-22:00,KFC,Q524757
182,kfc_my,KFC BERTAM DT,"Lot No. 22529, Jalan Bertam Mukim 6, 13200 Kepala Batas, Seberang Prai Utara",,Penang,,MY,+60 4-576 7898,,Mo-Su 11:00-21:30,KFC,Q524757
183,kfc_my,KFC BUKIT MERTAJAM DT,"Lot 10019, Mukim 10, Jln Song Ban Kheng, Bukit Mertajam, Seberang Prai Tengah, Pulau Pinang",,Penang,,MY,+60 4-530 2309,,Mo-Su 10:00-23:00,KFC,Q524757
187,kfc_my,KFC GREENLANE PULAU PINANG DT,"Lot 559 Jalan Masjid Negeri, Greenlane 11500 Penang",,Penang,,MY,+60 4-638 0454,,Mo-Su 08:00-23:00,KFC,Q524757
188,kfc_my,KFC JALAN BARU DT,"Lot No. 671, Mukim 6, Jalan Baru, Seberang Perai Tengah 14000 Bukit Mertajam",,Penang,,MY,+60 4-383 0793,,Mo-Su 11:00-23:00,KFC,Q524757
190,kfc_my,KFC JURU AUTO CITY,"Drive Thru Auto City Juru, Unit 10, Highway Auto, North South Highway, Juru Interchange, Prai 13600 Pulau Pinang",,Penang,,MY,+60 4-505 4171,,24/7,KFC,Q524757
198,kfc_my,KFC PETRONAS SEBERANG JAYA DT,"Petronas Service Station ( PPS Bandar Sunway ) Lot 5494 / 5729, Mukim 1, Bandar Sunway, Seberang Jaya, Prai 13700 Pulau Pinang",,Penang,,MY,+60 4-398 5643,,Mo-Su 08:00-00:00,KFC,Q524757
199,kfc_my,KFC RAJA UDA BUTTERWORTH,"No: 62 & 64,Ground Floor, Jalan Raja Uda, 12300 Butterworth, Pulau Pinang.",,Penang,,MY,+60 4-313 6199,,Mo-Su 10:00-23:00,KFC,Q524757
205,kfc_my,KFC TANJUNG TOKONG DT,"No. 10-8-01 Presint 10, Jalan Tanjung Tokong 10470 Tanjung Tokong",,Penang,,MY,+60 4-890 9663,,Mo-Su 10:00-23:00,KFC,Q524757
317,kfc_my,KFC BALIK PULAU,"No.21 Jln Tun Sardon, MK6 Balik Pulau 11000 Pulau Penang",,Penang,,MY,+60 4-869 2674,,Mo-Su 12:00-21:00,KFC,Q524757
318,kfc_my,KFC DESA RIA SG ARA,No 306A Jalan Dato Ismail Hashim Sungai Ara Bayan Lepas 11900 Pulau Pinang,,Penang,,MY,+60 4-611 9604,,Mo-Su 10:00-22:00,KFC,Q524757
319,kfc_my,KFC NIBONG TEBAL,"3910 Jalan Che Ahmad, Pusat Perniagaan Bandar Nibong Tebal 14300 Nibong Tebal",,Penang,,MY,+60 4-593 6498,,Mo-Su 10:00-22:00,KFC,Q524757
320,kfc_my,KFC SIMPANG AMPAT,"Lot No 6GF & 8GF & 1st Floor, Jalan Keruing , Kawasan Perindustrian Simpang Ampat 14100 Simpang Ampat Penang",,Penang,,MY,+60 4-588 7617,,Mo-Su 11:00-23:00,KFC,Q524757
321,kfc_my,KFC SG BAKAP,"No 36 Jalan Gemalan Indah1, Taman Gemalan Indah 14200 Sungai Bakap, Seberang Prai Selatan",,Penang,,MY,+60 4-582 3597,,Mo-Su 10:00-22:00,KFC,Q524757
322,kfc_my,KFC SETIA SENTRAL JURU DT,"Plot 32, Setia Sentral Juru, Juru Rest & Service Area Southbound 13600 Lebuhraya Utara Selatan",,Penang,,MY,+60 4-202 0247,,Mo-Su 10:00-21:00,KFC,Q524757
323,kfc_my,KFC TAMAN BUKIT MINYAK,No 1 Tgkt Bukit Minyak 7 Taman Bukit Minyak Bukit Mertajam 14000 Pulau Pinang,,Penang,,MY,+60 4-508 9469,,Mo-Su 10:00-22:00,KFC,Q524757
324,kfc_my,KFC BAGAN AJAM DT,"Lot No 35, Jalan Bagan Ajam, Seksyen 1, 13000 Bandar Butterworth, Seberang Perai Utara, Pulau Pinang.",,Penang,,MY,+60 4-323 8825,,24/7,KFC,Q524757
325,kfc_my,KFC BUTTERWORTH,No 4423 & 4424 Jalan Bagan Luar 12000 Butterworth,,Penang,,MY,+60 4-323 9289,,Mo-Su 10:00-23:00,KFC,Q524757
327,kfc_my,KFC BATU LANCHANG,Lot G-1 The Gallery Kompleks Perniagaan Seri Damai Medan Batu Lanchang 11600 Penang,,Penang,,MY,+60 4-202 0244,,Mo-Su 10:00-22:30,KFC,Q524757
453,kfc_my,KFC QUEENS BAY MALL,"GF 12A, Queensbay Mall, 100, Persiaran Bayan Indah, Bayan Lepas 11900 Pulau Pinang",,Penang,,MY,+60 11-2347 9637,,Mo-Su 10:00-22:00,KFC,Q524757
454,kfc_my,KFC AEON BUKIT MERTAJAM,"Lot No. G01 & G01A, AEON Mall Alma, 14000 Bukit Mertajam Penang",,Penang,,MY,+60 4-536 0720,,Mo-Su 10:00-20:00,KFC,Q524757
455,kfc_my,KFC LOTUSS BUKIT MERTAJAM,"Lot G-04 & G-05, Tesco Bukit Mertajam, 2323 Jalan Rozhan, Pusat Perniagaan Seri Impian Alma 14000 Bukit Mertajam, Penang",,Penang,,MY,+60 4-548 3280,,Mo-Su 10:00-21:30,KFC,Q524757
456,kfc_my,KFC MEGAMALL PENANG,"G-103, Ground Floor, Megamall Pinang, 2828 Jalan Baru, Bandar Prai Jaya, Seberang Prai Tengah 13600 Pulau Pinang",,Penang,,MY,+60 4-398 9485,,Mo-Su 10:00-20:00,KFC,Q524757
457,kfc_my,KFC LOTUSS EXTRA PRAI,"Lot G2, Ground Floor Tesco Extra Prai Prai 13700 Pulau Pinang",,Penang,,MY,+60 4-398 5614,,Mo-Su 10:00-21:30,KFC,Q524757
458,kfc_my,KFC LOTUSS TG PINANG,"Lot G07 & G08, Lotuss Tanjung Pinang, Jalan Tanjong Tokong, 10470 Penang",,Penang,,MY,+60 4-893 1563,,Mo-Su 09:30-22:00,KFC,Q524757
473,kfc_my,KFC SG AVENUE 2,"Lot 10, Lorong Perniagaan, Pusat Perniagaan Sg Dua R2 Avenue, 13800 Butterworth, Pulau Pinang.",,Penang,,MY,+60 4-356 3125,,Mo-Su 08:00-23:00,KFC,Q524757
557,kfc_my,KFC BUKIT JAMBUL,"26368-T, 3A-G-18, Kompleks Bukit Jambul, Jalan Rumbia , 11900 Pulau Pinang",,Penang,,MY,+60 4-611 0072,,Mo-Su 11:00-22:00,KFC,Q524757
590,kfc_my,KFC ALMA BUKIT MERTAJAM,"NO 2877 Ground & 1st Floor, Jalan Rozhan, Pusat Perniagaan Rozhan, Alma 14000 Bukit Mertajam Pulau Pinang",,Penang,,MY,+60 4-551 2432,,Mo-Su 10:30-22:00,KFC,Q524757
591,kfc_my,KFC LOTUSS JELUTONG,"Lot 6 Ground Floor Tesco Penang, Lot A3 - 4, Jalan Udini 11700 Pulau Pinang",,Penang,,MY,+60 4-657 7758,,Mo-Su 10:00-19:30,KFC,Q524757
592,kfc_my,KFC SUNWAY WELLESEY,"Lot No. 7, (Ground& 1st Floor) & 9(Ground Floor Only), Sunway Wellesley, Jalan Muthu Palaniappan 14000 Bukit Mertajam",,Penang,,MY,+60 4-537 6793,,Mo-Su 10:00-23:00,KFC,Q524757
594,kfc_my,KFC KOMTAR,"Unit B 11, 3.07 Second Floor, Kompleks Tun Abdul Razak, 10000 Pulau Pinang",,Penang,,MY,+60 4-226 1745,,Mo-Su 08:00-20:00,KFC,Q524757
595,kfc_my,KFC EDEN PARADE,G5 & EP - G6 Eden Parade Batu Feringghi 11100 Pulau Pinang,,Penang,,MY,+60 4-884 0512,,Mo-Su 12:00-21:00,KFC,Q524757
597,kfc_my,KFC GIANT BAYAN BARU,"Lot G05, Ground Floor, Giant Hypermarket Bayan Baru 11900, Penang",,Penang,,MY,+60 4-611 9761,,Mo-Su 10:00-22:00,KFC,Q524757
720,kfc_my,KFC AMANPUTRA KEPALA BATAS,"Lot No.39, Lorong Amanputra 1, Taman Amanputera, 13200 Kepala Batas Pulai Pinang",,Penang,,MY,+60 4-575 0811,,Mo-Su 15:00-21:00,KFC,Q524757
757,kfc_my,KFC BALIK PULAU DT,"No 2A, Jalan Sungai Rusa, Balik Pulau, 11000 Pulau Pinang",,Penang,,MY,+60 4-869 3725,,Mo-Su 12:00-22:00,KFC,Q524757
861,kfc_my,"KFC GURNEY PLAZA, PENANG","PLAZA GURNEY, PERSIARAN GURNEY, 10250 PENANG",,Penang,,MY,+60 4-226 3706,,Mo-Su 10:00-22:00,KFC,Q524757
