City,Place Name,Zipcode,Name
SANTA ROSA DE COPAN,visa,,unknown,unknown
LA ENTRADA,visa,,unknown,unknown
SANTA ROSA,visa,,unknown,unknown
RUINAS,visa,,unknown,unknown
La Entrada,western_union,,unknown,FICOHSA TENGO F SIMAN LA ENTRADA 3
Nueva Arcadia,western_union,,unknown,FICOHSA TENGO MIRNA CRISOSTOMO
Cucuyagua,western_union,,unknown,9867 BANCO AZTECA DAZ CUCUYAGUA
Santa Rosa De Copan,western_union,,unknown,FICOHSA AGN PLAZA SANTA ROSA SRC
La Union,western_union,,unknown,FICOHSA TENGO JUAN TABORA SAAVEDRA
Naco,western_union,,unknown,FICOHSA VTN LEAR SPS
Florida,western_union,,unknown,BP CORRESPONSAL OSMAN LOPEZ
Corquin,western_union,,unknown,S Y L ECO-FERRETERO
San Juan De Opoa,western_union,,unknown,BP-CORRESPONSAL CARLOS CRUZ
San Pedro De Copan,western_union,,unknown,BP CORRESPONSAL LUIS ABREGO
Santa Rosa,western_union,,unknown,IDH AGENCIA SANTA ROSA DE COPAN
Copan Ruinas,western_union,,unknown,BP CORRESPONSAL ELSA LANDAVERRY
Copan,western_union,,unknown,52 LC COPAN - PLAZA ALVARADO 504
Santa Rita De Copan,western_union,,unknown,AIRPAK HERMANDAD DE HONDURAS O
Dulce Nombre,western_union,,unknown,FICOHSA TENGO GERMAN MELGAR DUARTE
Dulce Nombre De Copan,western_union,,unknown,HERMANDAD DE HON DULCE NOMBRE DE COPAN
Dulce Nombre Copan,western_union,,unknown,3A08 OCOTEPEQUE DULCE NOMBRE COPAN
Trinidad De Copan,western_union,,unknown,BP CORRESPONSAL ELMAN TABORA
San Nicolas,western_union,,unknown,BP-CORRESPONSAL RAMON MEJIA 3
La Entrada Copan,western_union,,unknown,FICOHSA TENGO KIELSA K138
La Entrada Cop�n,western_union,,unknown,IDH AGENCIA LA ENTRADA COPAN
La Jigua,western_union,,unknown,BP-CORRESPONSAL ELDA PINEDA
San Antonio,western_union,,unknown,BP CORRESPONSAL CESAR VILLANUEVA
Cabanas,western_union,,unknown,3A03 OCOTEPEQUE CABANAS
Santa Rita,western_union,,unknown,BP CORRESPONSAL GERMAN DESTEPHEN
Santa Rita Copan,western_union,,unknown,FICOHSA TENGO F SIMAN SANTA RITA COPAN 1
Ruinas De Copan,western_union,,unknown,3A03 OCOTEPEQUE COPAN RUINAS
El Paraiso,western_union,,unknown,BP CORRESPONSAL GLADIS MEMBRENO
Ruinas,western_union,,unknown,HERMANDAD DE HONDURAS OPDF
San Agustin,western_union,,unknown,FICOHSA TENGO ADA FUENTES CONTRERAS
