City,Place Name,Zipcode,Name
Vladimir,audi,Traktornaya 33 600026 Vladimir,unknown,AC Vladimir
Владимир,coffee_like,ул.Верхняя Дуброва 38ж,unknown,Coffee Like
Владимир,coffee_like,ул. Тракторная 45,unknown,Coffee Like
Владимир,coffee_like,ул. Большая Московская 19,unknown,Coffee Like
Владимир,coffee_like,ул. Мира 34,unknown,Coffee Like
Владимир,coffee_like,ул. Гагарина 2Б,unknown,Coffee Like
Муром,coffee_like,ул. Ленина 17,unknown,Coffee Like
Муром,coffee_like,ул. Куликова 4 ,unknown,Coffee Like
Муром,coffee_like,ул. Московская 32,unknown,Coffee Like
Нижний Новгород,coffee_like,ул. Белинского 118,unknown,Coffee Like
Sudogodskiy area,lukoil,Russia 601364 Vladimir region Sudogodskiy area Muromtsevskoye M-12 140 km left,unknown,AZS № 33078
unknown,lukoil,Russia 601411 Vladimir region Mokrovo 8,unknown,AZS № 33714 
Sobinskiy area,lukoil,Russia 601241 Vladimir region Sobinskiy area Vorshinskaya ter.,unknown,AZS № 33077
Aleksandrov,lukoil,Russia 601655 Vladimir region Aleksandrov st. Kolchuginskaya 31A,unknown,AZS №33017
unknown,lukoil,Russia 601370 Vladimir region Likino road Vladimir-Murom-Aеzamas,unknown,AZS №33056
unknown,lukoil,Russia 601971 Vladimir region Aleksyeevka 251 km +640 m right road M7,unknown,AZS №33040
unknown,lukoil,Russia 601352 Vladimir region Lavrovo road Vladimir - Aеzamas,unknown,AZS №33057
unknown,lukoil,Russia 601390 Vladimir region MO Vyatkinskoe 17 km.+230m right road M-7 Volga,unknown,AZS № 33008
Sudogodskiy m.r-n,lukoil,Russia 601390 Vladimir region Sudogodskiy m.r-n s.p. Vyatkinskoye ter. Avtodoroga M-7 Yuzhnyy obkhod g. Vladimira 16-y km zd. 7,unknown,AZS № 33007
Pokrov,lukoil,Russia 601120 Vladimir region Pokrov st. Lenina 187,unknown,AZS №33052
unknown,lukoil,Russia 601808 Vladimir region 67 km road Vladimir YU.Polʹskii,unknown,AZS №33060
unknown,lukoil,Russia 601144 Vladimir region Starye Petushki 124 km road M-7 Volga,unknown,AZS №33050
Murom,lukoil,Russia 602267 Vladimir region Murom road Karacharovskoe 9,unknown,AZS №33065
Murom,lukoil,Russia 602266 Vladimir region Murom road Vladimirskoe 1,unknown,AZS №33064
Murom,lukoil,Russia 602205 Vladimir region Murom ul. Melenkovskaya 101,unknown,AZS №33049
unknown,lukoil,Russia 602221 Vladimir region Chaadaevo,unknown,AZS №33047
Kolʹchugino,lukoil,Russia 601770 Vladimir region Kolʹchugino Belaya Rechka st. Sadovaya 1а,unknown,AZS №33063
Kolʹchugino,lukoil,Russia 601750 Vladimir region Kolʹchugino st. Kolхoznaya 99,unknown,AZS №33042
Kovrov,lukoil,Russia 601911 Vladimir region Kovrov st. Yelovaya 1а,unknown,AZS №33075
unknown,lukoil,Russia 601966 Vladimir region Melekhovo st. Pervomaiskaya 312а,unknown,AZS №33041
unknown,lukoil,Russia 601965 Vladimir region Senino 920 m east,unknown,AZS №33039
Kovrov,lukoil,Russia 601900 Vladimir region Kovrov st. Yelovaya 29,unknown,AZS №33038
Kovrov,lukoil,Russia 601900 Vladimir region Kovrov st. Sverdlova 112а,unknown,AZS №33037
unknown,lukoil,Russia 601340 Vladimir region Novki,unknown,AZS №33035
Kirzhach,lukoil,Russia 601010 Vladimir region Kirzhach st. Voеzalʹnaya 30b,unknown,AZS №33033
Gusʹ-Khrustalʹnyi,lukoil,Russia 601500 Vladimir region Gusʹ-Khrustalʹnyi st. Kurlovskaya 53,unknown,AZS №33074
Gus-Khrustalnyy m.r-n,lukoil,Russia 601500 Vladimir region Gus-Khrustalnyy m.r-n s.p. poselok Anopino Avtodoroga Gus-Khrustalnyy-Vladimir ter. 1-y km zd. 1,unknown,AZS № 33030
Goroхovets,lukoil,Russia 601480 Vladimir region Goroхovets st. Moskovskaya 134а,unknown,AZS №33028
Goroхovets,lukoil,Russia 601483 Vladimir region Goroхovets st. Moskovskaya 123,unknown,AZS №33027
Vyazniki,lukoil,Russia 601446 Vladimir region Vyazniki ul. Yefimyevo d. 1B,unknown,AZS №33072
Vyazniki,lukoil,Russia 601446 Vladimir region Vyazniki st. Zheleznodorozhnaya 2а,unknown,AZS №33024
Vyazniki,lukoil,Russia 601443 Vladimir region Vyazniki st. Lenina 43,unknown,AZS №33023
unknown,lukoil,Russia 601620 Vladimir region Slednevo,unknown,AZS №33073
Aleksandrov,lukoil,Russia 601650 Vladimir region Aleksandrov st. 1 Lesnaya 2b,unknown,AZS №33016
Vladimir,lukoil,Russia 600037 Vladimir region Vladimir st. Verхnyaya Dubrova 43а,unknown,AZS №33070
unknown,lukoil,"Russia 601310 Vladimir region Khokhlovo road M-7 ""Volga""",unknown,AZS №33021
Lakinsk,lukoil,Russia 601242 Vladimir region Lakinsk Undol 105,unknown,AZS №33013
Suzdalʹ,lukoil,Russia 601293 Vladimir region Suzdalʹ st. Promyshlennaya,unknown,AZS № 33011
Suzdalʹ,lukoil,Russia 601293 Vladimir region Suzdalʹ st. Transportnaya,unknown,AZS №33010
Vladimir,lukoil,Russia 600900 Vladimir region Vladimir area Yurʹevets st. Noyabrʹskaya 136,unknown,AZS №33006
Vladimir,lukoil,Russia 600007 Vladimir region Vladimir st. Usti-na-Labe 35А,unknown,AZS № 33005
Vladimir,lukoil,Russia 600032 Vladimir region Vladimir st. Rastopchina 2,unknown,AZS №33003
Vladimir,lukoil,Russia 600023 Vladimir region Vladimir Sudogodskoe road 12,unknown,AZS №33004
Vladimir,lukoil,Russia 600028 Vladimir region Vladimir st. Lakina 211,unknown,AZS №33002
unknown,wildberries,Владимирская область Владимир улица Горького 58,unknown,Wildberries
unknown,wildberries,Владимирская область Муром Советская улица 70А,unknown,Wildberries
unknown,wildberries,г. Александров (Владимирская область) улица Революции д. 51,unknown,Wildberries
Kovrovskiy Rayon,wildberries,г. Ковров (Владимирская обл.) ул. Труда 1,unknown,Wildberries
unknown,wildberries,Владимирская область Владимир улица Безыменского 17Г,unknown,Wildberries
unknown,wildberries,г. Владимир (Владимирская область) проспект Ленина д. 16,unknown,Wildberries
unknown,wildberries,Владимирская область Гусь-Хрустальный улица Микрорайон 43,unknown,Wildberries
unknown,wildberries,г. Петушки (Владимирская область) Московская улица д. 20,unknown,Wildberries
unknown,wildberries,г. Владимир (Владимирская область) 2-я Никольская улица д. 2/9,unknown,Wildberries
unknown,wildberries,г. Кольчугино (Кольчугинский р-н.) ул. 3 Интернационала 66,unknown,Wildberries
unknown,wildberries,г. Киржач (Владимирская область) улица Гагарина д. 29,unknown,Wildberries
unknown,wildberries,Владимирская область Муром улица Филатова 15,unknown,Wildberries
unknown,wildberries,г. Муром (Владимирская область) улица Ленина д. 72,unknown,Wildberries
unknown,wildberries,г. Юрьев-Польский (Владимирская область) улица Шибанкова д. 22,unknown,Wildberries
unknown,wildberries,г. Владимир (Владимирская область) Суздальский проспект д. 24,unknown,Wildberries
unknown,wildberries,г. Владимир (Владимирская область) улица Труда д. 18,unknown,Wildberries
unknown,wildberries,г. Александров (Владимирская область) Красный переулок д. 10А,unknown,Wildberries
unknown,wildberries,г. Покров (Владимирская область) улица Ленина д. 71,unknown,Wildberries
unknown,wildberries,г. Вязники (Владимирская область) улица Ленина д. 34,unknown,Wildberries
Kovrovskiy Rayon,wildberries,г. Ковров (Владимирская область) улица Грибоедова д. 28,unknown,Wildberries
unknown,wildberries,г. Владимир (Владимирская область) проспект Ленина д. 71,unknown,Wildberries
unknown,wildberries,г. Судогда (Владимирская область) Коммунистическая улица д. 7,unknown,Wildberries
unknown,wildberries,г. Меленки (Владимирская область) Красноармейская улица д. 93 корп 5,unknown,Wildberries
Kovrovskiy Rayon,wildberries,г. Ковров (Владимирская область) проспект Ленина д. 51,unknown,Wildberries
unknown,wildberries,г. Владимир (Владимирская область) улица Диктора Левитана д. 25,unknown,Wildberries
unknown,wildberries,г. Петушки (Владимирская область) Советская площадь д. 16,unknown,Wildberries
unknown,wildberries,Владимирская область Владимир улица Мира 21,unknown,Wildberries
unknown,wildberries,г. Владимир (Владимирская область) Дворянская улица д. 5к1,unknown,Wildberries
Kovrovskiy Rayon,wildberries,г. Ковров (Владимирская область) улица Фурманова д. 27,unknown,Wildberries
Kovrovskiy Rayon,wildberries,г. Ковров (Владимирская область) улица Абельмана д. 4,unknown,Wildberries
unknown,wildberries,г. Владимир (Владимирская область) улица Мира д. 4В,unknown,Wildberries
unknown,wildberries,г. Александров (Владимирская область) Институтская улица д. 6,unknown,Wildberries
unknown,wildberries,Владимирская область Гусь-Хрустальный улица Чапаева 5,unknown,Wildberries
unknown,wildberries,Владимирская область Владимир улица Комиссарова 1Г,unknown,Wildberries
unknown,wildberries,г. Камешково (Владимирская область) Школьная улица д. 4,unknown,Wildberries
Kovrovskiy Rayon,wildberries,г. Ковров (Владимирская область) Либерецкая улица д. 1,unknown,Wildberries
unknown,wildberries,г. Муром (Владимирская область) улица Энгельса д. 12,unknown,Wildberries
unknown,wildberries,г. Владимир (Владимирская область) улица Балакирева д. 47А,unknown,Wildberries
unknown,wildberries,Владимирская область Лакинск улица Лермонтова 35А,unknown,Wildberries
unknown,wildberries,Владимирская область Владимир Судогодское шоссе 1,unknown,Wildberries
unknown,wildberries,Владимирская область Собинка улица Димитрова 24И,unknown,Wildberries
unknown,wildberries,Владимирская область Владимир проспект Ленина 40,unknown,Wildberries
unknown,wildberries,Владимирская область Киржач Привокзальная улица 63,unknown,Wildberries
unknown,wildberries,г. Владимир (Владимирская область) Юбилейная улица д. 58,unknown,Wildberries
unknown,wildberries,г. Владимир (Владимирская область) Красноармейская улица д. 43К,unknown,Wildberries
unknown,wildberries,г. Костерёво (Владимирская область) улица Серебрянникова д. 33,unknown,Wildberries
unknown,wildberries,Владимирская область Владимир улица Полины Осипенко 21,unknown,Wildberries
unknown,wildberries,г. Муром (Владимирская обл) Московская 32,unknown,Wildberries
unknown,wildberries,г. Муром (Владимирская обл) Ленинградская 30,unknown,Wildberries
unknown,wildberries,г. Струнино (Владимирская область) Дубки микрорайон д. 4,unknown,Wildberries
unknown,wildberries,г. Гусь-Хрустальный (Владимирская обл) ул. Окружная  8 А,unknown,Wildberries
unknown,wildberries,г. Гороховец (Владимирская обл) Мира 12,unknown,Wildberries
unknown,wildberries,Владимирская область Карабаново улица Лермонтова 3,unknown,Wildberries
unknown,wildberries,Владимирская область Владимир улица Нижняя Дуброва 47к1,unknown,Wildberries
Kovrovskiy Rayon,wildberries,Ковров (Владимирская обл) Зои Космодемьянской 5/1,unknown,Wildberries
unknown,wildberries,г Владимир (городской округ Город Владимир) улица Куйбышева 5Ж,unknown,Wildberries
unknown,wildberries,г Суздаль Владимирская область Суздальский район бульвар Всполье 31,unknown,Wildberries
unknown,wildberries,Владимир Владимирская обл улица Луначарского 35,unknown,Wildberries
unknown,wildberries,Балакирево (Владимирская область) улица 60 лет Октября д. 2А,unknown,Wildberries
unknown,wildberries,г Владимир (Владимирская область) улица Нижняя Дуброва 19А,unknown,Wildberries
unknown,wildberries,Владимирская область Кольчугино улица Веденеева 1,unknown,Wildberries
unknown,wildberries,Киржач Владимирская область Киржачский район улица Пушкина 27А/1,unknown,Wildberries
unknown,wildberries,Вольгинский Владимирская область Петушинский район Старовская улица 32,unknown,Wildberries
unknown,wildberries,Владимир Владимирская обл улица Алябьева 18,unknown,Wildberries
unknown,wildberries,Владимирская область Владимир Северная улица 12,unknown,Wildberries
unknown,wildberries,г Гусь-Хрустальный (Владимирская область) Октябрьская 19,unknown,Wildberries
unknown,wildberries,г. Муром Школьная улица 1А,unknown,Wildberries
unknown,wildberries,г Александров (Владимирская область) Двориковское шоссе 15,unknown,Wildberries
unknown,wildberries,г Владимир (Владимирская область) улица Институтский городок 26,unknown,Wildberries
Kovrovskiy Rayon,wildberries,г Ковров Улица Ватутина 88,unknown,Wildberries
unknown,wildberries,Струнино Владимирская область Александровский район улица Шувалова 5А,unknown,Wildberries
unknown,wildberries,Владимирская область Юрьев-Польский Вокзальная улица 16,unknown,Wildberries
unknown,wildberries,г Владимир Юбилейная Улица 9,unknown,Wildberries
unknown,wildberries,г Владимир Улица Горького 113,unknown,Wildberries
unknown,wildberries,г Радужный 1-Й Квартал 58,unknown,Wildberries
unknown,wildberries,г Гороховец Парковая Улица 56,unknown,Wildberries
unknown,wildberries,г Александров Улица Перфильева 1а,unknown,Wildberries
unknown,wildberries,г Муром Московская Улица 105,unknown,Wildberries
Kovrovskiy Rayon,wildberries,г Ковров Улица Строителей 2,unknown,Wildberries
unknown,wildberries,Кольчугино улица Ленина 2,unknown,Wildberries
unknown,wildberries,Владимирская область Покров Школьный проезд 5,unknown,Wildberries
unknown,wildberries,Судогда Владимирская обл Судогодский р-н улица Ленина 37,unknown,Wildberries
unknown,wildberries,Муром Владимирская область  округ Муром Комсомольская улица 39А,unknown,Wildberries
unknown,wildberries,Владимир Владимирская обл улица Сперанского 1,unknown,Wildberries
unknown,wildberries,г Радужный 3-Й Квартал 10а,unknown,Wildberries
unknown,wildberries,г Владимир Песочная Улица 19,unknown,Wildberries
Kovrovskiy Rayon,wildberries,г Ковров Улица Белинского 14,unknown,Wildberries
unknown,wildberries,г Александров Улица Маяковского 30а,unknown,Wildberries
unknown,wildberries,Владимирская область Кольчугино улица Дружбы 29,unknown,Wildberries
unknown,wildberries,г Юрьев-Польский Улица Шибанкова 96,unknown,Wildberries
unknown,wildberries,Муром Владимирская область округ Муром Радиозаводское шоссе 33,unknown,Wildberries
unknown,wildberries,Владимирская обл г Владимир ул Безыменского д 18Б ,unknown,Wildberries
unknown,wildberries,Гусь-Хрустальный Владимирская область улица Карла Либкнехта 1А,unknown,Wildberries
unknown,wildberries,г Владимир Улица Растопчина 47б,unknown,Wildberries
unknown,wildberries,Владимирская область Гусь-Хрустальный Интернациональная улица 40А,unknown,Wildberries
unknown,wildberries,п Мстёра Улица Горького 4,unknown,Wildberries
unknown,wildberries,г Радужный 1-Й Квартал 1,unknown,Wildberries
unknown,wildberries,г Владимир Улица Нижняя Дуброва 17,unknown,Wildberries
unknown,wildberries,Муром улица Льва Толстого 109,unknown,Wildberries
unknown,wildberries,г Владимир Улица Тихонравова 12а,unknown,Wildberries
unknown,wildberries,г Владимир Ставровская Улица 5а,unknown,Wildberries
unknown,wildberries,Владимирская область Собинка площадь Карла Маркса 2,unknown,Wildberries
unknown,wildberries,г Суздаль Суздальская Улица 3а,unknown,Wildberries
unknown,wildberries,г Владимир Проспект Ленина 35б,unknown,Wildberries
unknown,wildberries,г Александров Красный Переулок 16,unknown,Wildberries
unknown,wildberries,г Александров Улица Свердлова 1,unknown,Wildberries
unknown,wildberries,г Кольчугино Улица Мира 21,unknown,Wildberries
unknown,wildberries,г Владимир Суздальский Проспект 15,unknown,Wildberries
unknown,wildberries,г Киржач Улица 40 Лет Октября вл9,unknown,Wildberries
unknown,wildberries,г Радужный 1-Й Квартал 46а,unknown,Wildberries
unknown,wildberries,г Владимир Улица Нижняя Дуброва 7,unknown,Wildberries
unknown,wildberries,г Владимир 1-Й Коллективный Проезд 7,unknown,Wildberries
unknown,wildberries,г Покров Первомайская Улица 1,unknown,Wildberries
unknown,wildberries,г Покров Улица Карла Либкнехта 14,unknown,Wildberries
unknown,wildberries,г Владимир Улица Верхняя Дуброва 17,unknown,Wildberries
unknown,wildberries,г Киржач Ленинградская Улица 96а,unknown,Wildberries
unknown,wildberries,г Покров Октябрьская Улица 6с1,unknown,Wildberries
unknown,wildberries,г Собинка Центральная Улица 31,unknown,Wildberries
Kovrovskiy Rayon,wildberries,г Ковров Проспект Ленина 25,unknown,Wildberries
Kovrovskiy Rayon,wildberries,Ковров Владимирская обл Еловая улица 80/1,unknown,Wildberries
unknown,wildberries,Владимирская область Владимир Добросельская улица 188Бк1,unknown,Wildberries
Kovrovskiy Rayon,wildberries,г Ковров Улица Ранжева 13,unknown,Wildberries
unknown,wildberries,Суздаль  бульвар Всполье 35А,unknown,Wildberries
unknown,wildberries,Меленки Пушкина 2,unknown,Wildberries
unknown,wildberries,Владимирская область посёлок Красная Горбатка Пролетарская улица 18,unknown,Wildberries
unknown,wildberries,Владимирская область Александров улица Терешковой 11,unknown,Wildberries
unknown,wildberries,г Александров Улица Королёва 1,unknown,Wildberries
unknown,wildberries,г Лакинск Улица Пушкина 8,unknown,Wildberries
unknown,wildberries,г Кольчугино Улица Ломако 28а,unknown,Wildberries
unknown,wildberries,г Владимир Улица Белоконской 12б,unknown,Wildberries
unknown,wildberries,г Владимир Проспект Строителей 15ж,unknown,Wildberries
unknown,wildberries,г Владимир Проспект Строителей 34в,unknown,Wildberries
unknown,wildberries,г Кольчугино Улица Добровольского 15,unknown,Wildberries
unknown,wildberries,г Владимир Гвардейская Улица 13,unknown,Wildberries
unknown,wildberries,Владимирская область Александров Первомайская улица 46,unknown,Wildberries
unknown,wildberries,г Владимир (Владимирская область) проспект Ленина 17,unknown,Wildberries
unknown,wildberries,Муром Владимирская обл улица Дзержинского 49А,unknown,Wildberries
unknown,wildberries,Владимирская область Гусь-Хрустальный улица Калинина 8А,unknown,Wildberries
unknown,wildberries,Владимирская область Гусь-Хрустальный улица Менделеева 25,unknown,Wildberries
unknown,wildberries,Костерёво (Владимирская область) улица 40 лет Октября 14,unknown,Wildberries
unknown,wildberries,г Владимир Улица Гастелло 4,unknown,Wildberries
unknown,wildberries,тер МО город Карабаново Западная Улица 5,unknown,Wildberries
Kovrovskiy Rayon,wildberries,г Ковров Улица Грибоедова 5/2,unknown,Wildberries
unknown,wildberries,г Владимир Проспект Ленина 47,unknown,Wildberries
unknown,wildberries,Владимирская область Владимир улица Верхняя Дуброва 36Г,unknown,Wildberries
unknown,wildberries,пгт Вольгинский Старовская Улица 12,unknown,Wildberries
unknown,wildberries,Владимирская область Александров улица Королёва 4к2,unknown,Wildberries
unknown,wildberries,г Владимир Улица Мира 27,unknown,Wildberries
unknown,wildberries,г Владимир Улица Соколова-Соколёнка 9а,unknown,Wildberries
unknown,wildberries,п Боголюбово Полевая Улица 37,unknown,Wildberries
unknown,wildberries,г Владимир Судогодское Шоссе 33,unknown,Wildberries
Kovrovskiy Rayon,wildberries,г Ковров Пионерская Улица 12,unknown,Wildberries
unknown,wildberries,г Владимир Западная Улица 57,unknown,Wildberries
unknown,wildberries,г Гусь-Хрустальный Улица Каховского 5,unknown,Wildberries
unknown,wildberries,г Владимир Улица Чапаева 8а,unknown,Wildberries
Kovrovskiy Rayon,wildberries,г Ковров Еловая Улица 98,unknown,Wildberries
unknown,wildberries,п Боголюбово Улица Пушкина 58,unknown,Wildberries
unknown,wildberries,Владимирская область Петушки Московская улица 16,unknown,Wildberries
unknown,wildberries,Владимирская область Владимир улица Лакина 139,unknown,Wildberries
unknown,wildberries,г Владимир Улица Горького 77,unknown,Wildberries
unknown,wildberries,г Владимир Улица Нижняя Дуброва 34,unknown,Wildberries
unknown,wildberries,г Петушки Московская Улица 1а,unknown,Wildberries
unknown,wildberries,г Владимир Проспект Строителей 22,unknown,Wildberries
unknown,wildberries,г Муром Ленинградская Улица 5,unknown,Wildberries
unknown,wildberries,г Вязники Микрорайон Дечинский 3,unknown,Wildberries
Kovrovskiy Rayon,wildberries,г Ковров Улица Лопатина 44,unknown,Wildberries
unknown,wildberries,г Владимир Песочная Улица 19г,unknown,Wildberries
unknown,wildberries,г Камешково Улица Карла Маркса 13,unknown,Wildberries
unknown,wildberries,г Муром Улица Войкова 2б,unknown,Wildberries
unknown,wildberries,Владимирская область Владимир улица Мира 34А,unknown,Wildberries
unknown,wildberries,г Александров Улица Терешковой 6,unknown,Wildberries
unknown,wildberries,г Владимир Суздальский Проспект 11а,unknown,Wildberries
unknown,wildberries,г Владимир Улица Нижняя Дуброва 48а,unknown,Wildberries
