City,Place Name,Zipcode,Name
unknown,wildberries,Владимирская область Владимир 1-я Пионерская улица 92,unknown,Wildberries
unknown,wildberries,г Лакинск Улица 21 Партсъезда 185,unknown,Wildberries
Kovrovskiy Rayon,wildberries,г Ковров Улица Строителей 33,unknown,Wildberries
unknown,wildberries,п Мелехово Первомайская Улица 68а,unknown,Wildberries
unknown,wildberries,г Камешково Улица Дорофеичева 5,unknown,Wildberries
unknown,wildberries,г Владимир Улица Фейгина 7,unknown,Wildberries
unknown,wildberries,п Ставрово Октябрьская Улица 120,unknown,Wildberries
unknown,wildberries,Владимирская область Владимир Гвардейская улица 17,unknown,Wildberries
unknown,wildberries,г Владимир Улица Растопчина 27а,unknown,Wildberries
unknown,wildberries,Владимирская область Владимир улица 850-летия 6,unknown,Wildberries
Kovrovskiy Rayon,wildberries,г Ковров Молодогвардейская Улица 7,unknown,Wildberries
unknown,wildberries,г Муром Октябрьская Улица 27,unknown,Wildberries
unknown,wildberries,г Киржач Улица Гагарина 6,unknown,Wildberries
unknown,wildberries,тер МО поселок Великодворский Улица Ленина 1,unknown,Wildberries
unknown,wildberries,г Гусь-Хрустальный Проспект 50 Лет Советской Власти 35,unknown,Wildberries
unknown,wildberries,г Киржач Первомайская Улица 1/87,unknown,Wildberries
Kovrovskiy Rayon,wildberries,г Ковров Улица Суворова 104,unknown,Wildberries
unknown,wildberries,г Владимир Студенческая Улица 6д,unknown,Wildberries
Kovrovskiy Rayon,wildberries,г Ковров Волго-Донская Улица 42,unknown,Wildberries
Kovrovskiy Rayon,wildberries,г Ковров Улица Генералова 42,unknown,Wildberries
Kovrovskiy Rayon,wildberries,г Ковров Волго-Донская Улица 7г,unknown,Wildberries
unknown,wildberries,г Муром Орловская Улица 19,unknown,Wildberries
unknown,wildberries,п Малыгино Школьная Улица 55а,unknown,Wildberries
unknown,wildberries,г Юрьевец Славная Улица 4,unknown,Wildberries
unknown,wildberries,г Владимир Восточная Улица 80б,unknown,Wildberries
unknown,wildberries,г Вязники Улица Ленина 4,unknown,Wildberries
unknown,wildberries,г Собинка Улица Чайковского 12,unknown,Wildberries
unknown,wildberries,тер МО город Гороховец Улица Революции 40а,unknown,Wildberries
unknown,wildberries,п Уршельский Московская Улица 1,unknown,Wildberries
unknown,wildberries,Владимирская область посёлок городского типа Никологоры Советская улица 2Б,unknown,Wildberries
unknown,wildberries,г Муром Улица Льва Толстого 20,unknown,Wildberries
Kovrovskiy Rayon,wildberries,Ковров Улица Грибоедова 1,unknown,Wildberries
unknown,wildberries,Владимир Улица Мира 4,unknown,Wildberries
unknown,wildberries,г Петушки Спортивный Проезд 2,unknown,Wildberries
unknown,wildberries,Покров Больничный Проезд 4,unknown,Wildberries
Kovrovskiy Rayon,wildberries,г Ковров Муромская Улица 9,unknown,Wildberries
unknown,wildberries,поселок Новки Улица Ильича 7,unknown,Wildberries
unknown,wildberries,Владимир Новая Улица 2,unknown,Wildberries
unknown,wildberries,Владимирская область Вязники улица Ленина 41,unknown,Wildberries
unknown,wildberries,г Муром Улица Энгельса 19,unknown,Wildberries
unknown,wildberries,Муром Улица Ленина 9,unknown,Wildberries
unknown,wildberries,Владимир Улица Диктора Левитана 59с1,unknown,Wildberries
unknown,wildberries,посёлок Бавлены Улица Мира 10,unknown,Wildberries
unknown,wildberries,Муром Карачаровское Шоссе 11,unknown,Wildberries
unknown,wildberries,Владимир Проспект Ленина 62а,unknown,Wildberries
unknown,wildberries,Владимирская область город Струнино микрорайон Дубки 2,unknown,Wildberries
unknown,wildberries,Муром Посёлок Механизаторов 38б,unknown,Wildberries
unknown,wildberries,Владимирская область Вязники Советская улица 13/4,unknown,Wildberries
unknown,wildberries,Владимирская область Владимир улица Комиссарова 35А,unknown,Wildberries
unknown,wildberries,Владимирская область Вязники улица Горького 102,unknown,Wildberries
unknown,wildberries,Владимирская область Муром Владимирское шоссе 12,unknown,Wildberries
Kovrovskiy Rayon,wildberries,Владимирская область Ковров улица Тимофея Павловского 2,unknown,Wildberries
unknown,wildberries,посёлок Золотково Советская Улица 5,unknown,Wildberries
unknown,wildberries,Владимир Улица Верхняя Дуброва 8,unknown,Wildberries
unknown,wildberries,Владимирская область Гусь-Хрустальный улица Карла Маркса 58А,unknown,Wildberries
unknown,wildberries,Владимирская область Владимир улица Студёная Гора 34А,unknown,Wildberries
unknown,wildberries,Владимир Улица Горького 133,unknown,Wildberries
unknown,wildberries,Владимирская область Александров улица Королёва 9,unknown,Wildberries
unknown,wildberries,Муром Московская Улица 121,unknown,Wildberries
unknown,wildberries,Киржач Некрасовская Улица 28,unknown,Wildberries
unknown,wildberries,деревня Дворики Ярославское Шоссе 13а,unknown,Wildberries
unknown,wildberries,посёлок имени Горького Шоссейная Улица 1,unknown,Wildberries
unknown,wildberries,Владимирская область Киржач улица Текстильщиков 9,unknown,Wildberries
unknown,wildberries,посёлок Никологоры Советская Улица 28,unknown,Wildberries
unknown,wildberries,Владимирская область Владимир улица Егорова 1,unknown,Wildberries
unknown,wildberries,Владимирская область Владимир Суздальская улица 5,unknown,Wildberries
unknown,wildberries,Владимирская область посёлок Вольгинский Новосемёнковская улица 20А,unknown,Wildberries
unknown,wildberries,Владимирская область Владимир Добросельская улица 207А,unknown,Wildberries
unknown,wildberries,Киржач Большая Московская Улица 36,unknown,Wildberries
unknown,wildberries,Гусь-Хрустальный Улица Калинина 48,unknown,Wildberries
unknown,wildberries,Владимирская область Муром улица Кирова 32А,unknown,Wildberries
Kovrovskiy Rayon,wildberries,Ковров Улица Ватутина 47,unknown,Wildberries
unknown,wildberries,Владимир Проспект Ленина 25,unknown,Wildberries
unknown,wildberries,Владимирская область Судогда улица Чапаева 1А,unknown,Wildberries
unknown,wildberries,Владимирская область посёлок Балакирево Юго-Западный квартал 6А,unknown,Wildberries
unknown,wildberries,посёлок Ставрово Советская Улица 42,unknown,Wildberries
Kovrovskiy Rayon,wildberries,Ковров Социалистическая Улица 17,unknown,Wildberries
unknown,wildberries,Владимирская область Суздаль бульвар Всполье 36,unknown,Wildberries
unknown,wildberries,посёлок Первомайский Посёлок Первомайский 21,unknown,Wildberries
unknown,wildberries,деревня Старое Перепечино Вокзальная Улица 1,unknown,Wildberries
unknown,wildberries,Владимир Улица Токарева 2,unknown,Wildberries
unknown,wildberries,Вязники Молодёжная Улица 26,unknown,Wildberries
unknown,wildberries,посёлок Красная Горбатка Северная Улица 77а,unknown,Wildberries
unknown,wildberries,Владимирская область Покров улица Быкова 1,unknown,Wildberries
unknown,wildberries,Владимир Улица МОПРа 11,unknown,Wildberries
unknown,wildberries,Гусь-Хрустальный Улица Димитрова 33,unknown,Wildberries
unknown,wildberries,Владимир Смоленская Улица 8,unknown,Wildberries
unknown,wildberries,посёлок Красное Эхо Советская Улица 4,unknown,Wildberries
unknown,wildberries,Владимирская область посёлок Андреево Почтовая улица 4,unknown,Wildberries
unknown,wildberries,Курлово Улица Володарского 7,unknown,Wildberries
unknown,wildberries,посёлок Мезиновский Строительная Улица 15,unknown,Wildberries
unknown,wildberries,Владимирская область Гусь-Хрустальный улица Революции 6А,unknown,Wildberries
unknown,wildberries,Владимирская область село Ковардицы улица Дзержинского 135А,unknown,Wildberries
unknown,wildberries,Владимирская область Курлово Базарная улица 3Б,unknown,Wildberries
unknown,wildberries,Владимирская область Меленки Коммунистическая улица 39,unknown,Wildberries
unknown,wildberries,Владимирская область Юрьев-Польский Садовый переулок 23,unknown,Wildberries
unknown,wildberries,Владимирская область Александров улица Ануфриева 10,unknown,Wildberries
unknown,wildberries,Гусь-Хрустальный Прудинская Улица 1,unknown,Wildberries
unknown,wildberries,Камешково Молодёжная Улица 11,unknown,Wildberries
unknown,wildberries,Владимирская область Александров Красный переулок 7,unknown,Wildberries
unknown,wildberries,Владимирская область Петушки Московская улица 12,unknown,Wildberries
unknown,wildberries,Владимир Улица Безыменского 3а,unknown,Wildberries
unknown,wildberries,посёлок Анопино Южная Улица 4,unknown,Wildberries
unknown,wildberries,Муром Ленинградская Улица 21,unknown,Wildberries
unknown,wildberries,Муром Улица Мечтателей 6,unknown,Wildberries
unknown,wildberries,Муром Улица Дзержинского 10,unknown,Wildberries
unknown,wildberries,село Андреевское Центральная Улица 35,unknown,Wildberries
unknown,wildberries,Владимир Юбилейная Улица 11б,unknown,Wildberries
unknown,wildberries,Владимир Улица Энергетиков 25б,unknown,Wildberries
unknown,wildberries,Владимирская область Владимир улица Комиссарова 11А,unknown,Wildberries
unknown,wildberries,село Богослово Нагорная Улица 2,unknown,Wildberries
unknown,wildberries,Владимирская область Вязники улица Ленина 47А,unknown,Wildberries
unknown,wildberries,Владимирская область Струнино Заречная улица 32,unknown,Wildberries
unknown,wildberries,Муром Московская Улица 118,unknown,Wildberries
unknown,wildberries,Владимирская область Карабаново улица Лермонтова 17,unknown,Wildberries
unknown,wildberries,Владимирская область Кольчугино улица Ленина 12,unknown,Wildberries
unknown,wildberries,Владимирская область Собинка Базарная улица 5А,unknown,Wildberries
Kovrovskiy Rayon,wildberries,Ковров Улица Грибоедова 50,unknown,Wildberries
unknown,wildberries,Владимирская область Карабаново улица Мира 12,unknown,Wildberries
unknown,wildberries,Владимирская область Муром Советская улица 56А,unknown,Wildberries
unknown,wildberries,Владимир Улица Безыменского 26а,unknown,Wildberries
unknown,wildberries,Владимирская область Гороховец Вишнёвая улица 1А,unknown,Wildberries
unknown,wildberries,Владимир Проезд Лакина 10,unknown,Wildberries
unknown,wildberries,Владимирская область Владимир улица Жуковского 29,unknown,Wildberries
unknown,wildberries,Муром Посёлок Механизаторов 48а,unknown,Wildberries
unknown,wildberries,Гороховец Улица Лермонтова 4,unknown,Wildberries
unknown,wildberries,Муром Улица Осипенко 9,unknown,Wildberries
unknown,wildberries,Струнино Улица Лермонтова 8а,unknown,Wildberries
unknown,wildberries,Владимирская область Меленки улица Коминтерна 106,unknown,Wildberries
unknown,wildberries,Владимир Улица Даргомыжского 2,unknown,Wildberries
unknown,wildberries,Владимир Улица Верхняя Дуброва 33,unknown,Wildberries
unknown,wildberries,Лакинск Улица Мира 41,unknown,Wildberries
unknown,wildberries,Владимирская область Вязники улица Ефимьево 5,unknown,Wildberries
unknown,wildberries,Владимир Улица Сурикова 14б,unknown,Wildberries
unknown,wildberries,Владимир Всесвятская Улица 12,unknown,Wildberries
unknown,wildberries,Муром Владимирское Шоссе 2/54,unknown,Wildberries
Kovrovskiy Rayon,wildberries,Ковров Моховая Улица 1/3,unknown,Wildberries
Kovrovskiy Rayon,wildberries,Владимирская область Ковров Комсомольская улица 106,unknown,Wildberries
unknown,wildberries,посёлок Вольгинский Старовская Улица 2,unknown,Wildberries
Kovrovskiy Rayon,wildberries,Владимирская область Ковров Запольная улица 24к1,unknown,Wildberries
unknown,wildberries,Владимир Улица Фатьянова 16,unknown,Wildberries
unknown,wildberries,Владимир Фоминская Улица 2,unknown,Wildberries
unknown,wildberries,Струнино Улица Лермонтова 17,unknown,Wildberries
unknown,wildberries,Гусь-Хрустальный Полевая Улица 1а,unknown,Wildberries
unknown,wildberries,село Панфилово Октябрьская Улица 4г,unknown,Wildberries
unknown,wildberries,Гороховец Улица Гагарина 35,unknown,Wildberries
unknown,wildberries,Гороховец Улица Кирова 17,unknown,Wildberries
unknown,wildberries,Владимирская область посёлок Садовый Владимирская улица 1,unknown,Wildberries
unknown,wildberries,Владимирская область Владимир Тракторная улица 42,unknown,Wildberries
unknown,wildberries,Муром Кленовая Улица 32а,unknown,Wildberries
unknown,wildberries,Струнино Улица Фрунзе 9а,unknown,Wildberries
unknown,wildberries,посёлок Головино Советская Улица 39,unknown,Wildberries
unknown,wildberries,посёлок Городищи Улица Моисеенко 1а,unknown,Wildberries
unknown,wildberries,деревня Великово Советская Улица 48а,unknown,Wildberries
unknown,wildberries,Кольчугино Школьная Улица 7а,unknown,Wildberries
unknown,wildberries,село Сновицы Школьная Улица 8а,unknown,Wildberries
unknown,wildberries,Вязники Кооперативная Улица 1,unknown,Wildberries
unknown,wildberries,Юрьев-Польский Улица 1 Мая 70,unknown,Wildberries
unknown,wildberries,Владимир Проспект Строителей 12,unknown,Wildberries
unknown,wildberries,деревня Новое Аннино Центральная Улица 17а,unknown,Wildberries
unknown,wildberries,село Павловское Центральная Улица 31,unknown,Wildberries
unknown,wildberries,Владимир Улица Диктора Левитана 39,unknown,Wildberries
