Ref,Spider,Name,Address,City,State,Zipcode,Country,Phone,Website,Hours,Brand,WikiData
https://locations.auntieannes.com/#5489,auntie_annes,Auntie Anne's Portsmouth Naval Medical Center,,Portsmouth,VA,,US,+1 703-774-4554,https://locations.auntieannes.com/va/portsmouth/620-john-paul-jones-cir,Mo-Su 07:00-15:00,Auntie Anne's,Q4822010
vba_314q,department_veterans_affairs,Integrated Disability Evaluation System (IDES) Site at Naval Medical Center Portsmouth,,Portsmouth,VA,,US,+1 757-322-1179,,,Department Veterans Affairs,Q592576
https://restaurants.subway.com/#14898416,subway,Subway Naval Hospital (Military),,Portsmouth Usa,VA,,US,+1 757-393-2761,https://restaurants.subway.com/united-states/va/portsmouth/620-john-paul-jone-circle,Mo-Fr 07:00-17:00; Sa-Su 09:30-16:00,Subway,Q244457
,visa,,,PORTSMOUTH,VA,,US,,,,,
,visa,,,PORTSMOUTH,VA,,US,,,,,
