Ref,Spider,Name,Address,City,State,Zipcode,Country,Phone,Website,Hours,Brand,WikiData
8984572,baskin_robbins_in,Baskin Robbins Astra Tower,"Astra Tower, Major Arterial Road (North Extension) Action Area 2 C, New Town, Kolkata- 700156",Kolkata,West Bengal,,IN,+91 83369 92416,,,Baskin Robbins,Q584601
8984654,baskin_robbins_in,"Baskin Robbins Rosedale, Kolkata","Rosedale Plaza Complex, Ground Floor, Food Court, Action Area 3, Block 3, Newtown, Kolkata 700160",Kolkata,West Bengal,,IN,+91 98307 69399,,,Baskin Robbins,Q584601
8984574,baskin_robbins_in,Baskin Robbins Axis Mall,"Axis Mall, Wonderland Park, Street Number 106, Sub-Central Business District(Action Area 1), Action Area I, Newtown, Kolkata, West Bengal 700156",Kolkata,West Bengal,,IN,+91 70590 82201,,,Baskin Robbins,Q584601
https://www.dominos.co.in/store-locations/kolkata/dlf-it-park-new-town,dominos_pizza_in,Dominos Pizza DLF IT PARK NEW TOWN,0,Kolkata,West Bengal,,IN,+91 22 2632 6699,https://www.dominos.co.in/store-locations/kolkata/dlf-it-park-new-town,,Domino's Pizza,Q839466
2543b7f28f7f4b963c419f664341f711,western_union,RANK ELECTRONICS,,Kolkata,WEST BENGAL,,IN,+91 98308 41925,https://location.westernunion.com/in/west-bengal/kolkata/2543b7f28f7f4b963c419f664341f711,Mo-Su 08:00-22:00,Western Union,Q861042
