City,Place Name,Zipcode,Name
Ryazan,audi,Kuybyshevskoe shosse 40 390047 Ryazan,unknown,Audi Center Ryazan
Рязань,coffee_like,ул. Пушкина 3,unknown,Coffee Like
Рязань,coffee_like,ул. Гагарина 74,unknown,Coffee Like
Рязань,coffee_like,ул. Соборная 15 а,unknown,Coffee Like
Рязань,coffee_like,Проезд Завражнова 5,unknown,Coffee Like
Рязань,coffee_like,ул. Краснорядская 3,unknown,Coffee Like
Рязань,coffee_like,ш. Московское 21,unknown,Coffee Like
Рязань,coffee_like,просп. Первомайский 70/1,unknown,Coffee Like
Рязань,coffee_like,ш. Московское 65 а,unknown,Coffee Like
Рязань,coffee_like,Московское шоссе 69/1,unknown,Coffee Like
Рязань,coffee_like,проезд Завражнова 3,unknown,Coffee Like
Рязань,coffee_like,ул. Ленина 51,unknown,Coffee Like
Рязань,coffee_like,ул. Черновицкая 13В/3,unknown,Coffee Like
Рязань,coffee_like,ул. Ленина 21/3,unknown,Coffee Like
Рязань,coffee_like,ул. Пушкина 3/1,unknown,Coffee Like
Рязань,coffee_like,Окское шоссе 1/4,unknown,Coffee Like
unknown,lukoil,Russia Ryazan region Mikhaylovskiy area FAD R-22 Kaspiy 224 km right,unknown,AZS № 62872
Ryazan,lukoil,Russia Ryazan region Ryazan Kuybyshevskoye road 53,unknown,AZS № 62871
unknown,lukoil,Russia 391240 Ryazan region Aleksandro-Nevskiy area 330 km road Moscow-Volgograd,unknown,AZS № 62870
unknown,wildberries,г. Рязань (Рязанская обл.) ул. Большая 100,unknown,Wildberries
unknown,wildberries,г. Рязань (Рязанская обл) ул. Максима Горького 32,unknown,Wildberries
unknown,wildberries,Рязанская область Рязань Народный бульвар 11,unknown,Wildberries
unknown,wildberries,г. Ряжск (Рязанская область) улица Ленина д. 29,unknown,Wildberries
unknown,wildberries,Рязанская область Рязань проезд Завражнова 12,unknown,Wildberries
unknown,wildberries,Рязанская область Рязань Интернациональная улица 16к7,unknown,Wildberries
unknown,wildberries,г. Рязань (Рязанская область) улица Новосёлов д. 49,unknown,Wildberries
unknown,wildberries,Рязанская область Рязань улица Есенина 34,unknown,Wildberries
unknown,wildberries,Рязанская область Рязань Татарская улица 43,unknown,Wildberries
unknown,wildberries,г. Скопин (Рязанская область) Советская улица д. 65,unknown,Wildberries
unknown,wildberries,г. Сасово (Рязанская область) Южный мкр д. 32А,unknown,Wildberries
unknown,wildberries,Рязанская область Рязань Мервинская улица 30,unknown,Wildberries
unknown,wildberries,г. Шацк (Рязанская область) улица Красная площадь д. 14,unknown,Wildberries
unknown,wildberries,г. Новомичуринск (Рязанская область) улица Строителей д. 27/5,unknown,Wildberries
unknown,wildberries,г. Рязань (Рязанская область) Октябрьская улица д. 18,unknown,Wildberries
unknown,wildberries,г. Рязань (Рязанская область) Сенная улица д. 10,unknown,Wildberries
unknown,wildberries,Рязанская область Рязань Нижне-Трубежная улица 2,unknown,Wildberries
unknown,wildberries,Рязанская область рабочий посёлок Шилово Советская улица 27,unknown,Wildberries
unknown,wildberries,Рязанская область Рязань Шереметьевская улица 6,unknown,Wildberries
unknown,wildberries,Рязанская область Рязань улица Пирогова 4,unknown,Wildberries
unknown,wildberries,Рязанская область Рязань Интернациональная улица 4,unknown,Wildberries
unknown,wildberries,г. Рязань (Рязанская область) Касимовское шоссе д. 48к5,unknown,Wildberries
unknown,wildberries,г. Рязань (Рязанская область) улица Семёна Середы д. 36,unknown,Wildberries
unknown,wildberries,Рязанская область Рязань улица Циолковского 23,unknown,Wildberries
unknown,wildberries,Рязанская область Рязань Солотчинское шоссе 4,unknown,Wildberries
unknown,wildberries,Рязанская область Рязань Первомайский проспект 29,unknown,Wildberries
unknown,wildberries,Рязанская область Рязань Татарская улица 68,unknown,Wildberries
unknown,wildberries,г. Михайлов (Рязанская область) улица Маршала Голикова д. 17,unknown,Wildberries
unknown,wildberries,г. Касимов (Рязанская область) улица 50 лет СССР д. 11,unknown,Wildberries
unknown,wildberries,Рязанская область Рязань площадь Димитрова 3А,unknown,Wildberries
unknown,wildberries,г. Рязань (Рязанская область) Введенская улица д. 120,unknown,Wildberries
unknown,wildberries,г. Рязань (Рязанская область) улица Гагарина д. 9,unknown,Wildberries
unknown,wildberries,г. Рязань (Рязанская область) улица Чапаева д. 57,unknown,Wildberries
unknown,wildberries,Рязанская область Рязань улица Островского 16,unknown,Wildberries
unknown,wildberries,г. Рыбное (Рязанская обл) Большая 18 а,unknown,Wildberries
unknown,wildberries,Рязанская область Рязань улица Костычева 9,unknown,Wildberries
unknown,wildberries,г. Рязань (Рязанская область) Садовая улица д. 32,unknown,Wildberries
unknown,wildberries,Рязанская область Кораблино Школьная улица 11,unknown,Wildberries
unknown,wildberries,г. Рязань (Рязанская обл) Славянский 6,unknown,Wildberries
unknown,wildberries,г Скопин  Автозаводской микрорайон 19,unknown,Wildberries
unknown,wildberries,г Сасово (Рязанская обл) Кадомская 37в,unknown,Wildberries
unknown,wildberries,Рязанская область Рязань улица Княжье Поле 23к1,unknown,Wildberries
unknown,wildberries,г Рязань Рязанская область городской округ Рязань Вокзальная улица 61к1,unknown,Wildberries
unknown,wildberries,г Рязань (Россия Рязанская обл) Лесопарковая 18,unknown,Wildberries
unknown,wildberries,г Рязань Россия Рязанская обл Керамзавода 20,unknown,Wildberries
unknown,wildberries,г Рязань Россия Рязанская обл улица Новосёлов 7,unknown,Wildberries
unknown,wildberries,г Касимов (Рязанская область) улица Ленина 14Б,unknown,Wildberries
unknown,wildberries,г Рязань (Рязанская область) улица Шевченко 82к2,unknown,Wildberries
unknown,wildberries,Лесной (Рязанская обл) улица Строителей 8,unknown,Wildberries
unknown,wildberries,Спас-Клепики (Рязанская обл) площадь Ленина 66,unknown,Wildberries
unknown,wildberries,г Рязань (Рязанская область) улица Зубковой 16к1,unknown,Wildberries
unknown,wildberries,г Рязань (Рязанская область) Пугачёва 11/19,unknown,Wildberries
unknown,wildberries,г Рязань (Рязанская область) Новосёлов 37,unknown,Wildberries
unknown,wildberries,г Рязань Улица Свободы 52,unknown,Wildberries
unknown,wildberries,Рыбное Рязанская область Рыбновский район Электротяговая улица 26,unknown,Wildberries
unknown,wildberries,г Рязань Московская Улица 8,unknown,Wildberries
unknown,wildberries,г Рязань Монастырская Площадь 4,unknown,Wildberries
unknown,wildberries,г Рязань Кальная Улица 5,unknown,Wildberries
unknown,wildberries,г Касимов Микрорайон Приокский 11,unknown,Wildberries
unknown,wildberries,г Рязань Улица Зубковой 27к4,unknown,Wildberries
unknown,wildberries,г Рязань Черновицкая Улица 19,unknown,Wildberries
unknown,wildberries,рп Тума Улица Ленина 87,unknown,Wildberries
unknown,wildberries,Спасск-Рязанский Рязанская область Спасский район Рязанское шоссе 20Б,unknown,Wildberries
unknown,wildberries,Шилово Рязанская обл Шиловский р-н Стройкова 9 А,unknown,Wildberries
unknown,wildberries,г Рязань Окский Проезд 24к1,unknown,Wildberries
unknown,wildberries,Рязань Рязанская область городской округ Рязань Московское шоссе 61,unknown,Wildberries
unknown,wildberries,г Сасово Микрорайон Южный 1в,unknown,Wildberries
unknown,wildberries,Россия Рязанская обл Рязанский р-н п Мурмино Лесная Улица 1,unknown,Wildberries
unknown,wildberries,г Рязань Михайловское Шоссе 73а,unknown,Wildberries
unknown,wildberries,с Поляны Улица Терёхина 1,unknown,Wildberries
unknown,wildberries,г Рязань Улица Новикова-Прибоя 12,unknown,Wildberries
unknown,wildberries,г Рязань 2-Й Бульварный Проезд 1,unknown,Wildberries
unknown,wildberries,г Рязань Улица Новосёлов 58,unknown,Wildberries
unknown,wildberries,г Касимов Северная Улица 1а,unknown,Wildberries
unknown,wildberries,г Спасск-Рязанский Улица Ломоносова 1литз,unknown,Wildberries
unknown,wildberries,г Рязань Улица Княжье Поле 4,unknown,Wildberries
unknown,wildberries,г Рязань Касимовское Шоссе 63к1,unknown,Wildberries
unknown,wildberries,Ряжск Рязанская область Ряжский район улица Лермонтова 23,unknown,Wildberries
unknown,wildberries,Рязань Рязанская обл проезд Гоголя 3А,unknown,Wildberries
unknown,wildberries,г Рязань Улица Островского 105а,unknown,Wildberries
unknown,wildberries,г Рязань Семчинская Улица 3,unknown,Wildberries
unknown,wildberries,г Рыбное Перспективная Улица 2,unknown,Wildberries
unknown,wildberries,г Рязань Васильевский Проезд 4,unknown,Wildberries
unknown,wildberries,г Рязань Микрорайон Олимпийский Городок 9,unknown,Wildberries
unknown,wildberries,г Рязань Улица Крупской 9,unknown,Wildberries
unknown,wildberries,г Рыбное Переулок Свободы 8,unknown,Wildberries
unknown,wildberries,г Касимов Советская Улица 199г,unknown,Wildberries
unknown,wildberries,Рязань Рязанская обл Вишнёвая улица 21,unknown,Wildberries
unknown,wildberries,Рязанская область Рязань Весенняя улица 24к1,unknown,Wildberries
unknown,wildberries,Рязань Рязанская обл Интернациональная улица 22А,unknown,Wildberries
unknown,wildberries,Рязань Рязанская область городской округ Рязань улица Крупской 21к4,unknown,Wildberries
unknown,wildberries,г Рязань Мервинская Улица 2б,unknown,Wildberries
unknown,wildberries,рп Сараи Улица Ленина 29,unknown,Wildberries
unknown,wildberries,г Рязань Улица Новосёлов 40а,unknown,Wildberries
unknown,wildberries,г Рязань Вишнёвая Улица 32,unknown,Wildberries
unknown,wildberries,г Рязань Интернациональная Улица 16а,unknown,Wildberries
unknown,wildberries,г Рязань Улица Зубковой 26а,unknown,Wildberries
unknown,wildberries,г Рязань Улица Грибоедова 20,unknown,Wildberries
unknown,wildberries,г Сасово Микрорайон Южный 15а,unknown,Wildberries
unknown,wildberries,г Новомичуринск Улица Волкова 3/10,unknown,Wildberries
unknown,wildberries,г Рязань Касимовское Шоссе 15к2,unknown,Wildberries
unknown,wildberries,г Рязань Шереметьевская Улица 10к2,unknown,Wildberries
unknown,wildberries,г Рязань Быстрецкая Улица 20,unknown,Wildberries
unknown,wildberries,п Тереховое Улица Гончарова 2,unknown,Wildberries
unknown,wildberries,г Рязань Улица Гагарина 156,unknown,Wildberries
unknown,wildberries,г Михайлов Рязанская Улица 22,unknown,Wildberries
unknown,wildberries,г Рязань Улица Дзержинского 59,unknown,Wildberries
unknown,wildberries,Шилово Рязанская обл Шиловский р-н Советская площадь 7,unknown,Wildberries
unknown,wildberries,Рязань Рязанская область городской округ Рязань улица Александра Полина 1,unknown,Wildberries
unknown,wildberries,г Рязань Электрозаводская Улица 87,unknown,Wildberries
unknown,wildberries,г Рязань Улица Новаторов 2,unknown,Wildberries
unknown,wildberries,рп Шилово Советская Улица 6,unknown,Wildberries
unknown,wildberries,рп Тума Пожарная Площадь 2,unknown,Wildberries
unknown,wildberries,п Крутоярский Посёлок Крутоярский 76,unknown,Wildberries
unknown,wildberries,г Рязань Татарская Улица 77,unknown,Wildberries
unknown,wildberries,п Листвянка Школьная Улица 1а,unknown,Wildberries
unknown,wildberries,г Рязань Васильевская Улица 7,unknown,Wildberries
unknown,wildberries,рп Александро-Невский Советская Улица 8,unknown,Wildberries
unknown,wildberries,г Рыбное Улица Мира 12,unknown,Wildberries
unknown,wildberries,г Рязань Октябрьская Улица 35а,unknown,Wildberries
unknown,wildberries,г Рязань Станкозаводская Улица 22/10,unknown,Wildberries
unknown,wildberries,г Рязань Московское Шоссе 47к1,unknown,Wildberries
unknown,wildberries,г Рязань Улица Новаторов 25,unknown,Wildberries
unknown,wildberries,Михайлов Рязанская обл Михайловский р-н площадь Труда 1,unknown,Wildberries
unknown,wildberries,рп Старожилово Улица Толстого 11,unknown,Wildberries
unknown,wildberries,г Новомичуринск Проспект Смирягина 5,unknown,Wildberries
unknown,wildberries,г Ряжск Высотная Улица 3б,unknown,Wildberries
unknown,wildberries,рп Ухолово Улица Ленина 25,unknown,Wildberries
unknown,wildberries,г Рязань Улица Фирсова 16,unknown,Wildberries
unknown,wildberries,г Касимов Улица Посёлок Фабрика 1,unknown,Wildberries
unknown,wildberries,г Рязань Улица Связи 13,unknown,Wildberries
unknown,wildberries,г Рязань Центральная Улица 90а,unknown,Wildberries
unknown,wildberries,г Касимов Микрорайон Приокский 17,unknown,Wildberries
unknown,wildberries,г Рязань Улица Гагарина 33,unknown,Wildberries
unknown,wildberries,г Скопин Микрорайон АЗМР 14в,unknown,Wildberries
unknown,wildberries,рп Гусь-Железный Улица Капитана Подлеснова 1а,unknown,Wildberries
unknown,wildberries,г Касимов Татарская Улица 43,unknown,Wildberries
unknown,wildberries,г Михайлов Улица Карла Маркса 26,unknown,Wildberries
unknown,wildberries,г Рязань Интернациональная Улица 23к1,unknown,Wildberries
unknown,wildberries,г Скопин Улица Пирогова 11,unknown,Wildberries
unknown,wildberries,г Касимов Советская Улица 34,unknown,Wildberries
unknown,wildberries,рп Пронск Заводская Улица 14,unknown,Wildberries
unknown,wildberries,Рязанская область рабочий посёлок Кадом улица Дзержинского 4Б,unknown,Wildberries
unknown,wildberries,г Рязань Шереметьевская Улица 12,unknown,Wildberries
unknown,wildberries,г Рязань Улица Бирюзова 21к2,unknown,Wildberries
unknown,wildberries,г Рязань Октябрьская Улица 27,unknown,Wildberries
unknown,wildberries,г Рязань Улица 8 Марта 26с1,unknown,Wildberries
unknown,wildberries,г Рязань Улица Гоголя 42,unknown,Wildberries
unknown,wildberries,г Рязань Улица 4-Я Линия 66,unknown,Wildberries
unknown,wildberries,г Рязань Улица Пугачёва 15,unknown,Wildberries
unknown,wildberries,г Рязань Интернациональная Улица 21,unknown,Wildberries
unknown,wildberries,рп Шилово Улица Стройкова 4,unknown,Wildberries
unknown,wildberries,г Рязань Берёзовая Улица 1г,unknown,Wildberries
unknown,wildberries,г Рязань Октябрьская Улица 53,unknown,Wildberries
unknown,wildberries,г Рязань Посёлок Мехзавода 14,unknown,Wildberries
unknown,wildberries,рп Сапожок Улица Вал 56,unknown,Wildberries
unknown,wildberries,г Касимов Улица Илюшкина 51,unknown,Wildberries
unknown,wildberries,г Рязань Славянский Проспект 3,unknown,Wildberries
unknown,wildberries,г Рязань Улица Советской Армии 7к1,unknown,Wildberries
unknown,wildberries,г Скопин Высоковольтная Улица 1б,unknown,Wildberries
unknown,wildberries,г Новомичуринск Проспект Энергетиков 42а,unknown,Wildberries
unknown,wildberries,г Шацк Улица Тараскина 27,unknown,Wildberries
unknown,wildberries,Скопин Рязанская область городской округ Скопин Советская 90,unknown,Wildberries
unknown,wildberries,г Рязань Васильевский Переулок 5,unknown,Wildberries
unknown,wildberries,г Рязань Улица Новосёлов 16а,unknown,Wildberries
unknown,wildberries,г Рязань Куйбышевское Шоссе 13,unknown,Wildberries
unknown,wildberries,с Ижевское Улица Циолковского 299,unknown,Wildberries
unknown,wildberries,г Шацк Улица Цюрупы 4,unknown,Wildberries
unknown,wildberries,г Рязань Вокзальная Улица 51а,unknown,Wildberries
unknown,wildberries,г Кораблино Улица Карла Маркса 11,unknown,Wildberries
unknown,wildberries,г Рязань Улица Сельских Строителей 4в,unknown,Wildberries
unknown,wildberries,г Рязань Улица Зубковой 21,unknown,Wildberries
unknown,wildberries,г Рязань Затинная Улица 11,unknown,Wildberries
unknown,wildberries,Рязанская область Рязань улица Чкалова 1к4,unknown,Wildberries
unknown,wildberries,г Сасово Вокзальная Улица 45,unknown,Wildberries
unknown,wildberries,г Рязань Улица Чкалова 80,unknown,Wildberries
unknown,wildberries,г Рязань Улица Чапаева 61,unknown,Wildberries
unknown,wildberries,г Рязань Улица Карла Маркса 3к2,unknown,Wildberries
unknown,wildberries,г Рязань Улица 3-И Бутырки 2б,unknown,Wildberries
unknown,wildberries,г Рязань Забайкальская Улица 16б,unknown,Wildberries
unknown,wildberries,г Рязань 2-Й Сиреневый Проезд 2,unknown,Wildberries
unknown,wildberries,Рязанская область Сасово Ново-Елатомская улица 41,unknown,Wildberries
unknown,wildberries,рабочий посёлок Пителино Улица Советская Площадь 4,unknown,Wildberries
unknown,wildberries,рп Сараи Улица Ломоносова 25,unknown,Wildberries
unknown,wildberries,рабочий посёлок Сараи Привокзальная Улица 34,unknown,Wildberries
unknown,wildberries,Рязанская область Сасово улица Ленина 53,unknown,Wildberries
unknown,wildberries,Рязань Кальная Улица 37,unknown,Wildberries
unknown,wildberries,Рязань Большая Улица 94к1,unknown,Wildberries
unknown,wildberries,г Рязань Улица Нахимова 3,unknown,Wildberries
unknown,wildberries,Сасово Микрорайон Южный 5,unknown,Wildberries
unknown,wildberries,Рязанская область Спас-Клепики Московская улица 13,unknown,Wildberries
unknown,wildberries,рабочий посёлок Чучково Улица Ленина 6,unknown,Wildberries
unknown,wildberries,Рязанская область село Путятино улица Ворошилова 11,unknown,Wildberries
unknown,wildberries,Скопин Фабричная Улица 18,unknown,Wildberries
unknown,wildberries,Рязань Большая Улица 106,unknown,Wildberries
unknown,wildberries,Касимов Затонная Улица 2,unknown,Wildberries
unknown,wildberries,Рязанская область Рязань улица Есенина 65к2,unknown,Wildberries
unknown,wildberries,Рязанская область Рязань улица Бирюзова 7к2,unknown,Wildberries
unknown,wildberries,Рязанская область Рязань улица Стройкова 18,unknown,Wildberries
unknown,wildberries,Рязанская область Рязань улица Белякова 32А,unknown,Wildberries
unknown,wildberries,деревня Турлатово Новая Улица 17,unknown,Wildberries
unknown,wildberries,Рязанская область Рязань Черновицкая улица 6к1,unknown,Wildberries
unknown,wildberries,Рязань Улица Есенина 65,unknown,Wildberries
unknown,wildberries,деревня Хирино Центральная Улица 3,unknown,Wildberries
unknown,wildberries,Рязанская область Рязань Касимовское шоссе 32к5,unknown,Wildberries
unknown,wildberries,Рязанская область Рязань улица Островского 122,unknown,Wildberries
unknown,wildberries,село Заборье Улица Павлова 38,unknown,Wildberries
unknown,wildberries,село Истье Мострансгазовская Улица 18а,unknown,Wildberries
unknown,wildberries,село Подвязье Центральная Улица 4,unknown,Wildberries
unknown,wildberries,посёлок Искра Улица Мира 15а,unknown,Wildberries
unknown,wildberries,Рязань Введенская Улица 67,unknown,Wildberries
unknown,wildberries,Рязанская область посёлок городского типа Лесной Школьная улица 16,unknown,Wildberries
unknown,wildberries,Рязань Улица Есенина 108,unknown,Wildberries
unknown,wildberries,Рязань Улица Зубковой 27к2,unknown,Wildberries
unknown,wildberries,Рязанская область Ряжск улица Максима Горького 13А,unknown,Wildberries
unknown,wildberries,село Льгово Полевая Улица 88а,unknown,Wildberries
unknown,wildberries,Рязань Татарская Улица 15,unknown,Wildberries
unknown,wildberries,рабочий посёлок Сынтул Набережная Улица 1,unknown,Wildberries
unknown,wildberries,Рязань Улица Дзержинского 14,unknown,Wildberries
unknown,wildberries,село Поляны Улица Терёхина 75,unknown,Wildberries
unknown,wildberries,село Захарово Центральная Улица 118,unknown,Wildberries
unknown,wildberries,посёлок Сотницыно Заводская Улица 30,unknown,Wildberries
unknown,wildberries,село Агро-Пустынь Комсомольская Улица 1а,unknown,Wildberries
unknown,wildberries,рабочий посёлок Ухолово Улица Ленина 8б,unknown,Wildberries
unknown,wildberries,Рязанская область село Александрово Вишнёвая улица 34,unknown,Wildberries
unknown,wildberries,Рязанская область Рязань Михайловское шоссе 270,unknown,Wildberries
