City,Place Name,Zipcode,Name
Ljubljana,a1_si,,unknown,Center A1 Ljubljana Aleja Šiška
Ljubljana,audi,Bravnicarjeva ulica 5 1117 Ljubljana,unknown,Porsche Ljubljana podružnica PIA d.o.o.
Ljubljana,audi,Dunajska cesta 122 1000 Ljubljana,unknown,Autodelta d.o.o.
Ljubljana,audi,Verovskova ulica 78 1000 Ljubljana,unknown,Porsche Verovškova podružnica PIA d.o.o.
Ljubljana,avis,,unknown,Avis Slovenia Ljubljana
Ljubljana,mercedes_benz,,unknown,"Emil Frey Avtocenter, trgovina in storitve, d.o.o."
Ljubljana,nissan_europe,,unknown,"AVTOHIŠA MALGAJ D.O.O., PSC LJUBLJANA"
unknown,pepco,,unknown,Pepco
Ljubljana,smart,,unknown,"Emil Frey Avtocenter, trgovina in storitve, d.o.o."
