Ref,Spider,Name,Address,City,State,Zipcode,Country,Phone,Website,Hours,Brand,WikiData
139507,sparkasse_de,Nord-Ostsee Sparkasse  Geldautomat Busdorf  Autohof Wikingerland,,Busdorf,,,DE,+49 4621 895555,https://www.sparkasse.de/standorte/geldautomaten/nord-ostsee-sparkasse-geldautomat-busdorf-autohof-wikingerland-139507,24/7,Sparkasse,Q13601825
19152,sparkasse_de,Nord-Ostsee Sparkasse  Geldautomat Busdorf,,Busdorf,,,DE,+49 4621 895555,https://www.sparkasse.de/standorte/geldautomaten/nord-ostsee-sparkasse-geldautomat-busdorf-19152,24/7,Sparkasse,Q13601825
139731,sparkasse_de,Nord-Ostsee Sparkasse  SB-Filiale Busdorf,,Busdorf,,,DE,+49 4621 895555,https://www.sparkasse.de/standorte/filialen/nord-ostsee-sparkasse-sb-filiale-busdorf-139731,24/7,Sparkasse,Q13601825
,visa,,,BUSDORF,,,DE,,,,,
https://www.vr.de/standorte/B/Bn-Bz/vr-bank-schleswig-mittelholstein-eg-sb-filiale-edeka-fick-busdor-18894.html,vr_bank,VR Bank Schleswig-Mittelholstein eG SB-Filiale EDEKA Fick Busdorf,,Busdorf,,,DE,+49 4621 3880,https://www.vr-sl-mh.de,Mo-Sa 06:00-21:00,,
