Ref,Spider,Name,Address,City,State,Zipcode,Country,Phone,Website,Hours,Brand,WikiData
137073,wildberries,Wildberries,"г Изобильный, Улица Розы Люксембург 3б",,Stavropol'skiy,,RU,,,Mo-Su 09:00-21:00,Wildberries,Q24933714
137310,wildberries,Wildberries,"г Михайловск, Улица Ишкова 95",,Stavropol'skiy,,RU,,,Mo-Su 09:00-21:00,Wildberries,Q24933714
137599,wildberries,Wildberries,"г Ессентуки, Кисловодская Улица 30а",,Stavropol'skiy,,RU,,,Mo-Su 09:00-21:00,Wildberries,Q24933714
137639,wildberries,Wildberries,"Ставропольский край, г Ставрополь, ул Рогожникова, д 11 ",,Stavropol'skiy,,RU,,,Mo-Su 10:00-21:00,Wildberries,Q24933714
138214,wildberries,Wildberries,"г Ставрополь, Улица 50 Лет ВЛКСМ 33",,Stavropol'skiy,,RU,,,Mo-Su 10:00-21:00,Wildberries,Q24933714
138301,wildberries,Wildberries,"г Ипатово, Улица Свердлова 44",,Stavropol'skiy,,RU,,,Mo-Su 10:00-21:00,Wildberries,Q24933714
138304,wildberries,Wildberries,"г Пятигорск, 1-Я Бульварная Улица 14",,Stavropol'skiy,,RU,,,Mo-Su 10:00-21:00,Wildberries,Q24933714
138576,wildberries,Wildberries,"г Ставрополь, Улица 60 Лет Победы 21в",,Stavropol'skiy,,RU,,,Mo-Su 09:00-21:00,Wildberries,Q24933714
138579,wildberries,Wildberries,"г Ставрополь, Улица 50 Лет ВЛКСМ 79",,Stavropol'skiy,,RU,,,Mo-Su 09:00-21:00,Wildberries,Q24933714
138707,wildberries,Wildberries,"Ставропольский край, Пятигорск, улица Адмиральского, 6А",,Stavropol'skiy,,RU,,,Mo-Su 10:00-21:00,Wildberries,Q24933714
138731,wildberries,Wildberries,"г Ставрополь, Черниговская Улица 4/1",,Stavropol'skiy,,RU,,,Mo-Su 09:00-21:00,Wildberries,Q24933714
138904,wildberries,Wildberries,"Ставропольский край, Ипатово, Ленинградская улица, 26А",,Stavropol'skiy,,RU,,,Mo-Su 10:00-21:00,Wildberries,Q24933714
139196,wildberries,Wildberries,"г Буденновск, Прикумская Улица 62б",,Stavropol'skiy,,RU,,,Mo-Su 09:00-21:00,Wildberries,Q24933714
140047,wildberries,Wildberries,"г Михайловск, Улица Ленина 213",,Stavropol'skiy,,RU,,,Mo-Su 09:00-21:00,Wildberries,Q24933714
140590,wildberries,Wildberries,"Александровское Ставропольский край, Александровский р-н Войтика 33",,Stavropol'skiy,,RU,,,Mo-Su 10:00-21:00,Wildberries,Q24933714
140666,wildberries,Wildberries,"Новоалександровск Ставропольский край, р-н Новоалександровский Железнодорожная улица 47",,Stavropol'skiy,,RU,,,Mo-Su 10:00-21:00,Wildberries,Q24933714
141039,wildberries,Wildberries,"г Ставрополь, Улица Пирогова 54д",,Stavropol'skiy,,RU,,,Mo-Su 09:00-21:00,Wildberries,Q24933714
141043,wildberries,Wildberries,"г Ставрополь, Улица Тухачевского 7/2",,Stavropol'skiy,,RU,,,Mo-Su 10:00-21:00,Wildberries,Q24933714
141097,wildberries,Wildberries,"Ставропольский край, г Кисловодск, ул Чкалова, д 75/1 ",,Stavropol'skiy,,RU,,,Mo-Su 10:00-21:00,Wildberries,Q24933714
141314,wildberries,Wildberries,"г Ставрополь, Улица Пирогова 5ак9",,Stavropol'skiy,,RU,,,Mo-Su 10:00-21:00,Wildberries,Q24933714
141478,wildberries,Wildberries,"г Ставрополь, Улица Тухачевского 30/2",,Stavropol'skiy,,RU,,,Mo-Su 10:00-21:00,Wildberries,Q24933714
141649,wildberries,Wildberries,"г Ставрополь, Улица Ленина 474",,Stavropol'skiy,,RU,,,Mo-Su 09:00-21:00,Wildberries,Q24933714
141656,wildberries,Wildberries,"Георгиевск Ставропольский край, Георгиевский городской округ улица Гагарина 6/5",,Stavropol'skiy,,RU,,,Mo-Su 10:00-21:00,Wildberries,Q24933714
142169,wildberries,Wildberries,"г Пятигорск, (Ставропольский край), пр-кт 40 лет Октября, д 14 ",,Stavropol'skiy,,RU,,,Mo-Su 10:00-21:00,Wildberries,Q24933714
142960,wildberries,Wildberries,"с Кочубеевское, Улица Ленина 139",,Stavropol'skiy,,RU,,,Mo-Su 09:00-20:00,Wildberries,Q24933714
143357,wildberries,Wildberries,"Зеленокумск Ставропольский край, Советский городской округ улица 50 лет Октября 38",,Stavropol'skiy,,RU,,,Mo-Su 10:00-21:00,Wildberries,Q24933714
143815,wildberries,Wildberries,"Ставропольский край, г Кисловодск, ул Калинина, д 18 ",,Stavropol'skiy,,RU,,,Mo-Su 10:00-21:00,Wildberries,Q24933714
144020,wildberries,Wildberries,"г Ставрополь, Улица Пирогова 74",,Stavropol'skiy,,RU,,,Mo-Su 09:00-21:00,Wildberries,Q24933714
144146,wildberries,Wildberries,"Ставропольский край, Пятигорск, улица Пестова, 9",,Stavropol'skiy,,RU,,,Mo-Su 10:00-21:00,Wildberries,Q24933714
144147,wildberries,Wildberries,"Ставропольский край, Пятигорск, Соборная улица, 2А",,Stavropol'skiy,,RU,,,Mo-Su 10:00-21:00,Wildberries,Q24933714
144282,wildberries,Wildberries,"г Благодарный, Улица Однокозова 160",,Stavropol'skiy,,RU,,,Mo-Su 09:00-21:00,Wildberries,Q24933714
144310,wildberries,Wildberries,"Светлоград Ставропольский край, Петровский городской округ улица Пушкина 19",,Stavropol'skiy,,RU,,,Mo-Su 10:00-21:00,Wildberries,Q24933714
144469,wildberries,Wildberries,"г Минеральные Воды, Бештаугорская Улица 3",,Stavropol'skiy,,RU,,,Mo-Su 09:00-21:00,Wildberries,Q24933714
144523,wildberries,Wildberries,"г Минеральные Воды, Проспект 22-Го Партсъезда 9",,Stavropol'skiy,,RU,,,Mo-Su 10:00-21:00,Wildberries,Q24933714
144623,wildberries,Wildberries,"г Ставрополь, Октябрьская Улица 202",,Stavropol'skiy,,RU,,,Mo-Su 09:00-21:00,Wildberries,Q24933714
144871,wildberries,Wildberries,"г Ессентуки, Кисловодская Улица 24в",,Stavropol'skiy,,RU,,,Mo-Su 10:00-21:00,Wildberries,Q24933714
145266,wildberries,Wildberries,"Ставропольский край, Ставрополь, улица Рогожникова, 23",,Stavropol'skiy,,RU,,,Mo-Su 10:00-21:00,Wildberries,Q24933714
145562,wildberries,Wildberries,"Ставропольский край, Ставрополь, улица Тухачевского, 25/2",,Stavropol'skiy,,RU,,,Mo-Su 10:00-21:00,Wildberries,Q24933714
146218,wildberries,Wildberries,"г Ставрополь, Улица Ленина 328а",,Stavropol'skiy,,RU,,,Mo-Su 09:00-21:00,Wildberries,Q24933714
146510,wildberries,Wildberries,"г Благодарный, Московская Улица 199",,Stavropol'skiy,,RU,,,Mo-Su 09:00-21:00,Wildberries,Q24933714
147038,wildberries,Wildberries,"Ставропольский край, Кисловодск, улица Кирова, 35",,Stavropol'skiy,,RU,,,Mo-Su 10:00-21:00,Wildberries,Q24933714
147059,wildberries,Wildberries,Невинномысск Ставропольский край улица Менделеева 37,,Stavropol'skiy,,RU,,,Mo-Su 10:00-21:00,Wildberries,Q24933714
149754,wildberries,Wildberries,"г Пятигорск, Улица Комарова 33",,Stavropol'skiy,,RU,,,Mo-Su 10:00-21:00,Wildberries,Q24933714
149988,wildberries,Wildberries,"Ставропольский край, Ставрополь, улица Чехова, 49",,Stavropol'skiy,,RU,,,Mo-Su 10:00-21:00,Wildberries,Q24933714
150599,wildberries,Wildberries,"г Пятигорск, Улица Орджоникидзе 2",,Stavropol'skiy,,RU,,,Mo-Su 10:00-21:00,Wildberries,Q24933714
151105,wildberries,Wildberries,"г Благодарный, Квартал Площадь Строителей 14",,Stavropol'skiy,,RU,,,Mo-Su 10:00-21:00,Wildberries,Q24933714
151427,wildberries,Wildberries,"г Невинномысск, Революционная Улица 24",,Stavropol'skiy,,RU,,,Mo-Su 09:00-20:00,Wildberries,Q24933714
151731,wildberries,Wildberries,"г Ставрополь, Улица Тухачевского 22/3",,Stavropol'skiy,,RU,,,Mo-Su 10:00-21:00,Wildberries,Q24933714
152080,wildberries,Wildberries,"г Ессентуки, Улица Долина Роз 2",,Stavropol'skiy,,RU,,,Mo-Su 09:00-21:00,Wildberries,Q24933714
152214,wildberries,Wildberries,"г Кисловодск, Улица Островского 33",,Stavropol'skiy,,RU,,,Mo-Su 10:00-21:00,Wildberries,Q24933714
152228,wildberries,Wildberries,"Ставропольский край, Ставрополь, улица имени Советской Армии-2, 181А",,Stavropol'skiy,,RU,,,Mo-Su 10:00-21:00,Wildberries,Q24933714
152425,wildberries,Wildberries,"г Пятигорск, Улица Бунимовича 15к2",,Stavropol'skiy,,RU,,,Mo-Su 10:00-21:00,Wildberries,Q24933714
152723,wildberries,Wildberries,"с Ивановское, Улица Калинина 164",,Stavropol'skiy,,RU,,,Mo-Su 09:00-20:00,Wildberries,Q24933714
153619,wildberries,Wildberries,"г Ставрополь, Переулок Шеболдаева 3а",,Stavropol'skiy,,RU,,,Mo-Su 09:00-21:00,Wildberries,Q24933714
153655,wildberries,Wildberries,"Ставрополь Ставропольский край, городской округ Ставрополь Шпаковская улица 94/3",,Stavropol'skiy,,RU,,,Mo-Su 10:00-21:00,Wildberries,Q24933714
153882,wildberries,Wildberries,"Ставропольский край, Благодарный, Первомайская улица, 59",,Stavropol'skiy,,RU,,,Mo-Su 10:00-21:00,Wildberries,Q24933714
154368,wildberries,Wildberries,"п Иноземцево, Степная Улица 13",,Stavropol'skiy,,RU,,,Mo-Su 10:00-21:00,Wildberries,Q24933714
155399,wildberries,Wildberries,"г Ставрополь, Улица 50 Лет ВЛКСМ 69/1",,Stavropol'skiy,,RU,,,Mo-Su 10:00-21:00,Wildberries,Q24933714
155904,wildberries,Wildberries,"Ставропольский край, Пятигорск, улица 295-й Стрелковой Дивизии, 1А",,Stavropol'skiy,,RU,,,Mo-Su 10:00-21:00,Wildberries,Q24933714
157051,wildberries,Wildberries,"г Ставрополь, Улица 50 Лет ВЛКСМ 35а",,Stavropol'skiy,,RU,,,Mo-Su 10:00-21:00,Wildberries,Q24933714
157350,wildberries,Wildberries,"с Обильное, Колхозная Улица 35/1",,Stavropol'skiy,,RU,,,Mo-Su 09:00-20:00,Wildberries,Q24933714
157583,wildberries,Wildberries,"ст-ца Ессентукская, Улица Павлова 2а",,Stavropol'skiy,,RU,,,Mo-Su 10:00-21:00,Wildberries,Q24933714
157714,wildberries,Wildberries,"г Невинномысск, Клубный Переулок 19",,Stavropol'skiy,,RU,,,Mo-Su 09:00-20:00,Wildberries,Q24933714
157858,wildberries,Wildberries,"Ставропольский край, Ессентуки, Октябрьская улица, 360",,Stavropol'skiy,,RU,,,Mo-Su 10:00-21:00,Wildberries,Q24933714
158253,wildberries,Wildberries,"г Ессентуки, Озёрная Улица 4а",,Stavropol'skiy,,RU,,,Mo-Su 09:00-21:00,Wildberries,Q24933714
158302,wildberries,Wildberries,"Ставропольский край, Пятигорск, Оранжерейная улица, 21к4",,Stavropol'skiy,,RU,,,Mo-Su 10:00-21:00,Wildberries,Q24933714
158709,wildberries,Wildberries,"Ставропольский край, посёлок Горячеводский, проспект Советской Армии, 116",,Stavropol'skiy,,RU,,,Mo-Su 10:00-21:00,Wildberries,Q24933714
158778,wildberries,Wildberries,"г Ессентуки, Шоссейная Улица 45",,Stavropol'skiy,,RU,,,Mo-Su 09:00-21:00,Wildberries,Q24933714
158823,wildberries,Wildberries,"г Ставрополь, Улица 50 Лет ВЛКСМ 18",,Stavropol'skiy,,RU,,,Mo-Su 10:00-21:00,Wildberries,Q24933714
158834,wildberries,Wildberries,"г Ставрополь, 2-Й Юго-Западный Проезд 2д",,Stavropol'skiy,,RU,,,Mo-Su 10:00-21:00,Wildberries,Q24933714
158965,wildberries,Wildberries,"г Ставрополь, Объездная Улица 3",,Stavropol'skiy,,RU,,,Mo-Su 10:00-21:00,Wildberries,Q24933714
159051,wildberries,Wildberries,"г Ессентуки, Пятигорская Улица 96",,Stavropol'skiy,,RU,,,Mo-Su 10:00-21:00,Wildberries,Q24933714
159063,wildberries,Wildberries,"г Ставрополь, Улица Генерала Маргелова 9/1",,Stavropol'skiy,,RU,,,Mo-Su 09:00-22:00,Wildberries,Q24933714
159078,wildberries,Wildberries,"г Пятигорск, Теплосерная Улица 62а",,Stavropol'skiy,,RU,,,Mo-Su 10:00-21:00,Wildberries,Q24933714
159151,wildberries,Wildberries,"Ставропольский край, Ставрополь, Шпаковская улица, 42",,Stavropol'skiy,,RU,,,Mo-Su 10:00-21:00,Wildberries,Q24933714
159226,wildberries,Wildberries,"г Кисловодск, Проспект Победы 124а",,Stavropol'skiy,,RU,,,Mo-Su 10:00-21:00,Wildberries,Q24933714
159255,wildberries,Wildberries,"г Невинномысск, Улица Шевченко 6",,Stavropol'skiy,,RU,,,Mo-Su 09:00-20:00,Wildberries,Q24933714
159283,wildberries,Wildberries,"г Невинномысск, Улица Менделеева 10",,Stavropol'skiy,,RU,,,Mo-Su 10:00-21:00,Wildberries,Q24933714
159292,wildberries,Wildberries,"г Михайловск, Улица Ленина 96",,Stavropol'skiy,,RU,,,Mo-Su 10:00-21:00,Wildberries,Q24933714
159503,wildberries,Wildberries,"г Невинномысск, Улица Гагарина 54",,Stavropol'skiy,,RU,,,Mo-Su 09:00-21:00,Wildberries,Q24933714
159728,wildberries,Wildberries,"с Сотниковское, Площадь Тучина 5/3",,Stavropol'skiy,,RU,,,Mo-Su 10:00-21:00,Wildberries,Q24933714
159864,wildberries,Wildberries,"г Ставрополь, Восточный Переулок 4",,Stavropol'skiy,,RU,,,Mo-Su 10:00-21:00,Wildberries,Q24933714
159877,wildberries,Wildberries,"с Летняя Ставка, Советская Улица 118",,Stavropol'skiy,,RU,,,Mo-Su 09:00-21:00,Wildberries,Q24933714
159962,wildberries,Wildberries,"г Ставрополь, Проспект Кулакова 49/1",,Stavropol'skiy,,RU,,,Mo-Su 10:00-21:00,Wildberries,Q24933714
160549,wildberries,Wildberries,"г Ставрополь, Улица Тухачевского 28/1",,Stavropol'skiy,,RU,,,Mo-Su 10:00-22:00,Wildberries,Q24933714
160615,wildberries,Wildberries,"г Ставрополь, Октябрьская Улица 190/1",,Stavropol'skiy,,RU,,,Mo-Su 10:00-21:00,Wildberries,Q24933714
160864,wildberries,Wildberries,"г Михайловск, Улица Гоголя 79",,Stavropol'skiy,,RU,,,Mo-Su 10:00-21:00,Wildberries,Q24933714
160990,wildberries,Wildberries,"с Винсады, Подгорная Улица 11",,Stavropol'skiy,,RU,,,Mo-Su 09:00-21:00,Wildberries,Q24933714
161235,wildberries,Wildberries,"г Ставрополь, Проспект Кулакова 27г",,Stavropol'skiy,,RU,,,Mo-Su 09:00-21:00,Wildberries,Q24933714
161376,wildberries,Wildberries,"г Буденновск, Улица Кирпичных Заводов 181/3",,Stavropol'skiy,,RU,,,Mo-Su 08:00-21:00,Wildberries,Q24933714
161448,wildberries,Wildberries,"г Ставрополь, Улица Тухачевского 26/4",,Stavropol'skiy,,RU,,,Mo-Su 10:00-21:00,Wildberries,Q24933714
161609,wildberries,Wildberries,"г Невинномысск, Улица Энгельса 34",,Stavropol'skiy,,RU,,,Mo-Su 10:00-21:00,Wildberries,Q24933714
161807,wildberries,Wildberries,"Ставропольский край, Ставрополь, улица Тухачевского, 19/3",,Stavropol'skiy,,RU,,,Mo-Su 10:00-21:00,Wildberries,Q24933714
161911,wildberries,Wildberries,"г Ставрополь, Улица Мира 367/20",,Stavropol'skiy,,RU,,,Mo-Su 09:00-20:00,Wildberries,Q24933714
161982,wildberries,Wildberries,"г Минеральные Воды, Улица 50 Лет Октября 41",,Stavropol'skiy,,RU,,,Mo-Su 10:00-21:00,Wildberries,Q24933714
162254,wildberries,Wildberries,"г Ессентуки, Баррикадная Улица 2",,Stavropol'skiy,,RU,,,Mo-Su 10:00-21:00,Wildberries,Q24933714
162314,wildberries,Wildberries,"Ставропольский край, Минеральные Воды, Кисловодская улица, 54",,Stavropol'skiy,,RU,,,Mo-Su 10:00-21:00,Wildberries,Q24933714
162358,wildberries,Wildberries,"Ставропольский край, Ставрополь, переулок Буйнакского, 2з",,Stavropol'skiy,,RU,,,Mo-Su 10:00-21:00,Wildberries,Q24933714
162361,wildberries,Wildberries,"г Ставрополь, Вокзальная Улица 24",,Stavropol'skiy,,RU,,,Mo-Su 08:00-22:00,Wildberries,Q24933714
162462,wildberries,Wildberries,"ст-ца Ессентукская, Улица Гагарина 52а",,Stavropol'skiy,,RU,,,Mo-Su 10:00-21:00,Wildberries,Q24933714
162570,wildberries,Wildberries,"г Михайловск, Вокзальная Улица 99/1",,Stavropol'skiy,,RU,,,Mo-Su 09:00-21:00,Wildberries,Q24933714
162586,wildberries,Wildberries,"г Благодарный, Первомайская Улица 28",,Stavropol'skiy,,RU,,,Mo-Su 09:00-21:00,Wildberries,Q24933714
162612,wildberries,Wildberries,"г Пятигорск, Улица Пастухова 14",,Stavropol'skiy,,RU,,,Mo-Su 10:00-21:00,Wildberries,Q24933714
162617,wildberries,Wildberries,"г Минеральные Воды, Проспект Карла Маркса 71",,Stavropol'skiy,,RU,,,Mo-Su 10:00-21:00,Wildberries,Q24933714
162674,wildberries,Wildberries,"г Михайловск, Улица Никонова 55",,Stavropol'skiy,,RU,,,Mo-Su 09:00-21:00,Wildberries,Q24933714
162697,wildberries,Wildberries,"г Ессентуки, Улица Фридриха Энгельса 40/3",,Stavropol'skiy,,RU,,,Mo-Su 10:00-21:00,Wildberries,Q24933714
162878,wildberries,Wildberries,"Ставропольский край, Ставрополь, улица Рогожникова, 17",,Stavropol'skiy,,RU,,,Mo-Su 10:00-21:00,Wildberries,Q24933714
163014,wildberries,Wildberries,"Ставропольский край, станица Ессентукская, улица Шести Коммунаров, 80А",,Stavropol'skiy,,RU,,,Mo-Su 10:00-21:00,Wildberries,Q24933714
163156,wildberries,Wildberries,"Ставропольский край, Пятигорск, Коллективная улица, 3",,Stavropol'skiy,,RU,,,Mo-Su 10:00-21:00,Wildberries,Q24933714
163210,wildberries,Wildberries,"Ставропольский край, Ставрополь, улица Доваторцев, 21",,Stavropol'skiy,,RU,,,Mo-Su 10:00-21:00,Wildberries,Q24933714
163256,wildberries,Wildberries,"г Ставрополь, Улица Чехова 85/17",,Stavropol'skiy,,RU,,,Mo-Su 09:00-20:00,Wildberries,Q24933714
163274,wildberries,Wildberries,"г Светлоград, Выставочная Площадь 8а",,Stavropol'skiy,,RU,,,Mo-Su 09:00-21:00,Wildberries,Q24933714
163490,wildberries,Wildberries,"г Пятигорск, Луговая Улица 8",,Stavropol'skiy,,RU,,,Mo-Su 09:00-20:00,Wildberries,Q24933714
163548,wildberries,Wildberries,"г Михайловск, Улица Ленина 199б",,Stavropol'skiy,,RU,,,Mo-Su 09:00-21:00,Wildberries,Q24933714
164034,wildberries,Wildberries,"г Невинномысск, Бульвар Мира 40в",,Stavropol'skiy,,RU,,,Mo-Su 09:00-20:00,Wildberries,Q24933714
164042,wildberries,Wildberries,"г Ставрополь, Переулок Крупской 29/2к1",,Stavropol'skiy,,RU,,,Mo-Su 09:00-21:00,Wildberries,Q24933714
164282,wildberries,Wildberries,"п Солнечнодольск, Молодёжная Улица 15а",,Stavropol'skiy,,RU,,,Mo-Su 10:00-21:00,Wildberries,Q24933714
164366,wildberries,Wildberries,"г Ставрополь, Улица Доваторцев 86/2",,Stavropol'skiy,,RU,,,Mo-Su 10:00-21:00,Wildberries,Q24933714
164372,wildberries,Wildberries,"г Ставрополь, Улица Рогожникова 1",,Stavropol'skiy,,RU,,,Mo-Su 10:00-21:00,Wildberries,Q24933714
164383,wildberries,Wildberries,"г Ставрополь, Улица Ленина 456/1",,Stavropol'skiy,,RU,,,Mo-Su 10:00-21:00,Wildberries,Q24933714
164386,wildberries,Wildberries,"г Ставрополь, Улица Пирогова 18б",,Stavropol'skiy,,RU,,,Mo-Su 10:00-21:00,Wildberries,Q24933714
164692,wildberries,Wildberries,"г Георгиевск, Улица Чугурина 24",,Stavropol'skiy,,RU,,,Mo-Su 10:00-21:00,Wildberries,Q24933714
164792,wildberries,Wildberries,"Курсавка Ставропольский край, Андроповский р-н Октябрьская улица 133В",,Stavropol'skiy,,RU,,,Mo-Su 10:00-21:00,Wildberries,Q24933714
165566,wildberries,Wildberries,"г Ставрополь, Улица Серова 486/2",,Stavropol'skiy,,RU,,,Mo-Su 10:00-21:00,Wildberries,Q24933714
166143,wildberries,Wildberries,"Ставропольский край, станица Советская, улица Фрунзе 22",,Stavropol'skiy,,RU,,,Mo-Su 10:00-21:00,Wildberries,Q24933714
166421,wildberries,Wildberries,"г Ессентуки, Октябрьская Улица 452",,Stavropol'skiy,,RU,,,Mo-Su 10:00-21:00,Wildberries,Q24933714
166720,wildberries,Wildberries,"г Невинномысск, Приборостроительная Улица 6",,Stavropol'skiy,,RU,,,Mo-Su 09:00-20:00,Wildberries,Q24933714
166874,wildberries,Wildberries,"Кочубеевское Ставропольский край, Кочубеевский р-н улица Октябрьской Революции 80б",,Stavropol'skiy,,RU,,,Mo-Su 10:00-21:00,Wildberries,Q24933714
167314,wildberries,Wildberries,"г Ставрополь, Проспект Кулакова 5/3",,Stavropol'skiy,,RU,,,Mo-Su 10:00-21:00,Wildberries,Q24933714
167468,wildberries,Wildberries,"Ставропольский край, Ставрополь, улица Доваторцев, 44Д",,Stavropol'skiy,,RU,,,Mo-Su 10:00-21:00,Wildberries,Q24933714
167486,wildberries,Wildberries,"Ставропольский край, село Прикумское, улица Ленина, 52",,Stavropol'skiy,,RU,,,Mo-Su 10:00-21:00,Wildberries,Q24933714
167508,wildberries,Wildberries,"с Верхнерусское, Подгорная Улица 7",,Stavropol'skiy,,RU,,,Mo-Su 10:00-21:00,Wildberries,Q24933714
167629,wildberries,Wildberries,"г Ессентуки, Новопятигорская Улица 5",,Stavropol'skiy,,RU,,,Mo-Su 09:00-20:00,Wildberries,Q24933714
167714,wildberries,Wildberries,"г Ессентуки, Улица Ермолова 110и",,Stavropol'skiy,,RU,,,Mo-Su 09:00-21:00,Wildberries,Q24933714
167770,wildberries,Wildberries,"г Ставрополь, Улица Пирогова 5ак7",,Stavropol'skiy,,RU,,,Mo-Su 10:00-21:00,Wildberries,Q24933714
167810,wildberries,Wildberries,"г Кисловодск, Улица Героев Медиков 10",,Stavropol'skiy,,RU,,,Mo-Su 10:00-22:00,Wildberries,Q24933714
167852,wildberries,Wildberries,"г Ставрополь, Улица Мимоз 16",,Stavropol'skiy,,RU,,,Mo-Su 09:00-21:00,Wildberries,Q24933714
168149,wildberries,Wildberries,"г Ставрополь, Улица Серова 468/6",,Stavropol'skiy,,RU,,,Mo-Su 09:00-21:00,Wildberries,Q24933714
168412,wildberries,Wildberries,"с Покойное, Улица Будённого 27",,Stavropol'skiy,,RU,,,Mo-Su 10:00-21:00,Wildberries,Q24933714
168568,wildberries,Wildberries,"г Пятигорск, Улица Пальмиро Тольятти 337а",,Stavropol'skiy,,RU,,,Mo-Su 09:00-20:00,Wildberries,Q24933714
169112,wildberries,Wildberries,"с Красногвардейское, Заводская Улица 1/5",,Stavropol'skiy,,RU,,,Mo-Su 09:00-20:00,Wildberries,Q24933714
169412,wildberries,Wildberries,"г Буденновск, Северный Микрорайон 6",,Stavropol'skiy,,RU,,,Mo-Su 09:00-21:00,Wildberries,Q24933714
169493,wildberries,Wildberries,"г Ставрополь, Улица Тухачевского 30/8",,Stavropol'skiy,,RU,,,Mo-Su 10:00-21:00,Wildberries,Q24933714
169725,wildberries,Wildberries,"г Зеленокумск, Улица Пугачёва 199а",,Stavropol'skiy,,RU,,,Mo-Su 09:00-20:00,Wildberries,Q24933714
170560,wildberries,Wildberries,"г Пятигорск, Октябрьская Улица 12",,Stavropol'skiy,,RU,,,Mo-Su 10:00-21:00,Wildberries,Q24933714
170676,wildberries,Wildberries,"г Ставрополь, Улица Серова 218",,Stavropol'skiy,,RU,,,Mo-Su 09:00-21:00,Wildberries,Q24933714
170760,wildberries,Wildberries,"г Минеральные Воды, Мостовая Улица 42",,Stavropol'skiy,,RU,,,Mo-Su 09:30-20:30,Wildberries,Q24933714
171124,wildberries,Wildberries,"с Балахоновское, Октябрьская Улица 16а",,Stavropol'skiy,,RU,,,Mo-Su 09:00-20:00,Wildberries,Q24933714
171177,wildberries,Wildberries,"с Эдиссия, Улица Абовяна 27",,Stavropol'skiy,,RU,,,Mo-Su 10:00-21:00,Wildberries,Q24933714
171409,wildberries,Wildberries,"г Георгиевск, Улица Тургенева 7",,Stavropol'skiy,,RU,,,Mo-Su 09:00-21:00,Wildberries,Q24933714
171630,wildberries,Wildberries,"п Нежинский, Тепличная Улица 63а",,Stavropol'skiy,,RU,,,Mo-Su 10:00-21:00,Wildberries,Q24933714
171676,wildberries,Wildberries,"с Арзгир, Улица Николенко 29",,Stavropol'skiy,,RU,,,Mo-Su 10:00-22:00,Wildberries,Q24933714
172251,wildberries,Wildberries,"г Минеральные Воды, Красногвардейская Улица 8",,Stavropol'skiy,,RU,,,Mo-Su 09:00-21:00,Wildberries,Q24933714
