Ref,Spider,Name,Address,City,State,Zipcode,Country,Phone,Website,Hours,Brand,WikiData
218475,wildberries,Wildberries,"Ставропольский край, село Труновское, Партизанская улица, 19",,Stavropol'skiy,,RU,,,Mo-Su 10:00-21:00,Wildberries,Q24933714
218557,wildberries,Wildberries,"село Падинское, Красная Улица 111",,Stavropol'skiy,,RU,,,Mo-Su 10:00-21:00,Wildberries,Q24933714
218989,wildberries,Wildberries,"село Константиновское, Улица Ленина 5",,Stavropol'skiy,,RU,,,Mo-Su 10:00-21:00,Wildberries,Q24933714
219106,wildberries,Wildberries,"станица Боргустанская, Красная Улица 33",,Stavropol'skiy,,RU,,,Mo-Su 10:00-21:00,Wildberries,Q24933714
219138,wildberries,Wildberries,"село Гофицкое, Советская Улица 69а",,Stavropol'skiy,,RU,,,Mo-Su 10:00-21:00,Wildberries,Q24933714
300659,wildberries,Wildberries,"село Сухая Буйвола, Красная Улица 22",,Stavropol'skiy,,RU,,,Mo-Su 10:00-21:00,Wildberries,Q24933714
300844,wildberries,Wildberries,"село Правокумское, Советская Улица 2",,Stavropol'skiy,,RU,,,Mo-Su 10:00-21:00,Wildberries,Q24933714
300847,wildberries,Wildberries,"село Заветное, Улица Ленина 43/а",,Stavropol'skiy,,RU,,,Mo-Su 10:00-21:00,Wildberries,Q24933714
300857,wildberries,Wildberries,"Новопавловск, Улица Мира 198",,Stavropol'skiy,,RU,,,Mo-Su 10:00-21:00,Wildberries,Q24933714
301216,wildberries,Wildberries,"Изобильный, Промышленная Улица 118н",,Stavropol'skiy,,RU,,,Mo-Su 10:00-21:00,Wildberries,Q24933714
301305,wildberries,Wildberries,"Ставропольский край, село Александровское, улица Калинина, 203",,Stavropol'skiy,,RU,,,Mo-Su 10:00-21:00,Wildberries,Q24933714
301683,wildberries,Wildberries,"Ставропольский край, село Орловка, улица Крутина, 27",,Stavropol'skiy,,RU,,,Mo-Su 09:00-21:00,Wildberries,Q24933714
301975,wildberries,Wildberries,"Ставропольский край, село Бешпагир, улица Ленина, 10Г",,Stavropol'skiy,,RU,,,Mo-Su 10:00-21:00,Wildberries,Q24933714
302083,wildberries,Wildberries,"Лермонтов, Улица Волкова 6",,Stavropol'skiy,,RU,,,Mo-Su 09:00-21:00,Wildberries,Q24933714
302176,wildberries,Wildberries,"Ставропольский край, станица Барсуковская, улица Мира, 34/1",,Stavropol'skiy,,RU,,,Mo-Su 09:00-20:00,Wildberries,Q24933714
302229,wildberries,Wildberries,"село Сенгилеевское, Площадь Ленина 8",,Stavropol'skiy,,RU,,,Mo-Su 10:00-21:00,Wildberries,Q24933714
302423,wildberries,Wildberries,"Ставропольский край, Лермонтов, улица Матвиенко, 1",,Stavropol'skiy,,RU,,,Mo-Su 10:00-21:00,Wildberries,Q24933714
302685,wildberries,Wildberries,"Пятигорск, Подстанционная Улица 1",,Stavropol'skiy,,RU,,,Mo-Su 10:00-22:00,Wildberries,Q24933714
302903,wildberries,Wildberries,"посёлок Комсомолец, Улица Ленина 15г",,Stavropol'skiy,,RU,,,Mo-Su 09:00-20:00,Wildberries,Q24933714
302910,wildberries,Wildberries,"Ставропольский край, Пятигорск, Московская улица, 88К3",,Stavropol'skiy,,RU,,,Mo-Su 10:00-21:00,Wildberries,Q24933714
302996,wildberries,Wildberries,"Ставропольский край, село Саблинское, Первомайская улица, 55",,Stavropol'skiy,,RU,,,Mo-Su 10:00-21:00,Wildberries,Q24933714
303174,wildberries,Wildberries,"Ставропольский край, село Надежда, Октябрьская улица, 45",,Stavropol'skiy,,RU,,,Mo-Su 10:00-21:00,Wildberries,Q24933714
303225,wildberries,Wildberries,"село Тахта, Улица Ленина 160",,Stavropol'skiy,,RU,,,Mo-Su 09:00-20:00,Wildberries,Q24933714
303367,wildberries,Wildberries,"Ставропольский край, Ставрополь, проспект Кулакова, 71",,Stavropol'skiy,,RU,,,Mo-Su 10:00-21:00,Wildberries,Q24933714
303400,wildberries,Wildberries,"Ставропольский край, Изобильный, улица Ленина, 111",,Stavropol'skiy,,RU,,,Mo-Su 10:00-21:00,Wildberries,Q24933714
303417,wildberries,Wildberries,"село Ладовская Балка, Улица Андреева 32а",,Stavropol'skiy,,RU,,,Mo-Su 10:00-21:00,Wildberries,Q24933714
303443,wildberries,Wildberries,"село Стародубское, Улица Анджиевского 141",,Stavropol'skiy,,RU,,,Mo-Su 10:00-21:00,Wildberries,Q24933714
303455,wildberries,Wildberries,"Ставропольский край, село Дивное, Советская улица, 103",,Stavropol'skiy,,RU,,,Mo-Su 10:00-21:00,Wildberries,Q24933714
303913,wildberries,Wildberries,"село Новозаведенное, Кооперативная Улица 1б",,Stavropol'skiy,,RU,,,Mo-Su 09:00-20:00,Wildberries,Q24933714
303958,wildberries,Wildberries,"Ставропольский край, Ставрополь, проспект Юности, 26А",,Stavropol'skiy,,RU,,,Mo-Su 10:00-21:00,Wildberries,Q24933714
303988,wildberries,Wildberries,"посёлок Шаумянский, Ручейный Переулок 1",,Stavropol'skiy,,RU,,,Mo-Su 10:00-21:00,Wildberries,Q24933714
304022,wildberries,Wildberries,"аул Эрсакон, Улица Абдулаева 2/6",,Stavropol'skiy,,RU,,,Mo-Su 10:00-21:00,Wildberries,Q24933714
304038,wildberries,Wildberries,"Ставропольский край, Невинномысск, Водопроводная улица, 357",,Stavropol'skiy,,RU,,,Mo-Su 10:00-21:00,Wildberries,Q24933714
304137,wildberries,Wildberries,"аул Махмуд-Мектеб, Восточная Улица 1/1",,Stavropol'skiy,,RU,,,Mo-Su 10:00-21:00,Wildberries,Q24933714
304194,wildberries,Wildberries,"село Ортатюбе, Улица Джанибекова 4а",,Stavropol'skiy,,RU,,,Mo-Su 10:00-21:00,Wildberries,Q24933714
304214,wildberries,Wildberries,"Будённовск, Улица Лопатина 179",,Stavropol'skiy,,RU,,,Mo-Su 10:00-21:00,Wildberries,Q24933714
304257,wildberries,Wildberries,"Ставрополь, Биологическая Улица 8",,Stavropol'skiy,,RU,,,Mo-Su 10:00-21:00,Wildberries,Q24933714
304354,wildberries,Wildberries,"Лермонтов, Пятигорская Улица 13",,Stavropol'skiy,,RU,,,Mo-Su 10:00-21:00,Wildberries,Q24933714
304390,wildberries,Wildberries,"Ставропольский край, село Пелагиада, улица Ленина, 73",,Stavropol'skiy,,RU,,,Mo-Su 10:00-21:00,Wildberries,Q24933714
304455,wildberries,Wildberries,"село Новая Жизнь, Центральная Улица 23б",,Stavropol'skiy,,RU,,,Mo-Su 10:00-21:00,Wildberries,Q24933714
304462,wildberries,Wildberries,"село Нины, Комсомольская Улица 159",,Stavropol'skiy,,RU,,,Mo-Su 10:00-21:00,Wildberries,Q24933714
304619,wildberries,Wildberries,"посёлок Иноземцево, Степная Улица 1к6",,Stavropol'skiy,,RU,,,Mo-Su 09:00-21:00,Wildberries,Q24933714
304626,wildberries,Wildberries,"село Александрия, Советская Улица 10а",,Stavropol'skiy,,RU,,,Mo-Su 09:00-20:00,Wildberries,Q24933714
304657,wildberries,Wildberries,"село Солуно-Дмитриевское, Советская Улица 42",,Stavropol'skiy,,RU,,,Mo-Su 09:00-20:00,Wildberries,Q24933714
304665,wildberries,Wildberries,"посёлок имени Кирова, Шоссейная Улица 8",,Stavropol'skiy,,RU,,,Mo-Su 10:00-21:00,Wildberries,Q24933714
304750,wildberries,Wildberries,"Ставропольский край, Михайловск, Кремлёвская улица, 26",,Stavropol'skiy,,RU,,,Mo-Su 10:00-21:00,Wildberries,Q24933714
304943,wildberries,Wildberries,"посёлок Новкус-Артезиан, Советская Улица 30а",,Stavropol'skiy,,RU,,,Mo-Su 10:00-21:00,Wildberries,Q24933714
305129,wildberries,Wildberries,"Ставропольский край, село Птичье, улица Карла Маркса, 11",,Stavropol'skiy,,RU,,,Mo-Su 10:00-21:00,Wildberries,Q24933714
305133,wildberries,Wildberries,"Ставропольский край, село Верхнерусское, Привольная улица, 10А",,Stavropol'skiy,,RU,,,Mo-Su 10:00-21:00,Wildberries,Q24933714
305165,wildberries,Wildberries,"Ставропольский край, село Ростовановское, улица Ленина, 13",,Stavropol'skiy,,RU,,,Mo-Su 10:00-21:00,Wildberries,Q24933714
305237,wildberries,Wildberries,"Ставропольский край, станица Кармалиновская, Красная улица, 96",,Stavropol'skiy,,RU,,,Mo-Su 10:00-21:00,Wildberries,Q24933714
305314,wildberries,Wildberries,"Ставропольский край, станица Ессентукская, улица Гагарина, 7К",,Stavropol'skiy,,RU,,,Mo-Su 10:00-21:00,Wildberries,Q24933714
305479,wildberries,Wildberries,"Ставропольский край, Ессентуки, Кисловодская улица, 98А",,Stavropol'skiy,,RU,,,Mo-Su 10:00-21:00,Wildberries,Q24933714
305480,wildberries,Wildberries,"Ставропольский край, Пятигорск, улица Адмиральского, 1А",,Stavropol'skiy,,RU,,,Mo-Su 10:00-21:00,Wildberries,Q24933714
305491,wildberries,Wildberries,"село Отрадо-Ольгинское, Улица Ленина 55б",,Stavropol'skiy,,RU,,,Mo-Su 10:00-21:00,Wildberries,Q24933714
305538,wildberries,Wildberries,"Ставропольский край, станица Новотроицкая, Молодёжная улица, 31",,Stavropol'skiy,,RU,,,Mo-Su 10:00-21:00,Wildberries,Q24933714
305614,wildberries,Wildberries,"посёлок Змейка, Улица Лермонтова 81",,Stavropol'skiy,,RU,,,Mo-Su 09:00-21:00,Wildberries,Q24933714
305637,wildberries,Wildberries,"Михайловск, Кремлёвская Улица 28",,Stavropol'skiy,,RU,,,Mo-Su 10:00-21:00,Wildberries,Q24933714
305692,wildberries,Wildberries,"Ставропольский край, Пятигорск, улица Дзержинского, 63",,Stavropol'skiy,,RU,,,Mo-Su 10:00-21:00,Wildberries,Q24933714
305785,wildberries,Wildberries,"село Николо-Александровское, Амбулаторный Переулок 2",,Stavropol'skiy,,RU,,,Mo-Su 10:00-21:00,Wildberries,Q24933714
305865,wildberries,Wildberries,"Ставрополь, Улица 45-Я Параллель 75",,Stavropol'skiy,,RU,,,Mo-Su 10:00-21:00,Wildberries,Q24933714
305876,wildberries,Wildberries,"село Бургун-Маджары, Школьный Переулок 1в",,Stavropol'skiy,,RU,,,Mo-Su 10:00-21:00,Wildberries,Q24933714
305880,wildberries,Wildberries,"Минеральные Воды, Улица Дружбы 33а",,Stavropol'skiy,,RU,,,Mo-Su 10:00-22:00,Wildberries,Q24933714
305921,wildberries,Wildberries,"Ставрополь, Улица Гоголя 39/1",,Stavropol'skiy,,RU,,,Mo-Su 10:00-21:00,Wildberries,Q24933714
306018,wildberries,Wildberries,"село Архангельское, Улица Ленина 91",,Stavropol'skiy,,RU,,,Mo-Su 09:00-21:00,Wildberries,Q24933714
306095,wildberries,Wildberries,"Ставропольский край, Ставрополь, улица 45-я Параллель, 73",,Stavropol'skiy,,RU,,,Mo-Su 10:00-21:00,Wildberries,Q24933714
306098,wildberries,Wildberries,"село Воронежское, Лесная Улица 150",,Stavropol'skiy,,RU,,,Mo-Su 10:00-21:00,Wildberries,Q24933714
306109,wildberries,Wildberries,"Ставропольский край, Михайловск, улица Ленина, 160/3",,Stavropol'skiy,,RU,,,Mo-Su 10:00-21:00,Wildberries,Q24933714
306151,wildberries,Wildberries,"Лермонтов, Улица Волкова 33",,Stavropol'skiy,,RU,,,Mo-Su 10:00-21:00,Wildberries,Q24933714
306311,wildberries,Wildberries,"Ставропольский край, село Сергиевское, улица Карла Маркса, 30",,Stavropol'skiy,,RU,,,Mo-Su 10:00-21:00,Wildberries,Q24933714
306343,wildberries,Wildberries,"Ставропольский край, Железноводск, Октябрьская улица, 93",,Stavropol'skiy,,RU,,,Mo-Su 08:00-22:00,Wildberries,Q24933714
306405,wildberries,Wildberries,"Минеральные Воды, Советская Улица 34а",,Stavropol'skiy,,RU,,,Mo-Su 09:00-21:00,Wildberries,Q24933714
306420,wildberries,Wildberries,"село Петропавловское, Кооперативная Улица 4а",,Stavropol'skiy,,RU,,,Mo-Su 10:00-21:00,Wildberries,Q24933714
306472,wildberries,Wildberries,"Ставрополь, Улица Матрены Наздрачевой 3",,Stavropol'skiy,,RU,,,Mo-Su 10:00-21:00,Wildberries,Q24933714
306564,wildberries,Wildberries,"Ставропольский край, станица Темнолесская, Подгорная улица, 14",,Stavropol'skiy,,RU,,,Mo-Su 10:00-21:00,Wildberries,Q24933714
306570,wildberries,Wildberries,"Ставропольский край, Ставрополь, улица Генерала Маргелова, 3",,Stavropol'skiy,,RU,,,Mo-Su 10:00-21:00,Wildberries,Q24933714
306589,wildberries,Wildberries,"посёлок Большевик, Советская Улица 9а",,Stavropol'skiy,,RU,,,Mo-Su 10:00-21:00,Wildberries,Q24933714
306598,wildberries,Wildberries,"Георгиевск, Улица Бойко 106",,Stavropol'skiy,,RU,,,Mo-Su 10:00-21:00,Wildberries,Q24933714
306614,wildberries,Wildberries,"Ставрополь, Переулок Баумана 58",,Stavropol'skiy,,RU,,,Mo-Su 10:00-21:00,Wildberries,Q24933714
306632,wildberries,Wildberries,"Ставропольский край, Ставрополь, улица Пирогова, 5Ак6",,Stavropol'skiy,,RU,,,Mo-Su 10:00-21:00,Wildberries,Q24933714
306654,wildberries,Wildberries,"Ессентуки, Светлый Переулок 2а",,Stavropol'skiy,,RU,,,Mo-Su 10:00-21:00,Wildberries,Q24933714
306846,wildberries,Wildberries,"село Орловка, Улица Мира 23в",,Stavropol'skiy,,RU,,,Mo-Su 10:00-21:00,Wildberries,Q24933714
306937,wildberries,Wildberries,"Ставропольский край, село Курсавка, улица Стратийчука, 120",,Stavropol'skiy,,RU,,,Mo-Su 10:00-21:00,Wildberries,Q24933714
307101,wildberries,Wildberries,"село Отказное, Советская Улица 21а",,Stavropol'skiy,,RU,,,Mo-Su 10:00-21:00,Wildberries,Q24933714
307146,wildberries,Wildberries,"Ставрополь, Проспект Кулакова 51",,Stavropol'skiy,,RU,,,Mo-Su 10:00-21:00,Wildberries,Q24933714
307178,wildberries,Wildberries,"Ставропольский край, Пятигорск, Украинская улица, 48Б",,Stavropol'skiy,,RU,,,Mo-Su 10:00-21:00,Wildberries,Q24933714
307222,wildberries,Wildberries,"Ставропольский край, Ставрополь, улица Пирогова, 46/2",,Stavropol'skiy,,RU,,,Mo-Su 10:00-21:00,Wildberries,Q24933714
307233,wildberries,Wildberries,"село Спасское, Красная Улица 81",,Stavropol'skiy,,RU,,,Mo-Su 10:00-21:00,Wildberries,Q24933714
307280,wildberries,Wildberries,"Ставропольский край, посёлок Иноземцево, Шоссейная улица, 168",,Stavropol'skiy,,RU,,,Mo-Su 10:00-21:00,Wildberries,Q24933714
307302,wildberries,Wildberries,"село Горнозаводское, Улица Калинина 175",,Stavropol'skiy,,RU,,,Mo-Su 10:00-21:00,Wildberries,Q24933714
307454,wildberries,Wildberries,"село Северное, Улица Мира 2",,Stavropol'skiy,,RU,,,Mo-Su 10:00-21:00,Wildberries,Q24933714
307503,wildberries,Wildberries,"Минеральные Воды, Проспект 22-Го Партсъезда 8",,Stavropol'skiy,,RU,,,Mo-Su 10:00-21:00,Wildberries,Q24933714
307549,wildberries,Wildberries,"хутор Красный Пахарь, Улица 40 Лет Победы 8а",,Stavropol'skiy,,RU,,,Mo-Su 10:00-21:00,Wildberries,Q24933714
307691,wildberries,Wildberries,"Минеральные Воды, Красная Улица 114",,Stavropol'skiy,,RU,,,Mo-Su 09:00-21:00,Wildberries,Q24933714
307694,wildberries,Wildberries,"Ставрополь, Улица Михаила Морозова 73/10",,Stavropol'skiy,,RU,,,Mo-Su 09:00-21:00,Wildberries,Q24933714
307707,wildberries,Wildberries,"село Канглы, Шоссейная Улица 11б",,Stavropol'skiy,,RU,,,Mo-Su 10:00-21:00,Wildberries,Q24933714
307720,wildberries,Wildberries,"Ставрополь, Федеральная Улица 26",,Stavropol'skiy,,RU,,,Mo-Su 10:00-21:00,Wildberries,Q24933714
307730,wildberries,Wildberries,"Ставропольский край, Михайловск, улица Ишкова, 149",,Stavropol'skiy,,RU,,,Mo-Su 10:00-21:00,Wildberries,Q24933714
307808,wildberries,Wildberries,"село Большая Джалга, Советская Улица 3",,Stavropol'skiy,,RU,,,Mo-Su 10:00-21:00,Wildberries,Q24933714
307817,wildberries,Wildberries,"Будённовск, Красная Улица 196",,Stavropol'skiy,,RU,,,Mo-Su 10:00-21:00,Wildberries,Q24933714
307834,wildberries,Wildberries,"село Юца, Улица Луценко 113б",,Stavropol'skiy,,RU,,,Mo-Su 10:00-21:00,Wildberries,Q24933714
307844,wildberries,Wildberries,"село Обильное, Советская Улица 40",,Stavropol'skiy,,RU,,,Mo-Su 10:00-21:00,Wildberries,Q24933714
307863,wildberries,Wildberries,"Пятигорск, Партизанская Улица 1бк2",,Stavropol'skiy,,RU,,,Mo-Su 10:00-21:00,Wildberries,Q24933714
307898,wildberries,Wildberries,"Ставрополь, Проспект Карла Маркса 56",,Stavropol'skiy,,RU,,,Mo-Su 10:00-21:00,Wildberries,Q24933714
307940,wildberries,Wildberries,"село Арзгир, Улица Матросова 11",,Stavropol'skiy,,RU,,,Mo-Su 10:00-21:00,Wildberries,Q24933714
308104,wildberries,Wildberries,"Кисловодск, Азербайджанская Улица 21",,Stavropol'skiy,,RU,,,Mo-Su 10:00-21:00,Wildberries,Q24933714
308246,wildberries,Wildberries,"Ставропольский край, Михайловск, улица Гоголя, 207/1",,Stavropol'skiy,,RU,,,Mo-Su 10:00-21:00,Wildberries,Q24933714
308372,wildberries,Wildberries,"Благодарный, Переулок Фрунзе 4б",,Stavropol'skiy,,RU,,,Mo-Su 10:00-21:00,Wildberries,Q24933714
308431,wildberries,Wildberries,"Ессентуки, Сиреневая Улица 27а",,Stavropol'skiy,,RU,,,Mo-Su 10:00-21:00,Wildberries,Q24933714
308453,wildberries,Wildberries,"Пятигорск, Улица Захарова 10б",,Stavropol'skiy,,RU,,,Mo-Su 10:00-21:00,Wildberries,Q24933714
308459,wildberries,Wildberries,"село Левокумка, Мостовая Улица 2",,Stavropol'skiy,,RU,,,Mo-Su 10:00-21:00,Wildberries,Q24933714
308645,wildberries,Wildberries,"Невинномысск, Улица Гагарина 14",,Stavropol'skiy,,RU,,,Mo-Su 10:00-21:00,Wildberries,Q24933714
308797,wildberries,Wildberries,"Ставрополь, Улица Ленина 262",,Stavropol'skiy,,RU,,,Mo-Su 09:00-21:00,Wildberries,Q24933714
308909,wildberries,Wildberries,"Ставропольский край, Железноводск, улица Энгельса, 66",,Stavropol'skiy,,RU,,,Mo-Su 10:00-21:00,Wildberries,Q24933714
308946,wildberries,Wildberries,"Будённовск, Проспект Космонавтов 8а",,Stavropol'skiy,,RU,,,Mo-Su 10:00-21:00,Wildberries,Q24933714
308998,wildberries,Wildberries,"Ставропольский край, Ессентуки, улица Маркова, 76",,Stavropol'skiy,,RU,,,Mo-Su 10:00-21:00,Wildberries,Q24933714
309007,wildberries,Wildberries,"село Донское, Садовая Улица 154",,Stavropol'skiy,,RU,,,Mo-Su 09:00-20:00,Wildberries,Q24933714
309039,wildberries,Wildberries,"Ставропольский край, село Пелагиада, улица Ленина, 75",,Stavropol'skiy,,RU,,,Mo-Su 10:00-21:00,Wildberries,Q24933714
309199,wildberries,Wildberries,"Ставропольский край, Изобильный, Сиреневая улица, 43",,Stavropol'skiy,,RU,,,Mo-Su 10:00-21:00,Wildberries,Q24933714
309243,wildberries,Wildberries,"Пятигорск, Первомайская Улица 165",,Stavropol'skiy,,RU,,,Mo-Su 10:00-21:00,Wildberries,Q24933714
309253,wildberries,Wildberries,"село Левокумское, Улица Гагарина 24",,Stavropol'skiy,,RU,,,Mo-Su 10:00-21:00,Wildberries,Q24933714
309277,wildberries,Wildberries,"Изобильный, Колхозная Улица 100/4а",,Stavropol'skiy,,RU,,,Mo-Su 09:00-20:00,Wildberries,Q24933714
309305,wildberries,Wildberries,"Невинномысск, Линейная Улица 111",,Stavropol'skiy,,RU,,,Mo-Su 10:00-21:00,Wildberries,Q24933714
309337,wildberries,Wildberries,"Михайловск, Улица Ленина 127/5",,Stavropol'skiy,,RU,,,Mo-Su 10:00-21:00,Wildberries,Q24933714
309511,wildberries,Wildberries,"село Степное, Улица Петра Явецкого 29",,Stavropol'skiy,,RU,,,Mo-Su 10:00-21:00,Wildberries,Q24933714
309546,wildberries,Wildberries,"Железноводск, Октябрьская Улица 90а",,Stavropol'skiy,,RU,,,Mo-Su 10:00-21:00,Wildberries,Q24933714
309775,wildberries,Wildberries,"Ессентуки, Улица Маркова 65",,Stavropol'skiy,,RU,,,Mo-Su 10:00-21:00,Wildberries,Q24933714
309832,wildberries,Wildberries,"Ставропольский край, Минеральные Воды, Московская улица, 44",,Stavropol'skiy,,RU,,,Mo-Su 10:00-21:00,Wildberries,Q24933714
309847,wildberries,Wildberries,"Михайловск, Гражданская Улица 25/1",,Stavropol'skiy,,RU,,,Mo-Su 10:00-21:00,Wildberries,Q24933714
309928,wildberries,Wildberries,"Ставрополь, Улица Чапаева 4/1б",,Stavropol'skiy,,RU,,,Mo-Su 10:00-21:00,Wildberries,Q24933714
309948,wildberries,Wildberries,"Пятигорск, Московская Улица 69",,Stavropol'skiy,,RU,,,Mo-Su 10:00-21:00,Wildberries,Q24933714
310091,wildberries,Wildberries,"Ставропольский край, Михайловск, улица Ленина, 1/7",,Stavropol'skiy,,RU,,,Mo-Su 10:00-21:00,Wildberries,Q24933714
310104,wildberries,Wildberries,"село Винсады, Подгорная Улица 92",,Stavropol'skiy,,RU,,,Mo-Su 10:00-21:00,Wildberries,Q24933714
310140,wildberries,Wildberries,"Ставрополь, Селекционная Улица 3",,Stavropol'skiy,,RU,,,Mo-Su 10:00-21:00,Wildberries,Q24933714
310271,wildberries,Wildberries,"село Владимировка, Улица Сунжа 51",,Stavropol'skiy,,RU,,,Mo-Su 10:00-21:00,Wildberries,Q24933714
310633,wildberries,Wildberries,"Ставропольский край, посёлок Свободы, 1-я Набережная улица, 34А",,Stavropol'skiy,,RU,,,Mo-Su 10:00-21:00,Wildberries,Q24933714
310670,wildberries,Wildberries,"село Преградное, Красная Улица 151",,Stavropol'skiy,,RU,,,Mo-Su 10:00-21:00,Wildberries,Q24933714
310679,wildberries,Wildberries,"село Солдато-Александровское, Шоссейная Улица 11г",,Stavropol'skiy,,RU,,,Mo-Su 10:00-21:00,Wildberries,Q24933714
310704,wildberries,Wildberries,"Ставрополь, Улица Доваторцев 82/1",,Stavropol'skiy,,RU,,,Mo-Su 10:00-21:00,Wildberries,Q24933714
310719,wildberries,Wildberries,"Ставропольский край, Новоалександровск, улица Панфилова, 1/3",,Stavropol'skiy,,RU,,,Mo-Su 10:00-21:00,Wildberries,Q24933714
310721,wildberries,Wildberries,"Кисловодск, Улица Андрея Губина 38с1",,Stavropol'skiy,,RU,,,Mo-Su 09:00-21:00,Wildberries,Q24933714
310746,wildberries,Wildberries,"Пятигорск, Проспект 40 Лет Октября 37",,Stavropol'skiy,,RU,,,Mo-Su 10:00-21:00,Wildberries,Q24933714
310783,wildberries,Wildberries,"Ставропольский край, Ставрополь, улица К. Хетагурова, 7",,Stavropol'skiy,,RU,,,Mo-Su 10:00-21:00,Wildberries,Q24933714
310922,wildberries,Wildberries,"село Ачикулак, Кооперативная Улица 11б",,Stavropol'skiy,,RU,,,Mo-Su 10:00-21:00,Wildberries,Q24933714
310932,wildberries,Wildberries,"село Дмитриевское, Улица Ленина 31а",,Stavropol'skiy,,RU,,,Mo-Su 10:00-21:00,Wildberries,Q24933714
310994,wildberries,Wildberries,"Ставрополь, Первомайская Улица 22",,Stavropol'skiy,,RU,,,Mo-Su 10:00-21:00,Wildberries,Q24933714
310997,wildberries,Wildberries,"село Краснокумское, Улица Строителей 1е",,Stavropol'skiy,,RU,,,Mo-Su 09:00-20:00,Wildberries,Q24933714
311034,wildberries,Wildberries,"Ессентуки, Улица Ермолова 110е",,Stavropol'skiy,,RU,,,Mo-Su 09:00-21:00,Wildberries,Q24933714
311072,wildberries,Wildberries,"Ставрополь, Улица Тухачевского 21/2",,Stavropol'skiy,,RU,,,Mo-Su 10:00-21:00,Wildberries,Q24933714
311107,wildberries,Wildberries,"Ставрополь, Проспект Кулакова 65",,Stavropol'skiy,,RU,,,Mo-Su 10:00-21:00,Wildberries,Q24933714
311243,wildberries,Wildberries,"Ставрополь, Улица Ломоносова 23",,Stavropol'skiy,,RU,,,Mo-Su 10:00-21:00,Wildberries,Q24933714
311259,wildberries,Wildberries,"станица Ессентукская, Садовая Улица 1",,Stavropol'skiy,,RU,,,Mo-Su 10:00-21:00,Wildberries,Q24933714
