Ref,Spider,Name,Address,City,State,Zipcode,Country,Phone,Website,Hours,Brand,WikiData
1564,coffee_like,Coffee Like,"ул. Мира, 330",Ставрополь,Stavropol'skiy,,RU,,,Mo-Fr 08:00-19:00; Sa-Su 09:00-19:00,Coffee Like,Q55662627
928,coffee_like,Coffee Like,"ул. Мира, 315",Ставрополь,Stavropol'skiy,,RU,,,Mo-Fr 08:00-19:00; Sa-Su 09:00-19:00,Coffee Like,Q55662627
1247,coffee_like,Coffee Like,"ул. Мира, 290 корп. 3",Ставрополь,Stavropol'skiy,,RU,,,Mo-Fr 07:30-21:30; Sa-Su 09:00-21:30,Coffee Like,Q55662627
166002,lukoil,AZS № 26399,"Russia, Stavropol Territory, Stavropol, st. pr-ct Rossiyskiy, 7",Stavropol,Stavropol'skiy,,RU,,,24/7,Лукойл,Q329347
50601,lukoil,AZS №26252,"Russia, Stavropol Territory, Mineralnyye Vody, st. Sovetskaya, 20/3",Mineralnyye Vody,Stavropol'skiy,,RU,,,24/7,Лукойл,Q329347
3356,lukoil,MAZS №26066,"Russia, Stavropol Territory, Grachevskoe, road Astraхanʹ-Elista-Stavropolʹ 533 km ",,Stavropol'skiy,,RU,,,24/7,Лукойл,Q329347
3355,lukoil,MAZS №26099,"Russia, Stavropol Territory, Mineralovodskiy area, 473+443km road  Krasnodar-Baku",Mineralovodskiy area,Stavropol'skiy,,RU,,,24/7,Лукойл,Q329347
3354,lukoil,MAZS No26088,"Russia, Stavropol Territory, road ""Mineralnyye Vody-Kislovodsk"", 46 km ",,Stavropol'skiy,,RU,,,24/7,Лукойл,Q329347
740,wildberries,Wildberries,"г. Георгиевск (Ставропольский край), ул. Ленина, 117",,Stavropol'skiy,,RU,,,Mo-Su 10:00-21:00,Wildberries,Q24933714
755,wildberries,Wildberries,"г. Минеральные Воды (Ставропольский край), пр-кт 22 Партсъезда , д. 141",,Stavropol'skiy,,RU,,,Mo-Su 08:00-22:00,Wildberries,Q24933714
912,wildberries,Wildberries,"Ставропольский край, Пятигорск, проспект Калинина, 27А",,Stavropol'skiy,,RU,,,Mo-Su 10:00-21:00,Wildberries,Q24933714
955,wildberries,Wildberries,"Ставропольский край, Кисловодск, проспект Победы, 94",,Stavropol'skiy,,RU,,,Mo-Su 08:00-22:00,Wildberries,Q24933714
1056,wildberries,Wildberries,"Ставропольский край, Невинномысск, бульвар Мира, 16",,Stavropol'skiy,,RU,,,Mo-Su 10:00-21:00,Wildberries,Q24933714
1290,wildberries,Wildberries,"Ставропольский край, Ставрополь, улица Мира, 146",,Stavropol'skiy,,RU,,,Mo-Su 08:00-22:00,Wildberries,Q24933714
1349,wildberries,Wildberries,"Ставропольский край, Ставрополь, проспект Ворошилова, 12/1",,Stavropol'skiy,,RU,,,Mo-Su 08:00-22:00,Wildberries,Q24933714
1754,wildberries,Wildberries,"Ставропольский край, Пятигорск, улица Крайнего, 59",,Stavropol'skiy,,RU,,,Mo-Su 10:00-21:00,Wildberries,Q24933714
1770,wildberries,Wildberries,"г. Буденновск  (Ставропольский край), ул. Борцов Революции, д. 171",,Stavropol'skiy,,RU,,,Mo-Su 10:00-21:00,Wildberries,Q24933714
2044,wildberries,Wildberries,"г. Лермонтов (Ставропольский край), проспект Лермонтова, д. 25",,Stavropol'skiy,,RU,,,Mo-Su 10:00-21:00,Wildberries,Q24933714
2366,wildberries,Wildberries,"г. Ставрополь (Ставропольский край), переулок Макарова, д. 28",,Stavropol'skiy,,RU,,,Mo-Su 08:00-22:00,Wildberries,Q24933714
2416,wildberries,Wildberries,"Ставропольский край, Нефтекумск, 2-й микрорайон, 14",,Stavropol'skiy,,RU,,,Mo-Su 10:00-21:00,Wildberries,Q24933714
2526,wildberries,Wildberries,"Ставропольский край, Пятигорск, проспект Свободы, 50",,Stavropol'skiy,,RU,,,Mo-Su 10:00-21:00,Wildberries,Q24933714
2564,wildberries,Wildberries,"г. Михайловск (Ставропольский край), улица Ленина, д. 146/1",,Stavropol'skiy,,RU,,,Mo-Su 10:00-21:00,Wildberries,Q24933714
2640,wildberries,Wildberries,г. Ипатово (Ставропольский край) Первомайская улица 41А1,,Stavropol'skiy,,RU,,,Mo-Su 10:00-21:00,Wildberries,Q24933714
2657,wildberries,Wildberries,"г. Железноводск (Ставропольский край), улица Ленина, д. 102Б",,Stavropol'skiy,,RU,,,Mo-Su 08:00-22:00,Wildberries,Q24933714
2695,wildberries,Wildberries,"г. Ставрополь (Ставропольский край), улица Мимоз, д. 22А/2",,Stavropol'skiy,,RU,,,Mo-Su 10:00-21:00,Wildberries,Q24933714
2782,wildberries,Wildberries,"г. Ессентуки (Ставропольский край), ул. Володарского, 25 корп. 2",,Stavropol'skiy,,RU,,,Mo-Su 10:00-21:00,Wildberries,Q24933714
2849,wildberries,Wildberries,"г. село Арзгир (Ставропольский край), улица Матросова, д. 13А",,Stavropol'skiy,,RU,,,Mo-Su 10:00-21:00,Wildberries,Q24933714
3063,wildberries,Wildberries,"г. Будённовск (Ставропольский край), МКР. 7/1, д. 40А",,Stavropol'skiy,,RU,,,Mo-Su 10:00-21:00,Wildberries,Q24933714
3228,wildberries,Wildberries,"Ставропольский край, село Курсавка, улица Стратийчука, 74",,Stavropol'skiy,,RU,,,Mo-Su 10:00-21:00,Wildberries,Q24933714
3242,wildberries,Wildberries,"г. Ессентуки (Ставропольский край), Пятигорская улица, д. 119В",,Stavropol'skiy,,RU,,,Mo-Su 10:00-21:00,Wildberries,Q24933714
3438,wildberries,Wildberries,"село Дивное (Ставропольский край), Советская улица, д. 45",,Stavropol'skiy,,RU,,,Mo-Su 10:00-21:00,Wildberries,Q24933714
3459,wildberries,Wildberries,"г. Георгиевск (Ставропольский край), улица Калинина, д. 101/2",,Stavropol'skiy,,RU,,,Mo-Su 10:00-21:00,Wildberries,Q24933714
3471,wildberries,Wildberries,"г. Зеленокумск (Ставропольский край), Гражданская улица, д. 3",,Stavropol'skiy,,RU,,,Mo-Su 08:00-22:00,Wildberries,Q24933714
3528,wildberries,Wildberries,"г. Кисловодск (Ставропольский край), улица Куйбышева, д. 51",,Stavropol'skiy,,RU,,,Mo-Su 10:00-21:00,Wildberries,Q24933714
3557,wildberries,Wildberries,"г. Новоалександровск (Ставропольский край), Железнодорожная улица, д. 141",,Stavropol'skiy,,RU,,,Mo-Su 10:00-21:00,Wildberries,Q24933714
3760,wildberries,Wildberries,"Ставропольский край, Изобильный, улица Кирова, 126А",,Stavropol'skiy,,RU,,,Mo-Su 10:00-21:00,Wildberries,Q24933714
3772,wildberries,Wildberries,"Ставропольский край, Пятигорск, улица Юлиуса Фучика, 4к1",,Stavropol'skiy,,RU,,,Mo-Su 10:00-21:00,Wildberries,Q24933714
3806,wildberries,Wildberries,"г. Невинномысск (Ставропольский край), улица Калинина, д. 196",,Stavropol'skiy,,RU,,,Mo-Su 10:00-21:00,Wildberries,Q24933714
3910,wildberries,Wildberries,"г. Ставрополь (Ставропольский край), Краснофлотская улица, д. 94",,Stavropol'skiy,,RU,,,Mo-Su 08:00-22:00,Wildberries,Q24933714
4092,wildberries,Wildberries,"г. Ставрополь, улица Пржевальского д. 10А",,Stavropol'skiy,,RU,,,Mo-Su 10:00-21:00,Wildberries,Q24933714
4141,wildberries,Wildberries,"г. Будённовск (Ставропольский край), Пушкинская улица, д. 103",,Stavropol'skiy,,RU,,,Mo-Su 10:00-21:00,Wildberries,Q24933714
5117,wildberries,Wildberries,"г. Минеральные Воды (Ставропольский край), улица 50 лет Октября, д. 51",,Stavropol'skiy,,RU,,,Mo-Su 10:00-21:00,Wildberries,Q24933714
5245,wildberries,Wildberries,"Ставропольский край, Кисловодск, Ленинградская улица, 77",,Stavropol'skiy,,RU,,,Mo-Su 10:00-21:00,Wildberries,Q24933714
5474,wildberries,Wildberries,"г. Ставрополь (Ставропольский край), улица Маяковского, д. 15",,Stavropol'skiy,,RU,,,Mo-Su 08:00-22:00,Wildberries,Q24933714
5665,wildberries,Wildberries,"г. Кисловодск (Ставропольский край), Красивая улица, д. 30",,Stavropol'skiy,,RU,,,Mo-Su 10:00-21:00,Wildberries,Q24933714
5690,wildberries,Wildberries,"село Кочубеевское (Ставропольский край), улица Титова, д. 1А",,Stavropol'skiy,,RU,,,Mo-Su 10:00-21:00,Wildberries,Q24933714
5923,wildberries,Wildberries,"г. Ставрополь (Ставропольский край), улица 50 лет ВЛКСМ, д. 28/2",,Stavropol'skiy,,RU,,,Mo-Su 08:00-22:00,Wildberries,Q24933714
6018,wildberries,Wildberries,"Ставропольский край, станица Незлобная, улица Ленина, 338Б",,Stavropol'skiy,,RU,,,Mo-Su 10:00-21:00,Wildberries,Q24933714
6019,wildberries,Wildberries,"село Левокумское (Ставропольский край), улица Гагарина, д. 11А",,Stavropol'skiy,,RU,,,Mo-Su 10:00-21:00,Wildberries,Q24933714
6020,wildberries,Wildberries,"Ставропольский край, Нефтекумск, Шоссейная улица, 21",,Stavropol'skiy,,RU,,,Mo-Su 10:00-21:00,Wildberries,Q24933714
6035,wildberries,Wildberries,"г. Ессентуки (Ставропольский край), улица 60 лет Октября, д. 1/1",,Stavropol'skiy,,RU,,,Mo-Su 10:00-21:00,Wildberries,Q24933714
6073,wildberries,Wildberries,"село Александровское (Ставропольский край), улица Карла Маркса, д. 106",,Stavropol'skiy,,RU,,,Mo-Su 10:00-21:00,Wildberries,Q24933714
100346,wildberries,Wildberries,с. Красногвардейское (Ставропольский край) Ленина 83,,Stavropol'skiy,,RU,,,Mo-Su 10:00-21:00,Wildberries,Q24933714
101155,wildberries,Wildberries,"г. Будённовск (Ставропольский край), Прикумская улица, д. 44Б",,Stavropol'skiy,,RU,,,Mo-Su 10:00-21:00,Wildberries,Q24933714
101426,wildberries,Wildberries,"Ставропольский край, Невинномысск, Степная улица, 18В",,Stavropol'skiy,,RU,,,Mo-Su 10:00-21:00,Wildberries,Q24933714
101603,wildberries,Wildberries,"г. Ставрополь (Ставропольский край), улица Тухачевского, д. 30/5",,Stavropol'skiy,,RU,,,Mo-Su 08:00-22:00,Wildberries,Q24933714
101870,wildberries,Wildberries,"г. Ставрополь (Ставропольский край), улица Дзержинского, д. 158",,Stavropol'skiy,,RU,,,Mo-Su 08:00-22:00,Wildberries,Q24933714
101945,wildberries,Wildberries,"Ставропольский край, Ставрополь, проспект Кулакова, 51к1",,Stavropol'skiy,,RU,,,Mo-Su 08:00-22:00,Wildberries,Q24933714
103955,wildberries,Wildberries,г. Железноводск (п. Иноземцево ) Гагарина 126 Б,,Stavropol'skiy,,RU,,,Mo-Su 10:00-21:00,Wildberries,Q24933714
104037,wildberries,Wildberries,"село Донское (Ставропольский край), Кооперативная улица, д. 24А",,Stavropol'skiy,,RU,,,Mo-Su 10:00-21:00,Wildberries,Q24933714
104263,wildberries,Wildberries,"Ставропольский край, Ставрополь, Шпаковская улица, 84",,Stavropol'skiy,,RU,,,Mo-Su 10:00-21:00,Wildberries,Q24933714
104446,wildberries,Wildberries,ст. Суворовская Кооперативная 6а,,Stavropol'skiy,,RU,,,Mo-Su 10:00-21:00,Wildberries,Q24933714
104506,wildberries,Wildberries,"г. Минеральные Воды (Ставропольский край), улица Пушкина, д. 54",,Stavropol'skiy,,RU,,,Mo-Su 10:00-21:00,Wildberries,Q24933714
104695,wildberries,Wildberries,"станица Константиновская (Ставропольский край), Октябрьская улица, д. 118",,Stavropol'skiy,,RU,,,Mo-Su 10:00-21:00,Wildberries,Q24933714
104855,wildberries,Wildberries,с. Прасковея (Ставропольский край) Дзержинского 74,,Stavropol'skiy,,RU,,,Mo-Su 10:00-21:00,Wildberries,Q24933714
105298,wildberries,Wildberries,"г. Пятигорск (Ставропольский край), улица Маршала Жукова, д. 37А",,Stavropol'skiy,,RU,,,Mo-Su 10:00-21:00,Wildberries,Q24933714
105334,wildberries,Wildberries,Солнечнодольск Энергетиков 9А,,Stavropol'skiy,,RU,,,Mo-Su 10:00-21:00,Wildberries,Q24933714
105472,wildberries,Wildberries,ст-ца. Курская (Ставропольский край) Ессентукская 23,,Stavropol'skiy,,RU,,,Mo-Su 10:00-21:00,Wildberries,Q24933714
105607,wildberries,Wildberries,г. Пятигорск (Ставропольский край) Пальмиро  Тольятти 45 строение 2,,Stavropol'skiy,,RU,,,Mo-Su 10:00-21:00,Wildberries,Q24933714
106083,wildberries,Wildberries,"Ставропольский край, Ставрополь, улица Доваторцев, 86/1",,Stavropol'skiy,,RU,,,Mo-Su 08:00-22:00,Wildberries,Q24933714
106950,wildberries,Wildberries,снт. Надежда (Ставропольский край) Свободная 1 Б,,Stavropol'skiy,,RU,,,Mo-Su 10:00-21:00,Wildberries,Q24933714
107797,wildberries,Wildberries,г. Ессентуки (Ставропольский край) Карла Маркса 26,,Stavropol'skiy,,RU,,,Mo-Su 10:00-21:00,Wildberries,Q24933714
108314,wildberries,Wildberries,г Михайловск Ишкова 141,,Stavropol'skiy,,RU,,,Mo-Su 10:00-21:00,Wildberries,Q24933714
108366,wildberries,Wildberries,"с Юца Россия, Ставропольский край, Предгорный р-н Ессентукская 8а",,Stavropol'skiy,,RU,,,Mo-Su 10:00-21:00,Wildberries,Q24933714
108478,wildberries,Wildberries,"Ставропольский край, Ставрополь, Партизанская улица, 2Б",,Stavropol'skiy,,RU,,,Mo-Su 08:00-22:00,Wildberries,Q24933714
109592,wildberries,Wildberries,"Ставрополь, улица Достоевского 77/1",,Stavropol'skiy,,RU,,,Mo-Su 10:00-21:00,Wildberries,Q24933714
109618,wildberries,Wildberries,"г Благодарный (Россия, Ставропольский край, Благодарненский р-н) улица Свободы 36",,Stavropol'skiy,,RU,,,Mo-Su 10:00-21:00,Wildberries,Q24933714
109625,wildberries,Wildberries,"Ставропольский край, село Краснокумское, Советская улица, 100А/16",,Stavropol'skiy,,RU,,,Mo-Su 10:00-21:00,Wildberries,Q24933714
110033,wildberries,Wildberries,"Ставропольский край, Ставрополь, улица Пирогова, 5Ак2",,Stavropol'skiy,,RU,,,Mo-Su 08:00-22:00,Wildberries,Q24933714
110235,wildberries,Wildberries,г Минеральные Воды (Ставропольский край) Московская улица 29/6,,Stavropol'skiy,,RU,,,Mo-Su 10:00-21:00,Wildberries,Q24933714
110737,wildberries,Wildberries,"Новоселицкое (Ставропольский край, Новоселицкий район) Кавказский переулок 15А",,Stavropol'skiy,,RU,,,Mo-Su 10:00-21:00,Wildberries,Q24933714
111121,wildberries,Wildberries,"Ставропольский край, Кисловодск, улица Жуковского, 38",,Stavropol'skiy,,RU,,,Mo-Su 10:00-21:00,Wildberries,Q24933714
111164,wildberries,Wildberries,"Ставропольский край, Ставрополь, улица 50 лет ВЛКСМ, 113",,Stavropol'skiy,,RU,,,Mo-Su 08:00-22:00,Wildberries,Q24933714
111911,wildberries,Wildberries,"Лермонтов Ставропольский край, городской округ Лермонтов улица Волкова 5",,Stavropol'skiy,,RU,,,Mo-Su 10:00-21:00,Wildberries,Q24933714
112257,wildberries,Wildberries,Григорополисская (Ставропольский край) улица Орджоникидзе 7,,Stavropol'skiy,,RU,,,Mo-Su 10:00-21:00,Wildberries,Q24933714
112309,wildberries,Wildberries,г Новопавловск (Ставропольский край) Красная улица 168,,Stavropol'skiy,,RU,,,Mo-Su 10:00-21:00,Wildberries,Q24933714
112401,wildberries,Wildberries,"Грачевка Ставропольский край, Грачёвский муниципальный район Заречная улица 2В",,Stavropol'skiy,,RU,,,Mo-Su 10:00-21:00,Wildberries,Q24933714
112413,wildberries,Wildberries,Рыздвяный (Ставропольский край) Клубный переулок 3/1,,Stavropol'skiy,,RU,,,Mo-Su 10:00-21:00,Wildberries,Q24933714
113295,wildberries,Wildberries,"Ставропольский край, Ставрополь, улица Лермонтова, 151",,Stavropol'skiy,,RU,,,Mo-Su 10:00-21:00,Wildberries,Q24933714
113418,wildberries,Wildberries,"г Новоалександровск (Ставропольский край), Ленина 103",,Stavropol'skiy,,RU,,,Mo-Su 10:00-21:00,Wildberries,Q24933714
113545,wildberries,Wildberries,"г Ставрополь (Ставропольский край), Ленина 482/1  ",,Stavropol'skiy,,RU,,,Mo-Su 08:00-22:00,Wildberries,Q24933714
114212,wildberries,Wildberries,"г Ставрополь (Ставропольский край), улица Пирогова 42/2 ",,Stavropol'skiy,,RU,,,Mo-Su 08:00-22:00,Wildberries,Q24933714
114259,wildberries,Wildberries,"Ставропольский край, Невинномысск, улица Дунаевского, 5",,Stavropol'skiy,,RU,,,Mo-Su 10:00-21:00,Wildberries,Q24933714
114306,wildberries,Wildberries,"Михайловск (Ставропольский край), Полеводческая улица 9",,Stavropol'skiy,,RU,,,Mo-Su 08:00-22:00,Wildberries,Q24933714
114625,wildberries,Wildberries,"г Ставрополь (Ставропольский край), улица Голенева 47  ",,Stavropol'skiy,,RU,,,Mo-Su 10:00-21:00,Wildberries,Q24933714
114815,wildberries,Wildberries,"г Георгиевск (Ставропольский край), улица Мира 4",,Stavropol'skiy,,RU,,,Mo-Su 10:00-21:00,Wildberries,Q24933714
115271,wildberries,Wildberries,"Старомарьевка (Ставропольский край), Дорожная улица 10/2а",,Stavropol'skiy,,RU,,,Mo-Su 10:00-21:00,Wildberries,Q24933714
115607,wildberries,Wildberries,"Безопасное (Ставропольский край), Ленина 92",,Stavropol'skiy,,RU,,,Mo-Su 10:00-21:00,Wildberries,Q24933714
117349,wildberries,Wildberries,"Ставропольский край, Ставрополь, улица Тухачевского, 24/2",,Stavropol'skiy,,RU,,,Mo-Su 08:00-22:00,Wildberries,Q24933714
117793,wildberries,Wildberries,"Ставрополь (Ставропольский край), улица Васильева 29",,Stavropol'skiy,,RU,,,Mo-Su 10:00-21:00,Wildberries,Q24933714
117833,wildberries,Wildberries,"Ставропольский край, станица Александрийская, Библиотечный переулок, 17А",,Stavropol'skiy,,RU,,,Mo-Su 10:00-21:00,Wildberries,Q24933714
121927,wildberries,Wildberries,"ст-ца Ессентукская, Улица Павлова 8в",,Stavropol'skiy,,RU,,,Mo-Su 09:00-21:00,Wildberries,Q24933714
123695,wildberries,Wildberries,"г Лермонтов, Улица Ленина 14",,Stavropol'skiy,,RU,,,Mo-Su 09:00-21:00,Wildberries,Q24933714
123718,wildberries,Wildberries,"г Буденновск, Улица Лопатина 167",,Stavropol'skiy,,RU,,,Mo-Su 09:00-21:00,Wildberries,Q24933714
124019,wildberries,Wildberries,"г Невинномысск, Улица Матросова 92а",,Stavropol'skiy,,RU,,,Mo-Su 10:00-21:00,Wildberries,Q24933714
124917,wildberries,Wildberries,"г Ставрополь, Чапаевский Проезд 57",,Stavropol'skiy,,RU,,,Mo-Su 09:00-21:00,Wildberries,Q24933714
125507,wildberries,Wildberries,"Иноземцево Ставропольский край, городской округ Железноводск улица Маяковского 1А",,Stavropol'skiy,,RU,,,Mo-Su 10:00-21:00,Wildberries,Q24933714
125508,wildberries,Wildberries,"Ставропольский край, Пятигорск, Университетская улица, 28",,Stavropol'skiy,,RU,,,Mo-Su 10:00-21:00,Wildberries,Q24933714
125524,wildberries,Wildberries,"г Буденновск, 7-Й Микрорайон 23",,Stavropol'skiy,,RU,,,Mo-Su 09:00-21:00,Wildberries,Q24933714
127223,wildberries,Wildberries,Кисловодск Ставропольский край улица 40 лет Октября 10,,Stavropol'skiy,,RU,,,Mo-Su 10:00-21:00,Wildberries,Q24933714
127603,wildberries,Wildberries,"Георгиевск Ставропольский край, Георгиевский городской округ улица Кочубея 13/2",,Stavropol'skiy,,RU,,,Mo-Su 10:00-21:00,Wildberries,Q24933714
128041,wildberries,Wildberries,"г Невинномысск, Улица Гагарина 66",,Stavropol'skiy,,RU,,,Mo-Su 09:00-20:00,Wildberries,Q24933714
128367,wildberries,Wildberries,"Ставрополь Ставропольский край, городской округ Ставрополь улица Дзержинского 2/3",,Stavropol'skiy,,RU,,,Mo-Su 10:00-21:00,Wildberries,Q24933714
128407,wildberries,Wildberries,Пятигорск Ставропольский край проспект Калинина 150,,Stavropol'skiy,,RU,,,Mo-Su 10:00-21:00,Wildberries,Q24933714
128408,wildberries,Wildberries,Пятигорск Ставропольский край проспект Калинина 2А,,Stavropol'skiy,,RU,,,Mo-Su 10:00-21:00,Wildberries,Q24933714
128990,wildberries,Wildberries,"Светлоград Ставропольский край, Петровский р-н Выставочная площадь 44",,Stavropol'skiy,,RU,,,Mo-Su 10:00-21:00,Wildberries,Q24933714
129313,wildberries,Wildberries,"г Пятигорск, Проспект 40 Лет Октября 58а",,Stavropol'skiy,,RU,,,Mo-Su 10:00-21:00,Wildberries,Q24933714
130077,wildberries,Wildberries,"г Невинномысск, Улица Апанасенко 86а",,Stavropol'skiy,,RU,,,Mo-Su 09:00-20:00,Wildberries,Q24933714
130274,wildberries,Wildberries,"Ставропольский край, Пятигорск, Ессентукская улица, 34",,Stavropol'skiy,,RU,,,Mo-Su 10:00-21:00,Wildberries,Q24933714
130672,wildberries,Wildberries,Ставрополь Ставропольский край переулок Макарова 2,,Stavropol'skiy,,RU,,,Mo-Su 10:00-21:00,Wildberries,Q24933714
130679,wildberries,Wildberries,"г Невинномысск, Улица Павлова 11",,Stavropol'skiy,,RU,,,Mo-Su 09:00-20:00,Wildberries,Q24933714
132180,wildberries,Wildberries,"г Ставрополь, Улица Тухачевского 26/9",,Stavropol'skiy,,RU,,,Mo-Su 10:00-21:00,Wildberries,Q24933714
132454,wildberries,Wildberries,Ставрополь Ставропольский край улица Тухачевского 27/4,,Stavropol'skiy,,RU,,,Mo-Su 10:00-21:00,Wildberries,Q24933714
132527,wildberries,Wildberries,"г Изобильный, Улица Ленина 66",,Stavropol'skiy,,RU,,,Mo-Su 10:00-21:00,Wildberries,Q24933714
133666,wildberries,Wildberries,"г Невинномысск, Бульвар Мира 12",,Stavropol'skiy,,RU,,,Mo-Su 09:00-20:00,Wildberries,Q24933714
134565,wildberries,Wildberries,"г Ставрополь, Улица Ленина 102",,Stavropol'skiy,,RU,,,Mo-Su 09:00-21:00,Wildberries,Q24933714
134677,wildberries,Wildberries,Ставрополь Ставропольский край улица Абрамовой 51А,,Stavropol'skiy,,RU,,,Mo-Su 08:00-22:00,Wildberries,Q24933714
134866,wildberries,Wildberries,"Невинномысск Ставропольский край, городской округ Невинномысск бульвар мира  34б",,Stavropol'skiy,,RU,,,Mo-Su 10:00-21:00,Wildberries,Q24933714
135198,wildberries,Wildberries,Ставрополь Ставропольский край улица Пирогова 102/1,,Stavropol'skiy,,RU,,,Mo-Su 08:00-22:00,Wildberries,Q24933714
135563,wildberries,Wildberries,"г Михайловск, Улица Ленина 167/2к3",,Stavropol'skiy,,RU,,,Mo-Su 10:00-21:00,Wildberries,Q24933714
135615,wildberries,Wildberries,"г Пятигорск, Огородная Улица 37/2",,Stavropol'skiy,,RU,,,Mo-Su 10:00-21:00,Wildberries,Q24933714
135854,wildberries,Wildberries,"г Ставрополь, Переулок Крупской 29",,Stavropol'skiy,,RU,,,Mo-Su 10:00-21:00,Wildberries,Q24933714
136201,wildberries,Wildberries,"г Изобильный, Улица Кирова 2а",,Stavropol'skiy,,RU,,,Mo-Su 09:00-20:00,Wildberries,Q24933714
136394,wildberries,Wildberries,"г Лермонтов, Октябрьская Улица 54",,Stavropol'skiy,,RU,,,Mo-Su 09:00-21:00,Wildberries,Q24933714
136851,wildberries,Wildberries,"Ставропольский край, г Ставрополь, ул Родосская, д 7 ",,Stavropol'skiy,,RU,,,Mo-Su 10:00-21:00,Wildberries,Q24933714
136855,wildberries,Wildberries,"г Ессентуки, Никольская Улица 10",,Stavropol'skiy,,RU,,,Mo-Su 10:00-21:00,Wildberries,Q24933714
136956,wildberries,Wildberries,"г Михайловск, Музыкальная Улица 10",,Stavropol'skiy,,RU,,,Mo-Su 09:00-21:00,Wildberries,Q24933714
