Ref,Spider,Name,Address,City,State,Zipcode,Country,Phone,Website,Hours,Brand,WikiData
7167450,chaayos_in,Chaayos - Lulu Global Mall,"FF-03 ,First Floor, global mall, Gopalapura, Binnipete, Bengaluru, Karnataka 560023, India",Bengaluru,Karnataka,,IN,,,,Chaayos,Q117235235
https://www.dominos.co.in/store-locations/bangalore/krantiveera-sangolli-rayanna-ksr-bangalore-city-railway-station,dominos_pizza_in,Dominos Pizza Krantiveera Sangolli Rayanna (KSR) Bangalore City Railway Station,"Fast Food Unit, Krantiveera Sangolli Rayanna (KSR), Bangalore City Railway Station, Bangalore, Karnataka",Bangalore,Karnataka,,IN,+91 22 2632 6699,https://www.dominos.co.in/store-locations/bangalore/krantiveera-sangolli-rayanna-ksr-bangalore-city-railway-station,,Domino's Pizza,Q839466
https://www.dominos.co.in/store-locations/bangalore/gt-world-mall-bangalore-karnataka,dominos_pizza_in,"Dominos Pizza GT WORLD MALL, BANGALORE, KARNATAKA","Unit No. 3, Third Floor (Food Court), GT World Mall, bearing #92, GT WORLD MALL, BANGALORE, KARNATAKA, BANGALORE, Karnataka - 560023",Bangalore,Karnataka,,IN,+91 22 2632 6699,https://www.dominos.co.in/store-locations/bangalore/gt-world-mall-bangalore-karnataka,,Domino's Pizza,Q839466
https://www.dominos.co.in/store-locations/bangalore/binnipete-bengaluru-karnataka-560023,dominos_pizza_in,Dominos Pizza Binnipete Bengaluru Karnataka 560023,"Foodcourt 2nd Floor, Global Malls Gopalapura, Binnipete Bengaluru, Karnataka 560023, BANGALORE, KARNATAKA",Bangalore,Karnataka,,IN,+91 22 2632 6699,https://www.dominos.co.in/store-locations/bangalore/binnipete-bengaluru-karnataka-560023,,Domino's Pizza,Q839466
e9604f6ad505030acfd4ba25c86ab47f,western_union,MUTHOOT FINCORP LIMITED,,Bengaluru,KARNATAKA,,IN,+91 80 2314 9266,https://location.westernunion.com/in/karnataka/bengaluru/e9604f6ad505030acfd4ba25c86ab47f,Mo-Sa 08:00-20:00; Su 09:00-18:00,Western Union,Q861042
