Ref,Spider,Name,Address,City,State,Zipcode,Country,Phone,Website,Hours,Brand,WikiData
mx56d16ddc,pandora,Acerca de Joyería Pandora Pandora @ El Palacio de Hierro Puebla,,Puebla,,,MX,+52 222 273 8800,https://stores.pandora.net/mx-pue/puebla/joyeria-pandora-mx56d16ddc.html,Mo-Su 11:00-21:00,Pandora,Q2241604
mx59740130,pandora,"Acerca de Joyería Pandora Pandora Puebla, Mexico at the Luxury Hall Mall Center",,Puebla,,,MX,+52 222 273 8834,https://stores.pandora.net/mx-pue/puebla/joyeria-pandora-mx59740130.html,Mo-Su 11:00-21:00,Pandora,Q2241604
N090012,united_colors_of_benetton,"Benetton Puebla, Pue",,"PUEBLA, PUE",,,MX,+52 222 225259,,Mo-Th 11:00-20:30; Fr-Sa 11:00-21:00; Su 11:00-20:30,United Colors of Benetton,Q817139
N090935,united_colors_of_benetton,Benetton Puebla,,PUEBLA,,,MX,null,,,United Colors of Benetton,Q817139
N090936,united_colors_of_benetton,Benetton Puebla,,PUEBLA,,,MX,null,,,United Colors of Benetton,Q817139
,visa,,,PUEBLA,,,MX,,,,,
,visa,,,PUEBLA,,,MX,,,,,
