City,Place Name,Zipcode,Name
Matosinhos,sunglass_hut_2,C. C. MAR SHOPPING. Avenida Oscar Lopes Leça da Palmeira R/C.,unknown,Mar Shopping
V.N.Gaia,sunglass_hut_2,C. C. ARRABIDA SHOPPING Praceta Henrique Moreira 244,unknown,Arrabida Shopping
Porto,sunglass_hut_2,C. C. DOLCE VITA ANTAS Rua dos Campeões Europeus 28-198,unknown,Dolce Vita Antas
Vila do Conde,sunglass_hut_2,C. C. THE STYLE OUTLETS Avenida Fonte Cova 400,unknown,Vila Do Conde
Porto,sunglass_hut_2,Aeroporto Francisco Sá Carneiro Lj 34-A,unknown,Aeropuerto Porto
S.João da Madeira,sunglass_hut_2,C. C.  8ª AVENIDA. Av. Dr. Renato Araújo.,unknown,CC 8ª Avenida
Porto,sunglass_hut_2,C. C. VIA CATARINA. Rua Santa Catarina 312-350. ,unknown,Via Catarina
Senhora Da Horta,sunglass_hut_2,C. C. NORTE SHOPPING Rua Sara Afonso 105-117,unknown,Norte Shopping
