Ref,Spider,Name,Address,City,State,Zipcode,Country,Phone,Website,Hours,Brand,WikiData
sancugatdelvallesbarcelona/8183,claires,Compra piercings de oreja y bisutería en Barcelona San Cugat,,San Cugat Del Valles Barcelona,,,ES,+34 935 76 40 83,https://stores.claires.com/es/es-cm/sancugatdelvallesbarcelona/8183.html,Mo-Sa 10:00-22:00,Claire's,Q2974996
0070245002450,decathlon_es,Sant Cugat del Vallés,,Sant Cugat del Valles,,,ES,+34 936 61 83 36,https://www.decathlon.es/es/store-view/tienda-de-deportes-sant-cugat-del-valles-0070245002450,Mo-Sa 09:00-21:00,Decathlon,Q509349
2004,lidl_es,Lidl,,Sant Cugat del Vallès,,,ES,,,Mo-Sa 09:00-21:00,Lidl,Q151954
BCNSC,marriott,AC Hotel Sant Cugat,,Sant Cugat del Vallés,,,ES,+34 935 89 41 41,https://www.marriott.com/BCNSC,,AC Hotels,Q5653536
8796399337495,thebodyshop,BARCELONA CC SANT CUGAT,,BARCELONA,,,ES,,https://www.thebodyshop.com/es-es/store-details/barcelona-cc-sant-cugat/4481,,The Body Shop,Q837851
N400320,united_colors_of_benetton,Benetton Sant Cugat Del Valles,,SANT CUGAT DEL VALLES,,,ES,+34 937 87 95 36,,,United Colors of Benetton,Q817139
,visa,,,SANT CUGAT DEL VALLES,,,ES,,,,,
