City,Place Name,Zipcode,Name
Gomel,audi,Efremova 23 246028 Gomel,unknown,NTS GmzV
unknown,lukoil,Central'naja 3a 247006 Gomelskaja obl. Gomelslij area Kalinino Byelorussia,unknown,АZS № 82
Gomel,lukoil,pr. Kosmonavtov 10 Gomel,unknown,АZS № 70
unknown,wildberries,Гомельская область Гомель улица Малайчука 4/4,unknown,Wildberries
unknown,wildberries,Гомельская область Мозырь Советская улица 128,unknown,Wildberries
unknown,wildberries,Гомельская область Гомель проспект Октября 28В,unknown,Wildberries
unknown,wildberries,г. Речица (Гомельская обл.) ул. Достоевского 27,unknown,Wildberries
unknown,wildberries,г. Гомель (Гомельская область) ул. Головацкого 140,unknown,Wildberries
unknown,wildberries,г Рогачёв (Гомельская область) улица Ленина д. 59,unknown,Wildberries
unknown,wildberries,Гомельская область Мозырь улица С.О. Притыцкого 30А,unknown,Wildberries
unknown,wildberries,Гомельская область Гомель улица Чапаева 10А,unknown,Wildberries
unknown,wildberries,Гомельская область Гомель улица Тельмана 3,unknown,Wildberries
unknown,wildberries,Гомельская область Гомель улица Бориса Царикова 20А,unknown,Wildberries
unknown,wildberries,г. Мозырь (Гомельская область) бульвар Юности д. 155,unknown,Wildberries
unknown,wildberries,г. Добруш (Гомельская область) улица Гагарина д. 18,unknown,Wildberries
unknown,wildberries,г. Гомель (Гомельская область) Речицкий проспект д. 154,unknown,Wildberries
unknown,wildberries,г. Гомель (Гомельская область) улица Богдана Хмельницкого д. 108к1,unknown,Wildberries
unknown,wildberries,г. Лельчицы (Гомельская область) улица Меньшикова д. 67А,unknown,Wildberries
unknown,wildberries,г. Гомель (Гомельская область) улица Ильича д. 51Г,unknown,Wildberries
unknown,wildberries,Гомельская область Житковичи улица Чкалова 6,unknown,Wildberries
unknown,wildberries,г. Мозырь (Гомельская область) Пролетарская улица д. 47,unknown,Wildberries
unknown,wildberries,г. Гомель (Гомельская область) улица Свиридова д. 13,unknown,Wildberries
unknown,wildberries,г. Гомель (Гомельская область) улица Гагарина д. 63,unknown,Wildberries
unknown,wildberries,г. Мозырь (Гомельская обл)  Бульвар Страконицкий 21-133,unknown,Wildberries
unknown,wildberries,г Мозырь (Гомельская обл) Интернациональная 96,unknown,Wildberries
unknown,wildberries,г Светлогорск (Беларусь Гомельская обл) Мирошниченко 18/1,unknown,Wildberries
unknown,wildberries,Жлобин (Гомельская область Жлобинский район) Карла Маркса 2Б,unknown,Wildberries
unknown,wildberries,Хойники (Гомельская область) улица Жукова 2,unknown,Wildberries
unknown,wildberries,Петриков (Гомельская область) Коммунальная улица 11А,unknown,Wildberries
unknown,wildberries,г Речица (Гомельская область) Чапаева 8,unknown,Wildberries
unknown,wildberries,г Калинковичи (Гомельская область) улица 50 лет Октября 51-2,unknown,Wildberries
unknown,wildberries, Гомельская обл  г. Чечерск Советская улица 27,unknown,Wildberries
unknown,wildberries,г Гомель (Гомельская область) 8-я Иногородняя 4,unknown,Wildberries
unknown,wildberries,г Гомель (Гомельская область) улица Ильича 301,unknown,Wildberries
unknown,wildberries,Речица (Гомельская область) Молодёжная улица 34А,unknown,Wildberries
unknown,wildberries,Речица (Гомельская область) улица Трифонова 89,unknown,Wildberries
unknown,wildberries,Светлогорск Гомельская обл Азалова  8б,unknown,Wildberries
unknown,wildberries,Жлобин Гомельская область Жлобинский район улица Дзержинского 29,unknown,Wildberries
unknown,wildberries,Калинковичи Гомельская область Калинковичский район улица Князева 3,unknown,Wildberries
unknown,wildberries,Гомель Гомельская область Волотовская улица 11,unknown,Wildberries
unknown,wildberries,Мозырь Гомельская область Мозырский район бульвар Юности 119-242,unknown,Wildberries
unknown,wildberries,Гомель Гомельская область улица М.Г. Ефремова 63,unknown,Wildberries
unknown,wildberries,Мозырь Гомельская область Мозырский район улица Мира 1,unknown,Wildberries
unknown,wildberries,г Гомель Улица Карповича 21,unknown,Wildberries
unknown,wildberries,Гомель Гомельская область улица Мазурова 9,unknown,Wildberries
unknown,wildberries,Гомельская область Жлобин улица Макара Барташова 1Д,unknown,Wildberries
unknown,wildberries,г Гомель Улица Мазурова 83А,unknown,Wildberries
unknown,wildberries,Рогачев Гомельская область Рогачёвский район Набережная улица 79/2,unknown,Wildberries
unknown,wildberries,г Гомель Чечерская 70,unknown,Wildberries
unknown,wildberries,г Гомель проспект Речицкий 62А,unknown,Wildberries
unknown,wildberries,г Гомель Красная Улица 6,unknown,Wildberries
unknown,wildberries,г Речица Улица Нефтяников 70г,unknown,Wildberries
unknown,wildberries,г Гомель Улица Владимирова 65,unknown,Wildberries
unknown,wildberries,Гомельская область Мозырь улица С.О. Притыцкого 2Г,unknown,Wildberries
unknown,wildberries,г Гомель Улица Барыкина 78,unknown,Wildberries
unknown,wildberries,г Гомель Улица Пенязькова 21,unknown,Wildberries
unknown,wildberries,г Гомель Тереховская Улица 1,unknown,Wildberries
unknown,wildberries,г Гомель Советская Улица 144,unknown,Wildberries
unknown,wildberries,Светлогорск Гомельская обл улица 50 лет Октября 2Б,unknown,Wildberries
unknown,wildberries,Жлобин Гомельская обл 3-й м-н д. 10 пом. 1а,unknown,Wildberries
unknown,wildberries,Гомель Гомельская область проспект Космонавтов 98,unknown,Wildberries
unknown,wildberries,Гомельская область Гомель улица Кожара 1,unknown,Wildberries
unknown,wildberries,Гомельская область городской посёлок Корма улица Ленина 20,unknown,Wildberries
unknown,wildberries,Гомель Улица Хатаевича 53,unknown,Wildberries
unknown,wildberries,Гомельская область Мозырь улица Ивана Кеника 21,unknown,Wildberries
unknown,wildberries,Гомельская область Гомель улица Огоренко 33,unknown,Wildberries
unknown,wildberries,Гомель Улица Головацкого 116,unknown,Wildberries
unknown,wildberries,Гомельская область Гомель улица Ильича 163Е,unknown,Wildberries
unknown,wildberries,Гомель Октябрьская Улица 17,unknown,Wildberries
unknown,wildberries,Буда-Кошелёво Улица 50 Лет Октября 2,unknown,Wildberries
unknown,wildberries,Гомель Улица Михаила Ломоносова 29,unknown,Wildberries
unknown,wildberries,Гомельская область Гомель улица Клермон-Ферран 13,unknown,Wildberries
unknown,wildberries,Наровля Коммунистическая Улица 3,unknown,Wildberries
unknown,wildberries,Жлобин Бульвар Металлургов 11,unknown,Wildberries
unknown,wildberries,Гомельская область Речица Советская улица 151,unknown,Wildberries
unknown,wildberries,Гомельская область Гомель улица Белого 19А,unknown,Wildberries
unknown,wildberries,Гомельская область городской посёлок Лоев улица Ленина 24В,unknown,Wildberries
unknown,wildberries,Гомельская область Калинковичи улица Фрунзе 2,unknown,Wildberries
unknown,wildberries,Гомельская область Гомель Жемчужная улица 21,unknown,Wildberries
unknown,wildberries,Гомельская область Светлогорск Социалистическая улица 65,unknown,Wildberries
unknown,wildberries,Гомельская область Калинковичи улица Свердлова 73,unknown,Wildberries
unknown,wildberries,Гомельская область Ветка Октябрьская улица 26А,unknown,Wildberries
unknown,wildberries,Гомельская область Житковичи Социалистическая улица 91,unknown,Wildberries
unknown,wildberries,Гомель Улица Барыкина 100,unknown,Wildberries
unknown,wildberries,Гомель Проспект Октября 87а,unknown,Wildberries
unknown,wildberries,Гомель Улица Богдана Хмельницкого 59/1,unknown,Wildberries
unknown,wildberries,Гомельская область Мозырь Страконицкий бульвар 6А,unknown,Wildberries
unknown,wildberries,Добруш Проспект Луначарского 13,unknown,Wildberries
unknown,wildberries,Гомельская область Мозырь Социалистическая улица 96,unknown,Wildberries
unknown,wildberries,Гомельская область Гомель квартал МЖК Солнечный 6,unknown,Wildberries
unknown,wildberries,Гомель улица Кирова 59А,unknown,Wildberries
unknown,wildberries,Гомель Крестьянская Улица 33,unknown,Wildberries
unknown,wildberries,Гомель Улица Кирова 138,unknown,Wildberries
unknown,wildberries,Гомельская область Хойники Советская улица 93А,unknown,Wildberries
unknown,wildberries,Гомельская область Калинковичи Интернациональная улица 42,unknown,Wildberries
unknown,wildberries,Гомельская область Гомель микрорайон Энергетиков 8,unknown,Wildberries
unknown,wildberries,Гомель Улица 60 Лет СССР 4,unknown,Wildberries
unknown,wildberries,Добруш Улица Белинского 50а,unknown,Wildberries
unknown,wildberries,Гомельская область Мозырь улица Малинина 1А,unknown,Wildberries
unknown,wildberries,Жлобин Улица Войкова 8в,unknown,Wildberries
unknown,wildberries,Гомельская область Ельск улица 50 лет СССР 31,unknown,Wildberries
unknown,wildberries,Гомельская область Мозырь бульвар Юности 37А,unknown,Wildberries
unknown,wildberries,Гомель Речицкий Проспект 75,unknown,Wildberries
unknown,wildberries,Гомель Улица Свиридова 35,unknown,Wildberries
unknown,wildberries,Гомельская область Гомель улица Богдана Хмельницкого 85А,unknown,Wildberries
unknown,wildberries,Гомель Улица Маневича 10а,unknown,Wildberries
unknown,wildberries,Гомельская область Октябрьский Бобруйская улица 37А,unknown,Wildberries
unknown,wildberries,Гомельская область Петриков улица Академика Королёва 10,unknown,Wildberries
unknown,wildberries,Гомельская область Светлогорск улица Калинина 31А,unknown,Wildberries
unknown,wildberries,Жлобин Улица Войкова 2,unknown,Wildberries
unknown,wildberries,Гомельская область Светлогорск улица Луначарского 8,unknown,Wildberries
unknown,wildberries,Гомельская область Мозырь Полесская улица 24А,unknown,Wildberries
unknown,wildberries,Гомельская область Брагин улица Скорохода 16,unknown,Wildberries
unknown,wildberries,Мозырь Улица Пушкина 44бк1,unknown,Wildberries
unknown,wildberries,Гомельская область Мозырь улица Веры Хоружей 10,unknown,Wildberries
unknown,wildberries,городской посёлок Тереховка Советская Улица 21,unknown,Wildberries
unknown,wildberries,Гомельская область городской посёлок Копаткевичи Школьная улица 9,unknown,Wildberries
unknown,wildberries,Гомель Комсомольская Улица 6,unknown,Wildberries
unknown,wildberries,Гомельская область агрогородок Козенки Спортивная улица 50Г,unknown,Wildberries
unknown,wildberries,Буда-Кошелёво Улица Ленина 65,unknown,Wildberries
unknown,wildberries,Гомельская область Рогачёв Интернациональная улица 9,unknown,Wildberries
unknown,wildberries,Гомельская область Гомель Рощинская улица 10,unknown,Wildberries
unknown,wildberries,Гомельская область Речица Советская улица 108,unknown,Wildberries
unknown,wildberries,Гомельская область Речица улица Снежкова 20А,unknown,Wildberries
unknown,wildberries,Речица Улица Снежкова 19,unknown,Wildberries
unknown,wildberries,Калинковичи Советская Улица 122,unknown,Wildberries
unknown,wildberries,Гомельская область Речица Гомельская улица 4Г,unknown,Wildberries
unknown,wildberries,Гомельская область Мозырь Интернациональная улица 51,unknown,Wildberries
unknown,wildberries,Рогачёв Октябрьская Улица 29,unknown,Wildberries
unknown,wildberries,Гомельская область Калинковичи Подольская улица 49А,unknown,Wildberries
unknown,wildberries,Гомель Юбилейная Улица 8/2,unknown,Wildberries
unknown,wildberries,агрогородок Улуковье Тепличная Улица 22а,unknown,Wildberries
unknown,wildberries,Гомельская область Жлобин улица Козлова 50,unknown,Wildberries
unknown,wildberries,Жлобин Красная Улица 36б,unknown,Wildberries
unknown,wildberries,Гомельская область Гомель Севастопольская улица 103,unknown,Wildberries
unknown,wildberries,рабочий посёлок Сосновый Бор Советская Улица 7,unknown,Wildberries
unknown,wildberries,Калинковичи Улица Островского 59а,unknown,Wildberries
unknown,wildberries,Гомельская область Гомель улица Мазурова 21,unknown,Wildberries
unknown,wildberries,посёлок Зябровка Авиационная Улица 121,unknown,Wildberries
unknown,wildberries,Рогачёв Улица Владимира Ленина 42,unknown,Wildberries
unknown,wildberries,Добруш Улица Эрнста Тельмана 2,unknown,Wildberries
unknown,wildberries,деревня Озерщина Набережная Улица 21,unknown,Wildberries
unknown,wildberries,Гомель Международная Улица 1,unknown,Wildberries
unknown,wildberries,Гомельская область Туров Ленинская улица 15,unknown,Wildberries
unknown,wildberries,Гомель Советская Улица 244,unknown,Wildberries
unknown,wildberries,Гомель Улица Ильича 57,unknown,Wildberries
unknown,wildberries,Гомель Улица Дворникова 7,unknown,Wildberries
unknown,wildberries,Гомельская область Гомель улица Мазурова 117В,unknown,Wildberries
unknown,wildberries,Гомельская область Речица Светлогорское шоссе 27,unknown,Wildberries
unknown,wildberries,Гомельская область Мозырь Интернациональная улица 126,unknown,Wildberries
unknown,wildberries,агрогородок Коммунар Советская Улица 4,unknown,Wildberries
unknown,wildberries,Гомель Проспект Ленина 34,unknown,Wildberries
unknown,wildberries,Гомель Проспект Октября 217,unknown,Wildberries
unknown,wildberries,Гомель Дубравная Улица 10,unknown,Wildberries
unknown,wildberries,Гомель Советская Улица 119,unknown,Wildberries
unknown,wildberries,Гомельская область Мозырь бульвар Юности 46,unknown,Wildberries
unknown,wildberries,Калинковичи Улица Мира 74в,unknown,Wildberries
unknown,wildberries,Гомельская область Гомель улица Мазурова 127А,unknown,Wildberries
unknown,wildberries,Гомель Советская Улица 20/1,unknown,Wildberries
unknown,wildberries,Гомель Улица Ильича 331т,unknown,Wildberries
unknown,wildberries,Гомель Советская Улица 141а,unknown,Wildberries
unknown,wildberries,деревня Уза Шоссейная Улица 59,unknown,Wildberries
unknown,wildberries,Гомельская область Рогачёв улица Александра Пушкина 51,unknown,Wildberries
unknown,wildberries,Гомельская область Жлобин улица Урицкого 31,unknown,Wildberries
unknown,wildberries,Гомельская область Мозырь бульвар Юности 63,unknown,Wildberries
unknown,wildberries,Гомельская область Житковичи улица Фрунзе 50А,unknown,Wildberries
unknown,wildberries,Гомельская область Житковичи Социалистическая улица 45,unknown,Wildberries
unknown,wildberries,Гомельская область Светлогорск улица 50 лет Октября 16,unknown,Wildberries
unknown,wildberries,Гомельская область Жлобин 17-й микрорайон 29,unknown,Wildberries
unknown,wildberries,Гомель Улица Д.Н. Пенязькова 31,unknown,Wildberries
unknown,wildberries,посёлок Чёнки Чёнковский Сельсовет 23,unknown,Wildberries
unknown,wildberries,агрогородок Милошевичи Савецкая Вуліца 89а,unknown,Wildberries
unknown,wildberries,Светлогорск Паричская Улица 12,unknown,Wildberries
unknown,wildberries,Рогачёв Улица Ивана Богатырёва 114з,unknown,Wildberries
unknown,wildberries,Гомель Улица Гагарина 45,unknown,Wildberries
unknown,wildberries,Рогачёв Улица Сергея Кирова 39,unknown,Wildberries
unknown,wildberries,деревня Севруки Севруковская Улица 1б,unknown,Wildberries
