City,Place Name,Zipcode,Name
 Okulovskiy area,lukoil,Russia 174350 Novgorod Oblast  Okulovskiy area Okulovka area km 423 right,unknown,AZS № 53267 Okulovka-2
Okulovskiy area,lukoil,Russia 174350 Novgorod Oblast Okulovskiy area Okulovka area km 423 left,unknown,AZS № 53266 Okulovka-1
Velikii Novgorod,lukoil,Russia Novgorod Oblast Velikii Novgorod Bolshaya Sankt-Peterburgskaya 43 5,unknown,AZS № 53261 Stroitelej
Borovichi,lukoil,Russia Novgorod Oblast Borovichi Metallistov,unknown,AZS № 53254 Borovichi
"Starorusskiy area, Staraya Russa",lukoil,Russia Novgorod Oblast Starorusskiy area Staraya Russa Sankt-Peterburgskaya 80,unknown,AZS № 53196 Staraya Russa
Velikiy Novgorod,lukoil,Russia Novgorod Region Velikiy Novgorod st. Nekhinskaya д. 51,unknown,AZS № 53162 Nekhinskaya
unknown,lukoil,Russia 175460 Novgorod Oblast Krestetskiy area Novorakhinskoye poseleniye Pereyezd,unknown,AZS № 53065 Pereezd
unknown,lukoil,Russia 174581 Novgorod Oblast Khvoyninskiy area Khvoynaya st. Polevaya Polevaya,unknown,AZS № 53067 Hvojnaya
unknown,lukoil,Russia Novgorod Oblast Novgorodskiy area Proletarskoye gorodskoye poseleniye 489 km road Moskva-Sankt-Peterburg 489 km road Moskva-Sankt-Peterburg,unknown,AZS № 53066 Krasnye Stanki
Velikiy Novgorod,lukoil,Russia 173000 Novgorod Oblast  Velikii Novgorod Germana 19,unknown,AZS № 53063 Germana
Velikiy Novgorod,lukoil,Russia 173008 Novgorod Oblast Velikiy Novgorod road Syrkovskoye 1,unknown,AZS № 53062 Syrkovo
Velikiy Novgorod,lukoil,Russia 173000 Novgorod region  Velikiy Novgorod st. Sovetskoi Armii 1,unknown,AZS №53061 Derzhavina
unknown,wildberries,Новгородская область Великий Новгород Десятинная улица 3,unknown,Wildberries
unknown,wildberries,г. Боровичи (Боровичский р-н.) пл. Володарского 7,unknown,Wildberries
unknown,wildberries,г. Великий Новгород (Новгородская область) ул. Маловишерская д. 3,unknown,Wildberries
unknown,wildberries,г. Боровичи (Новгородская область) Новоселицкая улица д. 28,unknown,Wildberries
unknown,wildberries,г. Великий Новгород (Новгородская область) ул. Большая Санкт-Петербургская д. 5/1,unknown,Wildberries
unknown,wildberries,Новгородская область Валдай проспект Васильева 25,unknown,Wildberries
unknown,wildberries,г. Старая Русса (Новгородская область) Минеральная улица д. 27,unknown,Wildberries
unknown,wildberries,г. Пестово (Новгородская область) Вокзальная улица д. 2,unknown,Wildberries
unknown,wildberries,г. Великий Новгород (Новгородская область) Псковская улица 31/1,unknown,Wildberries
unknown,wildberries,г. Боровичи (Новгородская область) улица Мира д. 164,unknown,Wildberries
unknown,wildberries,г. Великий Новгород (Новгородская область) Большая Московская улица д. 124,unknown,Wildberries
unknown,wildberries,г. Боровичи (Новгородская область) Красноармейская улица д. 17,unknown,Wildberries
unknown,wildberries,г.Чудово (Новгородская область) улица Некрасова д. 12,unknown,Wildberries
unknown,wildberries,г. Великий Новгород (Новгородская область) улица Ломоносова д. 49,unknown,Wildberries
unknown,wildberries,г. Великий Новгород (Новгородская область) Псковская улица д. 36,unknown,Wildberries
unknown,wildberries,г. Великий Новгород (Новгородская область) Большая Санкт-Петербургская улица д. 106к1,unknown,Wildberries
unknown,wildberries,г. Великий Новгород (Новгородская область) Студенческая улица д. 13к1,unknown,Wildberries
unknown,wildberries,г. Великий Новгород (Новгородская область) Большая Санкт-Петербургская улица д. 28,unknown,Wildberries
unknown,wildberries,г. Великий Новгород (Новгородская область) улица Свободы д. 2/6,unknown,Wildberries
unknown,wildberries,г. Великий Новгород (Новгородская обл) Державина 12,unknown,Wildberries
unknown,wildberries,г. Великий Новгород (Новгородская область) улица Космонавтов д. 18/1,unknown,Wildberries
unknown,wildberries,г. Боровичи (Новгородская область) улица Подбельского д. 36,unknown,Wildberries
unknown,wildberries,Новгородская область Великий Новгород проспект Мира 21,unknown,Wildberries
unknown,wildberries,поселок городского типа Панковка (Новгородская область) Советская улица д. 7,unknown,Wildberries
unknown,wildberries,г. Малая Вишера (Новгородская обл) Московская 15,unknown,Wildberries
unknown,wildberries,г. Старая Русса (Новгородская обл) Поперечная 47,unknown,Wildberries
unknown,wildberries,г. Валдай (Новгородская обл) площадь Свободы 3А,unknown,Wildberries
unknown,wildberries,Пестово Новгородская область Устюженское шоссе 2,unknown,Wildberries
unknown,wildberries,Новгородская область Великий Новгород улица Кочетова 11/16,unknown,Wildberries
unknown,wildberries,г Боровичи (Новгородская обл) Сушанская 6,unknown,Wildberries
unknown,wildberries,д Григорово Россия Новгородская обл Новгородский р-н Центральная улица 4,unknown,Wildberries
unknown,wildberries,пос Сольцы (Новгородская область) Советский проспект 15А,unknown,Wildberries
unknown,wildberries,Крестцы Новгородская обл Крестецкий р-н Московская улица 23,unknown,Wildberries
unknown,wildberries,Хвойная Новгородская область Хвойнинский район улица Мира 3 Б,unknown,Wildberries
unknown,wildberries,г Великий Новгород Каберова-Власьевская 78,unknown,Wildberries
unknown,wildberries,Великий Новгород (Новгородская обл) улица Щусева 7,unknown,Wildberries
unknown,wildberries,г Великий Новгород Южная Улица 5,unknown,Wildberries
unknown,wildberries,г Великий Новгород Улица Кочетова 20к1,unknown,Wildberries
unknown,wildberries,г Великий Новгород Завокзальная Улица 3,unknown,Wildberries
unknown,wildberries,Окуловка Новгородская область Окуловский район Чайковского 4,unknown,Wildberries
unknown,wildberries,рп Угловка Центральная Улица 6а,unknown,Wildberries
unknown,wildberries,Новгородская область Великий Новгород улица Ломоносова 18к1,unknown,Wildberries
unknown,wildberries,г Великий Новгород Большая Московская Улица 122,unknown,Wildberries
unknown,wildberries,Старая Русса Новгородская область Старорусский район Воскресенская улица 2/1,unknown,Wildberries
unknown,wildberries,г Боровичи Улица Кропоткина 5,unknown,Wildberries
unknown,wildberries,г Великий Новгород Улица Кочетова 8,unknown,Wildberries
unknown,wildberries,г Великий Новгород Псковская Улица 46,unknown,Wildberries
unknown,wildberries,д Парфино Улица Карла Маркса 36,unknown,Wildberries
unknown,wildberries,г Великий Новгород Большая Санкт-Петербургская Улица 106к2,unknown,Wildberries
unknown,wildberries,г Великий Новгород Московская Улица 7,unknown,Wildberries
unknown,wildberries,г Великий Новгород Большая Московская Улица 130,unknown,Wildberries
unknown,wildberries,г Старая Русса Александровская Улица 19,unknown,Wildberries
unknown,wildberries,рп Крестцы Лесная Улица 13,unknown,Wildberries
unknown,wildberries,г Великий Новгород Проспект Мира 30к1,unknown,Wildberries
unknown,wildberries,г Великий Новгород Проспект Александра Корсунова 51к1,unknown,Wildberries
unknown,wildberries,г Великий Новгород Волотовская Улица 7а,unknown,Wildberries
unknown,wildberries,г Валдай Улица Ломоносова 53,unknown,Wildberries
unknown,wildberries,рп Пролетарий Ленинградская Улица 13/5,unknown,Wildberries
unknown,wildberries,г Великий Новгород Большая Московская Улица 54,unknown,Wildberries
unknown,wildberries,г Великий Новгород Улица Коровникова 4,unknown,Wildberries
unknown,wildberries,г Великий Новгород Псковская Улица 4,unknown,Wildberries
unknown,wildberries,Новгородская область Старая Русса улица Дзержинского 6,unknown,Wildberries
unknown,wildberries,Новгородская область Старая Русса улица Восстания 6,unknown,Wildberries
unknown,wildberries,г Великий Новгород Каберова-Власьевская Улица 97,unknown,Wildberries
unknown,wildberries,Великий Новгород Проспект Александра Корсунова 41/2,unknown,Wildberries
unknown,wildberries,поселок городского типа Любытино Базарная Улица 7,unknown,Wildberries
unknown,wildberries,Великий Новгород Нехинская Улица 24к1,unknown,Wildberries
unknown,wildberries,Старая Русса Улица Латышских Гвардейцев 40а,unknown,Wildberries
unknown,wildberries,Новгородская область Чудово улица Титова 5,unknown,Wildberries
unknown,wildberries,Малая Вишера Лесная Улица 36,unknown,Wildberries
unknown,wildberries,Новгородская область Великий Новгород Михайлова улица 42,unknown,Wildberries
unknown,wildberries,Великий Новгород Улица Свободы 16/11,unknown,Wildberries
unknown,wildberries,Новгородская область Малая Вишера улица Революции 14Н,unknown,Wildberries
unknown,wildberries,Новгородская область Старая Русса улица Некрасова 23А,unknown,Wildberries
unknown,wildberries,Новгородская область Великий Новгород улица Державина 13,unknown,Wildberries
unknown,wildberries,Великий Новгород Большая Санкт-Петербургская Улица 98к1,unknown,Wildberries
unknown,wildberries,поселок Прогресс Улица Гагарина 19,unknown,Wildberries
unknown,wildberries,посёлок Батецкий Советская Улица 2а,unknown,Wildberries
unknown,wildberries,Великий Новгород Нехинская Улица 32,unknown,Wildberries
unknown,wildberries,посёлок городского типа Демянск Улица Ленина 17,unknown,Wildberries
unknown,wildberries,Новгородская область Великий Новгород Тихвинская улица 3,unknown,Wildberries
unknown,wildberries,Боровичи Школьный Бульвар 25,unknown,Wildberries
unknown,wildberries,Великий Новгород Улица Щусева 8к5,unknown,Wildberries
unknown,wildberries,Боровичи Южная Улица 47,unknown,Wildberries
unknown,wildberries,Великий Новгород Проспект Александра Корсунова 21/1,unknown,Wildberries
unknown,wildberries,Великий Новгород Улица Кочетова 35к3,unknown,Wildberries
unknown,wildberries,посёлок городского типа Кулотино Улица Ворошилова 17,unknown,Wildberries
unknown,wildberries,Новгородская область Пестово Почтовая улица 13А,unknown,Wildberries
unknown,wildberries,Великий Новгород Улица Вересова 5к1,unknown,Wildberries
unknown,wildberries,Новгородская область Пестово улица Чапаева 19А,unknown,Wildberries
unknown,wildberries,село Мошенское Улица 1 Мая 31,unknown,Wildberries
unknown,wildberries,Новгородская область Старая Русса микрорайон Городок 9,unknown,Wildberries
unknown,wildberries,Чудово Улица Солдатова 9,unknown,Wildberries
unknown,wildberries,Великий Новгород Улица Советской Армии 30к2,unknown,Wildberries
unknown,wildberries,Окуловка Центральная Улица 1,unknown,Wildberries
unknown,wildberries,Окуловка Улица Володарского 39,unknown,Wildberries
unknown,wildberries,Окуловка Советская Улица 46а,unknown,Wildberries
