Ref,Spider,Name,Address,City,State,Zipcode,Country,Phone,Website,Hours,Brand,WikiData
BGRA00150,audi,Porsche Plovdiv,"Bulevard Pazardzhishko shose 82A, 4000 Plovdiv",Plovdiv,Plovdiv,,BG,+359 32 953 330,,,Audi,Q23317
53335,easypay,EasyPay,PLOVDIV  ul. Vesela 6,Obshtina Plovdiv,Plovdiv,,BG,,,,EasyPay,Q110583289
42093,easypay,EasyPay,PLOVDIV  bul. 6-ti Septemvri №35,Obshtina Plovdiv,Plovdiv,,BG,,,,EasyPay,Q110583289
55717,easypay,EasyPay,PLOVDIV  ul. Skopie 102,Obshtina Plovdiv,Plovdiv,,BG,,,,EasyPay,Q110583289
55695,easypay,EasyPay,PLOVDIV  ul. Gen. Radko  Dimitriev 1,Obshtina Plovdiv,Plovdiv,,BG,,,,EasyPay,Q110583289
56815,easypay,EasyPay,PLOVDIV  bul. Ruski 99,Obshtina Plovdiv,Plovdiv,,BG,,,,EasyPay,Q110583289
55167,easypay,EasyPay,PLOVDIV  ul. Borba 10,Obshtina Plovdiv,Plovdiv,,BG,,,,EasyPay,Q110583289
37842,easypay,EasyPay,PLOVDIV  bul. Lyuben Karavelov 9A,Obshtina Plovdiv,Plovdiv,,BG,,,,EasyPay,Q110583289
56695,easypay,EasyPay,PLOVDIV  bul. Makedonia 2,Obshtina Plovdiv,Plovdiv,,BG,,,,EasyPay,Q110583289
15260,easypay,EasyPay,PLOVDIV  ul. Knyaz Batenberg 26,Obshtina Asenovgrad,Plovdiv,,BG,,,,EasyPay,Q110583289
48287,easypay,EasyPay,PLOVDIV  ul. Ohrid 20,Obshtina Plovdiv,Plovdiv,,BG,,,,EasyPay,Q110583289
46766,easypay,EasyPay,"PLOVDIV  ul. Makedonia 97B, m-n Kaufland",Obshtina Plovdiv,Plovdiv,,BG,,,,EasyPay,Q110583289
47429,easypay,EasyPay,PLOVDIV  ul. Iskra 16,Obshtina Plovdiv,Plovdiv,,BG,,,,EasyPay,Q110583289
45340,easypay,EasyPay,"PLOVDIV  bul. Peshtersko shose 36, m- n Kaufland",Obshtina Plovdiv,Plovdiv,,BG,,,,EasyPay,Q110583289
37108,easypay,EasyPay,"PLOVDIV  kv. Trakia, bl.148",Obshtina Plovdiv,Plovdiv,,BG,,,,EasyPay,Q110583289
56725,easypay,EasyPay,PLOVDIV  ul. Ivan Andonov 7,Obshtina Plovdiv,Plovdiv,,BG,,,,EasyPay,Q110583289
56269,easypay,EasyPay,PLOVDIV  ul.Raya 3,Obshtina Plovdiv,Plovdiv,,BG,,,,EasyPay,Q110583289
42020,easypay,EasyPay,PLOVDIV  ul.Trakia 41,Obshtina Plovdiv,Plovdiv,,BG,,,,EasyPay,Q110583289
41667,easypay,EasyPay,"PLOVDIV  zh.k. Trakia, bul. Osvobozhdenie 47, m-n Kaufland",Obshtina Plovdiv,Plovdiv,,BG,,,,EasyPay,Q110583289
38239,easypay,EasyPay,PLOVDIV  bul.Hristo Botev № 118,Obshtina Plovdiv,Plovdiv,,BG,,,,EasyPay,Q110583289
36939,easypay,EasyPay,PLOVDIV  Okolovrasten pat Plovdiv,Obshtina Plovdiv,Plovdiv,,BG,,,,EasyPay,Q110583289
42094,easypay,EasyPay,PLOVDIV  bul. Perushtitsa №8,Obshtina Plovdiv,Plovdiv,,BG,,,,EasyPay,Q110583289
53550,easypay,EasyPay,PLOVDIV  ul.Konstantin Gerov 20,Obshtina Plovdiv,Plovdiv,,BG,,,,EasyPay,Q110583289
41317,easypay,EasyPay,"PLOVDIV  ul.Kapitan Raycho 50,tyalo A,**mRL**m**mNL**mparter, TTS `Market Tsentar`",Obshtina Plovdiv,Plovdiv,,BG,,,,EasyPay,Q110583289
40853,easypay,EasyPay,PLOVDIV  ul.Napredak № 2,Obshtina Plovdiv,Plovdiv,,BG,,,,EasyPay,Q110583289
30285,easypay,EasyPay,"PLOVDIV  ul. ""Kapitan Raycho"" 23",Obshtina Asenovgrad,Plovdiv,,BG,,,,EasyPay,Q110583289
49295,easypay,EasyPay,PLOVDIV  ul. Solunska № 1,Obshtina Plovdiv,Plovdiv,,BG,,,,EasyPay,Q110583289
56539,easypay,EasyPay,PLOVDIV  ul. Tsanko Dyustabanov 34,Obshtina Plovdiv,Plovdiv,,BG,,,,EasyPay,Q110583289
41393,easypay,EasyPay,"PLOVDIV  ul. Gevgeli, 40",Obshtina Plovdiv,Plovdiv,,BG,,,,EasyPay,Q110583289
42334,easypay,EasyPay,"PLOVDIV  bul. Maritsa 19, m-n Leksi",Obshtina Plovdiv,Plovdiv,,BG,,,,EasyPay,Q110583289
49111,easypay,EasyPay,PLOVDIV  ul. Tsarigradsko shose 76,Obshtina Plovdiv,Plovdiv,,BG,,,,EasyPay,Q110583289
53142,easypay,EasyPay,PLOVDIV  bul.Knyaginya Maria Luiza № 23,Obshtina Plovdiv,Plovdiv,,BG,,,,EasyPay,Q110583289
56702,easypay,EasyPay,PLOVDIV  Ul. Mladost 31,Obshtina Plovdiv,Plovdiv,,BG,,,,EasyPay,Q110583289
38349,easypay,EasyPay,PLOVDIV  kv.Trakia s/u bl.14,Obshtina Plovdiv,Plovdiv,,BG,,,,EasyPay,Q110583289
49504,easypay,EasyPay,PLOVDIV  ul. Dilyanka 11,Obshtina Plovdiv,Plovdiv,,BG,,,,EasyPay,Q110583289
43790,easypay,EasyPay,PLOVDIV  ul. Maria Luiza №49 /v magazina /,Obshtina Plovdiv,Plovdiv,,BG,,,,EasyPay,Q110583289
4560,easypay,EasyPay,"PLOVDIV  ul. ""Kapitan Raycho"" 56",Obshtina Asenovgrad,Plovdiv,,BG,,,,EasyPay,Q110583289
38203,easypay,EasyPay,PLOVDIV  ul.Mitropolit Panaret № 12,Obshtina Plovdiv,Plovdiv,,BG,,,,EasyPay,Q110583289
29979,easypay,EasyPay,PLOVDIV  bul.Maria Luiza,Obshtina Plovdiv,Plovdiv,,BG,,,,EasyPay,Q110583289
47599,easypay,EasyPay,"PLOVDIV  zh.k. Trakia bl.201 G, vh. A",Obshtina Plovdiv,Plovdiv,,BG,,,,EasyPay,Q110583289
50423,easypay,EasyPay,PLOVDIV  ul.Maria Kyuri 12,Obshtina Plovdiv,Plovdiv,,BG,,,,EasyPay,Q110583289
55481,easypay,EasyPay,PLOVDIV  Bul.Makedonia 107,Obshtina Plovdiv,Plovdiv,,BG,,,,EasyPay,Q110583289
42704,easypay,EasyPay,"PLOVDIV  ul. Tsarigradsko shose № 94, m-n Kaufland",Obshtina Plovdiv,Plovdiv,,BG,,,,EasyPay,Q110583289
31056,easypay,EasyPay,"PLOVDIV  bul.""Kuklensko shose""",Obshtina Plovdiv,Plovdiv,,BG,,,,EasyPay,Q110583289
43751,easypay,EasyPay,PLOVDIV  ul. Skopie 67,Obshtina Plovdiv,Plovdiv,,BG,,,,EasyPay,Q110583289
56897,easypay,EasyPay,PLOVDIV  zhk. Trakia bl.194,Obshtina Plovdiv,Plovdiv,,BG,,,,EasyPay,Q110583289
56582,easypay,EasyPay,PLOVDIV  bul. Shesti septemvri №152,Obshtina Plovdiv,Plovdiv,,BG,,,,EasyPay,Q110583289
53417,easypay,EasyPay,PLOVDIV  ul. Dimitar Talev 23,Obshtina Plovdiv,Plovdiv,,BG,,,,EasyPay,Q110583289
43263,easypay,EasyPay,PLOVDIV  bul. Mendeleev 2B,Obshtina Plovdiv,Plovdiv,,BG,,,,EasyPay,Q110583289
15001,easypay,EasyPay,"PLOVDIV  bul. ""Saedinenie"" 34",Obshtina Plovdiv,Plovdiv,,BG,,,,EasyPay,Q110583289
40175,easypay,EasyPay,PLOVDIV  Ul. Prespa 4,Obshtina Plovdiv,Plovdiv,,BG,,,,EasyPay,Q110583289
46153,easypay,EasyPay,PLOVDIV  ul.Ostromila 13,Obshtina Plovdiv,Plovdiv,,BG,,,,EasyPay,Q110583289
55562,easypay,EasyPay,PLOVDIV  ul. Zahari Stoyanov № 61a,Obshtina Plovdiv,Plovdiv,,BG,,,,EasyPay,Q110583289
55604,easypay,EasyPay,PLOVDIV  bul. Vasil Aprilov №32,Obshtina Plovdiv,Plovdiv,,BG,,,,EasyPay,Q110583289
3426,easypay,EasyPay,PLOVDIV  ul.6-i septemvri 144,Obshtina Plovdiv,Plovdiv,,BG,,,,EasyPay,Q110583289
56830,easypay,EasyPay,PLOVDIV  ul. Gladston 11,Obshtina Plovdiv,Plovdiv,,BG,,,,EasyPay,Q110583289
1947,easypay,EasyPay,PLOVDIV  ul. Bethoven 5,Obshtina Plovdiv,Plovdiv,,BG,,,,EasyPay,Q110583289
54503,easypay,EasyPay,PLOVDIV  bul. Peshtersko shose 133,Obshtina Plovdiv,Plovdiv,,BG,,,,EasyPay,Q110583289
50203,easypay,EasyPay,"PLOVDIV  ul. Makedonia, №6",Obshtina Plovdiv,Plovdiv,,BG,,,,EasyPay,Q110583289
3427,easypay,EasyPay,"PLOVDIV  ul. Skopie, bl. 1519",Obshtina Plovdiv,Plovdiv,,BG,,,,EasyPay,Q110583289
37276,easypay,EasyPay,"PLOVDIV  ul. Brezovsko shose 127, m-n Kaufland",Obshtina Plovdiv,Plovdiv,,BG,,,,EasyPay,Q110583289
29992,easypay,EasyPay,PLOVDIV  bul.Balgaria,Obshtina Plovdiv,Plovdiv,,BG,,,,EasyPay,Q110583289
50743,easypay,EasyPay,PLOVDIV  ul. Avksentiy Veleshki 20,Obshtina Plovdiv,Plovdiv,,BG,,,,EasyPay,Q110583289
56728,easypay,EasyPay,PLOVDIV  ul. Nikola Chernishevski 48,Obshtina Plovdiv,Plovdiv,,BG,,,,EasyPay,Q110583289
30393,easypay,EasyPay,"PLOVDIV  bul. Shesti Septemvri 221, m-n Billa",Obshtina Plovdiv,Plovdiv,,BG,,,,EasyPay,Q110583289
40347,easypay,EasyPay,PLOVDIV  zh.k.Trakia bl.45 vh B,Obshtina Plovdiv,Plovdiv,,BG,,,,EasyPay,Q110583289
35866,easypay,EasyPay,PLOVDIV  ul.Danail Nikolaev 74-76,Obshtina Plovdiv,Plovdiv,,BG,,,,EasyPay,Q110583289
42705,easypay,EasyPay,PLOVDIV  ul. Knyaz Aleksandar I 36,Obshtina Plovdiv,Plovdiv,,BG,,,,EasyPay,Q110583289
39663,easypay,EasyPay,PLOVDIV  bul. Aleksandar Stamboliyski 35 B do m-n Triumf,Obshtina Plovdiv,Plovdiv,,BG,,,,EasyPay,Q110583289
49507,easypay,EasyPay,"PLOVDIV  ul. Panteley Genov 1, sreshtu magazin Mesota",Obshtina Plovdiv,Plovdiv,,BG,,,,EasyPay,Q110583289
54276,easypay,EasyPay,"PLOVDIV  Plovdiv, bul. Tsar Boris III Obedinitel 179",Obshtina Plovdiv,Plovdiv,,BG,,,,EasyPay,Q110583289
46341,easypay,EasyPay,PLOVDIV  ul.Elba 15,Obshtina Plovdiv,Plovdiv,,BG,,,,EasyPay,Q110583289
35930,easypay,EasyPay,"PLOVDIV kv. 4003 bul. Peshtersko shose 66, UMBAL Sveti Georgi",Obshtina Plovdiv,Plovdiv,,BG,,,,EasyPay,Q110583289
54009,easypay,EasyPay,"PLOVDIV kv. Belomorski mestnost ""byalata vodenitsa"" rayon Yuzhen , Markovski pat do tabelata na Plovdiv",Obshtina Krichim,Plovdiv,,BG,,,,EasyPay,Q110583289
44223,easypay,EasyPay,PLOVDIV kv. Gagarin ul. Stefan i Obreyko Obreykovi №17(Knizharnitsa),Obshtina Plovdiv,Plovdiv,,BG,,,,EasyPay,Q110583289
46827,easypay,EasyPay,PLOVDIV kv. Gagarin ul. Gonda voda №1,Obshtina Plovdiv,Plovdiv,,BG,,,,EasyPay,Q110583289
56726,easypay,EasyPay,PLOVDIV kv. Gagarin Ul. Tsar Boris Obedenitel III 33,Obshtina Plovdiv,Plovdiv,,BG,,,,EasyPay,Q110583289
53355,easypay,EasyPay,PLOVDIV kv. Gladno pole ul.Lev tolstoy №3,Obshtina Plovdiv,Plovdiv,,BG,,,,EasyPay,Q110583289
46800,easypay,EasyPay,PLOVDIV kv. HRISTO SMIRNENSKI ul.Yordan Gavazov 23,Obshtina Plovdiv,Plovdiv,,BG,,,,EasyPay,Q110583289
37489,easypay,EasyPay,PLOVDIV kv. Hristo Botev ul. Georgi Ikonomov 2,Obshtina Plovdiv,Plovdiv,,BG,,,,EasyPay,Q110583289
38046,easypay,EasyPay,PLOVDIV kv. Hristo Smirnenski ul. Yundola 65/ Zhilishten Kompleks ELEGANS,Obshtina Plovdiv,Plovdiv,,BG,,,,EasyPay,Q110583289
55025,easypay,EasyPay,"PLOVDIV kv. Hristo Smirnenski ul. Ravnishta № 4, m-n T Market",Obshtina Plovdiv,Plovdiv,,BG,,,,EasyPay,Q110583289
54699,easypay,EasyPay,"PLOVDIV kv. Hristo Smirnenski bul.Peshtersko shose 78, m-n Leksi",Obshtina Plovdiv,Plovdiv,,BG,,,,EasyPay,Q110583289
46807,easypay,EasyPay,PLOVDIV kv. Izgrev ul. Gerlovo 16,Obshtina Plovdiv,Plovdiv,,BG,,,,EasyPay,Q110583289
42327,easypay,EasyPay,PLOVDIV kv. Izgrev ul. Landos 16,Obshtina Plovdiv,Plovdiv,,BG,,,,EasyPay,Q110583289
56736,easypay,EasyPay,"PLOVDIV kv. KVARTAL IZGREV gr. Plovdiv, ul. Vrattsata 1",Obshtina Plovdiv,Plovdiv,,BG,,,,EasyPay,Q110583289
56737,easypay,EasyPay,PLOVDIV kv. Kamenitsa ul. Petko De Petkov 60,Obshtina Plovdiv,Plovdiv,,BG,,,,EasyPay,Q110583289
56004,easypay,EasyPay,PLOVDIV kv. Kamenitsa 1 ul.Kapitan Raycho № 56,Obshtina Plovdiv,Plovdiv,,BG,,,,EasyPay,Q110583289
50120,easypay,EasyPay,PLOVDIV kv. Kamenitsa 1 ul. Tsar Asen I-vi №35,Obshtina Plovdiv,Plovdiv,,BG,,,,EasyPay,Q110583289
54796,easypay,EasyPay,PLOVDIV kv. Kamenitsa 1 ul. Ilarion Makariopolski № 13,Obshtina Plovdiv,Plovdiv,,BG,,,,EasyPay,Q110583289
51803,easypay,EasyPay,PLOVDIV kv. Kamenitsa 2 ul. Zornitsa 12,Obshtina Plovdiv,Plovdiv,,BG,,,,EasyPay,Q110583289
55280,easypay,EasyPay,PLOVDIV kv. Karshiaka ul. Slivnitsa 10,Obshtina Plovdiv,Plovdiv,,BG,,,,EasyPay,Q110583289
53073,easypay,EasyPay,PLOVDIV kv. Karshiaka ul.Vasil Levski 68,Obshtina Plovdiv,Plovdiv,,BG,,,,EasyPay,Q110583289
36362,easypay,EasyPay,"PLOVDIV kv. Karshiaka bul.Balgaria 4, k-ks Ori Bildings",Obshtina Plovdiv,Plovdiv,,BG,,,,EasyPay,Q110583289
56301,easypay,EasyPay,PLOVDIV kv. Karshiaka bul. Balgaria 63,Obshtina Plovdiv,Plovdiv,,BG,,,,EasyPay,Q110583289
42545,easypay,EasyPay,"PLOVDIV kv. Karshiaka ul. Vasil Levski № 95, parter",Obshtina Plovdiv,Plovdiv,,BG,,,,EasyPay,Q110583289
55370,easypay,EasyPay,PLOVDIV kv. Karshiaka ul.Sredets 78,Obshtina Plovdiv,Plovdiv,,BG,,,,EasyPay,Q110583289
56294,easypay,EasyPay,PLOVDIV kv. Karshiaka ul. Pobeda 21,Obshtina Plovdiv,Plovdiv,,BG,,,,EasyPay,Q110583289
49393,easypay,EasyPay,PLOVDIV kv. Karshiaka ul. Ivan Rilski 58,Obshtina Plovdiv,Plovdiv,,BG,,,,EasyPay,Q110583289
49081,easypay,EasyPay,PLOVDIV kv. Karshiaka bul. Dunav 44,Obshtina Plovdiv,Plovdiv,,BG,,,,EasyPay,Q110583289
56719,easypay,EasyPay,PLOVDIV kv. Karshiaka ul.Barzia 1,Obshtina Plovdiv,Plovdiv,,BG,,,,EasyPay,Q110583289
41182,easypay,EasyPay,PLOVDIV kv. Karshiaka ul. Ogradzhen 10,Obshtina Plovdiv,Plovdiv,,BG,,,,EasyPay,Q110583289
49098,easypay,EasyPay,PLOVDIV kv. Karshiaka bul.Balgaria № 115A,Obshtina Plovdiv,Plovdiv,,BG,,,,EasyPay,Q110583289
51251,easypay,EasyPay,PLOVDIV kv. Komatevo ul.Komatevsko shose 230,Obshtina Plovdiv,Plovdiv,,BG,,,,EasyPay,Q110583289
44443,easypay,EasyPay,PLOVDIV kv. Komatevo ul.Ela 3,Obshtina Plovdiv,Plovdiv,,BG,,,,EasyPay,Q110583289
43791,easypay,EasyPay,PLOVDIV kv. Kv. Izgrev ul.Krayna,Obshtina Plovdiv,Plovdiv,,BG,,,,EasyPay,Q110583289
48854,easypay,EasyPay,PLOVDIV kv. Kyuchuk Parizh Ul. Pere Toshev 26,Obshtina Plovdiv,Plovdiv,,BG,,,,EasyPay,Q110583289
48650,easypay,EasyPay,PLOVDIV kv. Kyuchuk Parizh bul. Nikola Vaptsarov 91a,Obshtina Plovdiv,Plovdiv,,BG,,,,EasyPay,Q110583289
55175,easypay,EasyPay,PLOVDIV kv. Marasha bul. Svoboda 14,Obshtina Plovdiv,Plovdiv,,BG,,,,EasyPay,Q110583289
50332,easypay,EasyPay,PLOVDIV kv. Marasha ul. Anton Strashimirov 1,Obshtina Plovdiv,Plovdiv,,BG,,,,EasyPay,Q110583289
38294,easypay,EasyPay,PLOVDIV kv. Marasha pl. Kocho Chestimenski 6,Obshtina Plovdiv,Plovdiv,,BG,,,,EasyPay,Q110583289
46571,easypay,EasyPay,PLOVDIV kv. Marasha bul. 6-ti Septemvri 102,Obshtina Plovdiv,Plovdiv,,BG,,,,EasyPay,Q110583289
49353,easypay,EasyPay,PLOVDIV kv. Ostromila ul. Ostromila 14 b,Obshtina Plovdiv,Plovdiv,,BG,,,,EasyPay,Q110583289
47021,easypay,EasyPay,PLOVDIV kv. PLOVDIV ul.Brezovsko shose 195,Obshtina Plovdiv,Plovdiv,,BG,,,,EasyPay,Q110583289
51819,easypay,EasyPay,PLOVDIV kv. Peshtersko shose ul. Perushtitsa 8,Obshtina Plovdiv,Plovdiv,,BG,,,,EasyPay,Q110583289
34672,easypay,EasyPay,PLOVDIV kv. SEVEREN ul.Pobeda  17,Obshtina Plovdiv,Plovdiv,,BG,,,,EasyPay,Q110583289
54411,easypay,EasyPay,PLOVDIV kv. SEVEREN bul.Vasil Levski 105,Obshtina Plovdiv,Plovdiv,,BG,,,,EasyPay,Q110583289
50967,easypay,EasyPay,PLOVDIV kv. SEVEREN ul. Pobeda 70,Obshtina Plovdiv,Plovdiv,,BG,,,,EasyPay,Q110583289
55559,easypay,EasyPay,PLOVDIV kv. Sadiyski ul. Stoyan Mihaylovski 12,Obshtina Plovdiv,Plovdiv,,BG,,,,EasyPay,Q110583289
49406,easypay,EasyPay,PLOVDIV kv. Shirok Tsentar ul.Mladezhka 30,Obshtina Plovdiv,Plovdiv,,BG,,,,EasyPay,Q110583289
49511,easypay,EasyPay,PLOVDIV kv. Shirok Tsentar ul. Georgi Mamarchev 21,Obshtina Plovdiv,Plovdiv,,BG,,,,EasyPay,Q110583289
43971,easypay,EasyPay,PLOVDIV kv. Smirnenski ul. Vasil Aprilov 41,Obshtina Plovdiv,Plovdiv,,BG,,,,EasyPay,Q110583289
45027,easypay,EasyPay,PLOVDIV kv. Stochna Gara ul.Avksentiy Veleshki 51,Obshtina Plovdiv,Plovdiv,,BG,,,,EasyPay,Q110583289
47597,easypay,EasyPay,PLOVDIV kv. Stolipinovo ul.Batak/Slavia 2,Obshtina Plovdiv,Plovdiv,,BG,,,,EasyPay,Q110583289
46344,easypay,EasyPay,PLOVDIV kv. Stolipinovo ul.Kalina 24,Obshtina Plovdiv,Plovdiv,,BG,,,,EasyPay,Q110583289
46799,easypay,EasyPay,PLOVDIV kv. TRAKIA bul.SHipka 6,Obshtina Plovdiv,Plovdiv,,BG,,,,EasyPay,Q110583289
44275,easypay,EasyPay,PLOVDIV kv. TRAKIA zh.k Trakia bl.277,Obshtina Plovdiv,Plovdiv,,BG,,,,EasyPay,Q110583289
47774,easypay,EasyPay,PLOVDIV kv. TSENTRALEN Bul. Maria Luiza 18,Obshtina Plovdiv,Plovdiv,,BG,,,,EasyPay,Q110583289
49931,easypay,EasyPay,"PLOVDIV kv. Trakia ul. Anton Mumdzhiev 2 bl.229, vh. A",Obshtina Plovdiv,Plovdiv,,BG,,,,EasyPay,Q110583289
53435,easypay,EasyPay,PLOVDIV kv. Trakia ul. Georgi Danchov 16,Obshtina Plovdiv,Plovdiv,,BG,,,,EasyPay,Q110583289
55764,easypay,EasyPay,PLOVDIV kv. Trakia sreshtu bl 100,Obshtina Plovdiv,Plovdiv,,BG,,,,EasyPay,Q110583289
54466,easypay,EasyPay,PLOVDIV kv. Trakia bl. 173 vh.A parter,Obshtina Plovdiv,Plovdiv,,BG,,,,EasyPay,Q110583289
52066,easypay,EasyPay,PLOVDIV kv. Trakia ul.Spas Zafirov 3,Obshtina Plovdiv,Plovdiv,,BG,,,,EasyPay,Q110583289
55794,easypay,EasyPay,"PLOVDIV kv. Trakia bul.Osvobozhdenie 155,  ofis 1",Obshtina Plovdiv,Plovdiv,,BG,,,,EasyPay,Q110583289
55083,easypay,EasyPay,PLOVDIV kv. Trakia Bul. Shipka 19 ofis 4 Harmonia,Obshtina Plovdiv,Plovdiv,,BG,,,,EasyPay,Q110583289
3581,easypay,EasyPay,"PLOVDIV kv. Trakia bul. Sankt Peterburg 48,",Obshtina Plovdiv,Plovdiv,,BG,,,,EasyPay,Q110583289
55912,easypay,EasyPay,PLOVDIV kv. Trakia bul. Tsar Simeon 35,Obshtina Plovdiv,Plovdiv,,BG,,,,EasyPay,Q110583289
49087,easypay,EasyPay,PLOVDIV kv. Trakia ul.Saedinenie 1,Obshtina Plovdiv,Plovdiv,,BG,,,,EasyPay,Q110583289
50396,easypay,EasyPay,PLOVDIV kv. Trakia ul.Saedinenie 63,Obshtina Plovdiv,Plovdiv,,BG,,,,EasyPay,Q110583289
47994,easypay,EasyPay,PLOVDIV kv. Tsentar ul. Filip Makedonski 58,Obshtina Plovdiv,Plovdiv,,BG,,,,EasyPay,Q110583289
39522,easypay,EasyPay,PLOVDIV kv. Tsentar pl.Grozdov pazar 2,Obshtina Plovdiv,Plovdiv,,BG,,,,EasyPay,Q110583289
56373,easypay,EasyPay,PLOVDIV kv. Tsentar ul. Tsar Ivan Shishman 4,Obshtina Plovdiv,Plovdiv,,BG,,,,EasyPay,Q110583289
55205,easypay,EasyPay,PLOVDIV kv. Tsentar ul. Georgi Benkovski 41,Obshtina Plovdiv,Plovdiv,,BG,,,,EasyPay,Q110583289
49383,easypay,EasyPay,PLOVDIV kv. Tsentar Bul.Ruski №54,Obshtina Plovdiv,Plovdiv,,BG,,,,EasyPay,Q110583289
53079,easypay,EasyPay,PLOVDIV kv. Tsentar ul. Rayko Daskalov 48,Obshtina Plovdiv,Plovdiv,,BG,,,,EasyPay,Q110583289
55241,easypay,EasyPay,"PLOVDIV kv. Tsentar Peshehoden most, obekt №11B",Obshtina Plovdiv,Plovdiv,,BG,,,,EasyPay,Q110583289
56184,easypay,EasyPay,PLOVDIV kv. Tsentar bul. Vasil Aprilov №78,Obshtina Plovdiv,Plovdiv,,BG,,,,EasyPay,Q110583289
44787,easypay,EasyPay,PLOVDIV kv. Tsentralen bul. Iztochen 43,Obshtina Plovdiv,Plovdiv,,BG,,,,EasyPay,Q110583289
55971,easypay,EasyPay,"PLOVDIV kv. Tsentralen bul.TSar Boris III Osvoboditel 89, podlez Arheologicheski",Obshtina Plovdiv,Plovdiv,,BG,,,,EasyPay,Q110583289
46892,easypay,EasyPay,PLOVDIV kv. Tsentralen ul.Preslav 32,Obshtina Plovdiv,Plovdiv,,BG,,,,EasyPay,Q110583289
46724,easypay,EasyPay,"PLOVDIV kv. Tsentralen ul. Rayko Daskalov 8, nivo -1",Obshtina Plovdiv,Plovdiv,,BG,,,,EasyPay,Q110583289
47368,easypay,EasyPay,PLOVDIV kv. Tsentralen bul.Hristo Botev 44**mRL**m**mNL**mPodleza na Tsentralna gara,Obshtina Plovdiv,Plovdiv,,BG,,,,EasyPay,Q110583289
56541,easypay,EasyPay,PLOVDIV kv. Yuzhen ul. Makedonia №65,Obshtina Plovdiv,Plovdiv,,BG,,,,EasyPay,Q110583289
52461,easypay,EasyPay,PLOVDIV kv. Yuzhen ul. Petar Stoev 6A,Obshtina Plovdiv,Plovdiv,,BG,,,,EasyPay,Q110583289
56661,easypay,EasyPay,PLOVDIV kv. Yuzhen gr.Plovdiv Yuzhen ul.Slaveevi gori 21,Obshtina Plovdiv,Plovdiv,,BG,,,,EasyPay,Q110583289
53699,easypay,EasyPay,"PLOVDIV kv. Yuzhen ul. Bratya Shkorpil 15 D,zhk. Oazis 3",Obshtina Plovdiv,Plovdiv,,BG,,,,EasyPay,Q110583289
48880,easypay,EasyPay,PLOVDIV kv. Yuzhen bul. Aleksandar Stamboliyski 131,Obshtina Plovdiv,Plovdiv,,BG,,,,EasyPay,Q110583289
55272,easypay,EasyPay,"PLOVDIV kv. Yuzhen ul. Pere Toshev 1, m-n 100 stotinki",Obshtina Plovdiv,Plovdiv,,BG,,,,EasyPay,Q110583289
54846,easypay,EasyPay,PLOVDIV kv. Yuzhen bul. Nikola Vaptsarov 23,Obshtina Plovdiv,Plovdiv,,BG,,,,EasyPay,Q110583289
49933,easypay,EasyPay,PLOVDIV kv. Yuzhen Kyuchuk Parizh ul Stefan Stambolov 22,Obshtina Plovdiv,Plovdiv,,BG,,,,EasyPay,Q110583289
42568,easypay,EasyPay,PLOVDIV kv. ZH.KV.KYUCHUK PARIZH BUL.MAKEDONIA 107,Obshtina Plovdiv,Plovdiv,,BG,,,,EasyPay,Q110583289
54453,easypay,EasyPay,PLOVDIV kv. Zapaden bul. Peshtersko shose № 30,Obshtina Plovdiv,Plovdiv,,BG,,,,EasyPay,Q110583289
44921,easypay,EasyPay,PLOVDIV kv. gr.Plovdiv ul.Vasil Levski 14,Obshtina Plovdiv,Plovdiv,,BG,,,,EasyPay,Q110583289
56467,easypay,EasyPay,PLOVDIV kv. kv. Belomorski Mestnost Belomorski 1 №27,Obshtina Plovdiv,Plovdiv,,BG,,,,EasyPay,Q110583289
56861,easypay,EasyPay,PLOVDIV kv. kv. Izgrev ul. Vratsata 7,Obshtina Plovdiv,Plovdiv,,BG,,,,EasyPay,Q110583289
42353,easypay,EasyPay,PLOVDIV kv. kv.Proslav ul.Elin Pelin 30,Obshtina Plovdiv,Plovdiv,,BG,,,,EasyPay,Q110583289
48130,easypay,EasyPay,PLOVDIV kv. kv.Proslav Ul.Boris Petrov 12,Obshtina Plovdiv,Plovdiv,,BG,,,,EasyPay,Q110583289
50856,easypay,EasyPay,PLOVDIV kv. rayon Yuzhen ul. Filip Totyu 24,Obshtina Plovdiv,Plovdiv,,BG,,,,EasyPay,Q110583289
50946,easypay,EasyPay,PLOVDIV kv. tsentar bul. 6-ti septemvri 141,Obshtina Plovdiv,Plovdiv,,BG,,,,EasyPay,Q110583289
54336,easypay,EasyPay,"PLOVDIV kv. tsentar ul. Kapitan Raycho 73B, et.1",Obshtina Plovdiv,Plovdiv,,BG,,,,EasyPay,Q110583289
49855,easypay,EasyPay,PLOVDIV kv. zh.k. Trakia ul. Knyaz Boris 1 11-A,Obshtina Plovdiv,Plovdiv,,BG,,,,EasyPay,Q110583289
55027,easypay,EasyPay,PLOVDIV kv. zh.k. Trakia ul. Gen. Dandevil №2,Obshtina Plovdiv,Plovdiv,,BG,,,,EasyPay,Q110583289
55762,easypay,EasyPay,PLOVDIV kv. zh.k. Trakia ul. Grigor Bozhkov 6,Obshtina Plovdiv,Plovdiv,,BG,,,,EasyPay,Q110583289
55090,easypay,EasyPay,"PLOVDIV kv. zh.k.Trakia ul.Saedinenie 19, TTS Arimag",Obshtina Plovdiv,Plovdiv,,BG,,,,EasyPay,Q110583289
44984,easypay,EasyPay,"PLOVDIV kv. zhk Trakia bul. Osvobozhdenie 33, k-s Oazis 5",Obshtina Plovdiv,Plovdiv,,BG,,,,EasyPay,Q110583289
13101431,shell,1059 PLOVDIV WEST,,PLOVDIV,Plovdiv,,BG,+359 88 258 8888,https://find.shell.com/bg/fuel/13101431-1059-plovdiv-west,24/7,Shell,Q110716465
10032136,shell,3013 PLOVDIV MARITSA,,PLOVDIV,Plovdiv,,BG,+359 88 428 8989,https://find.shell.com/bg/fuel/10032136-3013-plovdiv-maritsa,24/7,Shell,Q110716465
,visa,,,ASENOVGRAD,PLOVDIV,,BG,,,,,
,visa,,,PLOVDIV,PLOVDIV,,BG,,,,,
,visa,,,PLOVDIV,PLOVDIV,,BG,,,,,
,visa,,,PLOVDIV,PLOVDIV,,BG,,,,,
,visa,,,PLOVDIV,PLOVDIV,,BG,,,,,
,visa,,,PLOVDIV,PLOVDIV,,BG,,,,,
,visa,,,PLOVDIV,PLOVDIV,,BG,,,,,
,visa,,,PLOVDIV,PLOVDIV,,BG,,,,,
,visa,,,PLOVDIV,PLOVDIV,,BG,,,,,
,visa,,,PLOVDIV,PLOVDIV,,BG,,,,,
,visa,,,PLOVDIV,PLOVDIV,,BG,,,,,
,visa,,,PLOVDIV,PLOVDIV,,BG,,,,,
,visa,,,PLOVDIV,PLOVDIV,,BG,,,,,
,visa,,,PLOVDIV,PLOVDIV,,BG,,,,,
,visa,,,PLOVDIV,PLOVDIV,,BG,,,,,
,visa,,,PLOVDIV,PLOVDIV,,BG,,,,,
,visa,,,PLOVDIV,PLOVDIV,,BG,,,,,
,visa,,,PLOVDIV,PLOVDIV,,BG,,,,,
,visa,,,PLOVDIV,PLOVDIV,,BG,,,,,
,visa,,,PLOVDIV,PLOVDIV,,BG,,,,,
,visa,,,PLOVDIV,PLOVDIV,,BG,,,,,
,visa,,,PLOVDIV,PLOVDIV,,BG,,,,,
,visa,,,PLOVDIV,PLOVDIV,,BG,,,,,
,visa,,,PLOVDIV,PLOVDIV,,BG,,,,,
,visa,,,PLOVDIV,PLOVDIV,,BG,,,,,
,visa,,,PLOVDIV,PLOVDIV,,BG,,,,,
,visa,,,PLOVDIV,PLOVDIV,,BG,,,,,
,visa,,,PLOVDIV,PLOVDIV,,BG,,,,,
,visa,,,PLOVDIV,PLOVDIV,,BG,,,,,
,visa,,,PLOVDIV,PLOVDIV,,BG,,,,,
,visa,,,PLOVDIV,PLOVDIV,,BG,,,,,
,visa,,,PLOVDIV,PLOVDIV,,BG,,,,,
,visa,,,PLOVDIV,PLOVDIV,,BG,,,,,
,visa,,,PLOVDIV,PLOVDIV,,BG,,,,,
,visa,,,PLOVDIV,PLOVDIV,,BG,,,,,
,visa,,,PLOVDIV,PLOVDIV,,BG,,,,,
,visa,,,PLOVDIV,PLOVDIV,,BG,,,,,
,visa,,,PLOVDIV,PLOVDIV,,BG,,,,,
,visa,,,PLOVDIV,PLOVDIV,,BG,,,,,
,visa,,,PLOVDIV,PLOVDIV,,BG,,,,,
,visa,,,PLOVDIV,PLOVDIV,,BG,,,,,
,visa,,,PLOVDIV,PLOVDIV,,BG,,,,,
,visa,,,PLOVDIV,PLOVDIV,,BG,,,,,
,visa,,,PLOVDIV,PLOVDIV,,BG,,,,,
,visa,,,PLOVDIV,PLOVDIV,,BG,,,,,
,visa,,,PLOVDIV,PLOVDIV,,BG,,,,,
,visa,,,PLOVDIV,PLOVDIV,,BG,,,,,
,visa,,,PLOVDIV,PLOVDIV,,BG,,,,,
,visa,,,PLOVDIV,PLOVDIV,,BG,,,,,
,visa,,,PLOVDIV,PLOVDIV,,BG,,,,,
,visa,,,PLOVDIV,PLOVDIV,,BG,,,,,
,visa,,,PLOVDIV,PLOVDIV,,BG,,,,,
,visa,,,PLOVDIV,PLOVDIV,,BG,,,,,
,visa,,,PLOVDIV,PLOVDIV,,BG,,,,,
,visa,,,PLOVDIV,PLOVDIV,,BG,,,,,
,visa,,,PLOVDIV,PLOVDIV,,BG,,,,,
,visa,,,PLOVDIV,PLOVDIV,,BG,,,,,
,visa,,,PLOVDIV,PLOVDIV,,BG,,,,,
,visa,,,PLOVDIV,PLOVDIV,,BG,,,,,
,visa,,,PLOVDIV,PLOVDIV,,BG,,,,,
,visa,,,PLOVDIV,PLOVDIV,,BG,,,,,
,visa,,,PLOVDIV,PLOVDIV,,BG,,,,,
,visa,,,PLOVDIV,PLOVDIV,,BG,,,,,
,visa,,,PLOVDIV,PLOVDIV,,BG,,,,,
,visa,,,PLOVDIV,PLOVDIV,,BG,,,,,
,visa,,,PLOVDIV,PLOVDIV,,BG,,,,,
,visa,,,PLOVDIV,PLOVDIV,,BG,,,,,
,visa,,,PLOVDIV,PLOVDIV,,BG,,,,,
,visa,,,PLOVDIV,PLOVDIV,,BG,,,,,
,visa,,,TRUD,PLOVDIV,,BG,,,,,
1c721fa4e389de8b608dc1106c8bd3ac,western_union,STOMARTEN EOOD,,Plovdiv,PLOVDIV,,BG,+359 88 937 3972,https://location.westernunion.com/bg/plovdiv/plovdiv/1c721fa4e389de8b608dc1106c8bd3ac,Mo-Fr 09:00-17:00,Western Union,Q861042
8b08fbbb505652961ba208043935c8df,western_union,KAPITAL A1 OOD,,Plovdiv,PLOVDIV,,BG,+359 32 682 245,https://location.westernunion.com/bg/plovdiv/plovdiv/8b08fbbb505652961ba208043935c8df,Mo-Fr 08:00-19:00; Sa 09:30-18:30,Western Union,Q861042
e76a393b0c79840b15f8872302511368,western_union,SDI BROKER BILLA PLOVDIV,,Plovdiv,PLOVDIV,,BG,+359 89 366 8609,https://location.westernunion.com/bg/plovdiv/plovdiv/e76a393b0c79840b15f8872302511368,Mo-Su 09:00-21:00,Western Union,Q861042
85018e3ebc66031423f745739b56cf6d,western_union,SDI BROKER KAUFLAND TRAKIA,,Plovdiv,PLOVDIV,,BG,+359 89 366 8596,https://location.westernunion.com/bg/plovdiv/plovdiv/85018e3ebc66031423f745739b56cf6d,Mo-Su 09:00-21:00,Western Union,Q861042
66db8a0dafb9e2df5412602b953469f4,western_union,SDI BROKER TRIUMPH,,Plovdiv,PLOVDIV,,BG,+359 89 366 8511,https://location.westernunion.com/bg/plovdiv/plovdiv/66db8a0dafb9e2df5412602b953469f4,Mo-Su 09:00-21:00,Western Union,Q861042
6dd6c8cffe974490e093d224f0a16606,western_union,PALAZ EOOD,,Plovdiv,PLOVDIV,,BG,+359 32 670 148,https://location.westernunion.com/bg/plovdiv/plovdiv/6dd6c8cffe974490e093d224f0a16606,Mo-Fr 09:00-18:00; Sa 09:30-13:00,Western Union,Q861042
2f3e78ce7aab052899811904122a27ed,western_union,SDI BROKER KAUFLAND KIUCHUK PARIS,,Plovdiv,PLOVDIV,,BG,+359 88 260 0740,https://location.westernunion.com/bg/plovdiv/plovdiv/2f3e78ce7aab052899811904122a27ed,Mo-Su 09:00-21:00,Western Union,Q861042
f9e7c447aed5cb26cd901c4fe3cc0b5e,western_union,SDI BROKER TMARKET YUJEN,,Plovdiv,PLOVDIV,,BG,+359 88 614 5939,https://location.westernunion.com/bg/plovdiv/plovdiv/f9e7c447aed5cb26cd901c4fe3cc0b5e,Mo-Su 09:00-21:00,Western Union,Q861042
9704547a10305b625315d0386c76eaaf,western_union,SDI BROKER SLYNCHEVI LYCHI,,Plovdiv,PLOVDIV,,BG,+359 89 366 8514,https://location.westernunion.com/bg/plovdiv/plovdiv/9704547a10305b625315d0386c76eaaf,Mo-Fr 09:00-18:30,Western Union,Q861042
0074a79ea8a546acc880019ed54d0490,western_union,SDI BROKER TRAKIA,,Plovdiv,PLOVDIV,,BG,+359 89 366 8587,https://location.westernunion.com/bg/plovdiv/plovdiv/0074a79ea8a546acc880019ed54d0490,Mo-Fr 09:00-18:30,Western Union,Q861042
250877c4f74e3dc550312e3a87c156e9,western_union,CENTRAL COOPERATIVE BANK PLC,,Plovdiv,PLOVDIV,,BG,+359 32 623 425,https://location.westernunion.com/bg/plovdiv/plovdiv/250877c4f74e3dc550312e3a87c156e9,Mo-Sa 08:30-17:00,Western Union,Q861042
0d6732a21c1cd5d7277075b9d10c90ed,western_union,EUROBANK,,Plovdiv,PLOVDIV,,BG,+359 2 954 9945,https://location.westernunion.com/bg/plovdiv/plovdiv/0d6732a21c1cd5d7277075b9d10c90ed,Mo-Sa 08:30-17:00,Western Union,Q861042
7bdf9fc931b2ecb7aec27a05aca4bf96,western_union,SDI BROKER MALL PLOVDIV,,Plovdiv,PLOVDIV,,BG,+359 89 366 8503,https://location.westernunion.com/bg/plovdiv/plovdiv/7bdf9fc931b2ecb7aec27a05aca4bf96,Mo-Su 10:00-21:00,Western Union,Q861042
