Ref,Spider,Name,Address,City,State,Zipcode,Country,Phone,Website,Hours,Brand,WikiData
103187,sparkasse_de,Kreissparkasse Biberach Geldautomat Kirchdorf,,Kirchdorf,,,DE,+49 7351 5702020,https://www.sparkasse.de/standorte/geldautomaten/kreissparkasse-biberach-geldautomat-kirchdorf-103187,Mo-Su 05:00-23:00,Sparkasse,Q13601825
100460,sparkasse_de,Kreissparkasse Biberach Geschäftsstelle Kirchdorf,,Kirchdorf,,,DE,+49 7351 5702020,https://www.sparkasse.de/standorte/filialen/kreissparkasse-biberach-geschaeftsstelle-kirchdorf-100460,"Tu 08:15-12:15,14:00-17:00; Th 08:15-12:15,14:00-17:00",Sparkasse,Q13601825
,visa,,,KIRCHDORF AN DER ILLER,,,DE,,,,,
,visa,,,KIRCHDORF AN DER ILLER,,,DE,,,,,
,visa,,,KIRCHDORF,,,DE,,,,,
,visa,,,KIRCHDORF AN DER ILLER,,,DE,,,,,
https://www.vr.de/standorte/K/volksbank-raiffeisenbank-laupheim-illertal-eg-4438.html,vr_bank,Volksbank Raiffeisenbank Laupheim-Illertal eG,,Kirchdorf an der Iller,,,DE,+49 7392 70040,https://www.vr-li.de,24/7,,
