Ref,Spider,Name,Address,City,State,Zipcode,Country,Phone,Website,Hours,Brand,WikiData
8348786b-f8f4-4706-be18-3a5a55412a9f,scania,Fricke Nutzfahrzeuge Service GmbH,,Handewitt/Flensburg,,,DE,+49 461 957150,,Mo-Fr 07:45-18:00; Sa 07:45-13:00,Scania,Q219960
144853,sparkasse_de,Nord-Ostsee Sparkasse  SB-Filiale Jarplund,,Jarplund,,,DE,+49 461 15005555,https://www.sparkasse.de/standorte/filialen/nord-ostsee-sparkasse-sb-filiale-jarplund-144853,24/7,Sparkasse,Q13601825
144854,sparkasse_de,Nord-Ostsee Sparkasse  Geldautomat mit Einzahlfunktion Jarplund,,Jarplund,,,DE,+49 461 15005555,https://www.sparkasse.de/standorte/geldautomaten/nord-ostsee-sparkasse-geldautomat-mit-einzahlfunktion-jarplund-144854,24/7,Sparkasse,Q13601825
,visa,,,JARPLUND-WEDING,,,DE,,,,,
https://www.vr.de/standorte/H/Ha-Hm/niederlassung-raiffeisenbank-handewitt-beratungszentrum-weding-4151.html,vr_bank,"Niederlassung Raiffeisenbank Handewitt, Beratungszentrum Weding",,Handewitt,,,DE,+49 4630 909990,https://www.vrbank-westkueste.de,,,
