Ref,Spider,Name,Address,City,State,Zipcode,Country,Phone,Website,Hours,Brand,WikiData
ASICS Factory Outlet De Los Reyes,asics_eu,ASICS Factory Outlet De Los Reyes,,San Sebastian,Madrid,,ES,+34 916 67 11 41,,,Ascis Factory Outlet,Q327247
https://local.fedex.com/#27756331,fedex,,,San Sebastian De Los Reyes,Madrid,,ES,,https://local.fedex.com/es-es/san-sebastian-de-los-reyes/madfz,,FedEx,Q459477
https://local.fedex.com/#1031994194,fedex,,,San Sebastian De Los Reyes,Madrid,,ES,,https://local.fedex.com/es-es/san-sebastian-de-los-reyes/madft,,FedEx,Q459477
ES_2776,shell,LOS MAJUELOS,,SAN SEBASTIAN DE LOS REYES,Madrid,,ES,,https://find.shell.com/es/fuel/ES_2776-los-majuelos,,Shell,Q110716465
,visa,,,SAN SEBASTIAN DE LOS REYES,MADRID,,ES,,,,,
