City,Place Name,Zipcode,Name
DANLI,visa,,unknown,unknown
Liure,western_union,,unknown,FICOHSA TENGO RICCY FLORES LOPEZ
Danli,western_union,,unknown,FICOHSA TENGO KIELSA K166
Soledad,western_union,,unknown,BP CORRESPONSAL ROY GOMEZ
Vado Ancho,western_union,,unknown,FICOHSA TENGO MIRNA LOPEZ RAMIREZ
Yuscaran,western_union,,unknown,BANCO OCCIDENTE YUSCARAN
Ojo De Agua,western_union,,unknown,BP CORRESPONSAL ALLAN SALGADO
Moroceli,western_union,,unknown,469 PULPERIA TRANSPORTES BARRIENTOS
Teupasenti,western_union,,unknown,FICOHSA TENGO AZARIA ISSAMAR VALLADARES
Potrerillos,western_union,,unknown,FICOHSA TENGO WILMER ZELAYA ALVARADO
Las Animas,western_union,,unknown,BP CORRESPONSAL CESAR SEGURA
Jacaleapa,western_union,,unknown,BP CORRESPONSAL LOURDES ALVARADO
Elparaiso,western_union,,unknown,BP CORRESPONSAL MARIA MENDOZA
El Paraiso,western_union,,unknown,BANCO OCCIDENTE EL PARAISO
El Para�so,western_union,,unknown,FICOHSA TENGO KIELSA K257
Lasmanos,western_union,,unknown,BP CORRESPONSAL ROSA SOSA
Jamastran,western_union,,unknown,BP CORRESPONSAL MARIA ARGUETA
Jutiapa,western_union,,unknown,BP CORRESPONSAL YELBI MARTINEZ
Trojes,western_union,,unknown,5235 BANCO AZTECA DAZ TROJES
Patuca,western_union,,unknown,BP-CORRESPONSAL JOSE PERDOMO
