City,Place Name,Zipcode,Name
Wellington,footlocker,,unknown,"Foot Locker in Wellington: Wellington, Nelson City | Approved | Own It"
Manukau,footlocker,,unknown,"Foot Locker in Manukau: Manukau, Nelson City | Approved | Own It"
Auckland,footlocker,,unknown,"Foot Locker in Auckland: Auckland, Nelson City | Approved | Own It"
Porirua,footlocker,,unknown,"Foot Locker in Porirua: Porirua, Nelson City | Approved | Own It"
AUCKLAND,footlocker,,unknown,"Foot Locker in : AUCKLAND, Nelson City | Approved | Own It"
Hamilton,footlocker,,unknown,"Foot Locker in Hamilton: Hamilton, Nelson City | Approved | Own It"
