City,Place Name,Zipcode,Name
Akita,audi,011-0904 Akita AKITA Akita Terauchihirune 1-16-19,unknown,Audi Approved Automobile Akita
"Akita-City,",bmw_group,,unknown,"K.K. Motoren Akita, BPS Akita"
Akita City,bmw_group,,unknown,Y.K.Sato Motorcycle/Sato Motorcycle
"Akita-city,",bmw_group,,unknown,"K.K. Motoren Akita, MINI Akita/ MINI NEXT Akita"
Yokote Shi,western_union,,unknown,JTA NIHONKAI TICKET YOKOTE TEN
Akita,western_union,,unknown,JTA NIHONKAITICKET AKITAEKIMAE
Akita Shi,western_union,,unknown,JTA NIHONKAI TICKET SHINKOKUDO TEN
Odate Shi,western_union,,unknown,JTA PAWN SHOP OBATA
