Ref,Spider,Name,Address,City,State,Zipcode,Country,Phone,Website,Hours,Brand,WikiData
8985099,baskin_robbins_in,Baskin Robbins,"Super Service Station, Opp Podar Hospital, Worli, Mumbai",Mumbai,Maharashtra,,IN,+91 98198 66315,,,Baskin Robbins,Q584601
30949_7,bmw_group,Infinity Cars Pvt. Ltd. Infinity Cars MINI SR Worli,,Mumbai,Maharashtra,,IN,+91 22 6171 8888,https://www.mini-infinitycars.in,,Mini,Q116232
30949_1,bmw_group,Infinity Cars Pvt. Ltd. Infinity Cars Worli Showroom,,Mumbai,Maharashtra,,IN,+91 22 6714 5100,https://www.bmw-infinitycars.in,,BMW,Q26678
https://www.dominos.co.in/store-locations/mumbai/worli-landmark,dominos_pizza_in,"Dominos Pizza WORLI, LANDMARK","Ground Floor, Shop No. 1 &amp; 1ALandmark Building, 554, Worli, Landmark, Mumbai, MUMBAI, Maharashtra - 400018",Mumbai,Maharashtra,,IN,+91 22 2632 6699,https://www.dominos.co.in/store-locations/mumbai/worli-landmark,,Domino's Pizza,Q839466
GS0013413,mercedes_benz,Auto Hangar (India) Private Limited,,Mumbai,Maharashtra,,IN,+91 22 6612 3900,,,Mercedes-Benz,Q36008
e061ad5b225fc9263e8b9359afbeb793,western_union,MUTHOOT FINANCE LTD,,Mumbai - Worli,MAHARASHTRA,,IN,+91 22 2491 0171,https://location.westernunion.com/in/maharashtra/mumbai---worli/e061ad5b225fc9263e8b9359afbeb793,Mo-Sa 09:00-17:30,Western Union,Q861042
