Ref,Spider,Name,Address,City,State,Zipcode,Country,Phone,Website,Hours,Brand,WikiData
8984684,baskin_robbins_in,Baskin Robbins,"Baskin Robbins Ground Floor, Attrium, Garden Galleria Mall, Sec 18, Noida-201301",Noida,Delhi/NCR,,IN,+91 87006 92017,,,Baskin Robbins,Q584601
8984678,baskin_robbins_in,Baskin Robbins,"Baskin Robbins, Sunny Dessert Pvt. Ltd., The Great India Place, Sec- 38A, Noida U.P.- 201301",Noida,Delhi/NCR,,IN,+91 88827 89223,,,Baskin Robbins,Q584601
8984866,baskin_robbins_in,Baskin Robbins,"Baskin Robbins Kiosk, 3rd Flower, Food Court, logix city center Mall, Plot no-BW-58,Sec-32 Noida-201301",Noida,Delhi/NCR,,IN,+91 98106 33920,,,Baskin Robbins,Q584601
8984873,baskin_robbins_in,Baskin Robbins,"Baskin Robbins- Dynamic House,Dadri Main Road , Aggahpur Sector-41, Noida UP-201301",Noida,Delhi/NCR,,IN,+91 98105 32353,,,Baskin Robbins,Q584601
8984868,baskin_robbins_in,Baskin Robbins,"Baskin Robbins, H/A -106, Sec-104, Noida-201301",Noida,Delhi/NCR,,IN,+91 98118 45055,,,Baskin Robbins,Q584601
8984881,baskin_robbins_in,Baskin Robbins,"shop no 6, FF, Gaur sportswood, sector 79, noida",Noida,Delhi/NCR,,IN,+91 99909 06750,,,Baskin Robbins,Q584601
