City,Place Name,Zipcode,Name
Auto Glass Replacement Shop in Thornton,safelite,,unknown,Safelite AutoGlass
Windshield Repair Shop in Pagosa Springs,safelite,,unknown,Safelite AutoGlass
Auto Glass Shop in Grand Junction,safelite,,unknown,Safelite AutoGlass
Windshield Repair Shop in Glenwood Springs,safelite,,unknown,Safelite AutoGlass
Windshield Replacement Shop in Frisco,safelite,,unknown,Safelite AutoGlass
Auto Glass Replacement Shop in Ft Collins,safelite,,unknown,Safelite AutoGlass
Auto Glass Shop in Durango,safelite,,unknown,Safelite AutoGlass
Durango,safelite,,unknown,Safelite AutoGlass
Windshield Replacement Shop in South Lakewood,safelite,,unknown,Safelite AutoGlass
Auto Glass Replacement Shop in Cortez,safelite,,unknown,Safelite AutoGlass
Auto Glass Shop in Boulder,safelite,,unknown,Safelite AutoGlass
Windshield Replacement Shop in Aurora,safelite,,unknown,Safelite AutoGlass
Auto Glass Replacement Shop in Aurora,safelite,,unknown,Safelite AutoGlass
