City,Place Name,Zipcode,Name
Bire,western_union,,unknown,YA HALA
Kfarhim,western_union,,unknown,FADI FOR GENERAL TRADING KFARHIM
Hadath,western_union,,unknown,ISSA CELL STORE  HADATH
Batroun,western_union,,unknown,JOSEPH ELIAS SABA FOR TRADING
Thoum,western_union,,unknown,J . M TRADING
Jbeit - Mastita,western_union,,unknown,BOB M3 MASTITA   JS
Jrane,western_union,,unknown,BOB M3 AGROPHYT   JRAN
Aabrin,western_union,,unknown,DIALA TANNOUS FOR GENERAL TRADING
Madfoun,western_union,,unknown,SECRET PARADISE S.A.R.L MADFOUN
Kalamoun,western_union,,unknown,BOB M3 NOUR GENERAL TRADING   QALAMOUN
Deddeh,western_union,,unknown,SFGNET
Qalamoun,western_union,,unknown,BOB M3 ZAKARIA FOR COMMUNICATION   QALAM
Fiaa,western_union,,unknown,BUILDERS CASE S.A.R.L [FIH]
Kfar Hazir,western_union,,unknown,CARLA MAKARY TRADING IV [KFARHAZIR]
Chekka,western_union,,unknown,JIMY STORE CHEKKA
Ras Nahache,western_union,,unknown,AL RAED STORE RAS NHACH
Anfe,western_union,,unknown,BOB M3 WEHBE CELL
Anfeh,western_union,,unknown,E SHOP EST ANFEH
Beshmezzin,western_union,,unknown,STC FOR CONTRACTING AND GENERAL TRADING
Tripoli,western_union,,unknown,CASTLE SERVICES
Bechmezzine,western_union,,unknown,M&L BOOKSHOP
Amioun,western_union,,unknown,TWINS TRADING STORE KOURA
Mina,western_union,,unknown,MOHAMAD YAGHI FOR GENERAL TRADING STORE
Bourj El Arab,western_union,,unknown,RABIH ZAHRAMEN STORE  BOURJ EL
Kfarssaroun,western_union,,unknown,LINK KFARSAROUN
Nt Lb,western_union,,unknown,BEST LIFE
Al Mina,western_union,,unknown,ZAHER GHIYEH AN S.A.R.L [MINA]
Trablus,western_union,,unknown,ZEMA KABBARA FOR GENERAL TRADING
Kfarakka,western_union,,unknown,BOB FINANCE KFARAKKA
Jabal Mehsen,western_union,,unknown,ALI ABDALLAH FOR CAR TRADING STORE
Abou Samra,western_union,,unknown,WAHAT AL AMAL STORE  ABOU SAMR
Al Tall,western_union,,unknown,KILANI FOR TRAVEL AND TOURISM
Kfaraaka,western_union,,unknown,GSTORE STORE (KFARAAKA)
Ras Maska,western_union,,unknown,AL ZOUABI FOR GENERAL TRADING
Zgharta,western_union,,unknown,BAKKOUR CELL
Tripoly,western_union,,unknown,MAALIKI TRAVEL AND TOURISM
Kfarsaroun,western_union,,unknown,CLASSY FOR TRADING S A R L KFARSAROUN
Kobbeh,western_union,,unknown,SAID KHALIL AL SAMMAK STORE AL KOBBEH
Jabal Mohsen,western_union,,unknown,AL KAMAL FOR TRADE STORE  TRIPOLI
Kosba,western_union,,unknown,I CELL STORE KOUSBA
Al Kobbeh,western_union,,unknown,NAZIR FOR TRADING & SERVICES C
Daher El Ein,western_union,,unknown,LORD OF CELL STORE II  DAHER EL AIN
Koura,western_union,,unknown,CHAMI CELL STORE KOURA
Kobeh,western_union,,unknown,MOHAMAD HOBLOS STORE  KOBEH
Bet Wartij,western_union,,unknown,OUDAY STORE BETWARTIJ
Bsarma,western_union,,unknown,INATI CELL STORE BSARMA
Badawi,western_union,,unknown,IBRAHIM AHMAD CELL STORE BADDAWI
Baddawi,western_union,,unknown,BAHRI FOR GENERAL TRADING II STORE
Majdalaiya,western_union,,unknown,ORACELL STORE  MAJDLAYA
Al Beddaoui,western_union,,unknown,M CELL STORE [BADDAWI]
Beddawi,western_union,,unknown,CHALABI STORE BADDAWI
Deir Ammar,western_union,,unknown,ABDELRAHMAN KHAULA FOR TRADING
Tannourin,western_union,,unknown,SUPERMARKET TANNOURIN
Majdlaya,western_union,,unknown,JIMMY CELL STORE  MAJDLAYA
North,western_union,,unknown,HOMEISI CELLER EST   SIR EL DENNIEH
Aarjas,western_union,,unknown,MOUNETNA STORE AARJAS
Arde,western_union,,unknown,JNEID FOR GENERAL TRADING STORE ARDEH
Kfardlakos,western_union,,unknown,BAKHOS EL NEMER EST KFARDLAKOUS
Zghorta,western_union,,unknown,BUCKS MONEY TRANSFER
Kousba,western_union,,unknown,NICOLAS CHEHADEH EST   KOUSBA
Tripoli - Jabal Mohessen,western_union,,unknown,BOB M3 JBAL MOHSN AS
Menye,western_union,,unknown,M AT M MHEICH FOR GENERAL TRADING
Donieh,western_union,,unknown,MOHAMAD MAHMOUD AL HOMEISI EST
Rachiin,western_union,,unknown,ABDALLAH BOU ABDALLAH STORE RACHIIN
Ardeh,western_union,,unknown,JALAL CELL
Al Minyeh,western_union,,unknown,BOB M3 EL MASRI TRADING   MINYEH
Mezyara,western_union,,unknown,VANESSA TRADING STORE MEZYARA
Miniyeh,western_union,,unknown,DOUNIA FOR GENERAL TRADING STORE MENIEH
Minyeh,western_union,,unknown,M3-KHEIR CELL
Meryata,western_union,,unknown,BOB  M3 MERYATA  HI
Akkar,western_union,,unknown,TOBACO HOUSE
Aabdeh,western_union,,unknown,BOB M3 YARA TRADING  ABDEH
Abdeh,western_union,,unknown,DREAM COMPUTER SOLIDARITY COMP
Nahr El Bared,western_union,,unknown,OMAR 4 STORE AKKAR
Zouk Bhanine,western_union,,unknown,WEHBYS TRADING
Bhannin,western_union,,unknown,SWEID FOR GENERAL TRADING STORE BHANNIN
Izal,western_union,,unknown,YOUSSEF STORE IZAL
Bebnine,western_union,,unknown,M3 MOBILE NET
Bakhoun,western_union,,unknown,AYMAN YOUSSEF EST  BAKHOUN
Hakl El Azimeh,western_union,,unknown,KHDEIR CELL
Bsheri,western_union,,unknown,SAAD STATION   BCHARREH
Becharre,western_union,,unknown,BOB   BECHARRE
Bcharre,western_union,,unknown,BOB   M3 BSHERRI  TD
Mrah El Sraj,western_union,,unknown,OTHMAN FOR GENERAL TRADING STORE
Taran - Bakhoun,western_union,,unknown,BEST LIFE   2
Sir Dennyeh,western_union,,unknown,BOB M3 DENNYEH RS
Bqaa Safrin,western_union,,unknown,KHODOR KAMAL AL DIN SIR EL DANNIEH
Hisa,western_union,,unknown,MOHAMAD YOUNIS SLEIMAN II STORE  HISA
Halba,western_union,,unknown,ZOEBI FOR TRADING AND TRANSFER STORE
Bkarsouna,western_union,,unknown,SUPERMARKET AL DAYAA STORE DANIEH
Kharnoube,western_union,,unknown,MERHEB PETROLEUM
Kobayat,western_union,,unknown,ABED L KADER TRADING
Birreh,western_union,,unknown,NAHNOU
Fnaydek,western_union,,unknown,MOHAMAD ZAKARIA FOR GENERAL TR
Wadi Khaled,western_union,,unknown,EL AMANA FOR GENERAL TRADING
Rahbe,western_union,,unknown,SMART PHONE - RAHBEH
