Ref,Spider,Name,Address,City,State,Zipcode,Country,Phone,Website,Hours,Brand,WikiData
63,wildberries,Wildberries,"Псковская область, Псков, Октябрьский проспект, 19",,Pskov,,RU,,,Mo-Su 10:00-21:00,Wildberries,Q24933714
394,wildberries,Wildberries,"Псковская область, Великие Луки, Пионерская улица, 5",,Pskov,,RU,,,Mo-Su 10:00-21:00,Wildberries,Q24933714
1406,wildberries,Wildberries,"г. Псков (Псковская область), Юбилейная улица, д. 89",,Pskov,,RU,,,Mo-Su 10:00-21:00,Wildberries,Q24933714
2097,wildberries,Wildberries,"г. Псков (Псковская область), улица Труда, д. 69",,Pskov,,RU,,,Mo-Su 10:00-21:00,Wildberries,Q24933714
2166,wildberries,Wildberries,"г. Великие Луки (Псковская область), проспект Гагарина, д. 87/1",,Pskov,,RU,,,Mo-Su 10:00-21:00,Wildberries,Q24933714
2897,wildberries,Wildberries,"г. Невель (Псковская область), Комсомольская улица, д. 17",,Pskov,,RU,,,Mo-Su 10:00-21:00,Wildberries,Q24933714
2951,wildberries,Wildberries,"Псковская область, Псков, Рижский проспект, 29/31",,Pskov,,RU,,,Mo-Su 08:00-22:00,Wildberries,Q24933714
3027,wildberries,Wildberries,"г. Псков (Псковская область), Юбилейная улица, д. 32",,Pskov,,RU,,,Mo-Su 08:00-22:00,Wildberries,Q24933714
3246,wildberries,Wildberries,"г. Великие Луки (Псковская область), проспект Гагарина, д. 40",,Pskov,,RU,,,Mo-Su 10:00-21:00,Wildberries,Q24933714
3288,wildberries,Wildberries,"г. Печоры (Псковская область), Псковская улица, д. 6",,Pskov,,RU,,,Mo-Su 10:00-21:00,Wildberries,Q24933714
3767,wildberries,Wildberries,"г. Себеж (Псковская область), Замковая улица, 11",,Pskov,,RU,,,Mo-Su 10:00-21:00,Wildberries,Q24933714
3887,wildberries,Wildberries,"г. Великие Луки (Псковская область), улица Розы Люксембург, д. 17",,Pskov,,RU,,,Mo-Su 10:00-21:00,Wildberries,Q24933714
3896,wildberries,Wildberries,"г. Псков (Псковская область), улица Яна Фабрициуса, д. 22",,Pskov,,RU,,,Mo-Su 10:00-21:00,Wildberries,Q24933714
5265,wildberries,Wildberries,"г. Остров (Псковская область), улица Карла Маркса, д. 11",,Pskov,,RU,,,Mo-Su 10:00-21:00,Wildberries,Q24933714
5412,wildberries,Wildberries,"г. Псков (Псковская область), улица Никольская, д. 5",,Pskov,,RU,,,Mo-Su 10:00-21:00,Wildberries,Q24933714
5525,wildberries,Wildberries,"г. Великие Луки (Псковская область), улица Гоголя, д. 9",,Pskov,,RU,,,Mo-Su 10:00-21:00,Wildberries,Q24933714
100827,wildberries,Wildberries,"Псковская область, Великие Луки, Октябрьский проспект, 7",,Pskov,,RU,,,Mo-Su 10:00-21:00,Wildberries,Q24933714
101732,wildberries,Wildberries,"г. Псков (Псковская область), улица Крупской, д. 28",,Pskov,,RU,,,Mo-Su 10:00-21:00,Wildberries,Q24933714
102465,wildberries,Wildberries,"Псковская область, Опочка, Набережная улица, 4",,Pskov,,RU,,,Mo-Su 10:00-21:00,Wildberries,Q24933714
102474,wildberries,Wildberries,"г. Псков (Псковская область), Михайловская улица, д. 1",,Pskov,,RU,,,Mo-Su 10:00-21:00,Wildberries,Q24933714
102739,wildberries,Wildberries,"г. Порхов (Псковская область), проспект Ленина, д. 13",,Pskov,,RU,,,Mo-Su 10:00-21:00,Wildberries,Q24933714
102849,wildberries,Wildberries,"г. Псков (Псковская область), Вокзальная улица, д. 48",,Pskov,,RU,,,Mo-Su 10:00-21:00,Wildberries,Q24933714
102852,wildberries,Wildberries,д. Борисовичи (Псковская обл) Балтийская 1,,Pskov,,RU,,,Mo-Su 10:00-21:00,Wildberries,Q24933714
102979,wildberries,Wildberries,"г. Псков (Псковская область), улица Максима Горького, д. 18",,Pskov,,RU,,,Mo-Su 10:00-21:00,Wildberries,Q24933714
103610,wildberries,Wildberries,"г. Псков (Псковская область), улица Рокоссовского, д. 40А",,Pskov,,RU,,,Mo-Su 10:00-21:00,Wildberries,Q24933714
107337,wildberries,Wildberries,"Хотицы (Псковская обл, Псковский р-н) Загородная 4",,Pskov,,RU,,,Mo-Su 10:00-21:00,Wildberries,Q24933714
107705,wildberries,Wildberries,г Великие Луки (Псковская обл) Малышева 26,,Pskov,,RU,,,Mo-Su 10:00-21:00,Wildberries,Q24933714
108727,wildberries,Wildberries,"г Дно Россия, Псковская обл, Дновский р-н ул. Володарского 6",,Pskov,,RU,,,Mo-Su 10:00-21:00,Wildberries,Q24933714
109418,wildberries,Wildberries,"Псков Псковская область, городской округ Псков улица Труда 39",,Pskov,,RU,,,Mo-Su 10:00-21:00,Wildberries,Q24933714
110828,wildberries,Wildberries,Новосокольники (Псковская область) Ленинская улица 38,,Pskov,,RU,,,Mo-Su 10:00-21:00,Wildberries,Q24933714
111462,wildberries,Wildberries,"Дедовичи Псковская область, Дедовичский район улица Егорова 14",,Pskov,,RU,,,Mo-Su 10:00-21:00,Wildberries,Q24933714
114411,wildberries,Wildberries,"г Великие Луки (Псковская область), Рабочая 3",,Pskov,,RU,,,Mo-Su 10:00-21:00,Wildberries,Q24933714
121614,wildberries,Wildberries,"г Пыталово, Белорусская Улица 9",,Pskov,,RU,,,Mo-Su 10:00-22:00,Wildberries,Q24933714
125017,wildberries,Wildberries,"д Борисовичи, Балтийская Улица 10",,Pskov,,RU,,,Mo-Su 10:00-21:00,Wildberries,Q24933714
125167,wildberries,Wildberries,"Себеж Псковская область, Себежский район Ленинская улица 49",,Pskov,,RU,,,Mo-Su 10:00-21:00,Wildberries,Q24933714
129251,wildberries,Wildberries,"г Псков, Коммунальная Улица 45а",,Pskov,,RU,,,Mo-Su 10:00-21:00,Wildberries,Q24933714
129732,wildberries,Wildberries,Псков Красноармейская 31А,,Pskov,,RU,,,Mo-Su 10:00-21:00,Wildberries,Q24933714
132945,wildberries,Wildberries,"рп Пушкинские Горы, Улица Лермонтова 10",,Pskov,,RU,,,Mo-Su 10:00-21:00,Wildberries,Q24933714
133041,wildberries,Wildberries,"д Борисовичи, Венская Улица 8",,Pskov,,RU,,,Mo-Su 10:00-21:00,Wildberries,Q24933714
135858,wildberries,Wildberries,"д Хотицы, Загородная Улица 5",,Pskov,,RU,,,Mo-Su 10:00-21:00,Wildberries,Q24933714
148273,wildberries,Wildberries,"г Псков, Коммунальная Улица 44б",,Pskov,,RU,,,Mo-Su 10:00-21:00,Wildberries,Q24933714
150151,wildberries,Wildberries,"г Псков, Инженерная Улица 119",,Pskov,,RU,,,Mo-Su 10:00-21:00,Wildberries,Q24933714
150483,wildberries,Wildberries,"г Псков, Сосновая Улица 2б",,Pskov,,RU,,,Mo-Su 10:00-21:00,Wildberries,Q24933714
151611,wildberries,Wildberries,"г Невель, Улица Ленкоммуны 7",,Pskov,,RU,,,Mo-Su 10:00-21:00,Wildberries,Q24933714
157533,wildberries,Wildberries,"г Гдов, Улица Карла Маркса 8",,Pskov,,RU,,,Mo-Su 10:00-21:00,Wildberries,Q24933714
157742,wildberries,Wildberries,"г Великие Луки, Улица Ботвина 6а",,Pskov,,RU,,,Mo-Su 10:00-21:00,Wildberries,Q24933714
158990,wildberries,Wildberries,"г Великие Луки, Проспект Ленина 51/36",,Pskov,,RU,,,Mo-Su 10:00-21:00,Wildberries,Q24933714
162050,wildberries,Wildberries,"г Опочка, Коммунальная Улица 19а",,Pskov,,RU,,,Mo-Su 10:00-21:00,Wildberries,Q24933714
162509,wildberries,Wildberries,"г Великие Луки, Холмская Улица 18",,Pskov,,RU,,,Mo-Su 10:00-21:00,Wildberries,Q24933714
163643,wildberries,Wildberries,"г Псков, Инженерная Улица 108/62",,Pskov,,RU,,,Mo-Su 10:00-21:00,Wildberries,Q24933714
164081,wildberries,Wildberries,"г Псков, Улица Николая Васильева 38б",,Pskov,,RU,,,Mo-Su 10:00-21:00,Wildberries,Q24933714
164224,wildberries,Wildberries,"г Псков, Рижский Проспект 87а",,Pskov,,RU,,,Mo-Su 10:00-21:00,Wildberries,Q24933714
164271,wildberries,Wildberries,"г Пустошка, Советская Улица 11",,Pskov,,RU,,,Mo-Su 10:00-21:00,Wildberries,Q24933714
165591,wildberries,Wildberries,"Псковская область, г Великие Луки, Октябрьский Проспект, 25с1",,Pskov,,RU,,,Mo-Su 10:00-21:00,Wildberries,Q24933714
166464,wildberries,Wildberries,"Псковская область, посёлок городского типа Красногородск, Советская улица, 17",,Pskov,,RU,,,Mo-Su 10:00-21:00,Wildberries,Q24933714
167693,wildberries,Wildberries,"г Великие Луки, Октябрьский Проспект 118",,Pskov,,RU,,,Mo-Su 10:00-21:00,Wildberries,Q24933714
167708,wildberries,Wildberries,"рп Идрица, Улица Горького 17",,Pskov,,RU,,,Mo-Su 10:00-21:00,Wildberries,Q24933714
168208,wildberries,Wildberries,"г Псков, Улица Труда 51",,Pskov,,RU,,,Mo-Su 10:00-21:00,Wildberries,Q24933714
168386,wildberries,Wildberries,"г Псков, Проспект Энтузиастов 5а",,Pskov,,RU,,,Mo-Su 10:00-21:00,Wildberries,Q24933714
168811,wildberries,Wildberries,"г Великие Луки, Проспект Гагарина 16к1",,Pskov,,RU,,,Mo-Su 10:00-21:00,Wildberries,Q24933714
169001,wildberries,Wildberries,"г Псков, Инженерная Улица 12",,Pskov,,RU,,,Mo-Su 10:00-21:00,Wildberries,Q24933714
169120,wildberries,Wildberries,"г Псков, Улица Военный Городок-3 122а",,Pskov,,RU,,,Mo-Su 08:00-21:00,Wildberries,Q24933714
170786,wildberries,Wildberries,"г Себеж, Солнечная Улица 20",,Pskov,,RU,,,Mo-Su 10:00-21:00,Wildberries,Q24933714
171987,wildberries,Wildberries,"г Псков, Советская Улица 64",,Pskov,,RU,,,Mo-Su 10:00-21:00,Wildberries,Q24933714
172146,wildberries,Wildberries,"г Остров, Улица Карла Маркса 1а",,Pskov,,RU,,,Mo-Su 10:00-21:00,Wildberries,Q24933714
200335,wildberries,Wildberries,"г Псков, Рижский Проспект 35",,Pskov,,RU,,,Mo-Su 09:00-21:00,Wildberries,Q24933714
200352,wildberries,Wildberries,"Псков, Коммунальная Улица 67",,Pskov,,RU,,,Mo-Su 10:00-21:00,Wildberries,Q24933714
201306,wildberries,Wildberries,"Псков, Юбилейная Улица 40а",,Pskov,,RU,,,Mo-Su 10:00-21:00,Wildberries,Q24933714
202361,wildberries,Wildberries,"г Псков, Владимирская Улица 3в",,Pskov,,RU,,,Mo-Su 09:00-21:00,Wildberries,Q24933714
202892,wildberries,Wildberries,"г Псков, Улица Киселёва 8",,Pskov,,RU,,,Mo-Su 10:00-21:00,Wildberries,Q24933714
202958,wildberries,Wildberries,"Великие Луки, Октябрьский Проспект 40",,Pskov,,RU,,,Mo-Su 10:00-21:00,Wildberries,Q24933714
203034,wildberries,Wildberries,"Великие Луки, Гражданская Улица 7г",,Pskov,,RU,,,Mo-Su 10:00-21:00,Wildberries,Q24933714
203129,wildberries,Wildberries,"Псков, Улица Кузбасской Дивизии 26",,Pskov,,RU,,,Mo-Su 10:00-21:00,Wildberries,Q24933714
203286,wildberries,Wildberries,"Псков, Гражданская Улица 12Б",,Pskov,,RU,,,Mo-Su 10:00-21:00,Wildberries,Q24933714
203289,wildberries,Wildberries,"Великие Луки, Проспект Ленина 43/26",,Pskov,,RU,,,Mo-Su 10:00-21:00,Wildberries,Q24933714
204377,wildberries,Wildberries,"Великие Луки, Улица Заслонова 23/5",,Pskov,,RU,,,Mo-Su 09:00-21:00,Wildberries,Q24933714
206556,wildberries,Wildberries,"Псковская область, Великие Луки, Запрудная улица, 12Б",,Pskov,,RU,,,Mo-Su 10:00-21:00,Wildberries,Q24933714
207070,wildberries,Wildberries,"Псковская область, Порхов, Красноармейская улица, 12",,Pskov,,RU,,,Mo-Su 10:00-21:00,Wildberries,Q24933714
207343,wildberries,Wildberries,"Новоржев, Улица Германа 38",,Pskov,,RU,,,Mo-Su 10:00-21:00,Wildberries,Q24933714
207403,wildberries,Wildberries,"Псковская область, Невель, улица Ленина, 22",,Pskov,,RU,,,Mo-Su 10:00-21:00,Wildberries,Q24933714
207543,wildberries,Wildberries,"Псковская область, Невель, улица Маншук Маметовой, 27",,Pskov,,RU,,,Mo-Su 10:00-21:00,Wildberries,Q24933714
208668,wildberries,Wildberries,"Псковская область, рабочий посёлок Струги Красные, Проездной переулок, 1",,Pskov,,RU,,,Mo-Su 09:00-20:00,Wildberries,Q24933714
208875,wildberries,Wildberries,"Псковская область, деревня Писковичи, улица Гецентова, 10",,Pskov,,RU,,,Mo-Su 10:00-21:00,Wildberries,Q24933714
210287,wildberries,Wildberries,"Псковская область, Псков, Петровская улица, 49",,Pskov,,RU,,,Mo-Su 10:00-21:00,Wildberries,Q24933714
210288,wildberries,Wildberries,"Псковская область, деревня Борисовичи, Балтийская улица, 7",,Pskov,,RU,,,Mo-Su 10:00-21:00,Wildberries,Q24933714
210600,wildberries,Wildberries,"рабочий посёлок Плюсса, Железнодорожная Улица 3",,Pskov,,RU,,,Mo-Su 10:00-21:00,Wildberries,Q24933714
211544,wildberries,Wildberries,"Псковская область, деревня Неёлово-1, Юбилейная улица, 5",,Pskov,,RU,,,Mo-Su 09:00-20:00,Wildberries,Q24933714
212235,wildberries,Wildberries,"Псков, Улица Некрасова 15а",,Pskov,,RU,,,Mo-Su 10:00-21:00,Wildberries,Q24933714
212736,wildberries,Wildberries,"рабочий посёлок Струги Красные, Вокзальная Улица 3",,Pskov,,RU,,,Mo-Su 10:00-21:00,Wildberries,Q24933714
212861,wildberries,Wildberries,"Великие Луки, Широкая Улица 1",,Pskov,,RU,,,Mo-Su 10:00-22:00,Wildberries,Q24933714
213374,wildberries,Wildberries,"рабочий посёлок Бежаницы, Смольная Улица 25",,Pskov,,RU,,,Mo-Su 10:00-21:00,Wildberries,Q24933714
214337,wildberries,Wildberries,"Псковская область, Великие Луки, Вокзальная улица, 15/26",,Pskov,,RU,,,Mo-Su 10:00-21:00,Wildberries,Q24933714
214652,wildberries,Wildberries,"Печоры, Индустриальная Улица 12",,Pskov,,RU,,,Mo-Su 10:00-21:00,Wildberries,Q24933714
215177,wildberries,Wildberries,"Псков, Улица Яна Фабрициуса 7",,Pskov,,RU,,,Mo-Su 10:00-21:00,Wildberries,Q24933714
215436,wildberries,Wildberries,"Великие Луки, Улица Маршала Жукова 18",,Pskov,,RU,,,Mo-Su 10:00-21:00,Wildberries,Q24933714
215445,wildberries,Wildberries,"Псков, Рижский Проспект 55",,Pskov,,RU,,,Mo-Su 10:00-21:00,Wildberries,Q24933714
216084,wildberries,Wildberries,"Печоры, Индустриальная Улица 2",,Pskov,,RU,,,Mo-Su 10:00-21:00,Wildberries,Q24933714
216555,wildberries,Wildberries,"Остров, Улица Калинина 28",,Pskov,,RU,,,Mo-Su 10:00-21:00,Wildberries,Q24933714
218323,wildberries,Wildberries,"деревня Черёха, Деревня Черёха 16б",,Pskov,,RU,,,Mo-Su 10:00-21:00,Wildberries,Q24933714
218722,wildberries,Wildberries,"Остров, Улица ДОС 5",,Pskov,,RU,,,Mo-Su 10:00-21:00,Wildberries,Q24933714
301634,wildberries,Wildberries,"Псковская область, Новосокольники, Шоссейная улица, 6",,Pskov,,RU,,,Mo-Su 10:00-21:00,Wildberries,Q24933714
303463,wildberries,Wildberries,"Псковская область, Порхов, улица Красноармейская Слобода, 2А",,Pskov,,RU,,,Mo-Su 10:00-21:00,Wildberries,Q24933714
304223,wildberries,Wildberries,"рабочий посёлок Усвяты, Советская Площадь 9а",,Pskov,,RU,,,Mo-Su 10:00-21:00,Wildberries,Q24933714
304493,wildberries,Wildberries,"Псковская область, Псков, улица Кузбасской Дивизии, 10",,Pskov,,RU,,,Mo-Su 10:00-21:00,Wildberries,Q24933714
306218,wildberries,Wildberries,"Псковская область, Великие Луки, проспект Гагарина, 21к1",,Pskov,,RU,,,Mo-Su 10:00-21:00,Wildberries,Q24933714
306909,wildberries,Wildberries,"Псковская область, Дно, Советская улица, 11/2",,Pskov,,RU,,,Mo-Su 10:00-21:00,Wildberries,Q24933714
309615,wildberries,Wildberries,"Пустошка, Улица Татьяны Птичкиной 25а",,Pskov,,RU,,,Mo-Su 10:00-21:00,Wildberries,Q24933714
309963,wildberries,Wildberries,"Великие Луки, Улица Дружбы 3",,Pskov,,RU,,,Mo-Su 10:00-21:00,Wildberries,Q24933714
311618,wildberries,Wildberries,"Псковская область, Псков, Ипподромная улица, 127",,Pskov,,RU,,,Mo-Su 10:00-21:00,Wildberries,Q24933714
311850,wildberries,Wildberries,"Псков, Улица Труда 15",,Pskov,,RU,,,Mo-Su 10:00-21:00,Wildberries,Q24933714
50000451,wildberries,Wildberries,"рабочий посёлок Локня, Красноармейская Улица 6а",,Pskov,,RU,,,Mo-Su 09:00-21:00,Wildberries,Q24933714
