City,Place Name,Zipcode,Name
Obshtina Kaolinovo,easypay,BRANICHEVO  ul.Septemvri 15,unknown,EasyPay
Obshtina Khitrino,easypay,GARA HITRINO  Gara Hitrino ul Edelvays 1,unknown,EasyPay
Obshtina Smyadovo,easypay,IVANSKI  ul. Ivan Kr. Ivanski 17,unknown,EasyPay
Obshtina Kaolinovo,easypay,KAOLINOVO  ul.Vasil Levski 23,unknown,EasyPay
Obshtina Kaspichan,easypay,KASPICHAN  ul. Madarski konnik № 44,unknown,EasyPay
Obshtina Smyadovo,easypay,LYULYAKOVO  ul. Vasil Levski,unknown,EasyPay
Obshtina Smyadovo,easypay,LYULYAKOVO kv. tsentar ul. Vasil Levski 36,unknown,EasyPay
Obshtina Kaspichan,easypay,MADARA  ul. Madarski konnik 31,unknown,EasyPay
Obshtina Smyadovo,easypay,MEDOVETS  ul. Parva № 28,unknown,EasyPay
Obshtina Kaolinovo,easypay,NIKOLA KOZLEVO NIKOLA  pl. 23 ti Septemvri №2,unknown,EasyPay
Obshtina Novi Pazar,easypay,NOVI PAZAR  ul.Hadzhi Dimitar 14,unknown,EasyPay
Obshtina Kaspichan,easypay,NOVI PAZAR  ul.Rakovski 4,unknown,EasyPay
Obshtina Kaspichan,easypay,NOVI PAZAR  pl. Rakovski 4,unknown,EasyPay
Obshtina Novi Pazar,easypay,NOVI PAZAR  UL. Oborishte 14,unknown,EasyPay
Obshtina Kaspichan,easypay,NOVI PAZAR  ul. Rakovski 4,unknown,EasyPay
Obshtina Novi Pazar,easypay,NOVI PAZAR  ul. Tsar Osvoboditel 16,unknown,EasyPay
Obshtina Novi Pazar,easypay,NOVI PAZAR kv. Tsentar ul.Patriarh Evtimiy 2A,unknown,EasyPay
Obshtina Kaspichan,easypay,PLISKA  ul.TSar Boris I N2,unknown,EasyPay
Obshtina Smyadovo,easypay,POLYATSITE kv. obl. Varna ul. Parva No 25,unknown,EasyPay
Obshtina Smyadovo,easypay,SALMANOVO kv. tsentar ul. Shipka 4,unknown,EasyPay
Obshtina Kaolinovo,easypay,SEKULOVO kv. Sekulovo ul.TSentralna 40,unknown,EasyPay
Obshtina Shumen,easypay,SHUMEN  ul.Universitetska №26,unknown,EasyPay
Obshtina Shumen,easypay,SHUMEN  ul. Knyaz Boris I 4,unknown,EasyPay
Obshtina Shumen,easypay,SHUMEN  bul. Simeon Veliki 41,unknown,EasyPay
Obshtina Kaspichan,easypay,SHUMEN  Avtomagistrala Hemus **mRL**m**mNL**m356+745 vdyasno mezhdu gr. Shumen i gr. Kaspichan,unknown,EasyPay
Obshtina Shumen,easypay,SHUMEN  ul. Vasil Drumev № 17 B,unknown,EasyPay
Obshtina Shumen,easypay,SHUMEN  bul. Aleko Konstantinov №4,unknown,EasyPay
Obshtina Shumen,easypay,SHUMEN  bul. Slavyanski 62,unknown,EasyPay
Obshtina Shumen,easypay,SHUMEN  bul.Simeon Veliki 34,unknown,EasyPay
Obshtina Shumen,easypay,SHUMEN  ul. Patleyna 10,unknown,EasyPay
Obshtina Shumen,easypay,SHUMEN  Tsar Osvoboditel 83,unknown,EasyPay
Obshtina Shumen,easypay,SHUMEN  ul. „Patleyna“ № 10,unknown,EasyPay
Obshtina Shumen,easypay,SHUMEN  ul. Bacho Kiro № 7,unknown,EasyPay
Obshtina Shumen,easypay,SHUMEN  ul.TSar Osvoboditel 131,unknown,EasyPay
Obshtina Shumen,easypay,SHUMEN  bul. Simeon Veliki 67 ofis 4,unknown,EasyPay
Obshtina Shumen,easypay,SHUMEN  ul. Panayot Volov 7,unknown,EasyPay
Obshtina Shumen,easypay,SHUMEN  ul.Lozengrad 1,unknown,EasyPay
Obshtina Shumen,easypay,SHUMEN  ul. Avgust Popov 12 A,unknown,EasyPay
Obshtina Shumen,easypay,SHUMEN  bul. Madara 30 m-n TSBA,unknown,EasyPay
Obshtina Shumen,easypay,SHUMEN  bul. Rishki prohod 25(sreshtu Mitnitsata),unknown,EasyPay
Obshtina Shumen,easypay,SHUMEN  bul. Simeon Veliki 28 m-n Kaufland,unknown,EasyPay
Obshtina Shumen,easypay,SHUMEN  bul. Slavyanski 13A,unknown,EasyPay
Obshtina Kaspichan,easypay,SHUMEN  Avtomagistrala Shumen 356+745,unknown,EasyPay
Obshtina Shumen,easypay,SHUMEN  ul. Layosh Koshut 1,unknown,EasyPay
Obshtina Shumen,easypay,SHUMEN  bul. Veliki Preslav №7,unknown,EasyPay
Obshtina Shumen,easypay,SHUMEN  ul. Panayot Hitov 2,unknown,EasyPay
Obshtina Shumen,easypay,SHUMEN  bul. Veliki Preslav 121,unknown,EasyPay
Obshtina Shumen,easypay,SHUMEN  ul. Beli lom №1 m-n Kaufland,unknown,EasyPay
Obshtina Shumen,easypay,SHUMEN  pl. Balgaria №1,unknown,EasyPay
Obshtina Shumen,easypay,SHUMEN  ul. Makedonia 17,unknown,EasyPay
Obshtina Shumen,easypay,SHUMEN kv. GRIVITSA ul. General Dragomirov 5A,unknown,EasyPay
Obshtina Shumen,easypay,SHUMEN kv. Kurshun Cheshma ul. Saedinenie 116,unknown,EasyPay
Obshtina Shumen,easypay,SHUMEN kv. Kv. Boyan Balgaranov ul. Iskar 7 (Magazin BULMAG),unknown,EasyPay
Obshtina Shumen,easypay,SHUMEN kv. Peti Polk ul. Kraleviche 1,unknown,EasyPay
Obshtina Shumen,easypay,SHUMEN kv. Peti polk Sofiysko shose 19,unknown,EasyPay
Obshtina Shumen,easypay,SHUMEN kv. Trakia ul.Strandzha №12,unknown,EasyPay
Obshtina Shumen,easypay,SHUMEN kv. Tsentar ul.Maritsa №41,unknown,EasyPay
Obshtina Shumen,easypay,SHUMEN kv. Tsentar ul.TSar Ivan Aleksandar 54,unknown,EasyPay
Obshtina Shumen,easypay,SHUMEN kv. kv. Trakiyskia Promishlena zona benzinostantsia Kolyo,unknown,EasyPay
Obshtina Shumen,easypay,SHUMEN kv. zh. k. Dobrudzhanski ul. Saedinenie 28,unknown,EasyPay
Obshtina Smyadovo,easypay,SMYADOVO  ul. Chernorizets Hrabar 2,unknown,EasyPay
Obshtina Smyadovo,easypay,SMYADOVO kv. Tsentar ul.Belasitsa №4,unknown,EasyPay
Obshtina Novi Pazar,easypay,STOYAN MIHAYLOVSKI kv. Tsentar ul. V.G.Koprinkov 35,unknown,EasyPay
Obshtina Khitrino,easypay,STRUINO kv. Glaven pat Varna-Ruse Stopanski dvor 144,unknown,EasyPay
Obshtina Kaolinovo,easypay,TAKACH kv. TSENTAR TSENTAR,unknown,EasyPay
Obshtina Kaolinovo,easypay,TODOR IKONOMOVO  ul.Todor Ikonomov 1,unknown,EasyPay
Obshtina Kaolinovo,easypay,TODOR IKONOMOVO  pl. 9-ti septemvri,unknown,EasyPay
Obshtina Vurbitsa,easypay,VARBITSA  ul. Septemvriysko vazstanie 49,unknown,EasyPay
Obshtina Vurbitsa,easypay,VARBITSA  ul. Septemvriysko vastanie 24,unknown,EasyPay
Obshtina Shumen,easypay,VASIL DRUMEV kv. Tsentar ul. Han Asparuh 21,unknown,EasyPay
Obshtina Veliki Preslav,easypay,VELIKI PRESLAV  ul.Sergey Rumyantsev №1,unknown,EasyPay
Obshtina Veliki Preslav,easypay,VELIKI PRESLAV  ul. Boris Spirov 50,unknown,EasyPay
Obshtina Veliki Preslav,easypay,VELIKI PRESLAV  ul. Boris Spirov 30,unknown,EasyPay
Obshtina Veliki Preslav,easypay,VELIKI PRESLAV  ul. Boris Spirov № 61,unknown,EasyPay
Obshtina Veliki Preslav,easypay,VELIKI PRESLAV kv. Ticha №18 ul.Ticha №18,unknown,EasyPay
Obshtina Veliki Preslav,easypay,VELIKI PRESLAV kv. Veliki Preslav ul.Aleksandar Stamboliyski 15,unknown,EasyPay
Obshtina Venets,easypay,VENETS kv. TSENTAR ul.KIRIL I METODIY 24,unknown,EasyPay
Obshtina Kaspichan,easypay,VOYVODA  ul.Otets Paisiy 23,unknown,EasyPay
Obshtina Vurbitsa,easypay,YABLANOVO  ul.Osvobozhdenie 46,unknown,EasyPay
Obshtina Smyadovo,easypay,ZLATAR  ul. Dobrudzha 10,unknown,EasyPay
Obshtina Venets,lukoil,Венец Венец,unknown,Ф 537
Шумен,lukoil,бул. Рижки проход 28 Шумен,unknown,Б 205
Шумен,lukoil,кв. Боян Балгаран Шумен,unknown,Б 039
Obshtina Shumen,pepco,,unknown,Pepco
Shumen,rompetrol,,unknown,Shumen
ENEVO,shell,,unknown,9012 ENEVO NORTH
SHUMEN,shell,,unknown,1058 SHELL SHUMEN 7 KM
VELIKI PRESLAV,visa,,unknown,unknown
DRAGOEVO,visa,,unknown,unknown
SHUMEN,visa,,unknown,unknown
KASPICHAN,visa,,unknown,unknown
NOVI PAZAR,visa,,unknown,unknown
Smyyadovo,western_union,,unknown,ET NEVEN NEVYANKA DIMITROVA
Novi Pazar,western_union,,unknown,CENTRAL COOPERATIVE BANK PLC
Varbitsa,western_union,,unknown,EFTA KONSULT EOOD
Shumen,western_union,,unknown,SDI BROKER KAUFLAND BOYAN BALGARANOV
Veliki Preslav,western_union,,unknown,SOFT COM EOOD
Nikola Kozlevo,western_union,,unknown,ET BISER MITEV SEYKO EMIL MITEV NELI ALD
Voyvoda,western_union,,unknown,MILENIUM 36 EOOD
Venetc,western_union,,unknown,D COMMERCE BANK AD
Todor Ikonomovo,western_union,,unknown,ET KRASITSVET ROSITSA ILIEVA
Kaolinovo,western_union,,unknown,D COMMERCE BANK AD
