Ref,Spider,Name,Address,City,State,Zipcode,Country,Phone,Website,Hours,Brand,WikiData
DPSCY,marriott,Courtyard Bali Nusa Dua Resort,,Bali,,,ID,+62 361 3003888,https://www.marriott.com/DPSCY,,Courtyard by Marriott,Q1053170
DPSVC,marriott,Marriott’s Bali Nusa Dua Terrace,,Nusa Dua,,,ID,+62 361 2092888,https://www.marriott.com/DPSVC,,Marriott Vacation Club International,Q6772996
DPSMV,marriott,Marriott’s Bali Nusa Dua Gardens,,Nusa Dua,,,ID,+62 361 3013333,https://www.marriott.com/DPSMV,,Marriott Vacation Club International,Q6772996
DPSXR,marriott,The St. Regis Bali Resort,,Nusa Dua,,,ID,+62 361 8478111,https://www.marriott.com/DPSXR,,St. Regis Hotels & Resorts,Q30715430
70356001,moneygram,ARTHAPOS - BADUNG,,BADUNG,,,ID,+62 21 7190415,,Mo-Sa 06:00-22:00; Su 00:00-24:00,MoneyGram,Q1944412
43625345,moneygram,CIMB NIAGA NUSA DUA - NUSA DUA - NUSA DU,,DENPASAR,,,ID,+62 623 61772058,,Mo-Fr 07:00-15:00; Sa-Su 00:00-24:00,MoneyGram,Q1944412
