City,Place Name,Zipcode,Name
Windshield Repair Shop in Sedalia,safelite,,unknown,Safelite AutoGlass
Windshield Repair and Replacement in Rolla,safelite,,unknown,Safelite AutoGlass
Auto Glass Shop in Osage Beach,safelite,,unknown,Safelite AutoGlass
Windshield Repair Shop in Nixa,safelite,,unknown,Safelite AutoGlass
Auto Glass Shop in Lees Summit,safelite,,unknown,Safelite AutoGlass
Auto Glass Shop in Kansas City,safelite,,unknown,Safelite AutoGlass
Auto Glass Shop in Joplin,safelite,,unknown,Safelite AutoGlass
Auto Glass Replacement Shop in Independence,safelite,,unknown,Safelite AutoGlass
Auto Glass Replacement Shop in Columbia,safelite,,unknown,Safelite AutoGlass
