City,Place Name,Zipcode,Name
unknown,wildberries,Санкт-Петербург Санкт-Петербург проспект Большевиков 30к2,unknown,Wildberries
unknown,wildberries,посёлок Плодовое Центральная Улица 19,unknown,Wildberries
unknown,wildberries,Санкт-Петербург Гражданский Проспект 66к2,unknown,Wildberries
unknown,wildberries,Санкт-Петербург Проспект Металлистов 117,unknown,Wildberries
unknown,wildberries,деревня Лесколово Зелёная Улица 51,unknown,Wildberries
unknown,wildberries,Санкт-Петербург Гражданский Проспект 13к1,unknown,Wildberries
unknown,wildberries,Санкт-Петербург Комендантский Проспект 56,unknown,Wildberries
unknown,wildberries,Санкт-Петербург Плесецкая Улица 20к1,unknown,Wildberries
unknown,wildberries,городской посёлок Фёдоровское Почтовая Улица 7,unknown,Wildberries
unknown,wildberries,посёлок Терволово Ленинградская Улица 17г,unknown,Wildberries
Vsevolzhskij Rajon,wildberries,деревня Васкелово Привокзальная Площадь 2в,unknown,Wildberries
unknown,wildberries,посёлок Мичуринское Первомайская Улица 15б,unknown,Wildberries
unknown,wildberries,Тихвин Улица Ярослава Иванова 1,unknown,Wildberries
unknown,wildberries,деревня Лупполово Деревня Лупполово 26,unknown,Wildberries
unknown,wildberries,посёлок Парголово Толубеевский Проезд 18к1,unknown,Wildberries
unknown,wildberries,Мурино Новая Улица 13а,unknown,Wildberries
unknown,wildberries,Тихвин Улица Машиностроителей 42,unknown,Wildberries
unknown,wildberries,городской посёлок Будогощь Коммунальная Улица 1,unknown,Wildberries
unknown,wildberries,Ленинградская область Сосновый Бор Пионерская улица 4,unknown,Wildberries
unknown,wildberries,Гатчина Улица Киргетова 24,unknown,Wildberries
unknown,wildberries,посёлок Селезнёво Центральная Улица 16,unknown,Wildberries
unknown,wildberries,городской посёлок Янино-1 Улица Тюльпанов 2,unknown,Wildberries
unknown,wildberries,село Паша Набережная Улица 62а,unknown,Wildberries
unknown,wildberries,Санкт-Петербург Улица Даниила Хармса 4,unknown,Wildberries
unknown,wildberries,городской посёлок Важины Улица Осташева 10а,unknown,Wildberries
unknown,wildberries,Санкт-Петербург Богатырский Проспект 47к2,unknown,Wildberries
unknown,wildberries,Ленинградская область Мурино Екатерининская улица 8к1,unknown,Wildberries
unknown,wildberries,Санкт-Петербург Санкт-Петербург проспект Маршака 12к1,unknown,Wildberries
unknown,wildberries,Санкт-Петербург Проспект Большевиков 25,unknown,Wildberries
unknown,wildberries,деревня Ивановка Деревня Ивановка 11,unknown,Wildberries
unknown,wildberries,Санкт-Петербург Санкт-Петербург проспект Авиаконструкторов 67к1,unknown,Wildberries
unknown,wildberries,Санкт-Петербург Санкт-Петербург проспект Авиаконструкторов 61,unknown,Wildberries
unknown,wildberries,Санкт-Петербург Санкт-Петербург Кондратьевский проспект 83к1,unknown,Wildberries
unknown,wildberries,Санкт-Петербург Санкт-Петербург Манчестерская улица 3,unknown,Wildberries
unknown,wildberries,Санкт-Петербург Санкт-Петербург Верхне-Каменская улица 11к1с1,unknown,Wildberries
unknown,wildberries,Санкт-Петербург посёлок Парголово Ольгинская дорога,unknown,Wildberries
unknown,wildberries,посёлок Запорожское Улица Механизаторов 13а,unknown,Wildberries
unknown,wildberries,Россия Ленинградская область Подпорожье проспект Ленина 30,unknown,Wildberries
unknown,wildberries,Санкт-Петербург Санкт-Петербург Сиреневый бульвар 18к1В,unknown,Wildberries
unknown,wildberries,Санкт-Петербург Санкт-Петербург проспект Энгельса 143к1,unknown,Wildberries
unknown,wildberries,Ленинградская область Бокситогорск Садовая улица 5А,unknown,Wildberries
unknown,wildberries,Санкт-Петербург Санкт-Петербург Большой Сампсониевский проспект 69к3,unknown,Wildberries
unknown,wildberries,Санкт-Петербург Санкт-Петербург Рабфаковская улица 3к1,unknown,Wildberries
unknown,wildberries,Санкт-Петербург Мебельная Улица 49/92,unknown,Wildberries
unknown,wildberries,Подпорожье Проспект Ленина 13,unknown,Wildberries
unknown,wildberries,Ленинградская область деревня Мистолово Горная улица 25к1,unknown,Wildberries
unknown,wildberries,Санкт-Петербург Санкт-Петербург улица Корнея Чуковского 3к5,unknown,Wildberries
unknown,wildberries,Санкт-Петербург Гражданский Проспект 68,unknown,Wildberries
unknown,wildberries,Ленинградская область Луга проспект Володарского 34,unknown,Wildberries
unknown,wildberries,Кириши Волховская Набережная 40,unknown,Wildberries
unknown,wildberries,Ленинградская область городской посёлок Янино-1 Ясная улица 4,unknown,Wildberries
unknown,wildberries,посёлок Беседа Посёлок Беседа 4,unknown,Wildberries
unknown,wildberries,Санкт-Петербург Санкт-Петербург Русановская улица 20к1,unknown,Wildberries
unknown,wildberries,посёлок Парголово Улица Николая Рубцова 11к1,unknown,Wildberries
unknown,wildberries,Санкт-Петербург Санкт-Петербург Большеохтинский проспект 15к3,unknown,Wildberries
unknown,wildberries,Кингисепп Проспект Карла Маркса 53,unknown,Wildberries
unknown,wildberries,Кингисепп 2-Я Линия 49,unknown,Wildberries
unknown,wildberries,Санкт-Петербург Комендантский Проспект 71,unknown,Wildberries
unknown,wildberries,Ленинградская область Отрадное Никольское шоссе 2к3,unknown,Wildberries
unknown,wildberries,Санкт-Петербург Санкт-Петербург улица Грибалёвой 7к1,unknown,Wildberries
unknown,wildberries,Мурино Привокзальная Площадь 5ак5,unknown,Wildberries
unknown,wildberries,посёлок Войскорово Посёлок Войскорово 1б,unknown,Wildberries
unknown,wildberries,Санкт-Петербург Санкт-Петербург проспект Авиаконструкторов 54,unknown,Wildberries
unknown,wildberries,Сланцы Улица Гагарина 3,unknown,Wildberries
unknown,wildberries,Сланцы Улица Ленина 26,unknown,Wildberries
unknown,wildberries,посёлок Каложицы Посёлок Каложицы 23б,unknown,Wildberries
unknown,wildberries,Санкт-Петербург Глухарская Улица 26,unknown,Wildberries
unknown,wildberries,Ленинградская область деревня Новосаратовка улица Первых 2к1,unknown,Wildberries
unknown,wildberries,Мурино Екатерининская Улица 14,unknown,Wildberries
unknown,wildberries,Тосно Проспект Ленина 43,unknown,Wildberries
unknown,wildberries,городской посёлок Рахья Улица Лары Михеенко 1а,unknown,Wildberries
unknown,wildberries,посёлок Аннино Улица 10-Й Пятилетки 1а,unknown,Wildberries
unknown,wildberries,Кировск Бульвар Партизанской Славы 1,unknown,Wildberries
unknown,wildberries,посёлок Дзержинского Лужская Улица 10,unknown,Wildberries
unknown,wildberries,Санкт-Петербург Светлановский Проспект 79,unknown,Wildberries
unknown,wildberries,Санкт-Петербург посёлок Парголово улица Фёдора Абрамова 19к1,unknown,Wildberries
unknown,wildberries,Санкт-Петербург Улица Шишкина 303к1,unknown,Wildberries
unknown,wildberries,посёлок Сельцо Посёлок Сельцо 83,unknown,Wildberries
unknown,wildberries,Всеволожск Октябрьский Проспект 167,unknown,Wildberries
unknown,wildberries,д Новое Девяткино Улица Энергетиков 5,unknown,Wildberries
unknown,wildberries,Санкт-Петербург Большой Сампсониевский Проспект 94,unknown,Wildberries
unknown,wildberries,Санкт-Петербург Улица Савушкина 124к1,unknown,Wildberries
unknown,wildberries,Санкт-Петербург Нейшлотский Переулок 9,unknown,Wildberries
unknown,wildberries,Тихвин 3-Й Микрорайон 30,unknown,Wildberries
unknown,wildberries,Сосновый Бор Улица Петра Великого 1,unknown,Wildberries
unknown,wildberries,Кудрово Европейский Проспект 8,unknown,Wildberries
unknown,wildberries,деревня Разбегаево Деревня Разбегаево 32,unknown,Wildberries
unknown,wildberries,городской посёлок Рябово Улица Рычина 10,unknown,Wildberries
unknown,wildberries,Санкт-Петербург Проспект Обуховской Обороны 138к2,unknown,Wildberries
unknown,wildberries,Санкт-Петербург Улица Шотмана 7к1,unknown,Wildberries
unknown,wildberries,Выборг Улица Мира 18,unknown,Wildberries
unknown,wildberries,Санкт-Петербург Санкт-Петербург Вазаский переулок 3,unknown,Wildberries
unknown,wildberries,Ленинградская область Кириши улица Нефтехимиков 39,unknown,Wildberries
unknown,wildberries,Мурино Воронцовский Бульвар 16к1,unknown,Wildberries
unknown,wildberries,Санкт-Петербург Ручьёвский Проспект 3к1,unknown,Wildberries
unknown,wildberries,Санкт-Петербург Проспект Энгельса 94к2,unknown,Wildberries
unknown,wildberries,Санкт-Петербург Санкт-Петербург Большой Сампсониевский проспект 56,unknown,Wildberries
unknown,wildberries,посёлок Суходолье Лесная Улица 6,unknown,Wildberries
unknown,wildberries,городской посёлок Рощино Улица Шалавина 49бк3,unknown,Wildberries
unknown,wildberries,Мурино Улица Шоссе В Лаврики 67,unknown,Wildberries
unknown,wildberries,Санкт-Петербург Улица Маршала Тухачевского 41,unknown,Wildberries
unknown,wildberries,деревня Агалатово Приозерское Шоссе 30,unknown,Wildberries
unknown,wildberries,Никольское Спортивная Улица 6,unknown,Wildberries
unknown,wildberries,Мурино Охтинская Аллея 10к1,unknown,Wildberries
unknown,wildberries,Санкт-Петербург Проспект Авиаконструкторов 49,unknown,Wildberries
unknown,wildberries,Санкт-Петербург Пискарёвский Проспект 165к1,unknown,Wildberries
unknown,wildberries,Ивангород Восточная Улица 7а,unknown,Wildberries
unknown,wildberries,Сосновый Бор Молодёжная Улица 48а,unknown,Wildberries
unknown,wildberries,Санкт-Петербург Коломяжский Проспект 20,unknown,Wildberries
unknown,wildberries,Тихвин Улица Связи 34,unknown,Wildberries
unknown,wildberries,посёлок Ропша Стрельнинское Шоссе 5а,unknown,Wildberries
unknown,wildberries,Санкт-Петербург Коломяжский Проспект 5к1,unknown,Wildberries
unknown,wildberries,Приозерск Комсомольская Улица 6,unknown,Wildberries
unknown,wildberries,деревня Низино Верхняя Улица 1к4,unknown,Wildberries
unknown,wildberries,посёлок Шугозеро Советская Улица 53,unknown,Wildberries
unknown,wildberries,Кириши Улица Строителей 10,unknown,Wildberries
unknown,wildberries,Всеволожск Шоссе Дорога Жизни 46,unknown,Wildberries
unknown,wildberries,Санкт-Петербург Муринская Дорога 27к3,unknown,Wildberries
unknown,wildberries,городской посёлок Виллози Гатчинское Шоссе 7а,unknown,Wildberries
unknown,wildberries,Ленинградская область деревня Ваганово 14Г,unknown,Wildberries
Vsevolzhskij Rajon,wildberries,посёлок Стеклянный Посёлок Стеклянный 40а,unknown,Wildberries
unknown,wildberries,деревня Бор Берёзовая Аллея 8а,unknown,Wildberries
unknown,wildberries,Мурино Романовская Улица 2,unknown,Wildberries
unknown,wildberries,Санкт-Петербург Санкт-Петербург Лабораторный проспект 23с1,unknown,Wildberries
unknown,wildberries,Ленинградская область Кириши проспект Победы 7,unknown,Wildberries
unknown,wildberries,посёлок Бугры Тихая Улица 3к1,unknown,Wildberries
unknown,wildberries,посёлок Романовка Посёлок Романовка 19а,unknown,Wildberries
unknown,wildberries,Кудрово Проспект Строителей 16,unknown,Wildberries
unknown,wildberries,Тихвин 4-Й Микрорайон 9,unknown,Wildberries
unknown,wildberries,городской посёлок Новоселье Красносельское Шоссе 16,unknown,Wildberries
unknown,wildberries,деревня Малое Верево Улица Кутышева 9к1,unknown,Wildberries
unknown,wildberries,Ленинградская область Кириши проспект Ленина 61,unknown,Wildberries
unknown,wildberries,Ленинградская область Сосновый Бор Молодёжная улица 4,unknown,Wildberries
unknown,wildberries,деревня Низино Центральная Улица 58,unknown,Wildberries
unknown,wildberries,посёлок Бугры Улица Любови Барановой 2т,unknown,Wildberries
unknown,wildberries,Петергоф Ропшинское Шоссе 4,unknown,Wildberries
unknown,wildberries,Ленинградская область Мурино Петровский бульвар 6к2,unknown,Wildberries
unknown,wildberries,Санкт-Петербург Санкт-Петербург Мебельная улица 35к2,unknown,Wildberries
unknown,wildberries,Ленинградская область посёлок Сосново улица Никитина 16А,unknown,Wildberries
unknown,wildberries,Ленинградская область Сосновый Бор Копорское шоссе 32,unknown,Wildberries
unknown,wildberries,Сертолово Улица Мира 9к3,unknown,Wildberries
unknown,wildberries,деревня Вистино Ижорская Улица 7,unknown,Wildberries
unknown,wildberries,Сосновый Бор Улица Красных Фортов 22,unknown,Wildberries
unknown,wildberries,посёлок Романовка Шоссе Дорога Жизни 43,unknown,Wildberries
unknown,wildberries,деревня Оржицы Деревня Оржицы 12,unknown,Wildberries
unknown,wildberries,Колтуши Колтушское Шоссе 10ас2,unknown,Wildberries
unknown,wildberries,посёлок Бугры Тихая Улица 13к1,unknown,Wildberries
unknown,wildberries,Всеволожск Колтушское Шоссе 124к1,unknown,Wildberries
unknown,wildberries,Санкт-Петербург Улица Вавиловых 9к5,unknown,Wildberries
unknown,wildberries,посёлок Елизаветино Вокзальная Улица 16а,unknown,Wildberries
unknown,wildberries,деревня Новое Девяткино Лесная Улица 2а,unknown,Wildberries
unknown,wildberries,Санкт-Петербург Проспект Непокорённых 13к1,unknown,Wildberries
unknown,wildberries,деревня Озерки Р-21 Кола 25-Й Километр 8,unknown,Wildberries
unknown,wildberries,Тихвин 5-Й Микрорайон 41к1,unknown,Wildberries
unknown,wildberries,Мурино Проспект Авиаторов Балтики 25,unknown,Wildberries
