City,Place Name,Zipcode,Name
г. Санкт-Петербург,coffee_like,пр-т Просвещения 34,unknown,Coffee Like
Кудрово,coffee_like,просп. Европейский 8,unknown,Coffee Like
Кудрово,coffee_like,пр-т Европейский 15а,unknown,Coffee Like
Кудрово,coffee_like,просп. Европейский 21 к2,unknown,Coffee Like
Мурино,coffee_like,бульвар Менделеева 11 к1,unknown,Coffee Like
Мурино,coffee_like,Привокзальная площадь 3,unknown,Coffee Like
Санкт-Петербург,coffee_like,ул. Федора Абрамова 8,unknown,Coffee Like
Санкт-Петербург,coffee_like,ул. Тепловозная 2А,unknown,Coffee Like
Санкт-Петербург,coffee_like,пр-т Королёва 65А,unknown,Coffee Like
Санкт-Петербург,coffee_like,просп. Комендантский 71,unknown,Coffee Like
Санкт-Петербург,coffee_like,наб. Свердловская 44Ю (БЦ Зима),unknown,Coffee Like
Санкт-Петербург,coffee_like,ул. Сердобольская 64к1,unknown,Coffee Like
Санкт-Петербург,coffee_like,пр-т Испытателей 9А,unknown,Coffee Like
Санкт-Петербург,coffee_like,пр-т Энгельса 2,unknown,Coffee Like
Санкт-Петербург,coffee_like,просп. Просвещения 34,unknown,Coffee Like
Санкт-Петербург,coffee_like,пр-т Коломяжский 17/1,unknown,Coffee Like
Санкт-Петербург,coffee_like,пос. Мурино бул. Менделеева 10,unknown,Coffee Like
Санкт-Петербург,coffee_like,пр-т Большой Сампсониевский 56,unknown,Coffee Like
Tosnenskiy area,lukoil,Russia 187070 Leningrad region Tosnenskiy area Apraksin Bor d. 594 km trassy M-11,unknown,AZS No 47471 Apraksin Bor-2
unknown,lukoil,Russia Leningrad region MO Lomonosovskiy munitsipalnyy area MO Nizinskoye selskoye proizvodstvenno-administrativnaya zona Uzigonty Proizvodstvenno-administrativnaya zona Uzigonty 16,unknown,"AZS No 47273 ""Uzigonty"""
 Vsevolozhskiy area,lukoil,Russia 188660 Leningrad region  Vsevolozhskiy area Bugrovskoye  KAD 25 km,unknown,AZS № 47270 Parnas
unknown,lukoil,Russia Leningrad region Luzskii area Tolmachevskoye (Tolmachevskaya) 121 km - 100 m right to road Sankt-Peterburg-Pskov near Dolgovka,unknown,AZS № 47260 Dolgovka
unknown,lukoil,Russia 118261 Leningrad region Luzhskiy munitsipalnyy rayon Tolmachevskoye gorodskoye poseleniye d. Novyye Krupeli ul. Luzhskaya  uch. 19,unknown,AZS No 47198 Novyye Krupeli
unknown,lukoil,"187630 Russia Leningrad region Boksitogorsk Boksitogorskiy munitsipalnyy area Samoylovskoye Chudtsy 30 m left from federal highway ""Vologda-Novaya Ladoga"" 376 km + 700 m",unknown,AZS № 47253 CHudcy
Tikhvin,lukoil,Russia 187553 Leningrad region Tikhvin Tikhvinskiy municipal area Tikhvinskoye Tikhvinskoye st. K. Marksa 86,unknown,AZS № 47252 Tihvin
"Tosnenskiy r-n, g. Tosno",lukoil,Russia 187000 Leningrad region Tosnenskiy r-n g. Tosno Moskovskoye shosse 44a,unknown,AZS No 47241 Tosno
"Kingiseppskiy munitsipalnyy area, Kingiseppskoye gorodskoye poseleniye, Kingisepp",lukoil,Russia 188480 Leningrad region Kingiseppskiy munitsipalnyy area Kingiseppskoye gorodskoye poseleniye Kingisepp pr-ct st. Karla Marksa 46,unknown,AZS No 47195 Kingisepp
Sankt-Peterburg,lukoil,Russia 194358 St. Petersburg Sankt-Peterburg Engelsa prospect st. 164 лит. А,unknown,AZS № 78171 Engelsa
g. Sankt-Peterburg,lukoil,Russia 195009 St. Petersburg g. Sankt-Peterburg Kalininskiy r-n nab. Sverdlovskaya 1,unknown,AZS No 78144 Sverdlovskaya-2
Saint Petersburg,lukoil,Russia 195009 St. Petersburg st. Arsenalnaya 68A,unknown,AZS № 78179 Arsenalnaya
unknown,lukoil,Russia 193149 Leningrad region Vsevolozhskiy area Novotarasovka-tsentr 4,unknown,AZS No 47235 Utkina Zavod
g. Sankt-Peterburg,lukoil,Russia St. Petersburg g. Sankt-Peterburg Piskarevskii prospekt d. 46/1 lit. A,unknown,AZS № 78168 Volgo-Donskaya
St. Peterburg,lukoil,Russia St. Petersburg Petrodvorets st. Demyana Bednogo area 1 ( to south-west from crossroad with Ropshinskim road) 29А,unknown,AZS № 78190 Petrodvorets-2
St. Peterburg,lukoil,Russia 194156 St. Peterburg Sampsoniyevskiy B prospect st. 89А,unknown,AZS № 78165 Sampsonievskaya
St. Peterburg,lukoil,Russia 196641 St. Petersburg Vyborgskaya naberezhnaya area 1 (to west from crossroad with street Aleksandra Matrosova) 18А,unknown,AZS № 78145 Matrosova
Sankt-Peterburg,lukoil,Russia 197374 St.-Petersburg Shkolnaya st. plot 1 (opposite 128 korp. 1 on Shkolnaya St.) 91А,unknown,AZS № 78183 Shkolnaya
Sankt-Peterburg,lukoil,Russia St.-Petersburg prospect st. Kultury 49А ,unknown,AZS № 78186 pr. Kultury
Sankt-Peterburg,lukoil,Russia 192177 St. Petersburg Sankt-Peterburg st.Karavayevskaya д.3 кор.2 лит. А,unknown,AZS № 78166 Karavaevskaya
Sankt-Peterburg,lukoil,Russia 195299 St.-Petersburg st. Rustaveli plot 1 (east of the intersection with Suzdalsky prospect st.) 81A,unknown,AZS No 78176 Rustaveli
-,lukoil,"Russia Leningrad region Vyborgskiy area 1446 km road Ye-18 ""Skandinaviya"" (left)",unknown,AZS № 47148 Skandinaviya-2
-,lukoil,"Russia Leningrad region Vyborgskiy area 1446 km road Ye-18 ""Skandinaviya"" (right)",unknown,AZS № 47147 Skandinaviya-1
Saint Petersburg,lukoil,Russia 197373 St. Petersburg pr-ct st. Komendantskiy 44/1 А,unknown,AZS № 78117 SHavrova
Sankt-Peterburg,lukoil,Russia St.-Petersburg prospekt st. Nauki 52а лит. А,unknown,AZS № 78157 pr. Nauki
Slantsy,lukoil,Russia Leningrad region  Slantsy Slantsevskoe road  43,unknown,AZS № 47146 Slancy
Sankt-Peterburg,lukoil,Russia 197371 St.-Petersburg pr-ct Komendantskiy st. 43 korp. 2А,unknown,AZS № 78127 SHuvalovskaya
unknown,lukoil,"188686 Russia Leningrad region Vsevolozhskiy area Razmetelevskaya volost Ozerki 26 km. road ""Kola"" (right)",unknown,AZS № 47108 Murmanskaya-1 (p)
unknown,lukoil,"188686 Russia Leningrad region Vsevolozhskiy area Razmetelevskaya volost Ozerki 26 km. road ""Kola"" (left)",unknown,AZS № 47109 Murmanskaya-2 (l)
unknown,lukoil,Russia 188653 Leningrad region  Agalatovo road Sankt-Peterburg - Priozersk km. 16+400 right,unknown,AZS № 47103 Agalatovo
unknown,lukoil,"Russia 188861 Leningrad region Vyborgskiy area Kirillovskaya volost Kirpichnoye 98 km. road ""Skandinaviya""",unknown,AZS № 47101 Kirpichnoe
unknown,lukoil,Russia 188730 Leningrad region Priozerskiy area Sosnovskaya volost Ivanovo,unknown,AZS № 47089 Ivanovo
"Vyborgskiy area, Vyborg",lukoil,Russia 188800 Leningrad region Vyborgskiy area Vyborg road Leningradskoye р-н ПТУ-30,unknown,AZS № 47086 Vyborg
Sosnovyi Bor,lukoil,Russia 188544 Leningrad region Sosnovyi Bor road Koporskoe 34 А,unknown,AZS № 47197 Sosnovyj Bor
unknown,lukoil,"Russia 188664 Leningrad region Vsevolozhskiy area Toksovo Raz""ezzhaya st 13A",unknown,AZS № 47085 Toksovo
"Volkhovskiy area, Syasstroy",lukoil,Russia 187420 Leningrad region Volkhovskiy area Syasstroy st. Kirova 162,unknown,AZS № 47087 Syasstroj
unknown,lukoil,Russia 188401 Leningrad region Volosovskiy rayon AMO Kikerinskoye selskoye poseleniye poselok 81 km,unknown,AZS No 47090 Volosovo
St. Petersburg,lukoil,Russia 194100 St. Petersburg st. Litovskaya 5/2 лит.А,unknown,AZS № 78095 Litovskaya
Sankt-Peterburg,lukoil,Russia 195027 St. Petersburg Sankt-Peterburg Sverdlovskaya 58 корп. 4 лит. А,unknown,AZS № 78096 Sverdlovskaya
unknown,lukoil,Russia Leningrad region Vsevolozhskiy rayon Zanevskoye gorodskoye poseleniye g.p. Yanino-1 Proizvodstvennaya zona Yanino stl. Shosseynaya 116,unknown,AZS No 47104 Yanino
"Priozerskiy munitsipalnyy rayon, Priozerskoye gorodskoye poseleniye",lukoil,Russia Leningrad region,unknown,AZS № 47105 Priozersk
Vyborg,lukoil,Russia Leningrad region Vyborg Primorskoe road 112 km.,unknown,AZS № 47110 Vyborg-2
unknown,lukoil,Russia 187715 Leningrad region Lodeynopolskiy area Domozhirovskaya volost Domozhirovo,unknown,AZS № 47005 Domozhirovo
unknown,lukoil,Russia 188732 Leningrad region Petrovskaya volost Varshko,unknown,AZS  № 47058 Losevo
unknown,lukoil,"Russia 188309 Leningrad region 45 km road ""Sankt-Peterburg-Pskov"" Promzona ""Torfyanoe-1"" 3",unknown,AZS № 47002 Gatchina
Ivangorod,lukoil,Russia 188490 Leningrad region  Ivangorod sh. Kingiseppskoe 17,unknown,AZS № 47003 Ivangorod
Saint Petersburg,lukoil,Russia 194295 St. Petersburg st. Yesenina 21А,unknown,AZS № 78037 Еsenina
St. Peterburg,lukoil,Russia 194292 St. Petersburg pr-ct st. Suzdalʹskii 49А,unknown,AZS № 78038 Suzdalskaya
St. Peterburg,lukoil,Russia 195067 St. Petersburg pr-ct st. Piskarevskii 30А,unknown,AZS № 78041 Piskarevskaya
Sankt-Peterburg,lukoil,Russia 195067 St. Petersburg Piskarevskiy prospect st. 43A 2,unknown,AZS № 78044 Mechnikova
unknown,lukoil,Russia 188340 Leningrad region Taytsy road Gatchinskoye 25,unknown,AZS № 47055 Tajcy
Saint Petersburg,lukoil,Russia 194352 St. Petersburg  pr-ct st. Khudozhnikov 47А,unknown,AZS № 78070 Suzdalskaya-2
St. Petersburg,lukoil,Russia 195197 St. Petersburg st. Zamshina 2А,unknown,AZS № 78071 Zamshina
unknown,lukoil,Russia 188327 Leningrad region Gatchinskiy area Pizhma д. б/н,unknown,AZS № 47074 Pizhma
Sankt-Peterburg,lukoil,Russia 197348 St.-Petersburg st. Generala Хruleva 2А,unknown,AZS № 78075 Hruleva
unknown,wildberries,Ленинградская область Кириши Пионерская улица 2,unknown,Wildberries
unknown,wildberries,г. Санкт-Петербург Комендантский проспект д. 51к1,unknown,Wildberries
unknown,wildberries,п. Парголово (Санкт-Петербург г.) м. Парнас ул. Федора Абрамова 8 А,unknown,Wildberries
unknown,wildberries,Ленинградская область Всеволожск Всеволожский проспект 61,unknown,Wildberries
unknown,wildberries,г. Санкт-Петербург м. Лесная ул. Александра Матросова 20 корп.2А,unknown,Wildberries
unknown,wildberries,г. Санкт-Петербург пр-кт Металлистов д. 111,unknown,Wildberries
unknown,wildberries,г. Санкт-Петербург пр-кт Энгельса 47,unknown,Wildberries
unknown,wildberries,г. Санкт-Петербург ш. Революции 15,unknown,Wildberries
unknown,wildberries,г. Гатчина (Ленинградская обл.) пр-кт 25 Октября 75,unknown,Wildberries
unknown,wildberries,г. Приозерск (Ленинградская область) Советская улица д. 2Б,unknown,Wildberries
unknown,wildberries,г. Выборг (Ленинградская область) ул Ростовская улица д. 5,unknown,Wildberries
unknown,wildberries,г. Санкт-Петербург м Проспект Просвещения улица Кустодиева д. 19,unknown,Wildberries
unknown,wildberries,г. Санкт-Петербург м Чёрная речка набережная Чёрной речки д. 10,unknown,Wildberries
unknown,wildberries,г. Санкт-Петербург м Комендантский проспект Туристская улица д. 30к2 литер А,unknown,Wildberries
unknown,wildberries,г. Санкт-Петербург м Новочеркасская Большеохтинский проспект д. 10,unknown,Wildberries
unknown,wildberries,г. Санкт-Петербург м Чёрная речка Ланское шоссе д. 14к1,unknown,Wildberries
unknown,wildberries,г. Лодейное Поле (Ленинградская область) улица Гагарина д. 13,unknown,Wildberries
unknown,wildberries,г. Тосно (Ленинградская область) проспект Ленина д.3,unknown,Wildberries
unknown,wildberries,г. Луга (Ленинградская область) улица Красной Артиллерии д. 7/18,unknown,Wildberries
unknown,wildberries,г. Санкт-Петербург м Озерки улица Есенина д. 1к1,unknown,Wildberries
unknown,wildberries,г. Сланцы (Ленинградская область) улица Кирова д. 20,unknown,Wildberries
unknown,wildberries,г. Бокситогорск (Ленинградская область) Школьная улица д. 11/15,unknown,Wildberries
unknown,wildberries,г. Санкт-Петербург Русановская улица д. 19к4,unknown,Wildberries
unknown,wildberries,г. Пикалёво (Ленинградская область) Школьная улица д. 58,unknown,Wildberries
unknown,wildberries,г. Кудрово (Ленинградская область) Европейский проспект д. 18к2,unknown,Wildberries
unknown,wildberries,г. Санкт-Петербург проспект Авиаконструкторов д. 38к1,unknown,Wildberries
unknown,wildberries,г. Санкт-Петербург улица Есенина д. 32к1,unknown,Wildberries
unknown,wildberries,г. Сосновый Бор (Ленинградская область) Ленинградская улица д. 70,unknown,Wildberries
unknown,wildberries,г. Выборг (Ленинградская область) проспект Ленина д. 11Б,unknown,Wildberries
unknown,wildberries,г. Санкт-Петербург м Беговая улица Савушкина д. 138,unknown,Wildberries
unknown,wildberries,г. Кингисепп (Ленинградская область) Крикковское шоссе д. 20,unknown,Wildberries
unknown,wildberries,г. Санкт-Петербург м Гражданский проспект проспект Луначарского д. 80к1,unknown,Wildberries
unknown,wildberries,г. Кириши (Ленинградская область) Волховская набережная д. 50,unknown,Wildberries
unknown,wildberries,г. Кировск (Ленинградская область) Пионерская улица д. 14,unknown,Wildberries
unknown,wildberries,Ленинградская область г. Выборг Ленинградское шоссе д. 38,unknown,Wildberries
unknown,wildberries,г. Светогорск (Ленинградская область) Лесная улица д. 11,unknown,Wildberries
unknown,wildberries,г. Отрадное (Ленинградская область) Вокзальная улица д. 6,unknown,Wildberries
unknown,wildberries,г. Санкт-Петербург проспект Энгельса д. 70/1,unknown,Wildberries
unknown,wildberries,г. Волхов (Ленинградская область) Волховский проспект д. 29,unknown,Wildberries
unknown,wildberries,г. Сясьстрой (Ленинградская область) улица Космонавтов д. 4А,unknown,Wildberries
unknown,wildberries,г. Санкт-Петербург улица Академика Лебедева д. 21Б,unknown,Wildberries
unknown,wildberries,г. Всеволожск (Ленинградская область) улица Доктора Сотникова д. 5,unknown,Wildberries
unknown,wildberries,г. Санкт-Петербург проспект Маршака д. 20,unknown,Wildberries
unknown,wildberries,г. Санкт-Петербург Кондратьевский проспект д. 62к6,unknown,Wildberries
unknown,wildberries,г. Приозерск (Ленинградская область) улица Гагарина д. 18,unknown,Wildberries
unknown,wildberries,посёлок городского типа Ульяновка (Ленинградская область) ул. Левая линия д. 49,unknown,Wildberries
unknown,wildberries,Санкт-Петербург посёлок Парголово улица Михаила Дудина 10,unknown,Wildberries
unknown,wildberries,г. Гатчина (Ленинградская область) улица Урицкого д. 11,unknown,Wildberries
Volosovskiy Rayon,wildberries,г. Шлиссельбург (Ленинградская область) улица Староладожский Канал д. 24к1,unknown,Wildberries
unknown,wildberries,г. Гатчина (Ленинградская область) улица Хохлова д. 16,unknown,Wildberries
unknown,wildberries,г. Волосово (Ленинградская область) Краснофлотская улица д. 4А,unknown,Wildberries
unknown,wildberries,г. Санкт-Петербург м Рыбацкое Прибрежная улица д. 4,unknown,Wildberries
unknown,wildberries,Ленинградская область Лодейное Поле улица Володарского 55,unknown,Wildberries
unknown,wildberries,г. Санкт-Петербург Комендантский проспект д. 69,unknown,Wildberries
unknown,wildberries,г. Санкт-Петербург Богатырский проспект д. 49к2,unknown,Wildberries
unknown,wildberries,г. Кингисепп (Ленинградская область) Железнодорожная улица д. 7А,unknown,Wildberries
unknown,wildberries,Ленинградская область г. Всеволожск Колтушское шоссе д. 44к1,unknown,Wildberries
unknown,wildberries,Санкт-Петербург Санкт-Петербург улица Софьи Ковалевской 1к1,unknown,Wildberries
unknown,wildberries,г. Сертолово (Ленинградская область) Центральная улица д. 1 корп 3,unknown,Wildberries
unknown,wildberries,г. Всеволожск (Ленинградская область) Александровская улица д. 80А,unknown,Wildberries
unknown,wildberries,г. Кириши (Ленинградская область) проспект Героев д. 11А,unknown,Wildberries
unknown,wildberries,г. Коммунар (Ленинградская область) Пионерская улица д. 21,unknown,Wildberries
unknown,wildberries,г. Санкт-Петербург Народная улица д. 81,unknown,Wildberries
unknown,wildberries,г. Всеволожск (Ленинградская область) Христиновский проспект д. 83к2,unknown,Wildberries
unknown,wildberries,г. Санкт-Петербург проспект Маршала Блюхера д. 7к2,unknown,Wildberries
unknown,wildberries,г. Тихвин (Ленинградская область) 1А микрорайон д. 46к2,unknown,Wildberries
unknown,wildberries,г. Санкт-Петербург проспект Металлистов д. 100,unknown,Wildberries
unknown,wildberries,деревня Новое Девяткино (Ленинградская область) Школьная улица д. 2,unknown,Wildberries
unknown,wildberries,г. Санкт-Петербург проспект Культуры д. 29к1,unknown,Wildberries
unknown,wildberries,г. Санкт-Петербург Гражданский проспект д. 4,unknown,Wildberries
unknown,wildberries,г. Никольское (Ленинградская область) Первомайская улица д. 17к2,unknown,Wildberries
unknown,wildberries,г. Санкт-Петербург Апрельская улица д. 5,unknown,Wildberries
unknown,wildberries,Санкт-Петербург Санкт-Петербург Глухая Зеленина улица 2,unknown,Wildberries
unknown,wildberries,городской посёлок Мга (Ленинградская область) Железнодорожная улица д. 45,unknown,Wildberries
unknown,wildberries,г. Мурино (Ленинградская область) Петровский бульвар д. 7,unknown,Wildberries
unknown,wildberries,посёлок городского типа Сиверский (Ленинградская область) улица Строителей д. 14,unknown,Wildberries
unknown,wildberries,г. Сосновый Бор (Ленинградская область) Красных Фортов 15/5,unknown,Wildberries
unknown,wildberries,г. Гатчина (Ленинградская область) улица Генерала Кныша 2,unknown,Wildberries
unknown,wildberries,г. Луга (Ленинградская область) проспект Кирова д. 55,unknown,Wildberries
unknown,wildberries,г. Подпорожье (Ленинградская область) улица Гнаровской д. 3,unknown,Wildberries
unknown,wildberries,д. Кудрово (Ленинградская обл) ул. Английская 2,unknown,Wildberries
unknown,wildberries,г. Санкт-Петербург Богатырский проспект д. 59к3,unknown,Wildberries
unknown,wildberries,г. Гатчина (Ленинградская обл) Урицкого 30,unknown,Wildberries
unknown,wildberries,г Ивангород (Ленинградская обл Кингисеппский р-н) Гагарина 11 А,unknown,Wildberries
unknown,wildberries,г. Санкт-Петербург улица Шаврова 13к1,unknown,Wildberries
unknown,wildberries,г. Волхов (Ленинградская обл) Кирова 18,unknown,Wildberries
unknown,wildberries,Бугры Петровский бульвар  25,unknown,Wildberries
unknown,wildberries,пгт Кузьмоловский (Ленинградская обл Всеволожский р-н) Железнодорожная 26,unknown,Wildberries
unknown,wildberries,г. Выборг (Ленинградская обл) Ленинградское шоссе 59,unknown,Wildberries
unknown,wildberries,г. Кингисепп (Ленинградская обл) Октябрьская 13,unknown,Wildberries
unknown,wildberries,г.п.Новоселье Питерский проспект 7,unknown,Wildberries
unknown,wildberries,г Кириши (Россия Ленинградская обл Киришский р-н) Советская 19,unknown,Wildberries
unknown,wildberries,г. Бокситогорск (Ленинградская обл) Красных следопытов 3,unknown,Wildberries
unknown,wildberries,Ленинградская область г Выборг Выборгская 40,unknown,Wildberries
unknown,wildberries,Приозерск (Ленинградская Область) Гоголя 7а,unknown,Wildberries
unknown,wildberries,д Кудрово (Россия Ленинградская обл Всеволожский р-н) Европейский проспект 13 к 6,unknown,Wildberries
unknown,wildberries,Ленинградская область посёлок Сосново Мичуринская улица 2В,unknown,Wildberries
unknown,wildberries,г Санкт-Петербург (Россия) Лыжный переулок 3,unknown,Wildberries
unknown,wildberries,г Санкт-Петербург улица Даниила Хармса 6,unknown,Wildberries
unknown,wildberries,п Мурино (Россия Ленинградская обл Всеволожский р-н) шоссе в лаврики 89,unknown,Wildberries
unknown,wildberries,п Мурино Россия Ленинградская обл Всеволожский р-н Шувалова 27/7,unknown,Wildberries
unknown,wildberries,Пикалево Советская 3,unknown,Wildberries
unknown,wildberries,г Луга (Россия Ленинградская обл Лужский р-н) Победы 7,unknown,Wildberries
unknown,wildberries,Санкт-Петербург Санкт-Петербург Фермское шоссе 16,unknown,Wildberries
unknown,wildberries,пгт Вырица (Ленинградская обл) Слуцкая 9а,unknown,Wildberries
unknown,wildberries,г Сосновый Бор Россия Ленинградская обл улица Красных Фортов 49,unknown,Wildberries
unknown,wildberries,деревня Кальтино (Ленинградская область) Колтушское шоссе 19к1,unknown,Wildberries
unknown,wildberries,г Тосно (Ленинградская область) улица Блинникова 6,unknown,Wildberries
unknown,wildberries,Ленинградская область Всеволожск Центральная улица 10/2,unknown,Wildberries
unknown,wildberries,Янино-1 (Ленинградская область) Кольцевая улица 8к2,unknown,Wildberries
unknown,wildberries,Санкт-Петербург Санкт-Петербург улица Обручевых 5,unknown,Wildberries
unknown,wildberries,Подпорожье Красноармейская  14б,unknown,Wildberries
unknown,wildberries,Вартемяги (Ленинградская область) улица Ветеранов 1А,unknown,Wildberries
unknown,wildberries,Светогорск Ленинградская область Выборгский район Спортивная 2,unknown,Wildberries
unknown,wildberries,Лодейное Поле (Ленинградская область) Профсоюзная улица 16,unknown,Wildberries
unknown,wildberries,Старая (Ленинградская область) улица Генерала Чоглокова 5,unknown,Wildberries
unknown,wildberries,г Санкт-Петербург улица Тельмана 41к1,unknown,Wildberries
unknown,wildberries,Ленинградская область Сертолово Тихвинская улица 8к3,unknown,Wildberries
unknown,wildberries,г Кириши (Ленинградская область) улица Нефтехимиков 22А,unknown,Wildberries
