City,Place Name,Zipcode,Name
unknown,wildberries,г Санкт-Петербург улица Орбели 27к1,unknown,Wildberries
unknown,wildberries,Отрадное (Ленинградская область) Лесная улица 1,unknown,Wildberries
unknown,wildberries,Новая Ладога (Ленинградская область) микрорайон В д 14,unknown,Wildberries
unknown,wildberries,Санкт-Петербург Шуваловский 74к1,unknown,Wildberries
unknown,wildberries,г Санкт-Петербург улица Верности 14к2,unknown,Wildberries
unknown,wildberries,Россия Санкт-Петербург Богословская улица 4к1,unknown,Wildberries
unknown,wildberries,Тихвин (Ленинградская обл) 4-и мкр 31,unknown,Wildberries
unknown,wildberries,Санкт-Петербург посёлок Парголово улица Валерия Гаврилина 13к1,unknown,Wildberries
unknown,wildberries,Санкт-Петербург Туристская улица 23к1,unknown,Wildberries
unknown,wildberries,г Волосово Вингисаара 29,unknown,Wildberries
unknown,wildberries,г Санкт-Петербург Шостаковича 5к1,unknown,Wildberries
unknown,wildberries,п Аннино Весенняя Улица 1а,unknown,Wildberries
unknown,wildberries,г Гатчина Улица Авиатриссы Зверевой 14,unknown,Wildberries
unknown,wildberries,г Санкт-Петербург Проспект Металлистов 115,unknown,Wildberries
unknown,wildberries,г Санкт-Петербург Бестужевская Улица 10,unknown,Wildberries
unknown,wildberries,г Петергоф Парковая Улица 18,unknown,Wildberries
unknown,wildberries,г Всеволожск Советская Улица 2,unknown,Wildberries
unknown,wildberries,г Волосово Улица Красных Командиров 7,unknown,Wildberries
unknown,wildberries,г Сланцы Улица Маяковского 6,unknown,Wildberries
unknown,wildberries,п Сосново Вокзальная Улица 21а,unknown,Wildberries
unknown,wildberries,г Санкт-Петербург Городской Посёлок Новоселье 4а,unknown,Wildberries
unknown,wildberries,г Санкт-Петербург Улица Есенина 36к3,unknown,Wildberries
unknown,wildberries,г Санкт-Петербург Заречная Улица 45к1,unknown,Wildberries
unknown,wildberries,Кудрово Ленинградская обл Венская улица 4к1,unknown,Wildberries
unknown,wildberries,д Новое Девяткино Главная Улица 56,unknown,Wildberries
unknown,wildberries,Сланцы Ленинградская область Сланцевский район улица Максима Горького 6,unknown,Wildberries
unknown,wildberries,г Санкт-Петербург Большой Сампсониевский Проспект 75,unknown,Wildberries
unknown,wildberries,п Мыза-Ивановка Привокзальная Улица 2б,unknown,Wildberries
unknown,wildberries,г Санкт-Петербург Проспект Пархоменко 5,unknown,Wildberries
unknown,wildberries,п Куркиеки Улица Ленина 2,unknown,Wildberries
unknown,wildberries,Тихвин Ленинградская область Тихвинский район улица Пролетарской Диктатуры 35,unknown,Wildberries
unknown,wildberries,г Санкт-Петербург Пионерская Улица 50,unknown,Wildberries
unknown,wildberries,п Мурино Оборонная Улица 37к2,unknown,Wildberries
unknown,wildberries,Мурино Ленинградская обл Всеволожский р-н улица Шоссе в Лаврики 83,unknown,Wildberries
unknown,wildberries,г Санкт-Петербург Проспект Королёва 65,unknown,Wildberries
unknown,wildberries,г Санкт-Петербург Проспект Королёва 73,unknown,Wildberries
unknown,wildberries,г Всеволожск Улица Шишканя 14,unknown,Wildberries
unknown,wildberries,д Гарболово Деревня Гарболово 214,unknown,Wildberries
unknown,wildberries,Мурино Ленинградская область Всеволожский район Скандинавский проезд 8к2,unknown,Wildberries
unknown,wildberries,Мурино Ленинградская область Всеволожский район бульвар Менделеева 11к2,unknown,Wildberries
unknown,wildberries,п Мурино Новая Улица 7,unknown,Wildberries
unknown,wildberries,Санкт-Петербург посёлок Парголово улица Фёдора Абрамова 21к3,unknown,Wildberries
unknown,wildberries,д Гостилицы Школьная Улица 12а,unknown,Wildberries
unknown,wildberries,д Снегиревка Центральная Улица 10,unknown,Wildberries
unknown,wildberries,г Приозерск Улица Ленина 38а,unknown,Wildberries
unknown,wildberries,г Санкт-Петербург Сибирская Улица 16,unknown,Wildberries
unknown,wildberries,д Кудрово Европейский Проспект 20к4,unknown,Wildberries
unknown,wildberries,пгт Им Морозова Улица Мира 10,unknown,Wildberries
unknown,wildberries,пгт Рощино Советская Улица 8а,unknown,Wildberries
unknown,wildberries,Кингисепп Ленинградская область Кингисеппский район улица Химиков 7В,unknown,Wildberries
unknown,wildberries,Санкт-Петербург Санкт-Петербург Русановская улица 16к3,unknown,Wildberries
unknown,wildberries,п Новый Учхоз Площадь Усова 11,unknown,Wildberries
unknown,wildberries,п Парголово Улица Фёдора Абрамова 21к3,unknown,Wildberries
unknown,wildberries,г Санкт-Петербург Придорожная Аллея 19,unknown,Wildberries
unknown,wildberries,Санкт-Петербург посёлок Парголово Заречная улица 10,unknown,Wildberries
unknown,wildberries,г Санкт-Петербург Улица Валерия Гаврилина 3к1,unknown,Wildberries
unknown,wildberries,д Агалатово Деревня Агалатово 209к2,unknown,Wildberries
unknown,wildberries,г Санкт-Петербург Проспект Художников 35,unknown,Wildberries
unknown,wildberries,г мурино Воронцовский Бульвар 22,unknown,Wildberries
unknown,wildberries,Санкт-Петербург Россия улица Шоссе в Лаврики 76,unknown,Wildberries
unknown,wildberries,д Янино-1 Ясная Улица 11к5,unknown,Wildberries
unknown,wildberries,д Кудрово Европейский Проспект 2к1,unknown,Wildberries
unknown,wildberries,г Санкт-Петербург Шлиссельбургский Проспект 17к1,unknown,Wildberries
unknown,wildberries,г Санкт-Петербург Улица Савушкина 131,unknown,Wildberries
unknown,wildberries,г Санкт-Петербург Улица Шоссе В Лаврики 59к1,unknown,Wildberries
unknown,wildberries,г Санкт-Петербург Муринская Дорога 51к1,unknown,Wildberries
unknown,wildberries,г Санкт-Петербург Арсенальная Улица 9,unknown,Wildberries
unknown,wildberries,г Кингисепп Восточная Улица 2б,unknown,Wildberries
unknown,wildberries,п Бугры Школьная Улица 11к2,unknown,Wildberries
unknown,wildberries,г Санкт-Петербург Проспект Художников 43/14,unknown,Wildberries
unknown,wildberries,Гп Токсово Привокзальная Улица 20б,unknown,Wildberries
unknown,wildberries,д Хапо-Ое Шоссейная Улица 25,unknown,Wildberries
unknown,wildberries,г Всеволожск Пушкинская Улица 63,unknown,Wildberries
unknown,wildberries,Санкт-Петербург Россия Рыбацкий проспект 17к1,unknown,Wildberries
unknown,wildberries,г Санкт-Петербург Улица Николая Рубцова 5,unknown,Wildberries
unknown,wildberries,г мурино Садовая Улица 26б,unknown,Wildberries
unknown,wildberries,д Куйвози Первомайская Улица 2в,unknown,Wildberries
unknown,wildberries,снт СНТ Лесное-2 массива Никольское Школьная Улица 2,unknown,Wildberries
unknown,wildberries,г Санкт-Петербург Муринская Дорога 63к2,unknown,Wildberries
unknown,wildberries,гп Фёдоровское (Ленинградская обл) ул Центральная д 6 ,unknown,Wildberries
unknown,wildberries,д Янино-1 Ясная Улица 16,unknown,Wildberries
unknown,wildberries,пгт Невская Дубровка Советская Улица 17,unknown,Wildberries
unknown,wildberries,Вяхтелево Вишнёвая улица 2В,unknown,Wildberries
unknown,wildberries,Сосновый Бор Ленинградская обл Ленинградская улица 60А,unknown,Wildberries
unknown,wildberries,г Кировск Бульвар Партизанской Славы 3,unknown,Wildberries
unknown,wildberries,г Всеволожск Ленинградская Улица 18,unknown,Wildberries
unknown,wildberries,п Мурино Ручьёвский Проспект 4/26,unknown,Wildberries
unknown,wildberries,пгт Сертолово-1 Улица Ларина 15к1,unknown,Wildberries
unknown,wildberries,п Мурино Воронцовский Бульвар 17,unknown,Wildberries
unknown,wildberries,г Санкт-Петербург Проспект Королёва 63к1,unknown,Wildberries
unknown,wildberries,Санкт-Петербург Россия Большой Сампсониевский проспект 18,unknown,Wildberries
unknown,wildberries,Сосновый Бор Ленинградская обл Солнечная улица 33А,unknown,Wildberries
unknown,wildberries,пгт Сертолово-1 Кленовая Улица 7к1,unknown,Wildberries
unknown,wildberries,Санкт-Петербург  улица Оптиков 37,unknown,Wildberries
Volosovskiy Rayon,wildberries,г Шлиссельбург Улица Малоневский Канал 12а,unknown,Wildberries
unknown,wildberries,г Санкт-Петербург Гжатская Улица 22к2,unknown,Wildberries
unknown,wildberries,Санкт-Петербург Россия Комендантский проспект 66к1,unknown,Wildberries
unknown,wildberries,г Санкт-Петербург Гражданский Проспект 80к1,unknown,Wildberries
unknown,wildberries,Ленинградская область Мурино Охтинская аллея 6,unknown,Wildberries
unknown,wildberries,Санкт-Петербург Санкт-Петербург Фермское шоссе 32,unknown,Wildberries
unknown,wildberries,Санкт-Петербург Санкт-Петербург Шлиссельбургский проспект 32к1,unknown,Wildberries
unknown,wildberries,Санкт-Петербург  Шлиссельбургский проспект 6к2,unknown,Wildberries
unknown,wildberries,Ленинградская область Гатчина бульвар Авиаторов 3,unknown,Wildberries
unknown,wildberries,Санкт-Петербург Санкт-Петербург проспект Художников 30к1,unknown,Wildberries
unknown,wildberries,г Кировск Новая Улица 23,unknown,Wildberries
unknown,wildberries,Санкт-Петербург Заречная улица 37,unknown,Wildberries
unknown,wildberries,Ленинградская область Кудрово Пражская улица 15,unknown,Wildberries
unknown,wildberries,Парголово Санкт-Петербург улица Николая Рубцова 12к1,unknown,Wildberries
unknown,wildberries,г Гатчина Улица Генерала Сандалова 1а,unknown,Wildberries
unknown,wildberries,Санкт-Петербург Санкт-Петербург Пискарёвский проспект 20,unknown,Wildberries
unknown,wildberries,Санкт-Петербург  Большой Сампсониевский пр 38-40,unknown,Wildberries
unknown,wildberries,г Санкт-Петербург Ропшинское Шоссе 9д,unknown,Wildberries
unknown,wildberries,г Санкт-Петербург Улица Оптиков 45к1,unknown,Wildberries
unknown,wildberries,снт СНТ Сокол-1 массива Никольское Советский Проспект 144к2,unknown,Wildberries
unknown,wildberries,Светогорск Красноармейская 12а,unknown,Wildberries
unknown,wildberries,Кудрово (Ленинградская область) Пражская улица 13,unknown,Wildberries
unknown,wildberries,г Санкт-Петербург Советский Проспект 217,unknown,Wildberries
unknown,wildberries,п Мурино Петровский Бульвар 2к2,unknown,Wildberries
unknown,wildberries,Лодейное Поле Ленинградская обл Лодейнопольский р-н улица Гагарина 8,unknown,Wildberries
unknown,wildberries,Ленинградская область Всеволожск Коралловская улица 16,unknown,Wildberries
unknown,wildberries,Выборг Мира 4,unknown,Wildberries
unknown,wildberries,Ленинградская область Гатчина Воскова 1Б,unknown,Wildberries
unknown,wildberries,г Санкт-Петербург Комендантский Проспект 55к1,unknown,Wildberries
unknown,wildberries,Санкт-Петербург  улица Фёдора Абрамова 4,unknown,Wildberries
unknown,wildberries,Коммунар Ленинградская обл Гатчинский р-н Ижорская улица 24Б,unknown,Wildberries
unknown,wildberries,Ленинградская область деревня Старая Школьный переулок 5к1,unknown,Wildberries
unknown,wildberries,г Санкт-Петербург Проспект Непокорённых 74,unknown,Wildberries
unknown,wildberries,пгт Мга Железнодорожная Улица 58,unknown,Wildberries
unknown,wildberries,Ленинградская область Кудрово Столичная улица 11к2,unknown,Wildberries
unknown,wildberries,д Горбунки Деревня Горбунки 49,unknown,Wildberries
unknown,wildberries,г Выборг Ленинградское Шоссе 18,unknown,Wildberries
unknown,wildberries,г Выборг Проспект Победы 37,unknown,Wildberries
unknown,wildberries,пгт Мга Донецкая Улица 1,unknown,Wildberries
unknown,wildberries,г Санкт-Петербург Замшина Улица 31,unknown,Wildberries
unknown,wildberries,г Санкт-Петербург Кондратьевский Проспект 70к1,unknown,Wildberries
unknown,wildberries,г Санкт-Петербург Ипподромный Переулок 3к1,unknown,Wildberries
unknown,wildberries,г Петергоф Парковая Улица 16к2,unknown,Wildberries
unknown,wildberries,г Санкт-Петербург Улица Михаила Дудина 25к1,unknown,Wildberries
unknown,wildberries,г Санкт-Петербург Ропшинское Шоссе 1а,unknown,Wildberries
unknown,wildberries,г Санкт-Петербург Кондратьевский Проспект 83к1,unknown,Wildberries
unknown,wildberries,г Санкт-Петербург Улица Савушкина 143к1,unknown,Wildberries
unknown,wildberries,г Санкт-Петербург Плесецкая Улица 10,unknown,Wildberries
unknown,wildberries,Новая Ладога Карла Маркса 6А,unknown,Wildberries
unknown,wildberries,г Выборг Рубежная Улица 36,unknown,Wildberries
unknown,wildberries,Коммунар Ленинградская обл Гатчинский р-н Гатчинская улица 18Б,unknown,Wildberries
unknown,wildberries,Кудрово Европейский проспект 21к2,unknown,Wildberries
unknown,wildberries,д Липово Проспект Героев 35,unknown,Wildberries
unknown,wildberries,п Янино Улица Тюльпанов 1,unknown,Wildberries
unknown,wildberries,пгт Токсово Привокзальная Улица 20б,unknown,Wildberries
unknown,wildberries,Россия Санкт-Петербург проспект Металлистов 116к1,unknown,Wildberries
unknown,wildberries,Ленинградская область Всеволожск Московская улица 21,unknown,Wildberries
unknown,wildberries,Санкт-Петербург  улица Жукова 1,unknown,Wildberries
unknown,wildberries,Санкт-Петербург Санкт-Петербург Караваевская улица 23,unknown,Wildberries
unknown,wildberries,г Выборг Проспект Победы 9б,unknown,Wildberries
unknown,wildberries,п Курск Посёлок Курск 14,unknown,Wildberries
unknown,wildberries,г Выборг Выборгская Улица 6,unknown,Wildberries
unknown,wildberries,пгт Сертолово-1 Микрорайон Чёрная Речка 10,unknown,Wildberries
unknown,wildberries,г Санкт-Петербург Пискарёвский Проспект 25к2,unknown,Wildberries
unknown,wildberries,д Нурма Деревня Нурма 12,unknown,Wildberries
unknown,wildberries,г Всеволожск Межевая Улица 21,unknown,Wildberries
unknown,wildberries,пгт Кузнечное Садовая Улица 3,unknown,Wildberries
unknown,wildberries,г Кировск Молодёжная Улица 18б,unknown,Wildberries
unknown,wildberries,пгт Тайцы Советская Улица 50,unknown,Wildberries
unknown,wildberries,г Тосно Октябрьская Улица 16,unknown,Wildberries
unknown,wildberries,Ленинградская область Мурино проспект Авиаторов Балтики 31,unknown,Wildberries
unknown,wildberries,д Бегуницы Деревня Бегуницы 67,unknown,Wildberries
unknown,wildberries,п Сертолово-2 Тихвинская Улица 10к2,unknown,Wildberries
unknown,wildberries,Волхов Ленинградская область Волховский район Молодёжная улица 13,unknown,Wildberries
unknown,wildberries,Новоселье Ленинградская область Ломоносовский район Центральная улица 10к2,unknown,Wildberries
unknown,wildberries,г Санкт-Петербург Скачков Переулок 5,unknown,Wildberries
unknown,wildberries,п Петровское Шоссейная Улица 22,unknown,Wildberries
unknown,wildberries,г Ломоносов Село Русско-Высоцкое 18а,unknown,Wildberries
unknown,wildberries,г Тосно Улица Радищева 2,unknown,Wildberries
unknown,wildberries,тер Сосновоборское лесн-во квадрат 80 Улица Красных Фортов 10а,unknown,Wildberries
unknown,wildberries,г Санкт-Петербург Кондратьевский Проспект 64к2,unknown,Wildberries
unknown,wildberries,с Копорье Село Копорье 91,unknown,Wildberries
unknown,wildberries,Новое Девяткино Капральская 15,unknown,Wildberries
unknown,wildberries,Санкт-Петербург Санкт-Петербург Плесецкая улица 6,unknown,Wildberries
unknown,wildberries,Санкт-Петербург Санкт-Петербург Русановская улица 19к3,unknown,Wildberries
unknown,wildberries,п Первомайское Советская Улица 6,unknown,Wildberries
unknown,wildberries,д Кипень Ропшинское Шоссе 3,unknown,Wildberries
unknown,wildberries,г Санкт-Петербург Проспект Металлистов 117,unknown,Wildberries
unknown,wildberries,п Новоселье Центральная Улица 10к1,unknown,Wildberries
unknown,wildberries,п Мурино Улица Шувалова 22к2,unknown,Wildberries
unknown,wildberries,г Санкт-Петербург Октябрьская Набережная 118к7,unknown,Wildberries
unknown,wildberries,г Санкт-Петербург Улица Бутлерова 9к2,unknown,Wildberries
unknown,wildberries,д Разметелево Колтушское Шоссе 4,unknown,Wildberries
unknown,wildberries,Санкт-Петербург Санкт-Петербург Гражданский проспект 79к4,unknown,Wildberries
unknown,wildberries,г Ивангород Улица Юрия Гагарина 2,unknown,Wildberries
unknown,wildberries,д Яльгелево Деревня Яльгелево 16,unknown,Wildberries
unknown,wildberries,г Кингисепп Проспект Карла Маркса 21а,unknown,Wildberries
unknown,wildberries,пгт Сертолово-1 Пограничная Улица 4к1,unknown,Wildberries
unknown,wildberries,г Луга Проспект Урицкого 76,unknown,Wildberries
unknown,wildberries,п Сосново Ленинградская Улица 30,unknown,Wildberries
unknown,wildberries,г Санкт-Петербург Октябрьская Набережная 124к7,unknown,Wildberries
unknown,wildberries,п Бугры Школьная Улица 2,unknown,Wildberries
unknown,wildberries,г Санкт-Петербург Сердобольская Улица 43,unknown,Wildberries
unknown,wildberries,г Волхов Волгоградская Улица 34а,unknown,Wildberries
unknown,wildberries,д Лесколово Красноборская Улица 2,unknown,Wildberries
unknown,wildberries,Г Санкт-Петербург Туристская Улица 30к1,unknown,Wildberries
unknown,wildberries,г Тосно Улица Боярова 4а,unknown,Wildberries
unknown,wildberries,г Гатчина Пушкинское Шоссе 13к3,unknown,Wildberries
unknown,wildberries,г Каменногорск Ленинградское Шоссе 66,unknown,Wildberries
unknown,wildberries,г Санкт-Петербург Актёрский Проезд 6,unknown,Wildberries
unknown,wildberries,г Санкт-Петербург Проспект Маршала Блюхера 9к1,unknown,Wildberries
unknown,wildberries,г Санкт-Петербург Новосибирская Улица 10,unknown,Wildberries
unknown,wildberries,Санкт-Петербург Санкт-Петербург Школьная улица 68,unknown,Wildberries
unknown,wildberries,п Щеглово Магистральная Улица 3,unknown,Wildberries
unknown,wildberries,г Выборг Большая Каменная Улица 5а,unknown,Wildberries
unknown,wildberries,г Санкт-Петербург Шлиссельбургский Проспект 6к1,unknown,Wildberries
unknown,wildberries,г Санкт-Петербург Мебельная Улица 35к2,unknown,Wildberries
unknown,wildberries,п Мурино Петровский Бульвар 11к1,unknown,Wildberries
unknown,wildberries,г мурино Проспект Авиаторов Балтики 11/1,unknown,Wildberries
unknown,wildberries,г Кириши Улица Строителей 42,unknown,Wildberries
unknown,wildberries,Ленинградская область Гатчина улица Чехова 16А,unknown,Wildberries
unknown,wildberries,г Коммунар Пионерская Улица 2,unknown,Wildberries
unknown,wildberries,г Тосно Проспект Ленина 44,unknown,Wildberries
unknown,wildberries,п Мурино Графская Улица 2,unknown,Wildberries
unknown,wildberries,г Сланцы Улица Ленина 11,unknown,Wildberries
unknown,wildberries,г Санкт-Петербург Туристская Улица 30к1,unknown,Wildberries
unknown,wildberries,г Санкт-Петербург Улица Фёдора Абрамова 8,unknown,Wildberries
unknown,wildberries,г Волхов Авиационная Улица 19б,unknown,Wildberries
unknown,wildberries,п Пудость Улица Зайончковского 18,unknown,Wildberries
unknown,wildberries,д Янино-1 Ясная Улица 9к1,unknown,Wildberries
unknown,wildberries,г Санкт-Петербург Замшина Улица 27к1,unknown,Wildberries
unknown,wildberries,г Тосно Проспект Ленина 19,unknown,Wildberries
unknown,wildberries,Сиверский Ленинградская обл Гатчинский р-н переулок Стротелей 4,unknown,Wildberries
unknown,wildberries,г Санкт-Петербург Ропшинское Шоссе 22а,unknown,Wildberries
unknown,wildberries,Ленинградская область Мурино Воронцовский бульвар 23/11,unknown,Wildberries
unknown,wildberries,г Всеволожск Колтушское Шоссе 78к1,unknown,Wildberries
unknown,wildberries,г Кудрово Столичная Улица 1,unknown,Wildberries
unknown,wildberries,пгт Рощино Социалистическая Улица 102к1,unknown,Wildberries
