City,Place Name,Zipcode,Name
unknown,wildberries,п Сельцо Посёлок Сельцо 9б,unknown,Wildberries
unknown,wildberries,Санкт-Петербург Санкт-Петербург Плесецкая улица 21,unknown,Wildberries
unknown,wildberries,г Санкт-Петербург Ланское Шоссе 65,unknown,Wildberries
unknown,wildberries,г Волхов Улица Юрия Гагарина 24,unknown,Wildberries
unknown,wildberries,г Гатчина Улица Изотова 3а,unknown,Wildberries
unknown,wildberries,Ленинградская область Луга проспект Кирова 18Б,unknown,Wildberries
unknown,wildberries,г Выборг Улица Кривоносова 13,unknown,Wildberries
unknown,wildberries,г Санкт-Петербург Светлановский Проспект 46к1,unknown,Wildberries
unknown,wildberries,п Кикерино Гатчинское Шоссе 10,unknown,Wildberries
unknown,wildberries,г Санкт-Петербург Большая Пороховская Улица 13,unknown,Wildberries
unknown,wildberries,г Санкт-Петербург Заречная Улица 33,unknown,Wildberries
unknown,wildberries,г Санкт-Петербург Проспект Большевиков 31,unknown,Wildberries
unknown,wildberries,г Сланцы Улица Шахтёрской Славы 14,unknown,Wildberries
unknown,wildberries,д Малое Верево Улица Кириллова 5к2,unknown,Wildberries
unknown,wildberries,г Отрадное Новая Улица 3,unknown,Wildberries
unknown,wildberries,г Пикалево Улица Металлургов 5,unknown,Wildberries
unknown,wildberries,г Пикалево 6-Й Микрорайон 35,unknown,Wildberries
unknown,wildberries,тер Сосновоборское лесн-во квадрат 80 Молодёжная Улица 36,unknown,Wildberries
unknown,wildberries,г Санкт-Петербург Проспект Науки 38,unknown,Wildberries
unknown,wildberries,г Санкт-Петербург Приморский Проспект 161,unknown,Wildberries
unknown,wildberries,пгт Советский Садовая Улица 46,unknown,Wildberries
unknown,wildberries,Ленинградская область деревня Заклинье Новая улица 22,unknown,Wildberries
unknown,wildberries,г Санкт-Петербург Рашетова Улица 14,unknown,Wildberries
unknown,wildberries,г Всеволожск Улица Доктора Сотникова 15,unknown,Wildberries
unknown,wildberries,г Санкт-Петербург Рыбацкий Проспект 18к2,unknown,Wildberries
unknown,wildberries,г Санкт-Петербург Уральская Улица 21,unknown,Wildberries
unknown,wildberries,г Санкт-Петербург Улица Оптиков 50к2,unknown,Wildberries
unknown,wildberries,п Мельниково Улица Калинина 3,unknown,Wildberries
unknown,wildberries,г Санкт-Петербург Улица Бутлерова 11к4,unknown,Wildberries
unknown,wildberries,г Тосно Улица Максима Горького 19б,unknown,Wildberries
unknown,wildberries,пгт Сиверский Улица Военный Городок 7,unknown,Wildberries
unknown,wildberries,г Тихвин 6-Й Микрорайон 17,unknown,Wildberries
unknown,wildberries,д Терпилицы Деревня Терпилицы 4,unknown,Wildberries
unknown,wildberries,г Тихвин Микрорайон 1А 22,unknown,Wildberries
unknown,wildberries,г Санкт-Петербург Туристская Улица 18к1,unknown,Wildberries
unknown,wildberries,г Подпорожье Проспект Ленина 28,unknown,Wildberries
unknown,wildberries,пгт Ефимовский 1-Й Микрорайон 12,unknown,Wildberries
unknown,wildberries,г Санкт-Петербург Туристская Улица 15к1,unknown,Wildberries
unknown,wildberries,г Сясьстрой Улица 25 Октября 11а,unknown,Wildberries
unknown,wildberries,Санкт-Петербург Санкт-Петербург улица Руднева 21к1,unknown,Wildberries
unknown,wildberries,г Гатчина Посёлок Новый Свет 12а,unknown,Wildberries
unknown,wildberries,п Кингисеппский Посёлок Кингисеппский 1,unknown,Wildberries
unknown,wildberries,г Любань Улица Ленина 11,unknown,Wildberries
unknown,wildberries,Ленинградская область городской посёлок Павлово Советская улица 1А,unknown,Wildberries
unknown,wildberries,Санкт-Петербург Улица Александра Матросова 1,unknown,Wildberries
unknown,wildberries,Санкт-Петербург Проспект Авиаконструкторов 16к1,unknown,Wildberries
unknown,wildberries,г Приозерск Ленинградское Шоссе 33,unknown,Wildberries
unknown,wildberries,Санкт-Петербург посёлок Парголово улица Валерия Гаврилина 3к2,unknown,Wildberries
unknown,wildberries,д Старая Верхняя Улица 5к1,unknown,Wildberries
unknown,wildberries,деревня Старая Верхняя Улица 3к3,unknown,Wildberries
unknown,wildberries,Ленинградская область Гатчина улица Леонова 5,unknown,Wildberries
unknown,wildberries,Ленинградская область деревня Новое Девяткино Капральская улица 15,unknown,Wildberries
unknown,wildberries,посёлок Дунай Привокзальная Улица 3,unknown,Wildberries
unknown,wildberries,Выборг Улица Гагарина 27а,unknown,Wildberries
unknown,wildberries,Ленинградская область городской посёлок Кузьмоловский Молодёжная улица 13,unknown,Wildberries
unknown,wildberries,деревня Старополье Деревня Старополье 7,unknown,Wildberries
unknown,wildberries,деревня Большие Колпаны Киевское Шоссе 79,unknown,Wildberries
unknown,wildberries,Гатчина Рощинская Улица 13а,unknown,Wildberries
unknown,wildberries,Гатчина Улица Слепнёва 9,unknown,Wildberries
unknown,wildberries,Ленинградская область Пикалёво улица Горняков 10,unknown,Wildberries
unknown,wildberries,посёлок Осьмино Улица Ленина 50,unknown,Wildberries
unknown,wildberries,Санкт-Петербург Санкт-Петербург Комендантский проспект 60к3,unknown,Wildberries
unknown,wildberries,Всеволожск Магистральная Улица 8,unknown,Wildberries
unknown,wildberries,Санкт-Петербург Коломяжский Проспект 15к2,unknown,Wildberries
unknown,wildberries,Санкт-Петербург Улица Валерия Гаврилина 11к1,unknown,Wildberries
unknown,wildberries,городской посёлок Дружная Горка Улица Введенского 4,unknown,Wildberries
unknown,wildberries,Ленинградская область городской посёлок Форносово Круговая улица 4,unknown,Wildberries
unknown,wildberries,Санкт-Петербург Улица Ивана Фомина 7к3,unknown,Wildberries
unknown,wildberries,посёлок Глебычево Улица Мира 1,unknown,Wildberries
unknown,wildberries,Гатчина Рощинская Улица 14к1,unknown,Wildberries
unknown,wildberries,Санкт-Петербург Планерная Улица 63к1,unknown,Wildberries
unknown,wildberries,Санкт-Петербург Улица Шишкина 291к1,unknown,Wildberries
unknown,wildberries,Кингисепп Улица Воровского 34,unknown,Wildberries
unknown,wildberries,Коммунар Ленинградское Шоссе 11,unknown,Wildberries
unknown,wildberries,городской посёлок Назия Школьный Проспект 13,unknown,Wildberries
unknown,wildberries,городской посёлок Приладожский Садовая Улица 25,unknown,Wildberries
unknown,wildberries,Ленинградская область Кингисепп Большая Советская улица 42,unknown,Wildberries
unknown,wildberries,г Волосово Нарвская Улица 15,unknown,Wildberries
unknown,wildberries,Санкт-Петербург Коломяжский Проспект 15к1,unknown,Wildberries
unknown,wildberries,Кировск Краснофлотская Улица 31а,unknown,Wildberries
unknown,wildberries,городской посёлок Синявино Улица Кравченко 6,unknown,Wildberries
unknown,wildberries,Красное Село Территория Хвойный 45,unknown,Wildberries
unknown,wildberries,коттеджный посёлок Балтийская слобода 2 Покровская Улица 1,unknown,Wildberries
unknown,wildberries,Ленинградская область посёлок Усть-Луга квартал Ленрыба 9,unknown,Wildberries
unknown,wildberries,Ленинградская область Кириши проспект Героев 24,unknown,Wildberries
unknown,wildberries,Санкт-Петербург Проспект Энгельса 137,unknown,Wildberries
unknown,wildberries,деревня Лаголово Садовая Улица 4к1,unknown,Wildberries
unknown,wildberries,коттеджный посёлок Рождествено Большой Проспект 48а,unknown,Wildberries
unknown,wildberries,Волхов Проспект Державина 42,unknown,Wildberries
unknown,wildberries,деревня Энколово Центральная Улица 4а,unknown,Wildberries
unknown,wildberries,Ленинградская область Луга проспект Кирова 37,unknown,Wildberries
unknown,wildberries,посёлок Усть-Луга Квартал Ленрыба 1,unknown,Wildberries
unknown,wildberries,городской посёлок Красный Бор Советский Проспект 26,unknown,Wildberries
unknown,wildberries,деревня Низино Центральная Улица 29,unknown,Wildberries
unknown,wildberries,Санкт-Петербург Улица Фёдора Абрамова 18к1,unknown,Wildberries
unknown,wildberries,Тосно Московское Шоссе 34,unknown,Wildberries
Volosovskiy Rayon,wildberries,Шлиссельбург Улица Кирова 2,unknown,Wildberries
unknown,wildberries,Санкт-Петербург Санкт-Петербург Белоостровская улица 10к1,unknown,Wildberries
unknown,wildberries,городской посёлок Толмачёво Улица Толмачёва 7,unknown,Wildberries
unknown,wildberries,посёлок Каменка Посёлок Каменка 2,unknown,Wildberries
unknown,wildberries,Мурино Оборонная Улица 2к2,unknown,Wildberries
unknown,wildberries,городской посёлок Тайцы Железнодорожная Улица 2а,unknown,Wildberries
unknown,wildberries,Санкт-Петербург Проспект Металлистов 19/30,unknown,Wildberries
unknown,wildberries,Ленинградская область Приморск Выборгское шоссе 7Б,unknown,Wildberries
unknown,wildberries,Ленинградская область Сясьстрой Петрозаводская улица 33А,unknown,Wildberries
unknown,wildberries,посёлок Котельский Посёлок Котельский 6,unknown,Wildberries
unknown,wildberries,Никольское Советский Проспект 182,unknown,Wildberries
unknown,wildberries,Ленинградская область деревня Глинка Центральная улица 35 к 3,unknown,Wildberries
unknown,wildberries,Ленинградская область Гатчина улица Радищева 4,unknown,Wildberries
unknown,wildberries,деревня Скотное Каштановая Улица 1,unknown,Wildberries
unknown,wildberries,Тихвин 3-Й Микрорайон 1,unknown,Wildberries
unknown,wildberries,деревня Кузьмолово Заозёрная Улица 3,unknown,Wildberries
unknown,wildberries,Ивангород Кингисеппское Шоссе 22,unknown,Wildberries
unknown,wildberries,Санкт-Петербург Санкт-Петербург улица Руднева 16,unknown,Wildberries
unknown,wildberries,Мурино Арсенальная Улица 5а,unknown,Wildberries
unknown,wildberries,Санкт-Петербург Арцеуловская Аллея 23к1,unknown,Wildberries
unknown,wildberries,Мурино Проспект Авиаторов Балтики 3к1,unknown,Wildberries
unknown,wildberries,Отрадное Ленинградское Шоссе 3а,unknown,Wildberries
unknown,wildberries,деревня Кобрино Центральная Улица 10,unknown,Wildberries
Volosovskiy Rayon,wildberries,Ленинградская область Шлиссельбург улица Староладожский Канал 2,unknown,Wildberries
unknown,wildberries,Кингисепп Большой Бульвар 15б,unknown,Wildberries
unknown,wildberries,Волхов Улица Юрия Гагарина 13,unknown,Wildberries
unknown,wildberries,Луга Малая Инженерная Улица с14-15,unknown,Wildberries
unknown,wildberries,Санкт-Петербург Санкт-Петербург проспект Просвещения 54,unknown,Wildberries
unknown,wildberries,Ленинградская область посёлок Щеглово улица Щеглова 9,unknown,Wildberries
unknown,wildberries,посёлок Победа Улица Мира 8а,unknown,Wildberries
unknown,wildberries,Мурино Воронцовский Бульвар 20к1,unknown,Wildberries
unknown,wildberries,Санкт-Петербург Санкт-Петербург проспект Просвещения 46к1,unknown,Wildberries
unknown,wildberries,Санкт-Петербург Проспект Науки 17к6,unknown,Wildberries
unknown,wildberries,городской посёлок Янино-1 Шоссейная Улица 77,unknown,Wildberries
unknown,wildberries,Ленинградская область Луга проспект Урицкого 64,unknown,Wildberries
unknown,wildberries,Мурино Улица Шувалова 25к1,unknown,Wildberries
unknown,wildberries,Санкт-Петербург Проспект Просвещения 43,unknown,Wildberries
unknown,wildberries,посёлок при железнодорожной станции Лосево Улица Леншоссе 1,unknown,Wildberries
unknown,wildberries,Санкт-Петербург Львовская Улица 9,unknown,Wildberries
unknown,wildberries,Луга Старорусская Улица 5/1,unknown,Wildberries
unknown,wildberries,Санкт-Петербург Проспект Энгельса 97,unknown,Wildberries
unknown,wildberries,городской посёлок имени Морозова Улица Мира 13,unknown,Wildberries
unknown,wildberries,Всеволожск Центральная Улица 2,unknown,Wildberries
unknown,wildberries,Санкт-Петербург Бестужевская Улица 7к5,unknown,Wildberries
unknown,wildberries,Сертолово Парковый Проезд 5,unknown,Wildberries
unknown,wildberries,посёлок при железнодорожной станции Корнево Железнодорожная Улица 15а,unknown,Wildberries
unknown,wildberries,деревня Борисова Грива Центральная Улица 65/1,unknown,Wildberries
unknown,wildberries,Кировск Улица Кирова 13,unknown,Wildberries
unknown,wildberries,деревня Большая Пустомержа Улица Оболенского 27,unknown,Wildberries
unknown,wildberries,Выборг Приморское Шоссе 14,unknown,Wildberries
unknown,wildberries,посёлок Калитино Посёлок Калитино 22,unknown,Wildberries
unknown,wildberries,посёлок Парголово Заречная Улица 25,unknown,Wildberries
unknown,wildberries,Ленинградская область Луга переулок Толмачёва 1,unknown,Wildberries
unknown,wildberries,Всеволожск Ленинградская Улица 24а,unknown,Wildberries
unknown,wildberries,посёлок Парголово Улица Фёдора Абрамова 4,unknown,Wildberries
unknown,wildberries,Санкт-Петербург Заречная Улица 19к1,unknown,Wildberries
unknown,wildberries,городской посёлок Новоселье Невская Улица 1,unknown,Wildberries
unknown,wildberries,посёлок Бугры Улица Шекспира 3,unknown,Wildberries
unknown,wildberries,Всеволожск Межевая Улица 18а,unknown,Wildberries
unknown,wildberries,Ленинградская область Кудрово Пражская улица 14,unknown,Wildberries
unknown,wildberries,Ивангород Улица Пасторова 2а,unknown,Wildberries
unknown,wildberries,Приморск Набережная Лебедева 20,unknown,Wildberries
unknown,wildberries,деревня Кривко Фестивальная Улица 1,unknown,Wildberries
unknown,wildberries,Кудрово Австрийская Улица 4к1,unknown,Wildberries
unknown,wildberries,Мурино Улица Шоссе В Лаврики 72к4,unknown,Wildberries
unknown,wildberries,Кудрово Столичная Улица 4к2,unknown,Wildberries
unknown,wildberries,Санкт-Петербург Санкт-Петербург набережная Чёрной речки 59к1,unknown,Wildberries
unknown,wildberries,посёлок Парголово Заречная Улица 41,unknown,Wildberries
unknown,wildberries,Санкт-Петербург Санкт-Петербург улица Софьи Ковалевской 13к1,unknown,Wildberries
unknown,wildberries,посёлок Парголово Заречная Улица 44к1,unknown,Wildberries
unknown,wildberries,Санкт-Петербург Ипподромный Переулок 1к3,unknown,Wildberries
unknown,wildberries,Санкт-Петербург Санкт-Петербург Пискарёвский проспект 40,unknown,Wildberries
unknown,wildberries,Гатчина Рощинская Улица 1/1,unknown,Wildberries
unknown,wildberries,посёлок Хийтола Большая Приозерская Улица 1,unknown,Wildberries
unknown,wildberries,деревня Раздолье Центральная Улица 26,unknown,Wildberries
unknown,wildberries,Санкт-Петербург Муринская Дорога 59к1,unknown,Wildberries
unknown,wildberries,Ленинградская область городской посёлок Ульяновка улица Победы 36А,unknown,Wildberries
unknown,wildberries,Гатчина Улица Куприна 35а,unknown,Wildberries
unknown,wildberries,Мурино Ручьёвский Проспект 17к1,unknown,Wildberries
unknown,wildberries,городской посёлок Вырица Сиверское Шоссе 188а,unknown,Wildberries
unknown,wildberries,Санкт-Петербург Проспект Энгельса 15,unknown,Wildberries
unknown,wildberries,посёлок Гончарово Гончаровское Шоссе 1/2,unknown,Wildberries
unknown,wildberries,Ленинградская область Кингисепп Большая Советская улица 3В,unknown,Wildberries
unknown,wildberries,Санкт-Петербург Проспект Науки 24к1,unknown,Wildberries
unknown,wildberries,Ленинградская область городской посёлок Рощино Садовая улица 4,unknown,Wildberries
unknown,wildberries,Пикалёво Советская Улица 27,unknown,Wildberries
unknown,wildberries,Санкт-Петербург Санкт-Петербург Манчестерская улица 16,unknown,Wildberries
unknown,wildberries,Санкт-Петербург Русановская Улица 18к3,unknown,Wildberries
unknown,wildberries,Санкт-Петербург Лыжный Переулок 4к3,unknown,Wildberries
unknown,wildberries,Ленинградская область деревня Старая улица Иоанна Кронштадтского 15,unknown,Wildberries
unknown,wildberries,Санкт-Петербург Институтский Проспект 11,unknown,Wildberries
unknown,wildberries,Санкт-Петербург Планерная Улица 97к1,unknown,Wildberries
unknown,wildberries,Сосновый Бор Парковая Улица 22,unknown,Wildberries
unknown,wildberries,Санкт-Петербург Санкт-Петербург Комендантский проспект 61,unknown,Wildberries
unknown,wildberries,Санкт-Петербург Студенческая Улица 14к2,unknown,Wildberries
unknown,wildberries,Санкт-Петербург Санкт-Петербург улица Руставели 12,unknown,Wildberries
unknown,wildberries,Кириши Комсомольская Улица 14,unknown,Wildberries
unknown,wildberries,Ленинградская область городской посёлок имени Свердлова 1-й микрорайон 32А,unknown,Wildberries
unknown,wildberries,Санкт-Петербург Санкт-Петербург проспект Энгельса 43,unknown,Wildberries
unknown,wildberries,Всеволожск Межевая Улица 10,unknown,Wildberries
unknown,wildberries,Санкт-Петербург Советский Проспект 2,unknown,Wildberries
unknown,wildberries,посёлок Парголово Улица Шишкина 311,unknown,Wildberries
unknown,wildberries,Гатчина Киевская Улица 17г,unknown,Wildberries
unknown,wildberries,деревня Новолисино Заводская Улица 4,unknown,Wildberries
unknown,wildberries,Ленинградская область Кировск улица Победы 7,unknown,Wildberries
unknown,wildberries,Санкт-Петербург Санкт-Петербург Плесецкая улица 2,unknown,Wildberries
unknown,wildberries,Санкт-Петербург Санкт-Петербург Яхтенная улица 24к2,unknown,Wildberries
unknown,wildberries,Санкт-Петербург Плесецкая Улица 10,unknown,Wildberries
unknown,wildberries,Санкт-Петербург Русановская Улица 17к1,unknown,Wildberries
unknown,wildberries,Санкт-Петербург Улица Веденеева 12к1,unknown,Wildberries
unknown,wildberries,Санкт-Петербург Санкт-Петербург проспект Большевиков 33к1,unknown,Wildberries
unknown,wildberries,Ленинградская область деревня Куйвози Гарболовское шоссе 24к2,unknown,Wildberries
unknown,wildberries,Сосновый Бор Улица 50 Лет Октября 6,unknown,Wildberries
unknown,wildberries,Ленинградская область Гатчина проспект 25 Октября 69к1,unknown,Wildberries
unknown,wildberries,Санкт-Петербург Санкт-Петербург Свердловская набережная 58,unknown,Wildberries
unknown,wildberries,Тихвин 1-Й Микрорайон 3,unknown,Wildberries
unknown,wildberries,Санкт-Петербург Санкт-Петербург Гражданский проспект 36,unknown,Wildberries
unknown,wildberries,Санкт-Петербург Комендантский Проспект 51к1,unknown,Wildberries
unknown,wildberries,Мурино Воронцовский Бульвар 21к3,unknown,Wildberries
unknown,wildberries,Санкт-Петербург Толубеевский Проезд 8к2,unknown,Wildberries
unknown,wildberries,Санкт-Петербург посёлок Парголово Толубеевский проезд 8к2,unknown,Wildberries
unknown,wildberries,Санкт-Петербург Толубеевский Проезд 36к3,unknown,Wildberries
unknown,wildberries,Санкт-Петербург Кушелевская Дорога 7к6,unknown,Wildberries
unknown,wildberries,деревня Касимово Цветочная Улица 9,unknown,Wildberries
unknown,wildberries,Мурино Улица Шувалова 18/8,unknown,Wildberries
unknown,wildberries,деревня Горбунки Стрельнинское Шоссе 3,unknown,Wildberries
unknown,wildberries,Ленинградская область городской посёлок Токсово улица Советов 88А,unknown,Wildberries
unknown,wildberries,Тихвин 6-Й Микрорайон 10,unknown,Wildberries
unknown,wildberries,Санкт-Петербург Яхтенная Улица 28,unknown,Wildberries
unknown,wildberries,городской посёлок имени Свердлова 2-Й Микрорайон 28,unknown,Wildberries
unknown,wildberries,Санкт-Петербург Ланское Шоссе 24к6,unknown,Wildberries
