Ref,Spider,Name,Address,City,State,Zipcode,Country,Phone,Website,Hours,Brand,WikiData
157614,wildberries,Wildberries,"г Всеволожск, Межевая Улица 21",,Leningrad,,RU,,,Mo-Su 10:00-21:00,Wildberries,Q24933714
157886,wildberries,Wildberries,"пгт Кузнечное, Садовая Улица 3",,Leningrad,,RU,,,Mo-Su 10:00-21:00,Wildberries,Q24933714
157912,wildberries,Wildberries,"г Кировск, Молодёжная Улица 18б",,Leningrad,,RU,,,Mo-Su 10:00-21:00,Wildberries,Q24933714
157916,wildberries,Wildberries,"пгт Тайцы, Советская Улица 50",,Leningrad,,RU,,,Mo-Su 10:00-21:00,Wildberries,Q24933714
158073,wildberries,Wildberries,"г Тосно, Октябрьская Улица 16",,Leningrad,,RU,,,Mo-Su 10:00-21:00,Wildberries,Q24933714
158230,wildberries,Wildberries,"Ленинградская область, Мурино, проспект Авиаторов Балтики, 31",,Leningrad,,RU,,,Mo-Su 10:00-21:00,Wildberries,Q24933714
158332,wildberries,Wildberries,"д Бегуницы, Деревня Бегуницы 67",,Leningrad,,RU,,,Mo-Su 10:00-21:00,Wildberries,Q24933714
158358,wildberries,Wildberries,"п Сертолово-2, Тихвинская Улица 10к2",,Leningrad,,RU,,,Mo-Su 09:00-21:00,Wildberries,Q24933714
158509,wildberries,Wildberries,"Волхов Ленинградская область, Волховский район Молодёжная улица 13",,Leningrad,,RU,,,Mo-Su 10:00-21:00,Wildberries,Q24933714
158516,wildberries,Wildberries,"Новоселье Ленинградская область, Ломоносовский район Центральная улица 10к2",,Leningrad,,RU,,,Mo-Su 10:00-21:00,Wildberries,Q24933714
158838,wildberries,Wildberries,"г Санкт-Петербург, Скачков Переулок 5",,Leningrad,,RU,,,Mo-Su 10:00-21:00,Wildberries,Q24933714
159028,wildberries,Wildberries,"п Петровское, Шоссейная Улица 22",,Leningrad,,RU,,,Mo-Su 10:00-21:00,Wildberries,Q24933714
159261,wildberries,Wildberries,"г Ломоносов, Село Русско-Высоцкое 18а",,Leningrad,,RU,,,Mo-Su 09:00-21:00,Wildberries,Q24933714
159482,wildberries,Wildberries,"г Тосно, Улица Радищева 2",,Leningrad,,RU,,,Mo-Su 09:00-21:00,Wildberries,Q24933714
159519,wildberries,Wildberries,"тер Сосновоборское лесн-во квадрат 80, Улица Красных Фортов 10а",,Leningrad,,RU,,,Mo-Su 10:00-22:00,Wildberries,Q24933714
159690,wildberries,Wildberries,"г Санкт-Петербург, Кондратьевский Проспект 64к2",,Leningrad,,RU,,,Mo-Su 10:00-21:00,Wildberries,Q24933714
159717,wildberries,Wildberries,"с Копорье, Село Копорье 91",,Leningrad,,RU,,,Mo-Su 09:00-20:00,Wildberries,Q24933714
159794,wildberries,Wildberries,Новое Девяткино Капральская 15,,Leningrad,,RU,,,Mo-Su 10:00-21:00,Wildberries,Q24933714
160022,wildberries,Wildberries,"Санкт-Петербург, Санкт-Петербург, Плесецкая улица, 6",,Leningrad,,RU,,,Mo-Su 10:00-21:00,Wildberries,Q24933714
160026,wildberries,Wildberries,"Санкт-Петербург, Санкт-Петербург, Русановская улица, 19к3",,Leningrad,,RU,,,Mo-Su 10:00-21:00,Wildberries,Q24933714
160211,wildberries,Wildberries,"п Первомайское, Советская Улица 6",,Leningrad,,RU,,,Mo-Su 10:00-21:00,Wildberries,Q24933714
160434,wildberries,Wildberries,"д Кипень, Ропшинское Шоссе 3",,Leningrad,,RU,,,Mo-Su 09:00-20:00,Wildberries,Q24933714
160662,wildberries,Wildberries,"г Санкт-Петербург, Проспект Металлистов 117",,Leningrad,,RU,,,Mo-Su 09:00-21:00,Wildberries,Q24933714
160725,wildberries,Wildberries,"п Новоселье, Центральная Улица 10к1",,Leningrad,,RU,,,Mo-Su 10:00-21:00,Wildberries,Q24933714
160794,wildberries,Wildberries,"п Мурино, Улица Шувалова 22к2",,Leningrad,,RU,,,Mo-Su 10:00-22:00,Wildberries,Q24933714
160798,wildberries,Wildberries,"г Санкт-Петербург, Октябрьская Набережная 118к7",,Leningrad,,RU,,,Mo-Su 10:00-21:00,Wildberries,Q24933714
160810,wildberries,Wildberries,"г Санкт-Петербург, Улица Бутлерова 9к2",,Leningrad,,RU,,,Mo-Su 10:00-21:00,Wildberries,Q24933714
161164,wildberries,Wildberries,"д Разметелево, Колтушское Шоссе 4",,Leningrad,,RU,,,Mo-Su 10:00-21:00,Wildberries,Q24933714
161201,wildberries,Wildberries,"Санкт-Петербург, Санкт-Петербург, Гражданский проспект, 79к4",,Leningrad,,RU,,,Mo-Su 08:00-22:00,Wildberries,Q24933714
161286,wildberries,Wildberries,"г Ивангород, Улица Юрия Гагарина 2",,Leningrad,,RU,,,Mo-Su 10:00-21:00,Wildberries,Q24933714
161338,wildberries,Wildberries,"д Яльгелево, Деревня Яльгелево 16",,Leningrad,,RU,,,Mo-Su 10:00-21:00,Wildberries,Q24933714
161366,wildberries,Wildberries,"г Кингисепп, Проспект Карла Маркса 21а",,Leningrad,,RU,,,Mo-Su 10:00-21:00,Wildberries,Q24933714
161631,wildberries,Wildberries,"пгт Сертолово-1, Пограничная Улица 4к1",,Leningrad,,RU,,,Mo-Su 09:00-21:00,Wildberries,Q24933714
161666,wildberries,Wildberries,"г Луга, Проспект Урицкого 76",,Leningrad,,RU,,,Mo-Su 10:00-21:00,Wildberries,Q24933714
161772,wildberries,Wildberries,"п Сосново, Ленинградская Улица 30",,Leningrad,,RU,,,Mo-Su 10:00-21:00,Wildberries,Q24933714
161856,wildberries,Wildberries,"г Санкт-Петербург, Октябрьская Набережная 124к7",,Leningrad,,RU,,,Mo-Su 10:00-21:00,Wildberries,Q24933714
161910,wildberries,Wildberries,"п Бугры, Школьная Улица 2",,Leningrad,,RU,,,Mo-Su 09:00-21:00,Wildberries,Q24933714
161913,wildberries,Wildberries,"г Санкт-Петербург, Сердобольская Улица 43",,Leningrad,,RU,,,Mo-Su 10:00-21:00,Wildberries,Q24933714
162095,wildberries,Wildberries,"г Волхов, Волгоградская Улица 34а",,Leningrad,,RU,,,Mo-Su 10:00-21:00,Wildberries,Q24933714
162149,wildberries,Wildberries,"д Лесколово, Красноборская Улица 2",,Leningrad,,RU,,,Mo-Su 09:00-21:00,Wildberries,Q24933714
162281,wildberries,Wildberries,"Г Санкт-Петербург, Туристская Улица 30к1",,Leningrad,,RU,,,Mo-Su 10:00-21:00,Wildberries,Q24933714
162373,wildberries,Wildberries,"г Тосно, Улица Боярова 4а",,Leningrad,,RU,,,Mo-Su 10:00-21:00,Wildberries,Q24933714
162398,wildberries,Wildberries,"г Гатчина, Пушкинское Шоссе 13к3",,Leningrad,,RU,,,Mo-Su 10:00-21:00,Wildberries,Q24933714
162476,wildberries,Wildberries,"г Каменногорск, Ленинградское Шоссе 66",,Leningrad,,RU,,,Mo-Su 10:00-21:00,Wildberries,Q24933714
162480,wildberries,Wildberries,"г Санкт-Петербург, Актёрский Проезд 6",,Leningrad,,RU,,,Mo-Su 10:00-22:00,Wildberries,Q24933714
162574,wildberries,Wildberries,"г Санкт-Петербург, Проспект Маршала Блюхера 9к1",,Leningrad,,RU,,,Mo-Su 10:00-21:00,Wildberries,Q24933714
162580,wildberries,Wildberries,"г Санкт-Петербург, Новосибирская Улица 10",,Leningrad,,RU,,,Mo-Su 10:00-21:00,Wildberries,Q24933714
162692,wildberries,Wildberries,"Санкт-Петербург, Санкт-Петербург, Школьная улица, 68",,Leningrad,,RU,,,Mo-Su 10:00-21:00,Wildberries,Q24933714
162750,wildberries,Wildberries,"п Щеглово, Магистральная Улица 3",,Leningrad,,RU,,,Mo-Su 10:00-21:00,Wildberries,Q24933714
162891,wildberries,Wildberries,"г Выборг, Большая Каменная Улица 5а",,Leningrad,,RU,,,Mo-Su 10:00-21:00,Wildberries,Q24933714
162944,wildberries,Wildberries,"г Санкт-Петербург, Шлиссельбургский Проспект 6к1",,Leningrad,,RU,,,Mo-Su 10:00-21:00,Wildberries,Q24933714
163031,wildberries,Wildberries,"г Санкт-Петербург, Мебельная Улица 35к2",,Leningrad,,RU,,,Mo-Su 10:00-21:00,Wildberries,Q24933714
163065,wildberries,Wildberries,"п Мурино, Петровский Бульвар 11к1",,Leningrad,,RU,,,Mo-Su 10:00-22:00,Wildberries,Q24933714
163107,wildberries,Wildberries,"г мурино, Проспект Авиаторов Балтики 11/1",,Leningrad,,RU,,,Mo-Su 10:00-21:00,Wildberries,Q24933714
163601,wildberries,Wildberries,"г Кириши, Улица Строителей 42",,Leningrad,,RU,,,Mo-Su 10:00-21:00,Wildberries,Q24933714
163635,wildberries,Wildberries,"Ленинградская область, Гатчина, улица Чехова, 16А",,Leningrad,,RU,,,Mo-Su 10:00-21:00,Wildberries,Q24933714
163648,wildberries,Wildberries,"г Коммунар, Пионерская Улица 2",,Leningrad,,RU,,,Mo-Su 10:00-21:00,Wildberries,Q24933714
163658,wildberries,Wildberries,"г Тосно, Проспект Ленина 44",,Leningrad,,RU,,,Mo-Su 10:00-21:00,Wildberries,Q24933714
163965,wildberries,Wildberries,"п Мурино, Графская Улица 2",,Leningrad,,RU,,,Mo-Su 10:00-21:00,Wildberries,Q24933714
164047,wildberries,Wildberries,"г Сланцы, Улица Ленина 11",,Leningrad,,RU,,,Mo-Su 10:00-21:00,Wildberries,Q24933714
164083,wildberries,Wildberries,"г Санкт-Петербург, Туристская Улица 30к1",,Leningrad,,RU,,,Mo-Su 10:00-21:00,Wildberries,Q24933714
164230,wildberries,Wildberries,"г Санкт-Петербург, Улица Фёдора Абрамова 8",,Leningrad,,RU,,,Mo-Su 10:00-21:00,Wildberries,Q24933714
164459,wildberries,Wildberries,"г Волхов, Авиационная Улица 19б",,Leningrad,,RU,,,Mo-Su 09:00-21:00,Wildberries,Q24933714
164953,wildberries,Wildberries,"п Пудость, Улица Зайончковского 18",,Leningrad,,RU,,,Mo-Su 09:00-20:00,Wildberries,Q24933714
165129,wildberries,Wildberries,"д Янино-1, Ясная Улица 9к1",,Leningrad,,RU,,,Mo-Su 10:00-21:00,Wildberries,Q24933714
165215,wildberries,Wildberries,"г Санкт-Петербург, Замшина Улица 27к1",,Leningrad,,RU,,,Mo-Su 10:00-21:00,Wildberries,Q24933714
165593,wildberries,Wildberries,"г Тосно, Проспект Ленина 19",,Leningrad,,RU,,,Mo-Su 10:00-21:00,Wildberries,Q24933714
165641,wildberries,Wildberries,"Сиверский Ленинградская обл, Гатчинский р-н переулок Стротелей 4",,Leningrad,,RU,,,Mo-Su 10:00-21:00,Wildberries,Q24933714
165713,wildberries,Wildberries,"г Санкт-Петербург, Ропшинское Шоссе 22а",,Leningrad,,RU,,,Mo-Su 09:00-21:00,Wildberries,Q24933714
165875,wildberries,Wildberries,"Ленинградская область, Мурино, Воронцовский бульвар, 23/11",,Leningrad,,RU,,,Mo-Su 10:00-21:00,Wildberries,Q24933714
165890,wildberries,Wildberries,"г Всеволожск, Колтушское Шоссе 78к1",,Leningrad,,RU,,,Mo-Su 10:00-21:00,Wildberries,Q24933714
166006,wildberries,Wildberries,"г Кудрово, Столичная Улица 1",,Leningrad,,RU,,,Mo-Su 10:00-21:00,Wildberries,Q24933714
166367,wildberries,Wildberries,"пгт Рощино, Социалистическая Улица 102к1",,Leningrad,,RU,,,Mo-Su 10:00-21:00,Wildberries,Q24933714
166504,wildberries,Wildberries,"п Сельцо, Посёлок Сельцо 9б",,Leningrad,,RU,,,Mo-Su 10:00-21:00,Wildberries,Q24933714
167077,wildberries,Wildberries,"Санкт-Петербург, Санкт-Петербург, Плесецкая улица, 21",,Leningrad,,RU,,,Mo-Su 10:00-21:00,Wildberries,Q24933714
167127,wildberries,Wildberries,"г Санкт-Петербург, Ланское Шоссе 65",,Leningrad,,RU,,,Mo-Su 10:00-21:00,Wildberries,Q24933714
167243,wildberries,Wildberries,"г Волхов, Улица Юрия Гагарина 24",,Leningrad,,RU,,,Mo-Su 09:00-21:00,Wildberries,Q24933714
167939,wildberries,Wildberries,"г Гатчина, Улица Изотова 3а",,Leningrad,,RU,,,Mo-Su 09:00-21:00,Wildberries,Q24933714
168016,wildberries,Wildberries,"Ленинградская область, Луга, проспект Кирова, 18Б",,Leningrad,,RU,,,Mo-Su 10:00-21:00,Wildberries,Q24933714
168126,wildberries,Wildberries,"г Выборг, Улица Кривоносова 13",,Leningrad,,RU,,,Mo-Su 10:00-22:00,Wildberries,Q24933714
168302,wildberries,Wildberries,"г Санкт-Петербург, Светлановский Проспект 46к1",,Leningrad,,RU,,,Mo-Su 10:00-22:00,Wildberries,Q24933714
168348,wildberries,Wildberries,"п Кикерино, Гатчинское Шоссе 10",,Leningrad,,RU,,,Mo-Su 10:00-21:00,Wildberries,Q24933714
168356,wildberries,Wildberries,"г Санкт-Петербург, Большая Пороховская Улица 13",,Leningrad,,RU,,,Mo-Su 10:00-22:00,Wildberries,Q24933714
168734,wildberries,Wildberries,"г Санкт-Петербург, Заречная Улица 33",,Leningrad,,RU,,,Mo-Su 10:00-21:00,Wildberries,Q24933714
168736,wildberries,Wildberries,"г Санкт-Петербург, Проспект Большевиков 31",,Leningrad,,RU,,,Mo-Su 10:00-22:00,Wildberries,Q24933714
169309,wildberries,Wildberries,"г Сланцы, Улица Шахтёрской Славы 14",,Leningrad,,RU,,,Mo-Su 10:00-21:00,Wildberries,Q24933714
169365,wildberries,Wildberries,"д Малое Верево, Улица Кириллова 5к2",,Leningrad,,RU,,,Mo-Su 10:00-21:00,Wildberries,Q24933714
169574,wildberries,Wildberries,"г Отрадное, Новая Улица 3",,Leningrad,,RU,,,Mo-Su 09:00-21:00,Wildberries,Q24933714
169760,wildberries,Wildberries,"г Пикалево, Улица Металлургов 5",,Leningrad,,RU,,,Mo-Su 10:00-21:00,Wildberries,Q24933714
169848,wildberries,Wildberries,"г Пикалево, 6-Й Микрорайон 35",,Leningrad,,RU,,,Mo-Su 09:00-21:00,Wildberries,Q24933714
169871,wildberries,Wildberries,"тер Сосновоборское лесн-во квадрат 80, Молодёжная Улица 36",,Leningrad,,RU,,,Mo-Su 09:00-21:00,Wildberries,Q24933714
169965,wildberries,Wildberries,"г Санкт-Петербург, Проспект Науки 38",,Leningrad,,RU,,,Mo-Su 10:00-21:00,Wildberries,Q24933714
170045,wildberries,Wildberries,"г Санкт-Петербург, Приморский Проспект 161",,Leningrad,,RU,,,Mo-Su 10:00-21:00,Wildberries,Q24933714
170075,wildberries,Wildberries,"пгт Советский, Садовая Улица 46",,Leningrad,,RU,,,Mo-Su 09:00-21:00,Wildberries,Q24933714
170414,wildberries,Wildberries,"Ленинградская область, деревня Заклинье, Новая улица, 22",,Leningrad,,RU,,,Mo-Su 10:00-21:00,Wildberries,Q24933714
170795,wildberries,Wildberries,"г Санкт-Петербург, Рашетова Улица 14",,Leningrad,,RU,,,Mo-Su 10:00-21:00,Wildberries,Q24933714
170916,wildberries,Wildberries,"г Всеволожск, Улица Доктора Сотникова 15",,Leningrad,,RU,,,Mo-Su 10:00-21:00,Wildberries,Q24933714
170956,wildberries,Wildberries,"г Санкт-Петербург, Рыбацкий Проспект 18к2",,Leningrad,,RU,,,Mo-Su 10:00-21:00,Wildberries,Q24933714
170970,wildberries,Wildberries,"г Санкт-Петербург, Уральская Улица 21",,Leningrad,,RU,,,Mo-Su 10:00-21:00,Wildberries,Q24933714
171182,wildberries,Wildberries,"г Санкт-Петербург, Улица Оптиков 50к2",,Leningrad,,RU,,,Mo-Su 10:00-21:00,Wildberries,Q24933714
171284,wildberries,Wildberries,"п Мельниково, Улица Калинина 3",,Leningrad,,RU,,,Mo-Su 10:00-21:00,Wildberries,Q24933714
171383,wildberries,Wildberries,"г Санкт-Петербург, Улица Бутлерова 11к4",,Leningrad,,RU,,,Mo-Su 09:00-21:00,Wildberries,Q24933714
171452,wildberries,Wildberries,"г Тосно, Улица Максима Горького 19б",,Leningrad,,RU,,,Mo-Su 10:00-21:00,Wildberries,Q24933714
171464,wildberries,Wildberries,"пгт Сиверский, Улица Военный Городок 7",,Leningrad,,RU,,,Mo-Su 10:00-21:00,Wildberries,Q24933714
171741,wildberries,Wildberries,"г Тихвин, 6-Й Микрорайон 17",,Leningrad,,RU,,,Mo-Su 10:00-21:00,Wildberries,Q24933714
172120,wildberries,Wildberries,"д Терпилицы, Деревня Терпилицы 4",,Leningrad,,RU,,,Mo-Su 10:00-21:00,Wildberries,Q24933714
172208,wildberries,Wildberries,"г Тихвин, Микрорайон 1А 22",,Leningrad,,RU,,,Mo-Su 10:00-21:00,Wildberries,Q24933714
172275,wildberries,Wildberries,"г Санкт-Петербург, Туристская Улица 18к1",,Leningrad,,RU,,,Mo-Su 10:00-21:00,Wildberries,Q24933714
172320,wildberries,Wildberries,"г Подпорожье, Проспект Ленина 28",,Leningrad,,RU,,,Mo-Su 10:00-21:00,Wildberries,Q24933714
172347,wildberries,Wildberries,"пгт Ефимовский, 1-Й Микрорайон 12",,Leningrad,,RU,,,Mo-Su 09:00-20:00,Wildberries,Q24933714
172619,wildberries,Wildberries,"г Санкт-Петербург, Туристская Улица 15к1",,Leningrad,,RU,,,Mo-Su 09:00-21:00,Wildberries,Q24933714
172621,wildberries,Wildberries,"г Сясьстрой, Улица 25 Октября 11а",,Leningrad,,RU,,,Mo-Su 10:00-21:00,Wildberries,Q24933714
172695,wildberries,Wildberries,"Санкт-Петербург, Санкт-Петербург, улица Руднева, 21к1",,Leningrad,,RU,,,Mo-Su 10:00-21:00,Wildberries,Q24933714
173086,wildberries,Wildberries,"г Гатчина, Посёлок Новый Свет 12а",,Leningrad,,RU,,,Mo-Su 10:00-21:00,Wildberries,Q24933714
200040,wildberries,Wildberries,"п Кингисеппский, Посёлок Кингисеппский 1",,Leningrad,,RU,,,Mo-Su 10:00-21:00,Wildberries,Q24933714
200416,wildberries,Wildberries,"г Любань, Улица Ленина 11",,Leningrad,,RU,,,Mo-Su 09:00-21:00,Wildberries,Q24933714
201095,wildberries,Wildberries,"Ленинградская область, городской посёлок Павлово, Советская улица, 1А",,Leningrad,,RU,,,Mo-Su 10:00-21:00,Wildberries,Q24933714
201112,wildberries,Wildberries,"Санкт-Петербург, Улица Александра Матросова 1",,Leningrad,,RU,,,Mo-Su 10:00-21:00,Wildberries,Q24933714
201127,wildberries,Wildberries,"Санкт-Петербург, Проспект Авиаконструкторов 16к1",,Leningrad,,RU,,,Mo-Su 09:00-21:00,Wildberries,Q24933714
201131,wildberries,Wildberries,"г Приозерск, Ленинградское Шоссе 33",,Leningrad,,RU,,,Mo-Su 10:00-21:00,Wildberries,Q24933714
201153,wildberries,Wildberries,"Санкт-Петербург, посёлок Парголово, улица Валерия Гаврилина, 3к2",,Leningrad,,RU,,,Mo-Su 10:00-21:00,Wildberries,Q24933714
201231,wildberries,Wildberries,"д Старая, Верхняя Улица 5к1",,Leningrad,,RU,,,Mo-Su 09:00-21:00,Wildberries,Q24933714
201290,wildberries,Wildberries,"деревня Старая, Верхняя Улица 3к3",,Leningrad,,RU,,,Mo-Su 10:00-21:00,Wildberries,Q24933714
202441,wildberries,Wildberries,"Ленинградская область, Гатчина, улица Леонова, 5",,Leningrad,,RU,,,Mo-Su 10:00-21:00,Wildberries,Q24933714
202443,wildberries,Wildberries,"Ленинградская область, деревня Новое Девяткино, Капральская улица, 15",,Leningrad,,RU,,,Mo-Su 10:00-21:00,Wildberries,Q24933714
202466,wildberries,Wildberries,"посёлок Дунай, Привокзальная Улица 3",,Leningrad,,RU,,,Mo-Su 10:00-21:00,Wildberries,Q24933714
202469,wildberries,Wildberries,"Выборг, Улица Гагарина 27а",,Leningrad,,RU,,,Mo-Su 10:00-21:00,Wildberries,Q24933714
202647,wildberries,Wildberries,"Ленинградская область, городской посёлок Кузьмоловский, Молодёжная улица, 13",,Leningrad,,RU,,,Mo-Su 10:00-21:00,Wildberries,Q24933714
202773,wildberries,Wildberries,"деревня Старополье, Деревня Старополье 7",,Leningrad,,RU,,,Mo-Su 10:00-21:00,Wildberries,Q24933714
202836,wildberries,Wildberries,"деревня Большие Колпаны, Киевское Шоссе 79",,Leningrad,,RU,,,Mo-Su 10:00-21:00,Wildberries,Q24933714
203020,wildberries,Wildberries,"Гатчина, Рощинская Улица 13а",,Leningrad,,RU,,,Mo-Su 10:00-21:00,Wildberries,Q24933714
203024,wildberries,Wildberries,"Гатчина, Улица Слепнёва 9",,Leningrad,,RU,,,Mo-Su 10:00-21:00,Wildberries,Q24933714
203031,wildberries,Wildberries,"Ленинградская область, Пикалёво, улица Горняков, 10",,Leningrad,,RU,,,Mo-Su 10:00-21:00,Wildberries,Q24933714
203228,wildberries,Wildberries,"посёлок Осьмино, Улица Ленина 50",,Leningrad,,RU,,,Mo-Su 10:00-21:00,Wildberries,Q24933714
203325,wildberries,Wildberries,"Санкт-Петербург, Санкт-Петербург, Комендантский проспект, 60к3",,Leningrad,,RU,,,Mo-Su 10:00-21:00,Wildberries,Q24933714
203384,wildberries,Wildberries,"Всеволожск, Магистральная Улица 8",,Leningrad,,RU,,,Mo-Su 10:00-21:00,Wildberries,Q24933714
203490,wildberries,Wildberries,"Санкт-Петербург, Коломяжский Проспект 15к2",,Leningrad,,RU,,,Mo-Su 10:00-21:00,Wildberries,Q24933714
203798,wildberries,Wildberries,"Санкт-Петербург, Улица Валерия Гаврилина 11к1",,Leningrad,,RU,,,Mo-Su 10:00-21:00,Wildberries,Q24933714
203815,wildberries,Wildberries,"городской посёлок Дружная Горка, Улица Введенского 4",,Leningrad,,RU,,,Mo-Su 10:00-21:00,Wildberries,Q24933714
204018,wildberries,Wildberries,"Ленинградская область, городской посёлок Форносово, Круговая улица, 4",,Leningrad,,RU,,,Mo-Su 10:00-21:00,Wildberries,Q24933714
204050,wildberries,Wildberries,"Санкт-Петербург, Улица Ивана Фомина 7к3",,Leningrad,,RU,,,Mo-Su 09:00-21:00,Wildberries,Q24933714
204152,wildberries,Wildberries,"посёлок Глебычево, Улица Мира 1",,Leningrad,,RU,,,Mo-Su 10:00-21:00,Wildberries,Q24933714
204260,wildberries,Wildberries,"Гатчина, Рощинская Улица 14к1",,Leningrad,,RU,,,Mo-Su 09:00-21:00,Wildberries,Q24933714
204311,wildberries,Wildberries,"Санкт-Петербург, Планерная Улица 63к1",,Leningrad,,RU,,,Mo-Su 09:00-21:00,Wildberries,Q24933714
204372,wildberries,Wildberries,"Санкт-Петербург, Улица Шишкина 291к1",,Leningrad,,RU,,,Mo-Su 10:00-21:00,Wildberries,Q24933714
204444,wildberries,Wildberries,"Кингисепп, Улица Воровского 34",,Leningrad,,RU,,,Mo-Su 09:00-21:00,Wildberries,Q24933714
204463,wildberries,Wildberries,"Коммунар, Ленинградское Шоссе 11",,Leningrad,,RU,,,Mo-Su 10:00-21:00,Wildberries,Q24933714
204880,wildberries,Wildberries,"городской посёлок Назия, Школьный Проспект 13",,Leningrad,,RU,,,Mo-Su 10:00-21:00,Wildberries,Q24933714
204916,wildberries,Wildberries,"городской посёлок Приладожский, Садовая Улица 25",,Leningrad,,RU,,,Mo-Su 10:00-21:00,Wildberries,Q24933714
205144,wildberries,Wildberries,"Ленинградская область, Кингисепп, Большая Советская улица, 42",,Leningrad,,RU,,,Mo-Su 10:00-21:00,Wildberries,Q24933714
205177,wildberries,Wildberries,"г Волосово, Нарвская Улица 15",,Leningrad,,RU,,,Mo-Su 10:00-21:00,Wildberries,Q24933714
205330,wildberries,Wildberries,"Санкт-Петербург, Коломяжский Проспект 15к1",,Leningrad,,RU,,,Mo-Su 10:00-21:00,Wildberries,Q24933714
205736,wildberries,Wildberries,"Кировск, Краснофлотская Улица 31а",,Leningrad,,RU,,,Mo-Su 10:00-21:00,Wildberries,Q24933714
205905,wildberries,Wildberries,"городской посёлок Синявино, Улица Кравченко 6",,Leningrad,,RU,,,Mo-Su 10:00-21:00,Wildberries,Q24933714
205912,wildberries,Wildberries,"Красное Село, Территория Хвойный 45",,Leningrad,,RU,,,Mo-Su 10:00-21:00,Wildberries,Q24933714
205933,wildberries,Wildberries,"коттеджный посёлок Балтийская слобода 2, Покровская Улица 1",,Leningrad,,RU,,,Mo-Su 09:00-21:00,Wildberries,Q24933714
205968,wildberries,Wildberries,"Ленинградская область, посёлок Усть-Луга, квартал Ленрыба, 9",,Leningrad,,RU,,,Mo-Su 10:00-21:00,Wildberries,Q24933714
205999,wildberries,Wildberries,"Ленинградская область, Кириши, проспект Героев, 24",,Leningrad,,RU,,,Mo-Su 10:00-21:00,Wildberries,Q24933714
206014,wildberries,Wildberries,"Санкт-Петербург, Проспект Энгельса 137",,Leningrad,,RU,,,Mo-Su 10:00-21:00,Wildberries,Q24933714
206018,wildberries,Wildberries,"деревня Лаголово, Садовая Улица 4к1",,Leningrad,,RU,,,Mo-Su 10:00-21:00,Wildberries,Q24933714
