Ref,Spider,Name,Address,City,State,Zipcode,Country,Phone,Website,Hours,Brand,WikiData
2447,coffee_like,Coffee Like,"пр-т Просвещения, 34",г. Санкт-Петербург,Leningrad,,RU,,,,Coffee Like,Q55662627
554,coffee_like,Coffee Like,"просп. Европейский, 8",Кудрово,Leningrad,,RU,,,Mo-Fr 08:00-22:00; Sa-Su 10:00-22:00,Coffee Like,Q55662627
2457,coffee_like,Coffee Like,"пр-т Европейский, 15а",Кудрово,Leningrad,,RU,,,,Coffee Like,Q55662627
1766,coffee_like,Coffee Like,"просп. Европейский, 21 к2",Кудрово,Leningrad,,RU,,,Mo-Fr 08:00-22:00; Sa-Su 10:00-22:00,Coffee Like,Q55662627
1582,coffee_like,Coffee Like,"бульвар Менделеева, 11 к1",Мурино,Leningrad,,RU,,,Mo-Fr 07:30-22:00; Sa-Su 08:00-22:00,Coffee Like,Q55662627
1411,coffee_like,Coffee Like,"Привокзальная площадь, 3",Мурино,Leningrad,,RU,,,Mo-Sa 08:00-22:00; Su 09:00-21:30,Coffee Like,Q55662627
2061,coffee_like,Coffee Like,"ул. Федора Абрамова, 8",Санкт-Петербург,Leningrad,,RU,,,,Coffee Like,Q55662627
2317,coffee_like,Coffee Like,"ул. Тепловозная, 2А",Санкт-Петербург,Leningrad,,RU,,,Mo-Su 08:00-22:00,Coffee Like,Q55662627
2065,coffee_like,Coffee Like,"пр-т Королёва, 65А",Санкт-Петербург,Leningrad,,RU,,,,Coffee Like,Q55662627
1577,coffee_like,Coffee Like,"просп. Комендантский, 71",Санкт-Петербург,Leningrad,,RU,,,Mo-Fr 08:00-21:00; Sa-Su 09:00-21:00,Coffee Like,Q55662627
2353,coffee_like,Coffee Like,"наб. Свердловская, 44Ю (БЦ Зима)",Санкт-Петербург,Leningrad,,RU,,,,Coffee Like,Q55662627
2355,coffee_like,Coffee Like,"ул. Сердобольская, 64к1",Санкт-Петербург,Leningrad,,RU,,,,Coffee Like,Q55662627
2365,coffee_like,Coffee Like,"пр-т Испытателей, 9А",Санкт-Петербург,Leningrad,,RU,,,,Coffee Like,Q55662627
2132,coffee_like,Coffee Like,"пр-т Энгельса, 2",Санкт-Петербург,Leningrad,,RU,,,,Coffee Like,Q55662627
1116,coffee_like,Coffee Like,"просп. Просвещения, 34",Санкт-Петербург,Leningrad,,RU,,,Mo-Fr 08:00-22:00; Sa-Su 09:00-22:00,Coffee Like,Q55662627
2147,coffee_like,Coffee Like,"пр-т Коломяжский, 17/1",Санкт-Петербург,Leningrad,,RU,,,,Coffee Like,Q55662627
644,coffee_like,Coffee Like,"пос. Мурино, бул. Менделеева, 10",Санкт-Петербург,Leningrad,,RU,,,Mo-Fr 07:30-22:00; Sa-Su 08:00-22:00,Coffee Like,Q55662627
2279,coffee_like,Coffee Like,"пр-т Большой Сампсониевский, 56",Санкт-Петербург,Leningrad,,RU,,,,Coffee Like,Q55662627
2987,lukoil,AZS № 47105 Priozersk,"Russia, Leningrad region","Priozerskiy munitsipalnyy rayon, Priozerskoye gorodskoye poseleniye",Leningrad,,RU,,,24/7,Лукойл,Q329347
366,wildberries,Wildberries,"Ленинградская область, Кириши, Пионерская улица, 2",,Leningrad,,RU,,,Mo-Su 10:00-21:00,Wildberries,Q24933714
659,wildberries,Wildberries,г. Санкт-Петербург Комендантский проспект д. 51к1,,Leningrad,,RU,,,Mo-Su 08:00-22:00,Wildberries,Q24933714
687,wildberries,Wildberries,"п. Парголово (Санкт-Петербург г.), м. Парнас, ул. Федора Абрамова, 8 А",,Leningrad,,RU,,,Mo-Su 10:00-21:00,Wildberries,Q24933714
796,wildberries,Wildberries,"Ленинградская область, Всеволожск, Всеволожский проспект, 61",,Leningrad,,RU,,,Mo-Su 10:00-20:00,Wildberries,Q24933714
913,wildberries,Wildberries,"г. Санкт-Петербург, м. Лесная, ул. Александра Матросова, 20 корп.2А",,Leningrad,,RU,,,Mo-Su 08:00-22:00,Wildberries,Q24933714
977,wildberries,Wildberries,"г. Санкт-Петербург, пр-кт Металлистов, д. 111",,Leningrad,,RU,,,Mo-Su 08:00-22:00,Wildberries,Q24933714
999,wildberries,Wildberries,"г. Санкт-Петербург, пр-кт Энгельса, 47",,Leningrad,,RU,,,Mo-Su 08:00-22:00,Wildberries,Q24933714
1001,wildberries,Wildberries,"г. Санкт-Петербург, ш. Революции, 15",,Leningrad,,RU,,,Mo-Su 08:00-22:00,Wildberries,Q24933714
1004,wildberries,Wildberries,"г. Гатчина (Ленинградская обл.), пр-кт 25 Октября, 75",,Leningrad,,RU,,,Mo-Su 10:00-21:00,Wildberries,Q24933714
1009,wildberries,Wildberries,"г. Приозерск (Ленинградская область), Советская улица, д. 2Б",,Leningrad,,RU,,,Mo-Su 10:00-21:00,Wildberries,Q24933714
1727,wildberries,Wildberries,"г. Выборг (Ленинградская область), ул Ростовская улица, д. 5",,Leningrad,,RU,,,Mo-Su 10:00-21:00,Wildberries,Q24933714
1826,wildberries,Wildberries,"г. Санкт-Петербург, м Проспект Просвещения, улица Кустодиева, д. 19",,Leningrad,,RU,,,Mo-Su 08:00-22:00,Wildberries,Q24933714
1877,wildberries,Wildberries,"г. Санкт-Петербург, м Чёрная речка, набережная Чёрной речки, д. 10",,Leningrad,,RU,,,Mo-Su 08:00-22:00,Wildberries,Q24933714
1956,wildberries,Wildberries,"г. Санкт-Петербург, м Комендантский проспект, Туристская улица, д. 30к2 литер А",,Leningrad,,RU,,,Mo-Su 10:00-21:00,Wildberries,Q24933714
2034,wildberries,Wildberries,"г. Санкт-Петербург, м Новочеркасская, Большеохтинский проспект, д. 10",,Leningrad,,RU,,,Mo-Su 08:00-22:00,Wildberries,Q24933714
2100,wildberries,Wildberries,"г. Санкт-Петербург, м Чёрная речка, Ланское шоссе, д. 14к1",,Leningrad,,RU,,,Mo-Su 08:00-22:00,Wildberries,Q24933714
2141,wildberries,Wildberries,"г. Лодейное Поле (Ленинградская область), улица Гагарина, д. 13",,Leningrad,,RU,,,Mo-Su 10:00-21:00,Wildberries,Q24933714
2266,wildberries,Wildberries,"г. Тосно (Ленинградская область), проспект Ленина, д.3",,Leningrad,,RU,,,Mo-Su 08:00-22:00,Wildberries,Q24933714
2397,wildberries,Wildberries,"г. Луга (Ленинградская область), улица Красной Артиллерии, д. 7/18",,Leningrad,,RU,,,Mo-Su 10:00-21:00,Wildberries,Q24933714
2417,wildberries,Wildberries,"г. Санкт-Петербург, м Озерки, улица Есенина, д. 1к1",,Leningrad,,RU,,,Mo-Su 08:00-22:00,Wildberries,Q24933714
2425,wildberries,Wildberries,"г. Сланцы (Ленинградская область), улица Кирова, д. 20",,Leningrad,,RU,,,Mo-Su 08:00-22:00,Wildberries,Q24933714
2459,wildberries,Wildberries,"г. Бокситогорск (Ленинградская область), Школьная улица, д. 11/15",,Leningrad,,RU,,,Mo-Su 10:00-21:00,Wildberries,Q24933714
2587,wildberries,Wildberries,"г. Санкт-Петербург, Русановская улица, д. 19к4",,Leningrad,,RU,,,Mo-Su 10:00-21:00,Wildberries,Q24933714
2701,wildberries,Wildberries,"г. Пикалёво (Ленинградская область), Школьная улица, д. 58",,Leningrad,,RU,,,Mo-Su 10:00-21:00,Wildberries,Q24933714
2720,wildberries,Wildberries,"г. Кудрово (Ленинградская область), Европейский проспект, д. 18к2",,Leningrad,,RU,,,Mo-Su 08:00-22:00,Wildberries,Q24933714
2771,wildberries,Wildberries,"г. Санкт-Петербург, проспект Авиаконструкторов, д. 38к1",,Leningrad,,RU,,,Mo-Su 08:00-22:00,Wildberries,Q24933714
2804,wildberries,Wildberries,"г. Санкт-Петербург, улица Есенина, д. 32к1",,Leningrad,,RU,,,Mo-Su 08:00-22:00,Wildberries,Q24933714
2810,wildberries,Wildberries,"г. Сосновый Бор (Ленинградская область), Ленинградская улица, д. 70",,Leningrad,,RU,,,Mo-Su 08:00-22:00,Wildberries,Q24933714
3010,wildberries,Wildberries,"г. Выборг (Ленинградская область), проспект Ленина, д. 11Б",,Leningrad,,RU,,,Mo-Su 10:00-21:00,Wildberries,Q24933714
3026,wildberries,Wildberries,"г. Санкт-Петербург, м Беговая, улица Савушкина, д. 138",,Leningrad,,RU,,,Mo-Su 08:00-22:00,Wildberries,Q24933714
3078,wildberries,Wildberries,"г. Кингисепп (Ленинградская область), Крикковское шоссе, д. 20",,Leningrad,,RU,,,Mo-Su 08:00-22:00,Wildberries,Q24933714
3085,wildberries,Wildberries,"г. Санкт-Петербург, м Гражданский проспект, проспект Луначарского, д. 80к1",,Leningrad,,RU,,,Mo-Su 08:00-22:00,Wildberries,Q24933714
3115,wildberries,Wildberries,"г. Кириши (Ленинградская область), Волховская набережная, д. 50",,Leningrad,,RU,,,Mo-Su 10:00-21:00,Wildberries,Q24933714
3179,wildberries,Wildberries,"г. Кировск (Ленинградская область), Пионерская улица, д. 14",,Leningrad,,RU,,,Mo-Su 08:00-22:00,Wildberries,Q24933714
3208,wildberries,Wildberries,"Ленинградская область, г. Выборг, Ленинградское шоссе, д. 38",,Leningrad,,RU,,,Mo-Su 10:00-21:00,Wildberries,Q24933714
3291,wildberries,Wildberries,"г. Светогорск (Ленинградская область), Лесная улица, д. 11",,Leningrad,,RU,,,Mo-Su 10:00-21:00,Wildberries,Q24933714
3475,wildberries,Wildberries,"г. Отрадное (Ленинградская область), Вокзальная улица, д. 6",,Leningrad,,RU,,,Mo-Su 10:00-21:00,Wildberries,Q24933714
3507,wildberries,Wildberries,"г. Санкт-Петербург, проспект Энгельса, д. 70/1",,Leningrad,,RU,,,Mo-Su 08:00-22:00,Wildberries,Q24933714
3513,wildberries,Wildberries,"г. Волхов (Ленинградская область), Волховский проспект, д. 29",,Leningrad,,RU,,,Mo-Su 08:00-22:00,Wildberries,Q24933714
3559,wildberries,Wildberries,"г. Сясьстрой (Ленинградская область), улица Космонавтов, д. 4А",,Leningrad,,RU,,,Mo-Su 08:00-22:00,Wildberries,Q24933714
3596,wildberries,Wildberries,"г. Санкт-Петербург, улица Академика Лебедева, д. 21Б",,Leningrad,,RU,,,Mo-Su 08:00-22:00,Wildberries,Q24933714
3710,wildberries,Wildberries,"г. Всеволожск (Ленинградская область), улица Доктора Сотникова, д. 5",,Leningrad,,RU,,,Mo-Su 10:00-21:00,Wildberries,Q24933714
3881,wildberries,Wildberries,"г. Санкт-Петербург, проспект Маршака, д. 20",,Leningrad,,RU,,,Mo-Su 08:00-22:00,Wildberries,Q24933714
3996,wildberries,Wildberries,"г. Санкт-Петербург, Кондратьевский проспект, д. 62к6",,Leningrad,,RU,,,Mo-Su 10:00-21:00,Wildberries,Q24933714
4058,wildberries,Wildberries,"г. Приозерск (Ленинградская область), улица Гагарина, д. 18",,Leningrad,,RU,,,Mo-Su 10:00-21:00,Wildberries,Q24933714
4075,wildberries,Wildberries,"посёлок городского типа Ульяновка (Ленинградская область), ул. Левая линия, д. 49",,Leningrad,,RU,,,Mo-Su 10:00-21:00,Wildberries,Q24933714
4078,wildberries,Wildberries,"Санкт-Петербург, посёлок Парголово, улица Михаила Дудина, 10",,Leningrad,,RU,,,Mo-Su 10:00-21:00,Wildberries,Q24933714
4108,wildberries,Wildberries,"г. Гатчина (Ленинградская область), улица Урицкого, д. 11",,Leningrad,,RU,,,Mo-Su 10:00-21:00,Wildberries,Q24933714
4122,wildberries,Wildberries,"г. Шлиссельбург (Ленинградская область), улица Староладожский Канал, д. 24к1",Volosovskiy Rayon,Leningrad,,RU,,,Mo-Su 10:00-21:00,Wildberries,Q24933714
4124,wildberries,Wildberries,"г. Гатчина (Ленинградская область), улица Хохлова, д. 16",,Leningrad,,RU,,,Mo-Su 10:00-21:00,Wildberries,Q24933714
4140,wildberries,Wildberries,"г. Волосово (Ленинградская область), Краснофлотская улица, д. 4А",,Leningrad,,RU,,,Mo-Su 10:00-21:00,Wildberries,Q24933714
4206,wildberries,Wildberries,"г. Санкт-Петербург, м Рыбацкое, Прибрежная улица, д. 4",,Leningrad,,RU,,,Mo-Su 08:00-22:00,Wildberries,Q24933714
5006,wildberries,Wildberries,"Ленинградская область, Лодейное Поле, улица Володарского, 55",,Leningrad,,RU,,,Mo-Su 10:00-21:00,Wildberries,Q24933714
5086,wildberries,Wildberries,"г. Санкт-Петербург, Комендантский проспект, д. 69",,Leningrad,,RU,,,Mo-Su 08:00-22:00,Wildberries,Q24933714
5162,wildberries,Wildberries,"г. Санкт-Петербург, Богатырский проспект, д. 49к2",,Leningrad,,RU,,,Mo-Su 10:00-21:00,Wildberries,Q24933714
5242,wildberries,Wildberries,"г. Кингисепп (Ленинградская область), Железнодорожная улица, д. 7А",,Leningrad,,RU,,,Mo-Su 10:00-21:00,Wildberries,Q24933714
5248,wildberries,Wildberries,"Ленинградская область, г. Всеволожск, Колтушское шоссе, д. 44к1",,Leningrad,,RU,,,Mo-Su 08:00-22:00,Wildberries,Q24933714
5288,wildberries,Wildberries,"Санкт-Петербург, Санкт-Петербург, улица Софьи Ковалевской, 1к1",,Leningrad,,RU,,,Mo-Su 08:00-22:00,Wildberries,Q24933714
5433,wildberries,Wildberries,"г. Сертолово (Ленинградская область), Центральная улица, д. 1 корп 3",,Leningrad,,RU,,,Mo-Su 08:00-22:00,Wildberries,Q24933714
5596,wildberries,Wildberries,"г. Всеволожск (Ленинградская область), Александровская улица, д. 80А",,Leningrad,,RU,,,Mo-Su 10:00-21:00,Wildberries,Q24933714
5830,wildberries,Wildberries,"г. Кириши (Ленинградская область), проспект Героев, д. 11А",,Leningrad,,RU,,,Mo-Su 10:00-21:00,Wildberries,Q24933714
5926,wildberries,Wildberries,"г. Коммунар (Ленинградская область), Пионерская улица, д. 21",,Leningrad,,RU,,,Mo-Su 10:00-21:00,Wildberries,Q24933714
5993,wildberries,Wildberries,"г. Санкт-Петербург, Народная улица, д. 81",,Leningrad,,RU,,,Mo-Su 10:00-21:00,Wildberries,Q24933714
100310,wildberries,Wildberries,"г. Всеволожск (Ленинградская область), Христиновский проспект, д. 83к2",,Leningrad,,RU,,,Mo-Su 10:00-21:00,Wildberries,Q24933714
100913,wildberries,Wildberries,"г. Санкт-Петербург, проспект Маршала Блюхера, д. 7к2",,Leningrad,,RU,,,Mo-Su 08:00-22:00,Wildberries,Q24933714
101595,wildberries,Wildberries,"г. Тихвин (Ленинградская область), 1А микрорайон, д. 46к2",,Leningrad,,RU,,,Mo-Su 08:00-22:00,Wildberries,Q24933714
101813,wildberries,Wildberries,"г. Санкт-Петербург, проспект Металлистов, д. 100",,Leningrad,,RU,,,Mo-Su 08:00-22:00,Wildberries,Q24933714
101850,wildberries,Wildberries,"деревня Новое Девяткино (Ленинградская область), Школьная улица, д. 2",,Leningrad,,RU,,,Mo-Su 10:00-21:00,Wildberries,Q24933714
102065,wildberries,Wildberries,"г. Санкт-Петербург, проспект Культуры, д. 29к1",,Leningrad,,RU,,,Mo-Su 08:00-22:00,Wildberries,Q24933714
102351,wildberries,Wildberries,"г. Санкт-Петербург, Гражданский проспект, д. 4",,Leningrad,,RU,,,Mo-Su 08:00-22:00,Wildberries,Q24933714
102447,wildberries,Wildberries,"г. Никольское (Ленинградская область), Первомайская улица, д. 17к2",,Leningrad,,RU,,,Mo-Su 10:00-21:00,Wildberries,Q24933714
103169,wildberries,Wildberries,"г. Санкт-Петербург, Апрельская улица, д. 5",,Leningrad,,RU,,,Mo-Su 08:00-22:00,Wildberries,Q24933714
103326,wildberries,Wildberries,"Санкт-Петербург, Санкт-Петербург, Глухая Зеленина улица, 2",,Leningrad,,RU,,,Mo-Su 10:00-21:00,Wildberries,Q24933714
103588,wildberries,Wildberries,"городской посёлок Мга (Ленинградская область), Железнодорожная улица, д. 45",,Leningrad,,RU,,,Mo-Su 10:00-21:00,Wildberries,Q24933714
104186,wildberries,Wildberries,"г. Мурино (Ленинградская область), Петровский бульвар, д. 7",,Leningrad,,RU,,,Mo-Su 10:00-21:00,Wildberries,Q24933714
104201,wildberries,Wildberries,"посёлок городского типа Сиверский (Ленинградская область), улица Строителей, д. 14",,Leningrad,,RU,,,Mo-Su 10:00-21:00,Wildberries,Q24933714
104693,wildberries,Wildberries,г. Сосновый Бор (Ленинградская область) Красных Фортов 15/5,,Leningrad,,RU,,,Mo-Su 08:00-22:00,Wildberries,Q24933714
104820,wildberries,Wildberries,"г. Гатчина (Ленинградская область), улица Генерала Кныша, 2",,Leningrad,,RU,,,Mo-Su 10:00-21:00,Wildberries,Q24933714
104934,wildberries,Wildberries,"г. Луга (Ленинградская область), проспект Кирова, д. 55",,Leningrad,,RU,,,Mo-Su 10:00-21:00,Wildberries,Q24933714
105239,wildberries,Wildberries,"г. Подпорожье (Ленинградская область), улица Гнаровской, д. 3",,Leningrad,,RU,,,Mo-Su 10:00-21:00,Wildberries,Q24933714
105679,wildberries,Wildberries,д. Кудрово (Ленинградская обл) ул. Английская 2,,Leningrad,,RU,,,Mo-Su 10:00-21:00,Wildberries,Q24933714
105939,wildberries,Wildberries,"г. Санкт-Петербург, Богатырский проспект, д. 59к3",,Leningrad,,RU,,,Mo-Su 08:00-22:00,Wildberries,Q24933714
106175,wildberries,Wildberries,г. Гатчина (Ленинградская обл) Урицкого 30,,Leningrad,,RU,,,Mo-Su 10:00-21:00,Wildberries,Q24933714
106318,wildberries,Wildberries,"г Ивангород (Ленинградская обл, Кингисеппский р-н) Гагарина 11 А",,Leningrad,,RU,,,Mo-Su 10:00-21:00,Wildberries,Q24933714
106360,wildberries,Wildberries,г. Санкт-Петербург улица Шаврова 13к1,,Leningrad,,RU,,,Mo-Su 08:00-22:00,Wildberries,Q24933714
106380,wildberries,Wildberries,г. Волхов (Ленинградская обл) Кирова 18,,Leningrad,,RU,,,Mo-Su 08:00-22:00,Wildberries,Q24933714
106551,wildberries,Wildberries,Бугры Петровский бульвар  25,,Leningrad,,RU,,,Mo-Su 10:00-21:00,Wildberries,Q24933714
106555,wildberries,Wildberries,"пгт Кузьмоловский (Ленинградская обл, Всеволожский р-н) Железнодорожная 26",,Leningrad,,RU,,,Mo-Su 10:00-21:00,Wildberries,Q24933714
106692,wildberries,Wildberries,г. Выборг (Ленинградская обл) Ленинградское шоссе 59,,Leningrad,,RU,,,Mo-Su 10:00-21:00,Wildberries,Q24933714
106716,wildberries,Wildberries,г. Кингисепп (Ленинградская обл) Октябрьская 13,,Leningrad,,RU,,,Mo-Su 08:00-22:00,Wildberries,Q24933714
106857,wildberries,Wildberries,г.п.Новоселье Питерский проспект 7,,Leningrad,,RU,,,Mo-Su 10:00-21:00,Wildberries,Q24933714
107177,wildberries,Wildberries,"г Кириши (Россия, Ленинградская обл, Киришский р-н) Советская 19",,Leningrad,,RU,,,Mo-Su 10:00-21:00,Wildberries,Q24933714
107199,wildberries,Wildberries,г. Бокситогорск (Ленинградская обл) Красных следопытов 3,,Leningrad,,RU,,,Mo-Su 10:00-21:00,Wildberries,Q24933714
107213,wildberries,Wildberries,"Ленинградская область, г Выборг, Выборгская, 40",,Leningrad,,RU,,,Mo-Su 10:00-21:00,Wildberries,Q24933714
107571,wildberries,Wildberries,Приозерск (Ленинградская Область) Гоголя 7а,,Leningrad,,RU,,,Mo-Su 10:00-21:00,Wildberries,Q24933714
107694,wildberries,Wildberries,"д Кудрово (Россия, Ленинградская обл, Всеволожский р-н) Европейский проспект 13 к 6",,Leningrad,,RU,,,Mo-Su 10:00-21:00,Wildberries,Q24933714
107784,wildberries,Wildberries,"Ленинградская область, посёлок Сосново, Мичуринская улица, 2В",,Leningrad,,RU,,,Mo-Su 10:00-21:00,Wildberries,Q24933714
107869,wildberries,Wildberries,г Санкт-Петербург (Россия) Лыжный переулок 3,,Leningrad,,RU,,,Mo-Su 10:00-21:00,Wildberries,Q24933714
107931,wildberries,Wildberries,"г Санкт-Петербург, улица Даниила Хармса 6",,Leningrad,,RU,,,Mo-Su 08:00-22:00,Wildberries,Q24933714
108223,wildberries,Wildberries,"п Мурино (Россия, Ленинградская обл, Всеволожский р-н) шоссе в лаврики 89",,Leningrad,,RU,,,Mo-Su 10:00-21:00,Wildberries,Q24933714
108279,wildberries,Wildberries,"п Мурино Россия, Ленинградская обл, Всеволожский р-н Шувалова 27/7",,Leningrad,,RU,,,Mo-Su 10:00-21:00,Wildberries,Q24933714
108439,wildberries,Wildberries,Пикалево Советская 3,,Leningrad,,RU,,,Mo-Su 10:00-21:00,Wildberries,Q24933714
108652,wildberries,Wildberries,"г Луга (Россия, Ленинградская обл, Лужский р-н) Победы 7",,Leningrad,,RU,,,Mo-Su 10:00-21:00,Wildberries,Q24933714
109016,wildberries,Wildberries,"Санкт-Петербург, Санкт-Петербург, Фермское шоссе, 16",,Leningrad,,RU,,,Mo-Su 10:00-21:00,Wildberries,Q24933714
109055,wildberries,Wildberries,пгт Вырица (Ленинградская обл) Слуцкая 9а,,Leningrad,,RU,,,Mo-Su 10:00-21:00,Wildberries,Q24933714
109585,wildberries,Wildberries,"г Сосновый Бор Россия, Ленинградская обл улица Красных Фортов 49",,Leningrad,,RU,,,Mo-Su 10:00-21:00,Wildberries,Q24933714
109716,wildberries,Wildberries,деревня Кальтино (Ленинградская область) Колтушское шоссе 19к1,,Leningrad,,RU,,,Mo-Su 10:00-21:00,Wildberries,Q24933714
110331,wildberries,Wildberries,"г Тосно (Ленинградская область), улица Блинникова 6",,Leningrad,,RU,,,Mo-Su 08:00-22:00,Wildberries,Q24933714
111110,wildberries,Wildberries,"Ленинградская область, Всеволожск, Центральная улица, 10/2",,Leningrad,,RU,,,Mo-Su 08:00-22:00,Wildberries,Q24933714
111117,wildberries,Wildberries,"Янино-1 (Ленинградская область), Кольцевая улица 8к2",,Leningrad,,RU,,,Mo-Su 10:00-21:00,Wildberries,Q24933714
111174,wildberries,Wildberries,"Санкт-Петербург, Санкт-Петербург, улица Обручевых, 5",,Leningrad,,RU,,,Mo-Su 08:00-22:00,Wildberries,Q24933714
111195,wildberries,Wildberries,Подпорожье Красноармейская  14б,,Leningrad,,RU,,,Mo-Su 08:00-22:00,Wildberries,Q24933714
111393,wildberries,Wildberries,"Вартемяги (Ленинградская область), улица Ветеранов 1А",,Leningrad,,RU,,,Mo-Su 10:00-21:00,Wildberries,Q24933714
112380,wildberries,Wildberries,"Светогорск Ленинградская область, Выборгский район Спортивная 2",,Leningrad,,RU,,,Mo-Su 10:00-21:00,Wildberries,Q24933714
113132,wildberries,Wildberries,"Лодейное Поле (Ленинградская область), Профсоюзная улица 16",,Leningrad,,RU,,,Mo-Su 10:00-21:00,Wildberries,Q24933714
113306,wildberries,Wildberries,"Старая (Ленинградская область), улица Генерала Чоглокова 5",,Leningrad,,RU,,,Mo-Su 08:00-22:00,Wildberries,Q24933714
113325,wildberries,Wildberries,"г Санкт-Петербург, улица Тельмана 41к1",,Leningrad,,RU,,,Mo-Su 08:00-22:00,Wildberries,Q24933714
113496,wildberries,Wildberries,"Ленинградская область, Сертолово, Тихвинская улица, 8к3",,Leningrad,,RU,,,Mo-Su 10:00-21:00,Wildberries,Q24933714
114140,wildberries,Wildberries,"г Кириши (Ленинградская область), улица Нефтехимиков 22А",,Leningrad,,RU,,,Mo-Su 10:00-21:00,Wildberries,Q24933714
114594,wildberries,Wildberries,"г Санкт-Петербург, улица Орбели 27к1",,Leningrad,,RU,,,Mo-Su 08:00-22:00,Wildberries,Q24933714
114864,wildberries,Wildberries,"Отрадное (Ленинградская область), Лесная улица 1",,Leningrad,,RU,,,Mo-Su 10:00-21:00,Wildberries,Q24933714
