Ref,Spider,Name,Address,City,State,Zipcode,Country,Phone,Website,Hours,Brand,WikiData
115347,wildberries,Wildberries,"Новая Ладога (Ленинградская область), микрорайон В, д 14",,Leningrad,,RU,,,Mo-Su 10:00-21:00,Wildberries,Q24933714
115435,wildberries,Wildberries,"Санкт-Петербург, Шуваловский 74к1",,Leningrad,,RU,,,Mo-Su 08:00-22:00,Wildberries,Q24933714
116921,wildberries,Wildberries,"г Санкт-Петербург, улица Верности 14к2",,Leningrad,,RU,,,Mo-Su 08:00-22:00,Wildberries,Q24933714
117728,wildberries,Wildberries,"Россия, Санкт-Петербург, Богословская улица, 4к1",,Leningrad,,RU,,,Mo-Su 08:00-22:00,Wildberries,Q24933714
117883,wildberries,Wildberries,Тихвин (Ленинградская обл) 4-и мкр 31,,Leningrad,,RU,,,Mo-Su 08:00-22:00,Wildberries,Q24933714
118309,wildberries,Wildberries,"Санкт-Петербург, посёлок Парголово, улица Валерия Гаврилина, 13к1",,Leningrad,,RU,,,Mo-Su 10:00-21:00,Wildberries,Q24933714
120579,wildberries,Wildberries,"Санкт-Петербург, Туристская улица 23к1",,Leningrad,,RU,,,Mo-Su 10:00-21:00,Wildberries,Q24933714
121136,wildberries,Wildberries,"г Волосово, Вингисаара 29",,Leningrad,,RU,,,Mo-Su 10:00-21:00,Wildberries,Q24933714
121137,wildberries,Wildberries,"г Санкт-Петербург, Шостаковича 5к1",,Leningrad,,RU,,,Mo-Su 10:00-21:00,Wildberries,Q24933714
121441,wildberries,Wildberries,"п Аннино, Весенняя Улица 1а",,Leningrad,,RU,,,Mo-Su 09:00-21:00,Wildberries,Q24933714
121693,wildberries,Wildberries,"г Гатчина, Улица Авиатриссы Зверевой 14",,Leningrad,,RU,,,Mo-Su 10:00-21:00,Wildberries,Q24933714
121891,wildberries,Wildberries,"г Санкт-Петербург, Проспект Металлистов 115",,Leningrad,,RU,,,Mo-Su 10:00-21:00,Wildberries,Q24933714
121892,wildberries,Wildberries,"г Санкт-Петербург, Бестужевская Улица 10",,Leningrad,,RU,,,Mo-Su 10:00-21:00,Wildberries,Q24933714
121897,wildberries,Wildberries,"г Петергоф, Парковая Улица 18",,Leningrad,,RU,,,Mo-Su 10:00-21:00,Wildberries,Q24933714
122289,wildberries,Wildberries,"г Всеволожск, Советская Улица 2",,Leningrad,,RU,,,Mo-Su 10:00-21:00,Wildberries,Q24933714
122319,wildberries,Wildberries,"г Волосово, Улица Красных Командиров 7",,Leningrad,,RU,,,Mo-Su 10:00-21:00,Wildberries,Q24933714
122320,wildberries,Wildberries,"г Сланцы, Улица Маяковского 6",,Leningrad,,RU,,,Mo-Su 10:00-21:00,Wildberries,Q24933714
122357,wildberries,Wildberries,"п Сосново, Вокзальная Улица 21а",,Leningrad,,RU,,,Mo-Su 10:00-21:00,Wildberries,Q24933714
123111,wildberries,Wildberries,"г Санкт-Петербург, Городской Посёлок Новоселье 4а",,Leningrad,,RU,,,Mo-Su 10:00-21:00,Wildberries,Q24933714
123244,wildberries,Wildberries,"г Санкт-Петербург, Улица Есенина 36к3",,Leningrad,,RU,,,Mo-Su 09:00-21:00,Wildberries,Q24933714
123261,wildberries,Wildberries,"г Санкт-Петербург, Заречная Улица 45к1",,Leningrad,,RU,,,Mo-Su 10:00-21:00,Wildberries,Q24933714
123512,wildberries,Wildberries,Кудрово Ленинградская обл Венская улица 4к1,,Leningrad,,RU,,,Mo-Su 10:00-21:00,Wildberries,Q24933714
123667,wildberries,Wildberries,"д Новое Девяткино, Главная Улица 56",,Leningrad,,RU,,,Mo-Su 10:00-21:00,Wildberries,Q24933714
123670,wildberries,Wildberries,"Сланцы Ленинградская область, Сланцевский район улица Максима Горького 6",,Leningrad,,RU,,,Mo-Su 10:00-21:00,Wildberries,Q24933714
123739,wildberries,Wildberries,"г Санкт-Петербург, Большой Сампсониевский Проспект 75",,Leningrad,,RU,,,Mo-Su 09:00-21:00,Wildberries,Q24933714
123810,wildberries,Wildberries,"п Мыза-Ивановка, Привокзальная Улица 2б",,Leningrad,,RU,,,Mo-Su 10:00-21:00,Wildberries,Q24933714
124155,wildberries,Wildberries,"г Санкт-Петербург, Проспект Пархоменко 5",,Leningrad,,RU,,,Mo-Su 10:00-21:00,Wildberries,Q24933714
124236,wildberries,Wildberries,"п Куркиеки, Улица Ленина 2",,Leningrad,,RU,,,Mo-Su 10:00-21:00,Wildberries,Q24933714
124516,wildberries,Wildberries,"Тихвин Ленинградская область, Тихвинский район улица Пролетарской Диктатуры 35",,Leningrad,,RU,,,Mo-Su 10:00-21:00,Wildberries,Q24933714
124814,wildberries,Wildberries,"г Санкт-Петербург, Пионерская Улица 50",,Leningrad,,RU,,,Mo-Su 10:00-21:00,Wildberries,Q24933714
125049,wildberries,Wildberries,"п Мурино, Оборонная Улица 37к2",,Leningrad,,RU,,,Mo-Su 10:00-21:00,Wildberries,Q24933714
126430,wildberries,Wildberries,"Мурино Ленинградская обл, Всеволожский р-н улица Шоссе в Лаврики 83",,Leningrad,,RU,,,Mo-Su 10:00-22:00,Wildberries,Q24933714
126647,wildberries,Wildberries,"г Санкт-Петербург, Проспект Королёва 65",,Leningrad,,RU,,,Mo-Su 10:00-21:00,Wildberries,Q24933714
126815,wildberries,Wildberries,"г Санкт-Петербург, Проспект Королёва 73",,Leningrad,,RU,,,Mo-Su 10:00-21:00,Wildberries,Q24933714
126906,wildberries,Wildberries,"г Всеволожск, Улица Шишканя 14",,Leningrad,,RU,,,Mo-Su 10:00-21:00,Wildberries,Q24933714
127042,wildberries,Wildberries,"д Гарболово, Деревня Гарболово 214",,Leningrad,,RU,,,Mo-Su 10:00-21:00,Wildberries,Q24933714
127276,wildberries,Wildberries,"Мурино Ленинградская область, Всеволожский район Скандинавский проезд 8к2",,Leningrad,,RU,,,Mo-Su 10:00-21:00,Wildberries,Q24933714
127279,wildberries,Wildberries,"Мурино Ленинградская область, Всеволожский район бульвар Менделеева 11к2",,Leningrad,,RU,,,Mo-Su 10:00-21:00,Wildberries,Q24933714
127438,wildberries,Wildberries,"п Мурино, Новая Улица 7",,Leningrad,,RU,,,Mo-Su 10:00-21:00,Wildberries,Q24933714
128667,wildberries,Wildberries,"Санкт-Петербург, посёлок Парголово, улица Фёдора Абрамова, 21к3",,Leningrad,,RU,,,Mo-Su 10:00-21:00,Wildberries,Q24933714
129901,wildberries,Wildberries,"д Гостилицы, Школьная Улица 12а",,Leningrad,,RU,,,Mo-Su 09:00-20:00,Wildberries,Q24933714
130050,wildberries,Wildberries,"д Снегиревка, Центральная Улица 10",,Leningrad,,RU,,,Mo-Su 10:00-21:00,Wildberries,Q24933714
130229,wildberries,Wildberries,"г Приозерск, Улица Ленина 38а",,Leningrad,,RU,,,Mo-Su 10:00-21:00,Wildberries,Q24933714
130416,wildberries,Wildberries,"г Санкт-Петербург, Сибирская Улица 16",,Leningrad,,RU,,,Mo-Su 10:00-21:00,Wildberries,Q24933714
130474,wildberries,Wildberries,"д Кудрово, Европейский Проспект 20к4",,Leningrad,,RU,,,Mo-Su 10:00-21:00,Wildberries,Q24933714
130750,wildberries,Wildberries,"пгт Им Морозова, Улица Мира 10",,Leningrad,,RU,,,Mo-Su 09:00-21:00,Wildberries,Q24933714
130925,wildberries,Wildberries,"пгт Рощино, Советская Улица 8а",,Leningrad,,RU,,,Mo-Su 10:00-21:00,Wildberries,Q24933714
131618,wildberries,Wildberries,"Кингисепп Ленинградская область, Кингисеппский район улица Химиков 7В",,Leningrad,,RU,,,Mo-Su 10:00-21:00,Wildberries,Q24933714
132253,wildberries,Wildberries,"Санкт-Петербург, Санкт-Петербург, Русановская улица, 16к3",,Leningrad,,RU,,,Mo-Su 08:00-22:00,Wildberries,Q24933714
132316,wildberries,Wildberries,"п Новый Учхоз, Площадь Усова 11",,Leningrad,,RU,,,Mo-Su 10:00-21:00,Wildberries,Q24933714
133079,wildberries,Wildberries,"п Парголово, Улица Фёдора Абрамова 21к3",,Leningrad,,RU,,,Mo-Su 10:00-21:00,Wildberries,Q24933714
133127,wildberries,Wildberries,"г Санкт-Петербург, Придорожная Аллея 19",,Leningrad,,RU,,,Mo-Su 10:00-21:00,Wildberries,Q24933714
133287,wildberries,Wildberries,"Санкт-Петербург, посёлок Парголово, Заречная улица, 10",,Leningrad,,RU,,,Mo-Su 10:00-21:00,Wildberries,Q24933714
133519,wildberries,Wildberries,"г Санкт-Петербург, Улица Валерия Гаврилина 3к1",,Leningrad,,RU,,,Mo-Su 10:00-21:00,Wildberries,Q24933714
133542,wildberries,Wildberries,"д Агалатово, Деревня Агалатово 209к2",,Leningrad,,RU,,,Mo-Su 09:00-21:00,Wildberries,Q24933714
133654,wildberries,Wildberries,"г Санкт-Петербург, Проспект Художников 35",,Leningrad,,RU,,,Mo-Su 10:00-21:00,Wildberries,Q24933714
134006,wildberries,Wildberries,"г мурино, Воронцовский Бульвар 22",,Leningrad,,RU,,,Mo-Su 10:00-21:00,Wildberries,Q24933714
134222,wildberries,Wildberries,Санкт-Петербург Россия улица Шоссе в Лаврики 76,,Leningrad,,RU,,,Mo-Su 10:00-21:00,Wildberries,Q24933714
134342,wildberries,Wildberries,"д Янино-1, Ясная Улица 11к5",,Leningrad,,RU,,,Mo-Su 10:00-21:00,Wildberries,Q24933714
134368,wildberries,Wildberries,"д Кудрово, Европейский Проспект 2к1",,Leningrad,,RU,,,Mo-Su 10:00-21:00,Wildberries,Q24933714
134586,wildberries,Wildberries,"г Санкт-Петербург, Шлиссельбургский Проспект 17к1",,Leningrad,,RU,,,Mo-Su 10:00-21:00,Wildberries,Q24933714
134676,wildberries,Wildberries,"г Санкт-Петербург, Улица Савушкина 131",,Leningrad,,RU,,,Mo-Su 10:00-21:00,Wildberries,Q24933714
134971,wildberries,Wildberries,"г Санкт-Петербург, Улица Шоссе В Лаврики 59к1",,Leningrad,,RU,,,Mo-Su 09:00-21:00,Wildberries,Q24933714
135244,wildberries,Wildberries,"г Санкт-Петербург, Муринская Дорога 51к1",,Leningrad,,RU,,,Mo-Su 10:00-21:00,Wildberries,Q24933714
135363,wildberries,Wildberries,"г Санкт-Петербург, Арсенальная Улица 9",,Leningrad,,RU,,,Mo-Su 10:00-21:00,Wildberries,Q24933714
135635,wildberries,Wildberries,"г Кингисепп, Восточная Улица 2б",,Leningrad,,RU,,,Mo-Su 10:00-21:00,Wildberries,Q24933714
135645,wildberries,Wildberries,"п Бугры, Школьная Улица 11к2",,Leningrad,,RU,,,Mo-Su 09:00-21:00,Wildberries,Q24933714
136049,wildberries,Wildberries,"г Санкт-Петербург, Проспект Художников 43/14",,Leningrad,,RU,,,Mo-Su 10:00-21:00,Wildberries,Q24933714
136205,wildberries,Wildberries,"Гп Токсово, Привокзальная Улица 20б",,Leningrad,,RU,,,Mo-Su 10:00-21:00,Wildberries,Q24933714
136236,wildberries,Wildberries,"д Хапо-Ое, Шоссейная Улица 25",,Leningrad,,RU,,,Mo-Su 09:00-21:00,Wildberries,Q24933714
136402,wildberries,Wildberries,"г Всеволожск, Пушкинская Улица 63",,Leningrad,,RU,,,Mo-Su 10:00-21:00,Wildberries,Q24933714
136503,wildberries,Wildberries,Санкт-Петербург Россия Рыбацкий проспект 17к1,,Leningrad,,RU,,,Mo-Su 10:00-21:00,Wildberries,Q24933714
136748,wildberries,Wildberries,"г Санкт-Петербург, Улица Николая Рубцова 5",,Leningrad,,RU,,,Mo-Su 10:00-21:00,Wildberries,Q24933714
137450,wildberries,Wildberries,"г мурино, Садовая Улица 26б",,Leningrad,,RU,,,Mo-Su 10:00-21:00,Wildberries,Q24933714
137673,wildberries,Wildberries,"д Куйвози, Первомайская Улица 2в",,Leningrad,,RU,,,Mo-Su 09:00-21:00,Wildberries,Q24933714
138221,wildberries,Wildberries,"снт СНТ Лесное-2 массива Никольское, Школьная Улица 2",,Leningrad,,RU,,,Mo-Su 10:00-22:00,Wildberries,Q24933714
138340,wildberries,Wildberries,"г Санкт-Петербург, Муринская Дорога 63к2",,Leningrad,,RU,,,Mo-Su 10:00-21:00,Wildberries,Q24933714
138350,wildberries,Wildberries,"гп Фёдоровское (Ленинградская обл), ул Центральная, д 6 ",,Leningrad,,RU,,,Mo-Su 10:00-21:00,Wildberries,Q24933714
138356,wildberries,Wildberries,"д Янино-1, Ясная Улица 16",,Leningrad,,RU,,,Mo-Su 10:00-21:00,Wildberries,Q24933714
138436,wildberries,Wildberries,"пгт Невская Дубровка, Советская Улица 17",,Leningrad,,RU,,,Mo-Su 10:00-21:00,Wildberries,Q24933714
138508,wildberries,Wildberries,Вяхтелево Вишнёвая улица 2В,,Leningrad,,RU,,,Mo-Su 10:00-21:00,Wildberries,Q24933714
138884,wildberries,Wildberries,Сосновый Бор Ленинградская обл Ленинградская улица 60А,,Leningrad,,RU,,,Mo-Su 10:00-21:00,Wildberries,Q24933714
139112,wildberries,Wildberries,"г Кировск, Бульвар Партизанской Славы 3",,Leningrad,,RU,,,Mo-Su 10:00-21:00,Wildberries,Q24933714
139463,wildberries,Wildberries,"г Всеволожск, Ленинградская Улица 18",,Leningrad,,RU,,,Mo-Su 10:00-21:00,Wildberries,Q24933714
139867,wildberries,Wildberries,"п Мурино, Ручьёвский Проспект 4/26",,Leningrad,,RU,,,Mo-Su 09:00-21:00,Wildberries,Q24933714
140007,wildberries,Wildberries,"пгт Сертолово-1, Улица Ларина 15к1",,Leningrad,,RU,,,Mo-Su 10:00-21:00,Wildberries,Q24933714
140227,wildberries,Wildberries,"п Мурино, Воронцовский Бульвар 17",,Leningrad,,RU,,,Mo-Su 10:00-21:00,Wildberries,Q24933714
140230,wildberries,Wildberries,"г Санкт-Петербург, Проспект Королёва 63к1",,Leningrad,,RU,,,Mo-Su 10:00-21:00,Wildberries,Q24933714
140246,wildberries,Wildberries,Санкт-Петербург Россия Большой Сампсониевский проспект 18,,Leningrad,,RU,,,Mo-Su 08:00-22:00,Wildberries,Q24933714
140456,wildberries,Wildberries,Сосновый Бор Ленинградская обл Солнечная улица 33А,,Leningrad,,RU,,,Mo-Su 10:00-21:00,Wildberries,Q24933714
140631,wildberries,Wildberries,"пгт Сертолово-1, Кленовая Улица 7к1",,Leningrad,,RU,,,Mo-Su 09:00-21:00,Wildberries,Q24933714
140988,wildberries,Wildberries,Санкт-Петербург  улица Оптиков 37,,Leningrad,,RU,,,Mo-Su 08:00-22:00,Wildberries,Q24933714
141008,wildberries,Wildberries,"г Шлиссельбург, Улица Малоневский Канал 12а",Volosovskiy Rayon,Leningrad,,RU,,,Mo-Su 10:00-21:00,Wildberries,Q24933714
141058,wildberries,Wildberries,"г Санкт-Петербург, Гжатская Улица 22к2",,Leningrad,,RU,,,Mo-Su 09:00-21:00,Wildberries,Q24933714
141082,wildberries,Wildberries,Санкт-Петербург Россия Комендантский проспект 66к1,,Leningrad,,RU,,,Mo-Su 08:00-22:00,Wildberries,Q24933714
141147,wildberries,Wildberries,"г Санкт-Петербург, Гражданский Проспект 80к1",,Leningrad,,RU,,,Mo-Su 10:00-21:00,Wildberries,Q24933714
141237,wildberries,Wildberries,"Ленинградская область, Мурино, Охтинская аллея, 6",,Leningrad,,RU,,,Mo-Su 10:00-21:00,Wildberries,Q24933714
141676,wildberries,Wildberries,"Санкт-Петербург, Санкт-Петербург, Фермское шоссе, 32",,Leningrad,,RU,,,Mo-Su 10:00-21:00,Wildberries,Q24933714
141721,wildberries,Wildberries,"Санкт-Петербург, Санкт-Петербург, Шлиссельбургский проспект, 32к1",,Leningrad,,RU,,,Mo-Su 10:00-22:00,Wildberries,Q24933714
142133,wildberries,Wildberries,Санкт-Петербург  Шлиссельбургский проспект 6к2,,Leningrad,,RU,,,Mo-Su 08:00-22:00,Wildberries,Q24933714
142217,wildberries,Wildberries,"Ленинградская область, Гатчина, бульвар Авиаторов, 3",,Leningrad,,RU,,,Mo-Su 10:00-21:00,Wildberries,Q24933714
142219,wildberries,Wildberries,"Санкт-Петербург, Санкт-Петербург, проспект Художников, 30к1",,Leningrad,,RU,,,Mo-Su 10:00-21:00,Wildberries,Q24933714
142296,wildberries,Wildberries,"г Кировск, Новая Улица 23",,Leningrad,,RU,,,Mo-Su 10:00-21:00,Wildberries,Q24933714
142298,wildberries,Wildberries,Санкт-Петербург Заречная улица 37,,Leningrad,,RU,,,Mo-Su 10:00-21:00,Wildberries,Q24933714
142355,wildberries,Wildberries,"Ленинградская область, Кудрово, Пражская улица, 15",,Leningrad,,RU,,,Mo-Su 10:00-21:00,Wildberries,Q24933714
142415,wildberries,Wildberries,Парголово Санкт-Петербург улица Николая Рубцова 12к1,,Leningrad,,RU,,,Mo-Su 10:00-21:00,Wildberries,Q24933714
142466,wildberries,Wildberries,"г Гатчина, Улица Генерала Сандалова 1а",,Leningrad,,RU,,,Mo-Su 10:00-21:00,Wildberries,Q24933714
143115,wildberries,Wildberries,"Санкт-Петербург, Санкт-Петербург, Пискарёвский проспект, 20",,Leningrad,,RU,,,Mo-Su 10:00-21:00,Wildberries,Q24933714
143345,wildberries,Wildberries,Санкт-Петербург  Большой Сампсониевский пр 38-40,,Leningrad,,RU,,,Mo-Su 08:00-22:00,Wildberries,Q24933714
144043,wildberries,Wildberries,"г Санкт-Петербург, Ропшинское Шоссе 9д",,Leningrad,,RU,,,Mo-Su 10:00-21:00,Wildberries,Q24933714
144052,wildberries,Wildberries,"г Санкт-Петербург, Улица Оптиков 45к1",,Leningrad,,RU,,,Mo-Su 10:00-21:00,Wildberries,Q24933714
144266,wildberries,Wildberries,"снт СНТ Сокол-1 массива Никольское, Советский Проспект 144к2",,Leningrad,,RU,,,Mo-Su 10:00-22:00,Wildberries,Q24933714
144678,wildberries,Wildberries,Светогорск Красноармейская 12а,,Leningrad,,RU,,,Mo-Su 10:00-21:00,Wildberries,Q24933714
145014,wildberries,Wildberries,"Кудрово (Ленинградская область), Пражская улица, 13",,Leningrad,,RU,,,Mo-Su 10:00-21:00,Wildberries,Q24933714
145048,wildberries,Wildberries,"г Санкт-Петербург, Советский Проспект 217",,Leningrad,,RU,,,Mo-Su 10:00-21:00,Wildberries,Q24933714
145705,wildberries,Wildberries,"п Мурино, Петровский Бульвар 2к2",,Leningrad,,RU,,,Mo-Su 10:00-21:00,Wildberries,Q24933714
146884,wildberries,Wildberries,"Лодейное Поле Ленинградская обл, Лодейнопольский р-н улица Гагарина 8",,Leningrad,,RU,,,Mo-Su 10:00-21:00,Wildberries,Q24933714
146989,wildberries,Wildberries,"Ленинградская область, Всеволожск, Коралловская улица, 16",,Leningrad,,RU,,,Mo-Su 10:00-21:00,Wildberries,Q24933714
147112,wildberries,Wildberries,Выборг Мира 4,,Leningrad,,RU,,,Mo-Su 10:00-21:00,Wildberries,Q24933714
147686,wildberries,Wildberries,"Ленинградская область, Гатчина, Воскова, 1Б",,Leningrad,,RU,,,Mo-Su 10:00-21:00,Wildberries,Q24933714
147717,wildberries,Wildberries,"г Санкт-Петербург, Комендантский Проспект 55к1",,Leningrad,,RU,,,Mo-Su 10:00-21:00,Wildberries,Q24933714
147928,wildberries,Wildberries,Санкт-Петербург  улица Фёдора Абрамова 4,,Leningrad,,RU,,,Mo-Su 10:00-21:00,Wildberries,Q24933714
148200,wildberries,Wildberries,"Коммунар Ленинградская обл, Гатчинский р-н Ижорская улица 24Б",,Leningrad,,RU,,,Mo-Su 10:00-21:00,Wildberries,Q24933714
148802,wildberries,Wildberries,"Ленинградская область, деревня Старая, Школьный переулок, 5к1",,Leningrad,,RU,,,Mo-Su 10:00-21:00,Wildberries,Q24933714
150154,wildberries,Wildberries,"г Санкт-Петербург, Проспект Непокорённых 74",,Leningrad,,RU,,,Mo-Su 10:00-21:00,Wildberries,Q24933714
150382,wildberries,Wildberries,"пгт Мга, Железнодорожная Улица 58",,Leningrad,,RU,,,Mo-Su 10:00-21:00,Wildberries,Q24933714
150501,wildberries,Wildberries,"Ленинградская область, Кудрово, Столичная улица, 11к2",,Leningrad,,RU,,,Mo-Su 10:00-21:00,Wildberries,Q24933714
150511,wildberries,Wildberries,"д Горбунки, Деревня Горбунки 49",,Leningrad,,RU,,,Mo-Su 10:00-22:00,Wildberries,Q24933714
150517,wildberries,Wildberries,"г Выборг, Ленинградское Шоссе 18",,Leningrad,,RU,,,Mo-Su 09:00-21:00,Wildberries,Q24933714
150544,wildberries,Wildberries,"г Выборг, Проспект Победы 37",,Leningrad,,RU,,,Mo-Su 10:00-21:00,Wildberries,Q24933714
150587,wildberries,Wildberries,"пгт Мга, Донецкая Улица 1",,Leningrad,,RU,,,Mo-Su 10:00-21:00,Wildberries,Q24933714
150600,wildberries,Wildberries,"г Санкт-Петербург, Замшина Улица 31",,Leningrad,,RU,,,Mo-Su 09:00-21:00,Wildberries,Q24933714
150839,wildberries,Wildberries,"г Санкт-Петербург, Кондратьевский Проспект 70к1",,Leningrad,,RU,,,Mo-Su 09:00-21:00,Wildberries,Q24933714
151039,wildberries,Wildberries,"г Санкт-Петербург, Ипподромный Переулок 3к1",,Leningrad,,RU,,,Mo-Su 10:00-21:00,Wildberries,Q24933714
151136,wildberries,Wildberries,"г Петергоф, Парковая Улица 16к2",,Leningrad,,RU,,,Mo-Su 10:00-21:00,Wildberries,Q24933714
151392,wildberries,Wildberries,"г Санкт-Петербург, Улица Михаила Дудина 25к1",,Leningrad,,RU,,,Mo-Su 10:00-21:00,Wildberries,Q24933714
151527,wildberries,Wildberries,"г Санкт-Петербург, Ропшинское Шоссе 1а",,Leningrad,,RU,,,Mo-Su 10:00-21:00,Wildberries,Q24933714
151818,wildberries,Wildberries,"г Санкт-Петербург, Кондратьевский Проспект 83к1",,Leningrad,,RU,,,Mo-Su 10:00-21:00,Wildberries,Q24933714
151913,wildberries,Wildberries,"г Санкт-Петербург, Улица Савушкина 143к1",,Leningrad,,RU,,,Mo-Su 10:00-21:00,Wildberries,Q24933714
152162,wildberries,Wildberries,"г Санкт-Петербург, Плесецкая Улица 10",,Leningrad,,RU,,,Mo-Su 09:00-21:00,Wildberries,Q24933714
152251,wildberries,Wildberries,Новая Ладога Карла Маркса 6А,,Leningrad,,RU,,,Mo-Su 10:00-21:00,Wildberries,Q24933714
152255,wildberries,Wildberries,"г Выборг, Рубежная Улица 36",,Leningrad,,RU,,,Mo-Su 10:00-22:00,Wildberries,Q24933714
152766,wildberries,Wildberries,"Коммунар Ленинградская обл, Гатчинский р-н Гатчинская улица 18Б",,Leningrad,,RU,,,Mo-Su 10:00-21:00,Wildberries,Q24933714
153056,wildberries,Wildberries,Кудрово Европейский проспект 21к2,,Leningrad,,RU,,,Mo-Su 10:00-21:00,Wildberries,Q24933714
153263,wildberries,Wildberries,"д Липово, Проспект Героев 35",,Leningrad,,RU,,,Mo-Su 10:00-21:00,Wildberries,Q24933714
153421,wildberries,Wildberries,"п Янино, Улица Тюльпанов 1",,Leningrad,,RU,,,Mo-Su 10:00-21:00,Wildberries,Q24933714
153475,wildberries,Wildberries,"пгт Токсово, Привокзальная Улица 20б",,Leningrad,,RU,,,Mo-Su 10:00-21:00,Wildberries,Q24933714
154108,wildberries,Wildberries,"Россия, Санкт-Петербург, проспект Металлистов, 116к1",,Leningrad,,RU,,,Mo-Su 10:00-21:00,Wildberries,Q24933714
154402,wildberries,Wildberries,"Ленинградская область, Всеволожск, Московская улица, 21",,Leningrad,,RU,,,Mo-Su 10:00-21:00,Wildberries,Q24933714
155895,wildberries,Wildberries,Санкт-Петербург  улица Жукова 1,,Leningrad,,RU,,,Mo-Su 10:00-21:00,Wildberries,Q24933714
156011,wildberries,Wildberries,"Санкт-Петербург, Санкт-Петербург, Караваевская улица, 23",,Leningrad,,RU,,,Mo-Su 10:00-22:00,Wildberries,Q24933714
157022,wildberries,Wildberries,"г Выборг, Проспект Победы 9б",,Leningrad,,RU,,,Mo-Su 10:00-22:00,Wildberries,Q24933714
157049,wildberries,Wildberries,"п Курск, Посёлок Курск 14",,Leningrad,,RU,,,Mo-Su 10:00-21:00,Wildberries,Q24933714
157142,wildberries,Wildberries,"г Выборг, Выборгская Улица 6",,Leningrad,,RU,,,Mo-Su 10:00-21:00,Wildberries,Q24933714
157272,wildberries,Wildberries,"пгт Сертолово-1, Микрорайон Чёрная Речка 10",,Leningrad,,RU,,,Mo-Su 10:00-21:00,Wildberries,Q24933714
157422,wildberries,Wildberries,"г Санкт-Петербург, Пискарёвский Проспект 25к2",,Leningrad,,RU,,,Mo-Su 10:00-21:00,Wildberries,Q24933714
157502,wildberries,Wildberries,"д Нурма, Деревня Нурма 12",,Leningrad,,RU,,,Mo-Su 10:00-21:00,Wildberries,Q24933714
