Ref,Spider,Name,Address,City,State,Zipcode,Country,Phone,Website,Hours,Brand,WikiData
72473827,moneygram,NIRDHAN UTTHAN LAGHUBITTA BITTIYA SANSTH,,MAKWANPUR,,,NP,+977 57-693746,,Mo-Su 07:00-19:00,MoneyGram,Q1944412
72480412,moneygram,KUMARI BANK LIMITED - MAKWANPUR - HATIYA,,MAKWANPUR,,,NP,+977 57-530377,,Mo-Fr 10:00-18:00; Sa 10:00-17:00; Su 10:00-18:00,MoneyGram,Q1944412
72659696,moneygram,GANDAKI BIKAS BANK LIMITED - MAKWANPUR -,,MAKWANPUR,,,NP,+977 57-525774,,Mo-Fr 10:00-18:00; Sa 10:00-17:00; Su 10:00-18:00,MoneyGram,Q1944412
72889822,moneygram,NRN LAGHUBITTA BITTIYA SANSTHA LTD.,,MAKWANPUR,,,NP,+977 984-5176383,,Mo-Su 09:00-19:00,MoneyGram,Q1944412
72985894,moneygram,NIC ASIA LAGHUBITTA BITTIYA SANSTHA LTD,,MAKWANPUR,,,NP,+977 986-5003985,,Mo-Su 09:00-19:00,MoneyGram,Q1944412
72986097,moneygram,NIC ASIA LAGHUBITTA BITTIYA SANSTHA LTD,,MAKWANPUR,,,NP,+977 985-2021300,,Mo-Su 09:00-19:00,MoneyGram,Q1944412
73034896,moneygram,INFINITY LAGHUBITTA BITTIYA SANSTHA LTD.,,MAKWANPUR,,,NP,+977 986-2546355,,Mo-Su 09:00-19:00,MoneyGram,Q1944412
73034906,moneygram,INFINITY LAGHUBITTA BITTIYA SANSTHA LTD.,,MAKWANPUR,,,NP,+977 986-2546356,,Mo-Su 09:00-19:00,MoneyGram,Q1944412
73500074,moneygram,MAHILA LAGHUBITTA BITTIYA SANSTHA LTD.,,MAKWANPUR,,,NP,+977 57-523488,,Mo-Su 09:00-19:00,MoneyGram,Q1944412
