City,Place Name,Zipcode,Name
g. Shadrinsk,lukoil,Russia 641870 Kurgan Oblast g. Shadrinsk Kurganskii trakt 138 km,unknown,AZS No02-FR Grand-2
"g.o. gorod Kurgan, g. Kurgan",lukoil,"Russia 640004 Kurgan Oblast g.o. gorod Kurgan g. Kurgan mgstr. R-254 Irtysh Chelyabinsk-Omsk
 str. 2v",unknown,AZS No201 (45201)
Kurgan,lukoil,Russia 640008 Kurgan Oblast Kurgan st. Avtozavodskaya 5у,unknown,AZS No202 (45202)
Kurgan,lukoil,Russia 640016 Kurgan Oblast Kurgan Botanicheskoye road 2,unknown,AZS No203 (45203)
unknown,lukoil,"Russia 641360 Kurgan Oblast Belozerskoe 37km road Kurgan-Tyumen
",unknown,AZS No204 (45204)
unknown,wildberries,Курганская область Курган улица Пичугина 15,unknown,Wildberries
unknown,wildberries,г. Курган (Курганская область) улица Коли Мяготина д. 42,unknown,Wildberries
unknown,wildberries,г. Курган (Курганская область) улица Красина д. 65,unknown,Wildberries
unknown,wildberries,г. Курган (Курганская область) улица Бурова-Петрова д. 62,unknown,Wildberries
unknown,wildberries,г. Курган (Курганская область) улица Куйбышева д. 80,unknown,Wildberries
unknown,wildberries,г. Курган (Курганская область) 6-й мкр д. 13,unknown,Wildberries
unknown,wildberries,г. Курган (Курганская область) улица Карла Маркса д. 105,unknown,Wildberries
unknown,wildberries,Курганская область Шумиха улица Гагарина 1,unknown,Wildberries
unknown,wildberries,г. Шадринск (Курганская область) Фабричная улица д. 20,unknown,Wildberries
unknown,wildberries,г Курган (Курганская обл) Карбышева 2а,unknown,Wildberries
unknown,wildberries,г. Петухово (Курганская обл) Октябрьская  2,unknown,Wildberries
unknown,wildberries,г. Катайск (Курганская обл) Ленина 174,unknown,Wildberries
unknown,wildberries,г Далматово (Россия Курганская обл Далматовский р-н) Советская 161,unknown,Wildberries
unknown,wildberries,Курганская область Курган 2-й микрорайон 22Г,unknown,Wildberries
unknown,wildberries,с Октябрьское (Челябинская область Октябрьский район) улица Ленина 35,unknown,Wildberries
unknown,wildberries,Каргаполье Курганская область Каргапольский район улица Калинина 33,unknown,Wildberries
unknown,wildberries,Шадринск Курганская область городской округ Шадринск Комсомольская улица 5,unknown,Wildberries
unknown,wildberries,г Шадринск (Курганская область) улица Свердлова 83,unknown,Wildberries
unknown,wildberries,г Шадринск (Курганская область) Кооперативная улица 6,unknown,Wildberries
unknown,wildberries,г Курган Проспект Конституции 63,unknown,Wildberries
unknown,wildberries,г Шадринск Улица Розы Люксембург 15,unknown,Wildberries
unknown,wildberries,с Кетово Улица Космонавтов 29,unknown,Wildberries
unknown,wildberries,г Курган 4-Й Микрорайон 31б,unknown,Wildberries
unknown,wildberries,Курган Курганская область городской округ Курган Советская улица 51,unknown,Wildberries
unknown,wildberries,Шадринск Курганская область городской округ Шадринск улица Гагарина 33,unknown,Wildberries
unknown,wildberries,г Шадринск Улица Свердлова 53,unknown,Wildberries
unknown,wildberries,г Шадринск Первомайская Улица 3,unknown,Wildberries
unknown,wildberries,Курганская обл г Курган ул Коли Мяготина д 126 ,unknown,Wildberries
unknown,wildberries,г Курган Улица Гоголя 151,unknown,Wildberries
unknown,wildberries,г Курган 3-Й Микрорайон 6б,unknown,Wildberries
unknown,wildberries,г Курган Улица Володарского 29,unknown,Wildberries
unknown,wildberries,г Курган Улица Пушкина 49,unknown,Wildberries
unknown,wildberries,г Курган Улица Гоголя 9,unknown,Wildberries
unknown,wildberries,г Шадринск Улица Карла Либкнехта 21,unknown,Wildberries
unknown,wildberries,Курганская область посёлок городского типа Мишкино Телеграфная улица 1,unknown,Wildberries
unknown,wildberries,г Курган Улица Коли Мяготина 58,unknown,Wildberries
unknown,wildberries,г Курган Улица Коли Мяготина 111,unknown,Wildberries
unknown,wildberries,г Курган Улица Тимофея Невежина 3с26,unknown,Wildberries
unknown,wildberries,г Курган Улица Кирова 80,unknown,Wildberries
unknown,wildberries,г Макушино Улица Карла Маркса 65,unknown,Wildberries
unknown,wildberries,г Курган Улица Гоголя 66а,unknown,Wildberries
unknown,wildberries,г Куртамыш Улица XXII Партсъезда 46,unknown,Wildberries
unknown,wildberries,г Курган Улица Максима Горького 207,unknown,Wildberries
unknown,wildberries,г Курган Пролетарская Улица 61а,unknown,Wildberries
unknown,wildberries,г Курган 6-Й Микрорайон 4б,unknown,Wildberries
unknown,wildberries,г Шадринск (Курганская область) улица Автомобилистов 54,unknown,Wildberries
unknown,wildberries,г Курган Гвардейская Улица 2а,unknown,Wildberries
unknown,wildberries,Курганская область Шадринск улица Розы Люксембург 21,unknown,Wildberries
unknown,wildberries,г Курган 4-Я Больничная Улица 5,unknown,Wildberries
unknown,wildberries,с Половинное Советская Улица 73,unknown,Wildberries
unknown,wildberries,Курганская область Курган улица Дзержинского 4А,unknown,Wildberries
unknown,wildberries,Курганская область Курган Солнечный бульвар 5,unknown,Wildberries
unknown,wildberries,г Курган Улица Криволапова 67,unknown,Wildberries
unknown,wildberries,г Курган Профсоюзная Улица 4,unknown,Wildberries
unknown,wildberries,г Курган Улица Салавата Юлаева 4,unknown,Wildberries
unknown,wildberries,с Варгаши Комсомольская Улица 4,unknown,Wildberries
unknown,wildberries,рп Лебяжье Первомайская Улица 15,unknown,Wildberries
unknown,wildberries,рп Юргамыш Улица Пушкина 23,unknown,Wildberries
unknown,wildberries,г Курган 8-Й Микрорайон 4,unknown,Wildberries
unknown,wildberries,г Курган Проспект Конституции 58,unknown,Wildberries
unknown,wildberries,с Белозерское Улица Ленина 42,unknown,Wildberries
unknown,wildberries,г Курган 3-Й Микрорайон 37,unknown,Wildberries
unknown,wildberries,г Курган Улица Володарского 99,unknown,Wildberries
unknown,wildberries,г Катайск Улица Ленина 188,unknown,Wildberries
unknown,wildberries,с Введенское Улица Попова 3а,unknown,Wildberries
unknown,wildberries,Щучье Курганская обл Щучанский р-н улица Калинина 24,unknown,Wildberries
unknown,wildberries,г Курган 5-Й Микрорайон 1,unknown,Wildberries
unknown,wildberries,г Курган Улица Ленина 20,unknown,Wildberries
unknown,wildberries,г Курган Улица 9 Мая 2д,unknown,Wildberries
unknown,wildberries,с Глядянское Улица Гагарина 50,unknown,Wildberries
unknown,wildberries,г Курган Сибирская Улица 1а/1,unknown,Wildberries
unknown,wildberries,Далматово Улица Попова 12,unknown,Wildberries
unknown,wildberries,Курган Трактовая Улица 4а,unknown,Wildberries
unknown,wildberries,Катайск Улица Юдина 14,unknown,Wildberries
unknown,wildberries,Шумиха Улица Ленина 55б,unknown,Wildberries
unknown,wildberries,Курганская область Курган улица Достоевского 65,unknown,Wildberries
unknown,wildberries,село Альменево Улица Кирова 152,unknown,Wildberries
unknown,wildberries,село Шатрово Улица Мира 1,unknown,Wildberries
unknown,wildberries,село Мокроусово Улица Красных Борцов 20а,unknown,Wildberries
unknown,wildberries,Курганская область рабочий посёлок Каргаполье Клубная улица 2Б,unknown,Wildberries
unknown,wildberries,Курганская область Курган улица Алексеева 3,unknown,Wildberries
unknown,wildberries,Далматово Улица Чапаева 8,unknown,Wildberries
unknown,wildberries,Курганская область Шумиха Советская улица 50,unknown,Wildberries
unknown,wildberries,Курганская область Шадринск улица Архангельского 54А,unknown,Wildberries
unknown,wildberries,село Лесниково Студенческий Проспект 1а,unknown,Wildberries
unknown,wildberries,село Целинное Улица Бухарова 49,unknown,Wildberries
unknown,wildberries,Курган Проспект Машиностроителей 7,unknown,Wildberries
unknown,wildberries,село Чистопрудное Улица Ленина 15а,unknown,Wildberries
unknown,wildberries,село Сафакулево Улица 60 Лет СССР 18,unknown,Wildberries
unknown,wildberries,Курганская область село Погорелка Исетская улица 21,unknown,Wildberries
unknown,wildberries,село Звериноголовское Советская Улица 45,unknown,Wildberries
unknown,wildberries,Щучье Улица 50 Лет ВЛКСМ 8,unknown,Wildberries
unknown,wildberries,Курган Станционная Улица 47,unknown,Wildberries
unknown,wildberries,Курган Улица Куйбышева 144с37,unknown,Wildberries
unknown,wildberries,Курганская область Шадринск улица Свердлова 106,unknown,Wildberries
unknown,wildberries,село Узунколь Улица Абая 105,unknown,Wildberries
unknown,wildberries,Северо-Казахстанская область село Пресновка улица Есима Шайкина 42,unknown,Wildberries
unknown,wildberries,Курган Чернореченская Улица 91,unknown,Wildberries
unknown,wildberries,Петухово Октябрьская Улица 28,unknown,Wildberries
unknown,wildberries,Курган 2-Й Микрорайон 10,unknown,Wildberries
unknown,wildberries,Челябинская область село Октябрьское Восточная улица 45,unknown,Wildberries
unknown,wildberries,Куртамыш Улица Рыжова 2а,unknown,Wildberries
unknown,wildberries,рабочий посёлок Юргамыш Улица Чкалова 9,unknown,Wildberries
unknown,wildberries,Шадринск Улица Свердлова 35,unknown,Wildberries
unknown,wildberries,Курган 3-Й Микрорайон 9г,unknown,Wildberries
unknown,wildberries,Курганская область Курган улица Коли Мяготина 101,unknown,Wildberries
unknown,wildberries,Курган Проспект Конституции 71,unknown,Wildberries
unknown,wildberries,Курган Улица Савельева 35,unknown,Wildberries
unknown,wildberries,село Мехонское Улица Красных Уральцев 22,unknown,Wildberries
unknown,wildberries,Курган Улица Карла Маркса 147,unknown,Wildberries
unknown,wildberries,Курган Улица Максима Горького 138,unknown,Wildberries
unknown,wildberries,Шадринск Комсомольская Улица 21,unknown,Wildberries
unknown,wildberries,Курган Омская Улица 101к19,unknown,Wildberries
unknown,wildberries,Курган Улица Пугачёва 13,unknown,Wildberries
unknown,wildberries,рабочий посёлок Красный Октябрь Улица Чкалова 6,unknown,Wildberries
unknown,wildberries,село Каширино Улица Ленина 29,unknown,Wildberries
unknown,wildberries,Курган Улица Пугачёва 66а,unknown,Wildberries
