Ref,Spider,Name,Address,City,State,Zipcode,Country,Phone,Website,Hours,Brand,WikiData
https://www.dominos.co.in/store-locations/lucknow/umrao-mall-lucknow-uttar-pradesh,dominos_pizza_in,"Dominos Pizza UMRAO MALL, LUCKNOW, UTTAR PRADESH","Shop No. 1 &amp; back portion of Shop no. 2Upper Ground Floor, Near Badshah Nagar Metro StationMahanagar, 0",Lucknow,Uttar Pradesh,,IN,+91 22 2632 6699,https://www.dominos.co.in/store-locations/lucknow/umrao-mall-lucknow-uttar-pradesh,,Domino's Pizza,Q839466
https://www.dominos.co.in/store-locations/noida/spice-mall-sector-25a-noida-uttar-pradesh,dominos_pizza_in,"Dominos Pizza SPICE MALL, SECTOR-25A, NOIDA, UTTAR PRADESH","SPICE MALL, SECTOR-25A, NOIDA, UTTAR PRADESH",Noida,Uttar Pradesh,,IN,+91 22 2632 6699,https://www.dominos.co.in/store-locations/noida/spice-mall-sector-25a-noida-uttar-pradesh,,Domino's Pizza,Q839466
https://www.dominos.co.in/store-locations/lucknow/munshipulia-metro-station-lucknow,dominos_pizza_in,"Dominos Pizza MUNSHIPULIA METRO STATION, LUCKNOW","Shop No -04-MN-02, Ground Floor, Near Gate NO.2MUNSHIPULIA METRO STATIONMUNSHIPULIA, LUCKNOW0",Lucknow,Uttar Pradesh,,IN,+91 22 2632 6699,https://www.dominos.co.in/store-locations/lucknow/munshipulia-metro-station-lucknow,,Domino's Pizza,Q839466
https://www.dominos.co.in/store-locations/ghaziabad/jaipuria-plaza-indirapuram-uttar-pradesh,dominos_pizza_in,"Dominos Pizza JAIPURIA PLAZA, INDIRAPURAM, UTTAR PRADESH","JAIPURIA PLAZA, INDIRAPURAM, UTTAR PRADESH",Ghaziabad,Uttar Pradesh,,IN,+91 22 2632 6699,https://www.dominos.co.in/store-locations/ghaziabad/jaipuria-plaza-indirapuram-uttar-pradesh,,Domino's Pizza,Q839466
https://www.dominos.co.in/store-locations/lucknow/iim-road-lucknow-uttar-pradesh,dominos_pizza_in,"Dominos Pizza IIM ROAD, LUCKNOW, UTTAR PRADESH","Upper Ground Floor, Khasra No. 97, 98, 99Vikas Khand, Chinhut, RaipurIIM Road0",Lucknow,Uttar Pradesh,,IN,+91 22 2632 6699,https://www.dominos.co.in/store-locations/lucknow/iim-road-lucknow-uttar-pradesh,,Domino's Pizza,Q839466
https://www.dominos.co.in/store-locations/greater-noida/gaur-city-mall-greater-noida-west-uttar-pradesh,dominos_pizza_in,"Dominos Pizza GAUR CITY MALL, GREATER NOIDA (WEST), UTTAR PRADESH","Unit No. FC-5, 4th Floor, Gaur City Mall, Plot No.C1B GH-01, Sector-4, Greater Noida (West), 0",Greater Noida,Uttar Pradesh,,IN,+91 22 2632 6699,https://www.dominos.co.in/store-locations/greater-noida/gaur-city-mall-greater-noida-west-uttar-pradesh,,Domino's Pizza,Q839466
