Ref,Spider,Name,Address,City,State,Zipcode,Country,Phone,Website,Hours,Brand,WikiData
72342848,moneygram,JEEVAN BIKAS LAGHUBITTA BITTIYA SANSTHA,,JHAPA,,,NP,239802793728,,Mo-Su 07:00-19:00,MoneyGram,Q1944412
72707690,moneygram,NEPAL MULTIPURPOSE COOPERATIVE LTD - #GM,,RAJGADH,,,NP,+977 985-2689473,,Mo-Su 07:00-19:00,MoneyGram,Q1944412
72801237,moneygram,SHIKHAR BACHAT TATHA RIN SAHAKARI SANSTH,,JHAPA,,,NP,23980147338,,Mo-Su 07:00-19:00,MoneyGram,Q1944412
74362208,moneygram,SIMRIK BACHAT TATHA RIN SAHAKARI SANSTHA,,JHAPA,,,NP,+977 23-544925,,Mo-Su 07:00-19:00,MoneyGram,Q1944412
74897980,moneygram,NEELAM COMMUNICATION AND MONEY TRANSFER,,JHAPA,,,NP,+977 980-7903176,,Mo-Fr 08:00-18:00; Sa 09:00-17:00; Su 08:00-18:00,MoneyGram,Q1944412
