Ref,Spider,Name,Address,City,State,Zipcode,Country,Phone,Website,Hours,Brand,WikiData
8984600,baskin_robbins_in,Baskin Robbins Ekdalia-Kolkata,"15 Ekdalia Road,Gariahat,Kolkata 700019",Kolkata,West Bengal,,IN,+91 70440 99282,,,Baskin Robbins,Q584601
8984649,baskin_robbins_in,Baskin Robbins Purna Das Road,"49 B, Purna Das Road, Kolkata, West Bengal 700029",Kolkata,West Bengal,,IN,+91 90077 30350,,,Baskin Robbins,Q584601
https://www.dominos.co.in/store-locations/kolkata/ekdalia-road-gariahat,dominos_pizza_in,Dominos Pizza EKDALIA ROAD GARIAHAT,"GROUND &amp; FIRST FLOOR, 5 EKDALIA ROADNear Ekdalia Evergreen Club Ekdalia Road, Gariahat, Kolkata, West Bengal, KOLKATA, West Bengal - 700019",Kolkata,West Bengal,,IN,+91 22 2632 6699,https://www.dominos.co.in/store-locations/kolkata/ekdalia-road-gariahat,,Domino's Pizza,Q839466
https://www.dominos.co.in/store-locations/kolkata/ballygunge-circular-road,dominos_pizza_in,Dominos Pizza BALLYGUNGE CIRCULAR ROAD,"62 7, BALLY GUNJ CIRCULAR ROAD, Bali Gunj, KOLKATA, West Bengal - 700019",Kolkata,West Bengal,,IN,+91 22 2632 6699,https://www.dominos.co.in/store-locations/kolkata/ballygunge-circular-road,,Domino's Pizza,Q839466
00c07087ebdff83eae7f861d5600f087,western_union,THE SOUTH INDIAN BANK LTD,,Kolkata,WEST BENGAL,,IN,+91 33 2461 8959,https://location.westernunion.com/in/west-bengal/kolkata/00c07087ebdff83eae7f861d5600f087,Mo-Sa 09:00-21:00,Western Union,Q861042
