City,Place Name,Zipcode,Name
El Kelaa Des Sraghna,western_union,,unknown,SAHRIJ
Kelaa Des Sraghna,western_union,,unknown,EL ATTAOUIA HAY BOUDHER RT KECH
Kelaat Sraghna,western_union,,unknown,WAFACASH TAMELLALTE AL WIFAK AMN
El Kelaa Des Srarhna,western_union,,unknown,DC KELAA SRAGHNA NAKHLA 1
Oulad Zarrad,western_union,,unknown,OULED BOUHMED OULAD ZARRAD
Mzem Sendhaja,western_union,,unknown,MZEM SANHAJA
Laatama,western_union,,unknown,LAATAMNA
El Kelaa Des Sra,western_union,,unknown,TASSHILAT M2T KELAA DES SRAGHN
Kalaat Des Sraghna,western_union,,unknown,KALAAT DES SRAGHNA IMLIL
Kelaat Des Sraghna,western_union,,unknown,DECHRA
Kelaa Sraghna,western_union,,unknown,STE ESKA EXPRESS SARL
Elkelaa Des Sraghna,western_union,,unknown,CASH PLUS SA CENTRE VILLE
Kalaa De Sraghnas,western_union,,unknown,KELAA DES SRAGHNAS QODS
Sahrij,western_union,,unknown,SAHRIJ SERVICES PLUS
El-kelaa-des-sraghna,western_union,,unknown,AL BARID EL KELAA DES SRAGHNA PRINCIPAL
El Marbouh,western_union,,unknown,CASH PLUS EL MARBOUH
El Kelaa Sraghna,western_union,,unknown,CASH PLUS Dr DRAOUA
El Kelaa Des Seraghna,western_union,,unknown,HIADNA CASH
Kelaa Sragna,western_union,,unknown,BCP KELAA EL MOURAKKAB
Kalaa Seraghna,western_union,,unknown,BP MARRAKECH BENI MELLAL AL NAHA
Kelaat Seghna,western_union,,unknown,JAYCH EL MALAKI
El Kalaa Sraghna,western_union,,unknown,EL KALAA SRAGHNA LOUNASDA
Ouled Klibe,western_union,,unknown,CASH PLUS OULED KLIBE
Tassaout,western_union,,unknown,CASH PLUS TASSAOUT
Lounassda,western_union,,unknown,CASH PLUS LOUNASSDA
Ben Guerir,western_union,,unknown,BOUIHI STAR
Skhour Rehamna,western_union,,unknown,CASH PLUS SKHOUR REHAMNA
El Attaouia,western_union,,unknown,CASH PLUS ATTAOUIYA QU ADMINISTRATIF
Al Attawia,western_union,,unknown,WAFACASH ATTAOUIA ROUTE EL KELAA MP
El Aataouia,western_union,,unknown,ATTAOUIYA ZITOUNE
Khemis Attaouia,western_union,,unknown,WAFACASH ATTAOUIA TASSAOUTE AMN
Laataouia,western_union,,unknown,AL ATTAOUIA
Tamallalt,western_union,,unknown,DC ZEMRANE CHARQIA
Laattaouia-zemrane Charqia,western_union,,unknown,ES SRAIDI EL MUSTAPHA
Tamellalt,western_union,,unknown,CASH PLUS TAMELLALT 2
El Kliaa,western_union,,unknown,CASH PLUS EL KLIAA
