Ref,Spider,Name,Address,City,State,Zipcode,Country,Phone,Website,Hours,Brand,WikiData
W069,jysk,"Bucium, Iași",,Iasi,,,RO,+40 723 115 975,https://jysk.ro/magazinele-jysk?storeId=W069,Mo-Fr 10:00-20:00; Sa-Su 10:00-18:00,JYSK,Q138913
RO.1136.8,omv,OMV,,Iasi,,,RO,+40 372 428 962,,24/7,OMV,Q168238
64200145_001-renault,renault,CASA AUTO VALEA LUPULUI SRL,,COM. VALEA LUPULUI,,,RO,+40 232 933,,,Renault,Q6686
64200145_001-dacia,renault,CASA AUTO VALEA LUPULUI SRL,,COM. VALEA LUPULUI,,,RO,+40 232 933,,,Dacia,Q27460
SGN-MCB229662,ship_and_go_ro,PUNCT SOS.BUCIUM NR.37-MAGAZIN CHEI INCINTA FAMILY MARKET,"IASI, Soseaua Bucium, Nr. 37, Cod postal. 700280",IASI,,,RO,,,Mo-Su 10:00-22:00,Ship & Go,Q117327750
SGI230152,ship_and_go_ro,"Punct Family Market Bucium, Spalatoria Omniclean","IASI, Soseaua Bucium, Nr. 37, Cod postal. 700280",IASI,,,RO,,,Mo-Fr 09:00-21:00,Ship & Go,Q117327750
SGN-OMV230361,ship_and_go_ro,Punct Soseaua Bucium 17 OMV Bucium,"IASI, Soseaua Bucium, Nr. 17, Cod postal. 700280",IASI,,,RO,,,24/7,Ship & Go,Q117327750
