Ref,Spider,Name,Address,City,State,Zipcode,Country,Phone,Website,Hours,Brand,WikiData
https://vertretung.allianz.de/frank.teschner/,allianz_de,Allianz Versicherung Frank Teschner HAUPTVERTRETUNG,,Schnaitsee,,,DE,+49 8074 9154270,https://vertretung.allianz.de/frank.teschner/,"Mo-We 08:30-12:30; Th 08:30-12:30,13:30-18:00",Allianz SE,Q487292
38556,sparkasse_de,Kreis- und Stadtsparkasse Wasserburg am Inn Geldautomat Schnaitsee,,Schnaitsee,,,DE,+49 8071 1013030,https://www.sparkasse.de/standorte/geldautomaten/kreis-und-stadtsparkasse-wasserburg-am-inn-geldautomat-schnaitsee-38556,24/7,Sparkasse,Q13601825
11030,sparkasse_de,Kreis- und Stadtsparkasse Wasserburg am Inn Geschäftsstelle Schnaitsee,,Schnaitsee,,,DE,+49 8071 1013030,https://www.sparkasse.de/standorte/filialen/kreis-und-stadtsparkasse-wasserburg-am-inn-geschaeftsstelle-schnaitsee-11030,"Mo 08:00-12:00,14:30-16:30; We 08:00-12:00; Th 08:00-12:00,14:30-17:30",Sparkasse,Q13601825
,visa,,,SCHNAITSEE,,,DE,,,,,
,visa,,,SCHNAITSEE,,,DE,,,,,
https://www.vr.de/standorte/S/Sa-Sm/meine-volksbank-raiffeisenbank-eg-sb-geschaeftsstelle-schnaitse-19217.html,vr_bank,"meine Volksbank Raiffeisenbank eG, SB-Geschäftsstelle Schnaitsee (Waldhausen)",,Schnaitsee,,,DE,+49 8031 1850,https://www.vb-rb.de,,,
https://www.vr.de/standorte/S/Sa-Sm/meine-volksbank-raiffeisenbank-eg-schnaitsee-8164.html,vr_bank,"meine Volksbank Raiffeisenbank eG, Schnaitsee",,Schnaitsee,,,DE,+49 8031 18533300,https://www.vb-rb.de,"Mo-Tu 08:30-12:00,14:00-17:00; We 08:30-12:00; Th-Fr 08:30-12:00,14:00-17:00",,
