City,Place Name,Zipcode,Name
Hyderabad,audi,CSR Estate Plot No.8 Ground Floor Sector 01 HUDA Techno Enclave Madhapur 500081 Hyderabad,unknown,Audi Hyderabad
Hyderabad,audi,Madhapur Gram Panchayat Lingampally Post Plot No:24 to 31 Survey No:34 500051 Hyderabad,unknown,Audi Service Hyderabad
Secunderabad,audi,SMR Garden RTC ColonyTirumalgherry Survey No-109 500015 Secunderabad,unknown,Audi Service Secunderabad
Warangal,baskin_robbins_in,Baskin Robbins Hno 2-5-748 Opp U niversity Arts &Science College Hanamkonda Warangal Telangana- 506001,unknown,Baskin Robbins
Hyderabad,baskin_robbins_in,Adjacent To Hp-Petrol Bunk & Macdon alds M-Sqamre Mall & Multiplex NarapallyTelangana-500051,unknown,Baskin Robbins
Hyderabad,baskin_robbins_in,Plot No 780 3Rd Avenue Defence Co lony Sainikpuri Secunderabad-500056,unknown,Baskin Robbins
Hyderabad,baskin_robbins_in,Baskin Robbins HNo;2-108/Ic/P-5 Behind Voilet& Purple Icrisat ColonyChandanagarHyderabad-500050,unknown,Baskin Robbins
Hyderabad,baskin_robbins_in,Baskin Robbins Hig66P 0Pposite C hervi Super Market (Old Congress Office) Kphb Phase 6 Kukatpally -500085 Telangana,unknown,Baskin Robbins
Hyderabad,baskin_robbins_in,SNo1 Ground Floor Srr Arcade Opposite Maruti Suzuki Showroom Trimulgherry Secunderabad 500015 (Telangana),unknown,Baskin Robbins
Hyderabad,baskin_robbins_in,Baskin Robbins Plot No 7 Ground F loor Beside Seeds School Opp South Park Apartment Gulmohar - Nallagandla Fly Over Road Serilingampally Hyderabad 500019,unknown,Baskin Robbins
Hyderabad,baskin_robbins_in,DNo:ÊÊ 1/67/1  MiyapurÊ Beside Vi jetha Super Market MiyapurHyderabad (TS) 500049,unknown,Baskin Robbins
Hyderabad,baskin_robbins_in,Baskin Robbins Plot No 1-112/26 Kondapur Hyderabad-500084 Telangana,unknown,Baskin Robbins
Hyderabad,baskin_robbins_in,Baskin Robbins Plot No 1-57/2 A B lock Sriram Nagar Next To Chirec Public School Kondapur-500084 Telangana,unknown,Baskin Robbins
Hyderabad,baskin_robbins_in,Baskin Robbins Amb Cinemas Llp Sa rath City Capital Mall Survey No:40Opp Ratnadeep Super MarketKothaguda Junction Gachibowli Road Hyderabad 500084  Telangana,unknown,Baskin Robbins
Hyderabad,baskin_robbins_in,Baskin Robbins #1-90/Huda/Tec/2/1 And 2/2/Ugf/Nr Huda Techno Enclave Phoenix Tower A Madapur Hyderabad-500081 Telangana,unknown,Baskin Robbins
Hyderabad,baskin_robbins_in,1St Floor Ameerpet Metro Station Bus Stop Near To Mythrivanam Ameerpet Hyderabad Telangana Ð 500016,unknown,Baskin Robbins
Hyderabad,baskin_robbins_in,92/192/3Plot No77P8 And 15ÊGa chibowliHyderabad Telangana 500032,unknown,Baskin Robbins
Hyderabad,baskin_robbins_in,Baskin Robbins Oasis Centre Green lands Rd Durga Nagar Somajiguda-500016 Telangana,unknown,Baskin Robbins
Hyderabad,baskin_robbins_in,Baskin Robbins Unit No F&B -12 Se cond Floor Inorbit Mall Mind Space Survey No 64Part Apiisc Soft Ware Layout Hitech City Madhapur Hyderabd-500058 Telangana,unknown,Baskin Robbins
Hyderabad,baskin_robbins_in,Baskin Robbins Shop No G4 H/No 8-2-626/7&8 Next To Spice Touch Rest Banjara Hills Road No14 Opp Bhagya Nagar Studio Hyderabad-500034 Telangana,unknown,Baskin Robbins
Hyderabad,baskin_robbins_in,Baskin Robbins Plot No -213 Tngo ÕS Colony Back Side Q City Wipro Circle Gachibowli Hyderbad- 500032 Telangana,unknown,Baskin Robbins
Hyderabad,baskin_robbins_in,Baskin Robbins Baskin Robbins C/O Wood Bridge Hotel Opp Mehdi Function Hall Ac Gards Masab Tank Hyderabad-500 028 Telangana,unknown,Baskin Robbins
Hyderabad,baskin_robbins_in,"1-1-385First FloorBhargavi Encla veBeside Sbi
BankGandhinagarHyderabad-500080",unknown,Baskin Robbins
Hyderabad,baskin_robbins_in,Baskin Robbins 227/1/6 Ground Flo or (Next To Subway) Shivam Road DD Colony Hyderabad-500007 Telangana,unknown,Baskin Robbins
Hyderabad,baskin_robbins_in,Baskin Robbins Lalitha Foods 8-2 -293/82/F/C/61A On Plot No61 Survey No403 Film Nagar Shaikpet Village Hyderabad- 500096 Telangana,unknown,Baskin Robbins
Hyderabad,baskin_robbins_in,Baskin Robbins Shop No : 103A  P No 3-6-552 To 558/1 Mpm Millenium Wajhuddin Estate Beside Kfc  Opp Paradise Himayatnagar Main Road Hyderabad- 500029,unknown,Baskin Robbins
Hyderabad,baskin_robbins_in,Baskin Robbins Subishi'S Town Cent re (Commercial) Shankarpally MandalOpp:Windsor Luxury Homes Near:Ibs (Icfai) -501203 Telangana,unknown,Baskin Robbins
Hyderabad,baskin_robbins_in,Baskin Robbins H/No 1 -2-289 Pl ot No 38 Pleasant Part Apartment Opp Shanti Nager Park Shanti Nager Hyderabad -500028 Telangana,unknown,Baskin Robbins
Hyderabad,baskin_robbins_in,Baskin Robbins H No 8-1-284/Ou/4 03 Ou Colony Shaikpet Manikonda Hyderabad Telangana 500089 Telangana,unknown,Baskin Robbins
Mehaboobnagara,baskin_robbins_in,Baskin Robbins DNo 9-402 Nh44 Opp Police Balanagar Station Balanagar Mandal Mehboobnagar-509202 Telangana,unknown,Baskin Robbins
Hyderabad,baskin_robbins_in,Baskin Robbins Baskin Robbins Tol ichowki 9-4-86/184 Salarjung Colony Beside Shifa Elite Tolichwoki Hyderbad-500008 Telangana,unknown,Baskin Robbins
Hyderabad,baskin_robbins_in,Shop Address : Door No : 11-13-74/2  Flat No 103 Sai Keerthi Enclave Road No 2  Alkapuri Kothapet Hyderabad- 500035,unknown,Baskin Robbins
Hyderabad,baskin_robbins_in,Baskin Robbins Ground Floor H N 1 6-11-19/9/5 Saleem Nagar Colony Malakpet Hyderabad-500036 Telangana,unknown,Baskin Robbins
Hyderabad,baskin_robbins_in,Baskin Robbins H No6-57/2 Raghur am Nagar Colony Main Road Beside Hdfc Bank Sun City BandlagudaHyderabad Telangana-500091,unknown,Baskin Robbins
Hyderabad,baskin_robbins_in,Grow Space Elegance 2-5-25/5 Uppe rpally Circle No6 Hyderabad Telangana-500048,unknown,Baskin Robbins
Hyderabad,baskin_robbins_in,Baskin Robbins DNo180 5-5-180 Prashant Nagar Vanastalipuram Main Road Hyderabad-500070 Telangana,unknown,Baskin Robbins
Hyderabad,baskin_robbins_in,Dsl Mall ÊNear Cricket Stadium Upp al Hyderabad Telangana 500039 TS,unknown,Baskin Robbins
Hyderabad,bmw_group,,unknown,KUN Motoren Pvt. Ltd. KUN Exclusive Hyderabad Sales Only
Visakhapatnam,bmw_group,,unknown,KUN Motoren Pvt. Ltd. KUN Exclusive
Hyderabad,deloitte,,unknown,Deloitte - Hyderabad
Hyderabad,dominos_pizza_in,Ground Floor 5-5-708 8 Udayanandan Heights Abhyudaya Colony Chintalkunta Saheb Nagar Khurd Hyderabad HYDERABAD Telangana - 500070,unknown,Dominos Pizza VANASTHALIPURAM
Hyderabad,dominos_pizza_in,Ground Floor 16-11-20 7 H 2A VAH MAGNA SAROOR NAGAR - HYDERABAD HYDERABAD Telangana - 500036,unknown,Dominos Pizza VAH MAGNA SAROOR NAGAR
Hyderabad,dominos_pizza_in,VEGA BLOCKTHE V &#039; ASCENDAS PLOT NO - 17 MADHAPUR HYDERABAD - 500081 PH.NO. 040-40268585  84  83  64618585  80,unknown,Dominos Pizza V. MADHAPUR
Secundrabad,dominos_pizza_in,Plot No. 79 Survey No. 30 P &amp; T Coloney TRIMULGHERRY KARKHANA - SECUNDERABAD HYDERABAD Telangana - 500015,unknown,"Dominos Pizza TRIMULGHERRY, KARKHANA"
Hyderabad,dominos_pizza_in,Upper Ground Floor And First Floor H. No. 8-1-400 61 Plot No. 61 In Survey Nos. 69 To 72 Of Hakimpet (V) &amp; 160 Of Shaikpet Tolichowki(Hyderabad) HYDERABAD Telangana - 500008,unknown,Dominos Pizza TOLICHOWKI
Hyderabad,dominos_pizza_in,THE FORUM SUJANA MALL GROUND FLOOR UNIT NO 22&amp;23 CITY KUKKATPALLY HYDERABAD TELANGANA500072 Ph-040-30534111,unknown,Dominos Pizza THE FORUM SUJANA MALL
Hyderabad,dominos_pizza_in,Ground Floor Plot No.76 (Part) Survey No. 11 1 11 2 11 4 11 5 &amp; 11 5 (Uab) Situated At Hydershakote Village &amp; G.P Vikarabad To Hyderabad Main Road SUN CITY HYDERABAD HYDERABAD Telangana - 500091,unknown,"Dominos Pizza SUN CITY, HYDERABAD"
Secundrabad,dominos_pizza_in,No. 9-1-164 Ground Floor Amsri Plaza Near Basera Hotel SECUNDRABAD HYDERABAD Telangana - 500003,unknown,Dominos Pizza ST.MY RD. (SECUNDARABAD)
Hyderabad,dominos_pizza_in,Upper Ground FloorPlot No. 85 Survey No. 103 1 SRILINGAMPALLY (ANDHRA PRADESH) HYDERABAD Telangana - 500019,unknown,Dominos Pizza SRILINGAMPALLY
Hyderabad,dominos_pizza_in,No. 7-1-621 267(48 3Rt) Main Road Sr Nagar SR NAGAR HYDERABAD (A.P) HYDERABAD Telangana - 500873,unknown,"Dominos Pizza SR NAGAR, HYDERABAD"
Hyderabad,dominos_pizza_in,&quot;R3 Icon&quot; Ground Floor 6-8 New Municipal House No. 6-8 A Dargah Hussian Shah Wali Village SERI LINGAMPALLY HYDERABAD Telangana - 500008,unknown,Dominos Pizza SHAIKPET DARGA
Secundrabad,dominos_pizza_in,First Floor Signature Square H No 1 10 316 Bapuji Nagar Bowenpally Secunderabad 500009 Telangana SECUNDRABAD Telangana,unknown,Dominos Pizza Secunderabad 500009 Telangana
Hyderabad,dominos_pizza_in,Unit No 4F FC 17 on the Fourth Floor Sarath City Capital Mall Kothaguda Village Serilingampally Mandal R R District Hyderabad Telangana 500084,unknown,Dominos Pizza SARATH CITY CAPITAL MALL
Hyderabad,dominos_pizza_in,Ground Floor Migh House No. 7 A Bearing G.H.M.C No. 17-1-A 7 SANTOSH NAGAR COLONY HYDERABAD ANDHRA PRADESH HYDERABAD Telangana - 500059,unknown,Dominos Pizza SANTOSH NAGAR COLONY
Hyderabad,dominos_pizza_in,Ground FloorG-2 G S Mall SOMAJI GUDA HYDERABAD Telangana - 500082,unknown,Dominos Pizza SAMAJI GDA (HYDERABAD)
Hyderabad,dominos_pizza_in,0,unknown,"Dominos Pizza GAR LAXMI INFOBHAN, HYDERABAD, TELENGANA"
Hyderabad,dominos_pizza_in,Unit number 23 at Food court Ground Floor Building # 9 K. Raheja Mindspace IT Park Hi Tech City Hyderabad-500081 (A.P),unknown,Dominos Pizza RAHEJA MINDSPACE IT PARK
Hyderabad,dominos_pizza_in,R C REDDY COMPLEX UPPAL HYDERABAD First Floor R C Reddy Complex 2-1-57 A  39 &amp; 40 Ventateshwara Colony Uppal Hyderabad 500039 ph 040-42428383,unknown,Dominos Pizza R C REDDY COMPLEX UPPAL HYDERABAD
Hyderabad,dominos_pizza_in,Shop No. 1 And  Shop No. 2  Ground Floor Survey No 145 Part Quthibubulla Village QUTHIBULLAPUR R.R DIST. (HYDERABAD) HYDERABAD Telangana - 500037,unknown,"Dominos Pizza QUTHIBULLAPUR , R.R DIST"
Hyderabad,dominos_pizza_in,Prajay Princeton TowersShop No 5B Ground Floor Prajay Princeton Towers Saroornagar Hyderabad HYDERABAD Telangana - 500035,unknown,Dominos Pizza PRAJYA PRINCETON TOWER
Suryapet,dominos_pizza_in,0,unknown,"Dominos Pizza PILLALAMARRI VILLAGE, SURYAPET MANDAL, TELANGANA"
Secundrabad,dominos_pizza_in,Ground Floor &amp; 1St Floor#1-8-303 46 6&amp;7 Rasoolpura P.G. ROAD BEGUMPETH SECUNDRABAD HYDERABAD Telangana - 500003,unknown,"Dominos Pizza P.G. ROAD, BEGUMPETH"
Hyderabad,dominos_pizza_in,First Floor House No. 1-99 3 Plot No. 3 Survey No. 198 2 Manikonda Near Mari Chettu Puppalguda Hyderabad-500098,unknown,Dominos Pizza PAPULAGUDA
Secundrabad,dominos_pizza_in,Ground Floor 6 1 344 16 Padma Rao Nagar next to Anu Sri Hospital Secunderabad 500025 Telangana,unknown,Dominos Pizza PADMA RAO NAGAR SECUNDERABAD
Hyderabad,dominos_pizza_in,Mayuri Nagar MIYAPUR HYDERABAD TELANGANA First Floor 202 A Plot No 16 E P Eastern Part Madeenaguda Miyapur HYDERABAD Telangana,unknown,Dominos Pizza P Eastern Part Madeenaguda Miyapur
Hyderabad,dominos_pizza_in,Ground Floor Plot No 37 Sector III B Block Survey No 105 106 107 108 Neekampur Rajendarnagar Mandal Ranga Reddy HYDERABAD Telangana,unknown,Dominos Pizza Neekampur Rajendarnagar Mandal Ranga Reddy
Hyderabad,dominos_pizza_in,First Floor Plot NO 9 C Nallangandla Village Under GHMC Serilingampally Mandal Opposite Apama Cyber Ranga Reddy District Hyderabad Telangana-500019,unknown,Dominos Pizza NALAGANDLA HYDERABAD
Hyderabad,dominos_pizza_in,First Floor H.No.1-10-28 155 Plot No. 3 (3Rd Part Of Plot No. 3) Nagarjuna Nagar Colony Hyderabad HYDERABAD Telangana - 500062,unknown,"Dominos Pizza NAGARJUNA NAGAR COLONY,HYDERABAD"
Hyderabad,dominos_pizza_in,Plot No:1 Survey Nos 204 &amp; 206 2Kumar Arcade Opp Ram Krishna Studio NACHARAM - HYDERABAD HYDERABAD Telangana - 500076,unknown,Dominos Pizza NACHARAM-HYDERABAD
Hyderabad,dominos_pizza_in,Ground Floor Plot No 145-B Survey Nos. 19 &amp; 20 Door House No. 13-01-106 A Motinagar Bobbuguda (V) MOTINAGAR HYDERABAD HYDERABAD Telangana - 500018,unknown,Dominos Pizza MOTINAGAR HYDERABAD
Hyderabad,dominos_pizza_in,1st Floor H. No. 12-7-134 B1 Plot No B1 &amp; B2 Anjaneya Nagar MOOSAPET HYDERABAD HYDERABAD Telangana - 500018,unknown,Dominos Pizza MOOSAPET HYDERABAD
Hyderabad,dominos_pizza_in,Food Counter 2 2nd Floor MJR MultiplexSy. No. 757 in Korremul VillageGhatkesar Mandal Medchal- MalkajgiriDistrict Of HDMA -Hyderabad,unknown,"Dominos Pizza MJR MAL AND MULTIPLEX NARAPALLY, HYDERABAD"
Hyderabad,dominos_pizza_in,Ground Floor H No 5 5 Deepthi Srinagar Colony Miyapur Hyderabad 500050 Telangana HYDERABAD Telangana,unknown,Dominos Pizza Miyapur Hyderabad 500050 Telangana
Hyderabad,dominos_pizza_in,Ground And First Floor Door Mch. No. 10-3-76 Humayun Nagar Mehdipatnam MEHDIPATNAM HYDERABAD (TELANGANA) HYDERABAD Telangana - 500028,unknown,"Dominos Pizza MEHDIPATNAM,HYDERABAD"
Hyderabad,dominos_pizza_in,Counter No. 1 Third Floor Mantra Mall Survey No. 30 Attapur Upperpally Village Mantra Mall Hyderabad Telangana HYDERABAD Telangana,unknown,"Dominos Pizza MANTRA MALL,HYDERABAD,TELANGANA"
Hyderabad,dominos_pizza_in,Ground Floor House No 577 MIG II Malaysian Township Sy No 15 24 577 A P H B Colony Phase I And II Kukatapplay R R District Hyderabad Andhra Pradesh 500072,unknown,Dominos Pizza MALAYSIAN TOWNSHIP HYDERABAD
Hyderabad,dominos_pizza_in,Ground Floor1-58 A 8 Madinaguda Miyapur Next to Bharat Petrol bunk Hyderabad 500049 AP.PH-040-42348888,unknown,"Dominos Pizza MADINAGUDA, HYDERABAD"
Hyderabad,dominos_pizza_in,M.A Plaza Ashok Nagar  Ground floor plot no 6 surv situated at Ashok Nagar colony Medak district Sanga Reddy  Pin code 502032  Ramachandrapuram Phone no. 9652486409,unknown,Dominos Pizza M. A. PLAZA ASHOK NAGAR TELANGANA
Hyderabad,dominos_pizza_in,Food Court Unit No 4 5th Floor L &amp; T Mall Survey No 1 1 1 2 1 3 3 2 6 1  6 2 Ward No 89 Situated at Punjagutta Hyderabad Telangana 500082,unknown,Dominos Pizza L&amp;T MALL
Hyderabad,dominos_pizza_in,Ground Floor Shop No.108 109(Part)Alluri Trade Centre KUKATPALLY (HYDERABAD) HYDERABAD Telangana - 500072,unknown,Dominos Pizza KUKATPALLY
Hyderabad,dominos_pizza_in,First Floor Plot No. 122 &amp; 123 Sy. No. 19 At Ravi Enclave KONDAPUR HYDERABAD HYDERABAD Telangana - 500084,unknown,"Dominos Pizza KONDAPUR, HYDERABAD"
Hyderabad,dominos_pizza_in,Ground Floor Plot No_ 2Opp Satyam Enclave Komapally - Hyderabad HYDERABAD Telangana - 500100,unknown,Dominos Pizza KOMPALLY
Hyderabad,dominos_pizza_in,Ground Floor M. No 3-4-1081 3-4-1081 2 To 3-4-1081 9 M.No.3-4-1082 Kachiguda Road (Near Kachiguda Railway Station) KACHIGUDA HYDERABAD HYDERABAD Telangana - 500027,unknown,"Dominos Pizza KACHIGUDA, HYDERABAD"
Hyderabad,dominos_pizza_in,Ground And First Floor Plot No. 1128 Jubilee Square (Near Chutneys Restaurant) JUBILEE HILLS HYDERABAD HYDERABAD Telangana - 500033,unknown,Dominos Pizza JUBLEE HILLS ROAD NUMBER 36
Hyderabad,dominos_pizza_in,Plot No.23 8-2-293 82 A 23 Divyasai Enclave Next To Kuna&#039;S Guest House Road No.5 JUBLEE HILLS HYDERABAD Telangana - 500033,unknown,Dominos Pizza JUBILEE HILL
Hyderabad,dominos_pizza_in,Ground Floor Hari Nivas M Chandrakala Plot No 47 47A Mithala Nagar Jillaguda Balapur Hyderabad 500005 HYDERABAD Telangana,unknown,Dominos Pizza Jillaguda Balapur Hyderabad 500005
Hyderabad,dominos_pizza_in,Unit No. F&amp;B-01 Second Floor Inorbit Cyberabad INORBIT HYDERABAD HYDERABAD Telangana - 500081,unknown,"Dominos Pizza INORBIT, HYDERABAD"
Hyderabad,dominos_pizza_in,INFOSYS CAMPUS 210 MANIKONDA VILLAGE OPP I.S.B SERI LINGAMPALLY RAJENDER NAGAR R.R. DIST. HYDERABAD - 500082 PH.NO. 040-64638585   64538590,unknown,Dominos Pizza INFOSYS HYDERABAD
Hyderabad,dominos_pizza_in,Plot No. 1 &amp; 2 (P) Ground FloorBeside Vasanth Nagar Main Gate Next To Ibp Petrol Bunk Hyder Nagar - Hyderabad HYDERABAD Telangana - 500085,unknown,"Dominos Pizza HYDER NAGAR, HYDERABAD"
Hyderabad,dominos_pizza_in,Plot No.26 Opp. Cyber Tower HI TECH CITY HYDERABAD Telangana - 500081,unknown,Dominos Pizza HI TECH CITY
Hyderabad,dominos_pizza_in,SRI KALKI HEIGHTS MADINAGUDDA TELANGANA First Floor Sri Kalki Heights Survey nos 61 AA 61 E 62 63 A 63 A 1 HYDERABAD Telangana,unknown,Dominos Pizza Heights Survey nos 61 AA 61 E 62 63 A 63 A 1
Warangal,dominos_pizza_in,Ground Floor No. 533 (Old) 505(New) Waddepally Revenue Village Subedari Hanamkonda Hanamakonda Warangal City WARANGAL Telangana - 506001,unknown,Dominos Pizza HANAMAKONDA
Hyderabad,dominos_pizza_in,Ground Floor Plot-78 Gacchi Bowli Gachi Bowli - Hyderabad HYDERABAD Telangana - 500032,unknown,Dominos Pizza GACHI BOWLI
Hydrabad,dominos_pizza_in,Elite Commercial Complex  Plot No 1534 &amp; 1535 in Block No 95 Survey No 165 166 167 178 &amp; 179 situated at Bachupally Village Pragathi Nagar Gram Panchayat Quthbullapur Mandal Ranga Reddy District 500090  Telangana,unknown,Dominos Pizza ELITE COMMERCIAL COMPLEX PRAGATHI NAGAR
Hyderabad,dominos_pizza_in,Ground Floor Eatstreet  T.S No 5 Block B  Necklace Road Khairatabad Hyderabad Telangana 500005 ph-040-69990025,unknown,Dominos Pizza EAT STREET NECKLACE ROAD HYDERABAD TELANGANA
Hyderabad,dominos_pizza_in,Ground Floor Lobby Building 7 Divyasree Orion SY.NO.66 1 Raidurg Ranga Reddy District Hyderabad Telangana- 500008,unknown,"Dominos Pizza DIVYASREE ORION,HYDERABAD,TELANGANA"
Hyderabad,dominos_pizza_in,Ground And First Floor Plot No. 06 Southern Part In Survey No. 54(A) At Peerzadiguda (V &amp; Gp) Bod Uppal Hyderabad (Andhra Pradesh) HYDERABAD Telangana - 500039,unknown,"Dominos Pizza BOD UPPAL, HYDERABAD"
Hyderabad,dominos_pizza_in,MUNICIPAL NO. 2-2-1105 90 BAGH AMBERPETSHIVAM ROAD HYDERABAD - 500013 PH.NO. 040-64548585  64548536  64548537  64548538  64548539  64548540   27552840  50,unknown,Dominos Pizza BAGHAMBERPET
Hyderabad,dominos_pizza_in,BACHUPALLY HYDERABAD,unknown,"Dominos Pizza BACHUPALLY,HYDERABAD"
Hyderabad,dominos_pizza_in,Ayyappa Heights Commercial premises bearing no 4-33 on 1st Floor of the building situated at Gachibowli Opp DLF Hyderabad pin code 500032,unknown,Dominos Pizza AYYAPPA HEIGHTS  GACHIBOWLI HYDERABAD
Hyderabad,dominos_pizza_in,Agrr ArcadeGround Floor Plot No-4 ATTAPUR - HYDERABAD HYDERABAD Telangana - 500048,unknown,Dominos Pizza ATTAPUR
Hyderabad,dominos_pizza_in,103 104- First FloorDoor No:1-19-71 4 A13 A S RAO NAGAR - HYDERABAD HYDERABAD Telangana - 500062,unknown,Dominos Pizza A.S.RAO NAGAR
Hyderabad,dominos_pizza_in,Ground And First Floor No. 25-40 31 A On Plot No. 46Survey Nos. 554(P) 555(P) 559 To 561(P) And 570 571 ANANDBAGH (MALKAJGIRI) HYDERABAD HYDERABAD Telangana - 500047,unknown,Dominos Pizza ANANDBAGH(MALKAJGIRI)
Hyderabad,dominos_pizza_in,Ground Floor H No 14 81 964 13 15A 1 Raghavendra Colony Beeramguda Ameenpoor Hyderabad 502032 Telangana HYDERABAD Telangana,unknown,Dominos Pizza Ameenpoor Hyderabad 502032 Telangana
Hyderabad,fossil,,unknown,Fossil India - Forum Sujana HYD
Rangareddi,google_offices,"Survey No. 13 DivyaSree Omega
Kondapur Village
Hyderabad Telangana 500084
India",unknown,Hyderabad
Hyderabad,hm,,unknown,Inorbit Mall
Secunderabad,mercedes_benz,,unknown,Adishwar Auto Diagnostics Private Limited
Hyderabad,mercedes_benz,,unknown,Raam Autobahn India Private Limited
Rangareddi,meta,,unknown,Meta
Hyderabad,nike,,unknown,Nike Forum Mall Hyderabad
Secunderabad,nike,,unknown,NFS Hyderabad
HYDERABAD,nissan_europe,,unknown,VIBRANT NISSAN (Workshop)
KHAMMAM,nissan_europe,,unknown,VVC NISSAN (Workshop)
WARANGAL,nissan_europe,,unknown,VVC Nissan  (SHOWROOM)
Hyderabad,reebok,,unknown,Reebok Exclusive Store - Banjara Kids
Nizamabad,reebok,,unknown,Reebok Exclusive Store - Nizamabad
Karim Nagar,reebok,,unknown,Reebok Exclusive Store - Karimnagar
Khammam,reebok,,unknown,Reebok Exclusive Store - Khammam
HYDERABAD,shell,,unknown,HABSIGUDA
RANGAREDDY,visa,,unknown,unknown
MEDCHAL MALKAJGIRI,visa,,unknown,unknown
HYDERABAD,visa,,unknown,unknown
MANCHERIAL,visa,,unknown,unknown
Thorrur,western_union,,unknown,MUTHOOT FINANCE LTD
Warangal,western_union,,unknown,KLM AXIVA FINVEST LTD
Mahabubabad,western_union,,unknown,INDIA POST PAYMENTS BANK LTD
Nalgonda,western_union,,unknown,MUTHOOT FINCORP LIMITED
Suryapet,western_union,,unknown,MUTHOOTTU MINI FINANCIERS LTD
Khammam,western_union,,unknown,MUTHOOT FINCORP LIMITED
Hydreabad,western_union,,unknown,KLM AXIVA FINVEST LTD
Medchal,western_union,,unknown,MUTHOOT FINANCE LTD
Adilabad,western_union,,unknown,INDIA POST PAYMENTS BANK LTD
Narayanpet,western_union,,unknown,QUICK ENTERPRISES
Mahabub Nagar,western_union,,unknown,MUTHOOT FINCORP LTD
Nirmal,western_union,,unknown,BHEEMESHWAR ONLINE SERVICE AND INTERNET
Bhainsa Nirmal,western_union,,unknown,NEW RANIYA JEWELLERS
Gadwal,western_union,,unknown,SREENIVASA COMPUTERS  IT  MEESEVA
Nizamabad,western_union,,unknown,LAMBODHARA TRAVELS
Tandur,western_union,,unknown,MUTHOOT FINANCE LTD
Rangareddy,western_union,,unknown,UNIMONI HYDERABAD VANASTHALIPURAM VNM
Zaheerabad,western_union,,unknown,M S SHIVAMANI TRADERS
Medak,western_union,,unknown,INDIA POST PAYMENTS BANK LTD
Hyderabad,western_union,,unknown,LAKSHMI SAI MONEY TRANSFER
Utnoor,western_union,,unknown,MUTHOOT FINANCE LTD
Wanaparthy,western_union,,unknown,INDIA POST PAYMENTS BANK LTD
Machareddy,western_union,,unknown,A B S TOURS AND TRAVELS
Nizamabad North,western_union,,unknown,SRI VARUN TRAVELS
Mamada,western_union,,unknown,SRI LAXMI NARASIMHA SWAMY COMMUNICATION
Armur,western_union,,unknown,VAISHNAVI T SEVA ONLINE SERVICES
Armoor,western_union,,unknown,SHALINI ENTERPRISES
Asifabad,western_union,,unknown,MUTHOOT FINCORP LTD
Mahaboob Nagar,western_union,,unknown,HAJI GAFFAR AHMED
Komarambheem,western_union,,unknown,SRI VENKATESHWARA COMMUNICATIONS
Jagtial,western_union,,unknown,SRIDHAR TRAVELS
Jannaram,western_union,,unknown,ROYAL COMMUNICATIONS
Vikarabad,western_union,,unknown,INDIA POST PAYMENTS BANK LTD
Metpally,western_union,,unknown,SHANKAR MEDICALS
Nagar Kurnool,western_union,,unknown,MUTHOOT FINANCE LTD
Bheemgal,western_union,,unknown,SRINIVASA MONEY POINT
Nagarkurnool,western_union,,unknown,INDIA POST PAYMENTS BANK LTD
Jadcherla,western_union,,unknown,SARASWATHI INTERNET
Karimnagar,western_union,,unknown,GYK ONLINE SERVICES
Ranga Reddy,western_union,,unknown,MUTHOOT FINCORP LIMITED
Ibrahimpatnam,western_union,,unknown,MUTHOOT FINANCE LTD
Itikyal,western_union,,unknown,MAHESWARI ENTERPRISES
Jagitial,western_union,,unknown,VENKATESHWARA ONLINE SERVICES
Sirkonda,western_union,,unknown,SK ONLINE SERVICES
Korutla,western_union,,unknown,SRINIVASA TRAVELS
Kamareddy,western_union,,unknown,OM SHIVA TRAVELS
Sangareddy,western_union,,unknown,MS VINAYAKA BANKER
Kondapur,western_union,,unknown,LONKA RAMASWAMI NETWORKS
Shad Nagar-station Road,western_union,,unknown,MUTHOOT FINANCE LTD
Patancheru,western_union,,unknown,S S MONEY WORLD
Luxettipet,western_union,,unknown,SAI XEROX AND INTERNET
Ramayampet,western_union,,unknown,MUTHOOT FINCORP LIMITED
Karim Nagar,western_union,,unknown,UNIMONI KARIM NAGAR KAR
Sircilla,western_union,,unknown,ANUCHARAN TOURS AND TRAVELS
Ragareddy,western_union,,unknown,M M MOBILES
Serilingmapalli,western_union,,unknown,MUTHOOT FINANCE LTD
Mancherial,western_union,,unknown,UNIMONI MANCHERIAL MCL
Kukatpally,western_union,,unknown,SBI TINY CUSTOMERS SERVICES POI
Hyderabad - Madhapur,western_union,,unknown,MUTHOOT FINANCE LTD
Aswaraopet,western_union,,unknown,MUTHOOT FINANCE LTD
Hyderabad - Kalyannagar,western_union,,unknown,MUTHOOT FINANCE LTD
Gopalraopet,western_union,,unknown,ARVIND COMMUNICATIONS
Rajanna Sircilla,western_union,,unknown,UNIMONI SIRCILLA SIR
Rajanna Siricilla,western_union,,unknown,SRIDHAR TRAVELS
Telangana,western_union,,unknown,TAQDEER ENTERPRISES
Hyderabad-ameerpet,western_union,,unknown,MUTHOOT FINANCE LTD
Ameerpet,western_union,,unknown,MS BRAND FOREX PRIVATE LIMITED
Charminar,western_union,,unknown,UNIQUE TRAVEL MARKET
Secunderabad,western_union,,unknown,MANAPPURAM FINANCE LIMITED
Hederabad,western_union,,unknown,GHULAMS FOREIGN EXCHANGE
Hyderabad-mg Road,western_union,,unknown,MUTHOOT FINANCE LTD
Choppadhandi,western_union,,unknown,SAINATH ASSOCIATES
Hyderabad   Ashok Nagar,western_union,,unknown,MUTHOOT FINANCE LTD
Hyderabad - Barkathpura,western_union,,unknown,MUTHOOT FINANCE LTD
Hyderabad- Tilak Nagar,western_union,,unknown,MUTHOOT FINANCE LTD
Malakpet,western_union,,unknown,LIMRA TRAVELS AND ONLINE SERVICES
Saroornagar,western_union,,unknown,MUTHOOT FINCORP LIMITED
Secunderabad - Mettuguda,western_union,,unknown,MUTHOOT FINANCE LTD
Qutubullapur,western_union,,unknown,UNIQUE COMMUNICATION
Hyderabad - Diamond Point,western_union,,unknown,MUTHOOT FINANCE LTD
Hyderabad - Omkar Nagar,western_union,,unknown,MUTHOOT FINANCE LTD
Meerpet,western_union,,unknown,MUTHOOT FINANCE
Warasiguda,western_union,,unknown,MANAPPURAM FINANCE LIMITED
Siricilla,western_union,,unknown,JYOTHI COMMUNICATIONS
Hyderabaduth East,western_union,,unknown,FINE ENTERPRISES
Secunderabad- East Maredpally,western_union,,unknown,MUTHOOT FINANCE LTD
Hyderabad - Ramanthapur - Prag,western_union,,unknown,MUTHOOT FINANCE LTD
Secundrabad,western_union,,unknown,B VANISREE MEESEVA
Medchal Malkajgiri,western_union,,unknown,MOUNISH COMMUNICATION
Hyderabad-malkajgiri-geetha Na,western_union,,unknown,MUTHOOT FINANCE LTD
Hyderabad - Nagole,western_union,,unknown,MUTHOOT FINANCE LTD
Hayathnagar,western_union,,unknown,MUTHOOT FINCORP LIMITED
Hyderabad -vanastalipuram,western_union,,unknown,MUTHOOT FINANCE LTD
Bhoopalapally,western_union,,unknown,MUTHOOT FINANCE LTD
Siddipet,western_union,,unknown,AR XEROX ONLINE SERVICES
Hyderabad-ghatkesar,western_union,,unknown,MUTHOOT FINANCE LTD
Abdullapurmet,western_union,,unknown,MUTHOOT FINANCE LTD
Hyderabad-mallapur,western_union,,unknown,MUTHOOT FINANCE LTD
Hyderabad-kapara-saketh Road,western_union,,unknown,MUTHOOT FINANCE LTD
Jammikunta,western_union,,unknown,MUTHOOT FINCORP LTD
Bhongir,western_union,,unknown,MUTHOOT FINANCE LTD
Kothagudem - Barlipit,western_union,,unknown,MUTHOOT FINANCE LTD
Husnabad,western_union,,unknown,MANAPPURAM FINANCE LIMITED
Kothagudem,western_union,,unknown,RICHMAX FINVEST KOTHAGUDEM
Malkajigiri,western_union,,unknown,KLM AXIVA FINVEST LTD
Hyderabad - Nacharam,western_union,,unknown,MUTHOOT FINANCE LTD
Peddapalli,western_union,,unknown,UNIMONI PEDDAPALLI PPI
Hyderabad   A S Raonagar,western_union,,unknown,MUTHOOT FINANCE LTD
