Ref,Spider,Name,Address,City,State,Zipcode,Country,Phone,Website,Hours,Brand,WikiData
739,adairs,Adairs Fountain Gate Shopping Centre,"Shop 1106/7, Fountain Gate Shopping Centre, 25-55 Overland Dr, Narre Warren, VIC, 3805, Australia",,,,AU,+61 3 8763 4202,https://www.adairs.com.au/stores/fountain-gate/,Mo-We 09:00-17:30; Th 09:00-21:00; Fr 09:00-17:30; Sa 09:00-17:00; Su 10:00-17:00,Adairs,Q109626904
838,adairs,Adairs Fountain Gate Homemaker,"Pad Site E, Narre Warren North Road, Narre Warren, VIC, 3805, Australia",,,,AU,+61 3 8763 4203,https://www.adairs.com.au/stores/fountain-gate-homemaker/,Mo-We 09:00-17:30; Th 09:00-18:00; Fr 09:00-19:00; Sa 09:00-17:00; Su 10:00-17:00,Adairs,Q109626904
3655,country_fire_authority_au,Narre Warren,,Narre Warren South,,,AU,,,,,
7772,goodyear_autocare_au_nz,Goodyear Autocare Narre Warren,,Narre Warren,,,AU,+61 3 9705 0007,https://www.goodyearautocare.com.au/store-locator/goodyear-autocare-narre-warren,Mo-Fr 08:30-17:30; Sa 08:00-12:00,Goodyear Autocare,Q620875
70669002,moneygram,PARK  N SHOP GROCERY,,NARRE WARREN,,,AU,+61 3 8774 7686,,Mo-Su 09:30-21:30,MoneyGram,Q1944412
au42ce3394,pandora,Pandora Jewellery at Pandora Fountaingate,,Narre Warren,,,AU,+61 3 9705 8555,https://stores.pandora.net/au-vic/narrewarren/pandora-jewellery-au42ce3394.html,Mo-We 09:00-17:30; Th-Fr 09:00-21:00; Sa 09:00-17:00; Su 10:00-17:00,Pandora,Q2241604
https://rolld.com.au/location/fountain-gate/,rolld_au,Roll’d Fountain Gate,"Shop 2095, Westfield Fountain Gate, 352 Princes Highway, Fountain Gate, VIC, 3805",,,,AU,+61 3 8774 7115,https://rolld.com.au/location/fountain-gate/,,Roll'd,Q113114631
187,united_petroleum_au,United Narre Warren South,25 Cranbourne-Narre Warren Road Narre Warren South VIC,,,,AU,+61 3 8691 2034,,,United Petroleum,Q28224393
