Ref,Spider,Name,Address,City,State,Zipcode,Country,Phone,Website,Hours,Brand,WikiData
4844,bp,WHITTINGTON ROAD FILLING STN,,WORCESTER,,,GB,+44 1905 351245,,24/7,BP,Q152057
a802d68d-0797-eb11-b1ac-000d3a2ed0d4,costa_coffee_gg_gb_im_je,Global Fuel (UK) Limited @ BP Whittington Rd,,Worcester,,,GB,,,24/7,Costa Express,Q113556385
gcq2y5k6sg29,gov_cma_fuel_gb,BP,"Whittington Road, Worcester, Worcestershire",,,,GB,,,,BP,Q152057
GB_EXT_00741,totalenergies,Whittington Road Filling Stn,,WORCESTER,,,GB,+44 1905 351245,https://store.totalenergies.fr/en_EN/GB_EXT_00741,,BP,Q152057
,visa,,,WORCESTER,,,GB,,,,,
