Ref,Spider,Name,Address,City,State,Zipcode,Country,Phone,Website,Hours,Brand,WikiData
74065301,moneygram,GLOBAL MONEY NETWORK SIS A MODINGOUL OUA,,MATAM,,,SN,+221 77 944 32 07,,Mo-Su 08:00-22:00,MoneyGram,Q1944412
74065275,moneygram,GLOBAL MONEY NETWORK THILOGNE QUARTIER G,,MATAM,,,SN,+221 77 912 25 68,,Mo-Su 08:00-22:00,MoneyGram,Q1944412
74211210,moneygram,NIANG AMADOU MAMADOU - MATAM,,MATAM,,,SN,+221 77 790 54 79,,Mo-Su 08:00-23:00,MoneyGram,Q1944412
74889396,moneygram,GIE SOPE KHADIM TOUBA MULTISERVICES - #4,,MATAM,,,SN,+221 33 839 00 90,,Mo-Su 08:00-22:00,MoneyGram,Q1944412
75034179,moneygram,SARR MICHEL FRANCOIS GARA - KANEL,,KANEL,,,SN,+221 77 509 31 87,,Mo-Su 08:00-23:00,MoneyGram,Q1944412
