City,Place Name,Zipcode,Name
unknown,wildberries,Тамбовская область Тамбов Колхозная улица 1Ак2,unknown,Wildberries
unknown,wildberries,Мичуринск Липецкое Шоссе 45а,unknown,Wildberries
unknown,wildberries,Тамбовская область Рассказово Совхозная улица 3,unknown,Wildberries
unknown,wildberries,Тамбов Улица Агапкина 15а,unknown,Wildberries
unknown,wildberries,рабочий посёлок Первомайский Больничная Улица 4,unknown,Wildberries
unknown,wildberries,рабочий посёлок Дмитриевка Микрорайон Сахзавод 4,unknown,Wildberries
unknown,wildberries,Тамбовская область Рассказово Пролетарская улица 52,unknown,Wildberries
unknown,wildberries,Тамбов Улица Рылеева 59ак6,unknown,Wildberries
unknown,wildberries,Тамбовская область Рассказово Тамбовская улица 141,unknown,Wildberries
unknown,wildberries,посёлок Пригородный Покровская Улица 18б,unknown,Wildberries
unknown,wildberries,Мичуринск Липецкое Шоссе 79,unknown,Wildberries
unknown,wildberries,село Заворонежское Советская Улица 95,unknown,Wildberries
unknown,wildberries,Тамбовская область рабочий посёлок Первомайский Московская улица 8,unknown,Wildberries
unknown,wildberries,Тамбовская область Тамбов Мичуринская улица 143А,unknown,Wildberries
unknown,wildberries,Тамбовская область посёлок Устьинский улица Ленина 338Д,unknown,Wildberries
unknown,wildberries,Тамбов Запрудная Улица 4,unknown,Wildberries
unknown,wildberries,Мичуринск Кооперативная Улица 69,unknown,Wildberries
