City,Place Name,Zipcode,Name
Тамбов,coffee_like,ул. Советская 194б,unknown,Coffee Like
Тамбов,coffee_like,ул. Советская 143,unknown,Coffee Like
Тамбов,coffee_like,ул. Советская 192,unknown,Coffee Like
Тамбов,coffee_like,ул. Интернациональная 26а,unknown,Coffee Like
Тамбов,coffee_like,ул. Чичерина 27,unknown,Coffee Like
Тамбов,coffee_like,ул. Мичуринская 112 в,unknown,Coffee Like
Тамбов,coffee_like,ул. Советская 60,unknown,Coffee Like
Тамбов,coffee_like,ул. Советская 99а (Павильон),unknown,Coffee Like
Тамбов,coffee_like,ул. Советская 120,unknown,Coffee Like
Тамбов,coffee_like,"ул. Советская 99а (ТРЦ ""РИО"")",unknown,Coffee Like
g.p. Novolyadinskiy possovet,lukoil,Russia 392515 Tambov region. g.p. Novolyadinskiy possovet Novaya Lyada ul. Sovetskaya str. 250,unknown,AZS № 68857
Tambovskiy area,lukoil,Russia 392540 Tambov region. Tambovskiy area s.p. Streletskiy selsovet ter. avtomagistral Moskva-Volgograd 446-y km str. 1,unknown,AZS № 68856
Tambovskiy m.r-n,lukoil,Russia 392540 Tambov region. Tambovskiy m.r-n s.p. Streletskiy selsovet s. Streltsy ul. Urozhaynaya soor. 10b,unknown,AZS № 68855
g.p. Novolyadinskiy possovet,lukoil,Russia 392515 Tambov region. g.p. Novolyadinskiy possovet Novaya Lyada ul. Berezovaya str. 50,unknown,AZS № 68854
Tambov,lukoil,Russia 392000 Tambov region Tambov st. Proletarskaya 174,unknown,AZS № 68853
Tambov,lukoil,Russia 392000 Tambov region Tambov st. Chicherina 5,unknown,AZS № 68852
Tambov,lukoil,Russia 392000 Tambov region Tambov st. Sovetskaya 194,unknown,AZS № 68851
Pervomayskiy m.r-n,lukoil,Russia 392000 Tambov region. Pervomayskiy m.r-n s.p. Khobotovskiy selsovet str. 1,unknown,AZS № 68850
unknown,wildberries,г. Тамбов (Тамбовская область) ул. Кронштадтская 4А корп 2,unknown,Wildberries
unknown,wildberries,г. Тамбов (Тамбовская обл.) ул. Чичерина 62В,unknown,Wildberries
unknown,wildberries,г. Моршанск (Тамбовская обл.) ул. Интернациональная  д. 48,unknown,Wildberries
unknown,wildberries,г. Мичуринск (Тамбовская обл.) Липецкое шоссе 44а,unknown,Wildberries
unknown,wildberries,Тамбовская область Тамбов Советская улица 191,unknown,Wildberries
unknown,wildberries,г. Тамбов (Тамбовская область) улица Сенько д. 14,unknown,Wildberries
unknown,wildberries,г. Котовск (Тамбовская область) Октябрьская улица д. 49,unknown,Wildberries
unknown,wildberries,г. Тамбов (Тамбовская область) улица Рылеева д. 60А,unknown,Wildberries
unknown,wildberries,г. Тамбов (Тамбовская область) улица Карла Маркса д. 175Б,unknown,Wildberries
unknown,wildberries,г. Тамбов (Тамбовская область) Державинская улица д. 13,unknown,Wildberries
unknown,wildberries,г. Тамбов (Тамбовская область) Свободная улица д. 16А,unknown,Wildberries
unknown,wildberries,г. Тамбов (Тамбовская область) Астраханская улица д. 197А,unknown,Wildberries
unknown,wildberries,Строитель (Тамбовская область) мкр.Северный дом  д.5,unknown,Wildberries
unknown,wildberries,Тамбовская область Мичуринск Советская улица 279А,unknown,Wildberries
unknown,wildberries,г. Уварово (Тамбовская область) Октябрьская улица д. 2а,unknown,Wildberries
unknown,wildberries,г. Котовск (Тамбовская область) улица Посконкина д. 6Б,unknown,Wildberries
unknown,wildberries,г. Кирсанов (Тамбовская область) Советская улица д. 23А,unknown,Wildberries
unknown,wildberries,г. Моршанск (Тамбовская область) Интернациональная улица д. 15,unknown,Wildberries
unknown,wildberries,г. Рассказово (Тамбовская область) улица 8 Марта д. 7,unknown,Wildberries
unknown,wildberries,рабочий посёлок Первомайский (Тамбовская область) улица Дружбы д. 3,unknown,Wildberries
unknown,wildberries,деревня Красненькая (Тамбовская область) Совхозная улица д. 12А,unknown,Wildberries
unknown,wildberries,г. Тамбов (Тамбовская область) улица Чичканова д. 55,unknown,Wildberries
unknown,wildberries,г. Тамбов (Тамбовская область) Астраханская улица 7/1,unknown,Wildberries
unknown,wildberries,посёлок городского типа Инжавино (Тамбовская область) Советская улица д. 20,unknown,Wildberries
unknown,wildberries,г. Мичуринск (Тамбовская область) улица 7 Ноября д. 50,unknown,Wildberries
unknown,wildberries,г. Мичуринск (Тамбовская область) улица Гагарина д. 1,unknown,Wildberries
unknown,wildberries,г. Тамбов (Тамбовская область) Советская улица 190Ак1,unknown,Wildberries
unknown,wildberries,г. Жердевка (Тамбовская область) Советская улица д. 115,unknown,Wildberries
unknown,wildberries,г. Мичуринск (Тамбовская область) Новая улица д. 11,unknown,Wildberries
unknown,wildberries,Тамбовская область Тамбов Никифоровская улица 40,unknown,Wildberries
unknown,wildberries,г. Моршанск (Тамбовская обл) Куйбышева 32,unknown,Wildberries
unknown,wildberries,г Тамбов (Тамбовская обл) улица 3-я Линия 18Б,unknown,Wildberries
unknown,wildberries,Тамбов (Тамбов) 3-й Почтовый проезд 5,unknown,Wildberries
unknown,wildberries,г Тамбов (Тамбовская обл) Мичуринская 112Д,unknown,Wildberries
unknown,wildberries,г Мичуринск (Тамбовская обл) Лермонтова 12,unknown,Wildberries
unknown,wildberries,г Уварово (Россия Тамбовская обл) 1 микрорайон 1в,unknown,Wildberries
unknown,wildberries,г Тамбов (Россия Тамбовская обл) Киквидзе 75И,unknown,Wildberries
unknown,wildberries,"г Тамбов (Россия Тамбовская обл) Мичуринская 185 ""А"" корпус 1 пом.6",unknown,Wildberries
unknown,wildberries,г Тамбов (Тамбовская область) Мичуринская улица 335А,unknown,Wildberries
unknown,wildberries,г Тамбов (Тамбовская область) Астраханская улица 175/23А,unknown,Wildberries
unknown,wildberries,г Тамбов (Тамбовская область городской округ Тамбов) улица имени Юрия Гагарина 38А,unknown,Wildberries
unknown,wildberries,г Тамбов (Тамбовская область) улица Агапкина 4/16,unknown,Wildberries
unknown,wildberries,п Знаменка 1-я (Тамбовская область Знаменский район) Красная площадь 21А,unknown,Wildberries
unknown,wildberries,г Тамбов (Тамбовская область) Интернациональная улица 56 ,unknown,Wildberries
unknown,wildberries,Мордово Тамбовская область Мордовский район Ленинский проспект 12В,unknown,Wildberries
unknown,wildberries,Токаревка (Тамбовская область) улица Ленина 3,unknown,Wildberries
unknown,wildberries,Строитель (Тамбовская область) Южный микрорайон 1В,unknown,Wildberries
unknown,wildberries,г Котовск (Тамбовская область) Октябрьская улица 6В,unknown,Wildberries
unknown,wildberries,г. Рассказово (Тамбовская обл) улица Куйбышева 57,unknown,Wildberries
unknown,wildberries,Сосновка (Тамбовская область) Моршанская улица 35  ,unknown,Wildberries
unknown,wildberries,Мучкапский (Тамбовская область) Базарная улица 23,unknown,Wildberries
unknown,wildberries,Рассказово Тамбовская обл улица 60 лет Рассказово 4,unknown,Wildberries
unknown,wildberries,Тамбов Тамбовская область городской округ Тамбов Красноармейская площадь 7,unknown,Wildberries
unknown,wildberries,г Мичуринск Гоголевская Улица 240,unknown,Wildberries
unknown,wildberries,Жердевка Тамбовская обл Жердевский р-н Кировская улица 46,unknown,Wildberries
unknown,wildberries,г Тамбов Свободная Улица 8,unknown,Wildberries
unknown,wildberries,г Кирсанов Пушкинская Улица 25а,unknown,Wildberries
unknown,wildberries,г Тамбов Сабуровская Улица 2ак1,unknown,Wildberries
unknown,wildberries,г Мичуринск Автозаводская Улица 4,unknown,Wildberries
unknown,wildberries,р.п. Новая Ляда Улица Первомайская 1Б,unknown,Wildberries
unknown,wildberries,Тамбов Тамбовская обл улица Фридриха Энгельса 5,unknown,Wildberries
unknown,wildberries,Россия Тамбовская обл г Тамбов Улица Агапкина 17а,unknown,Wildberries
unknown,wildberries,Тамбов Тамбовская область городской округ Тамбов Ореховая улица 18,unknown,Wildberries
unknown,wildberries,рп Ржакса Первомайская Улица 39,unknown,Wildberries
unknown,wildberries,г Тамбов Бульвар Энтузиастов 1а,unknown,Wildberries
unknown,wildberries,Тамбовская область Тамбов улица Карла Маркса 348,unknown,Wildberries
unknown,wildberries,Жердевка Тамбовская обл Жердевский р-н улица Чкалова 26Б,unknown,Wildberries
unknown,wildberries,Бокино Тамбовская область Тамбовский район Дорожный переулок 39,unknown,Wildberries
unknown,wildberries,Котовск Тамбовская обл Октябрьская улица 24,unknown,Wildberries
unknown,wildberries,г Тамбов Магистральная Улица 39г,unknown,Wildberries
unknown,wildberries,Тамбовская область Строитель Придорожная улица 38,unknown,Wildberries
unknown,wildberries,Котовск Тамбовская область городской округ Котовск улица Посконкина 30,unknown,Wildberries
unknown,wildberries,Тамбов Тамбовская область городской округ Тамбов Рубежный проезд 14,unknown,Wildberries
unknown,wildberries,г Котовск Октябрьская Улица 35,unknown,Wildberries
unknown,wildberries,Мичуринск Тамбовская область городской округ Мичуринск Красная улица 82,unknown,Wildberries
unknown,wildberries,г Тамбов (Тамбовская обл) ул Магистральная д 25 ,unknown,Wildberries
unknown,wildberries,Тамбовская область рабочий посёлок Первомайский Солнечная улица 19,unknown,Wildberries
unknown,wildberries,Тамбов Тамбовская область городской округ Тамбов улица Гастелло 22,unknown,Wildberries
unknown,wildberries,Мичуринск Тамбовская обл Интернациональная улица 85,unknown,Wildberries
unknown,wildberries,Моршанск Тамбовская область городской округ Моршанск улица Куйбышева 56,unknown,Wildberries
unknown,wildberries,Тамбов Тамбовская область городской округ Тамбов улица Карла Маркса 227,unknown,Wildberries
unknown,wildberries,г Тамбов (Тамбовская обл) ул Чичерина д 11 ,unknown,Wildberries
unknown,wildberries,г Тамбов Магистральная Улица 39в,unknown,Wildberries
unknown,wildberries,Кирсанов Тамбовская область городской округ Кирсанов Советская улица 2,unknown,Wildberries
unknown,wildberries,Красненькая (Тамбовская обл) ул Совхозная д 210 ,unknown,Wildberries
unknown,wildberries,Тамбов Тамбовская область городской округ Тамбов Запрудный проезд 4Вк1,unknown,Wildberries
unknown,wildberries,Тамбовская область Тамбов Мичуринская улица 3А,unknown,Wildberries
unknown,wildberries,Тамбовская область Тамбов проезд Николая Островского 6,unknown,Wildberries
unknown,wildberries,Уварово Тамбовская обл Интернациональная улица 57,unknown,Wildberries
unknown,wildberries,г Рассказово Фабричный Проезд 1ж,unknown,Wildberries
unknown,wildberries,Моршанск Тамбовская область городской округ Моршанск Красная улица 28,unknown,Wildberries
unknown,wildberries,г Тамбов Улица Рылеева 92/2,unknown,Wildberries
unknown,wildberries,г Рассказово Улица Куйбышева 1,unknown,Wildberries
unknown,wildberries,Тамбовская область Тамбов Базарная улица 126,unknown,Wildberries
unknown,wildberries,Тамбовская область Тамбов улица Гоголя 37к3,unknown,Wildberries
unknown,wildberries,Тамбовская область Тамбов улица Агапкина 22к2,unknown,Wildberries
unknown,wildberries,г Тамбов Улица Рылеева 100б,unknown,Wildberries
unknown,wildberries,г Тамбов Мичуринская Улица 142к2,unknown,Wildberries
unknown,wildberries,рп Дмитриевка Улица Победы 3,unknown,Wildberries
unknown,wildberries,г Тамбов Мичуринская Улица 60,unknown,Wildberries
unknown,wildberries,Первомайский Тамбовская область Первомайский район Вокзальная улица 16А,unknown,Wildberries
unknown,wildberries,г Мичуринск Улица Мира 10,unknown,Wildberries
unknown,wildberries,г Тамбов Улица Чичерина 52,unknown,Wildberries
unknown,wildberries,г Тамбов Советская Улица 163,unknown,Wildberries
unknown,wildberries,г Тамбов Улица Агапкина 25,unknown,Wildberries
unknown,wildberries,г Тамбов Улица Николая Вирты 201,unknown,Wildberries
unknown,wildberries,Тамбовская область Уварово улица Петра Ширяева 19,unknown,Wildberries
unknown,wildberries,с Староюрьево Улица Ломоносова 3а,unknown,Wildberries
unknown,wildberries,г Тамбов Улица Сенько 24ак1,unknown,Wildberries
unknown,wildberries,г Тамбов Славная Улица 1,unknown,Wildberries
unknown,wildberries,Тамбовская область Кирсанов Красноармейская улица 21В,unknown,Wildberries
unknown,wildberries,г Тамбов Авиационная Улица 148,unknown,Wildberries
unknown,wildberries,г Тамбов Улица Максима Горького 31к2,unknown,Wildberries
unknown,wildberries,рп Умет Кооперативная Улица 76а,unknown,Wildberries
unknown,wildberries,г Тамбов Ореховая Улица 9,unknown,Wildberries
unknown,wildberries,с Пичаево Пролетарская Улица 14а,unknown,Wildberries
unknown,wildberries,Тамбовская область Тамбов бульвар Энтузиастов 1Е/1,unknown,Wildberries
unknown,wildberries,с Горелое Улица Ленина 45ж,unknown,Wildberries
unknown,wildberries,Котовск Октябрьская Улица 75,unknown,Wildberries
unknown,wildberries,Тамбовская область село Пичаево Пролетарская улица 63,unknown,Wildberries
unknown,wildberries,Тамбовская область Мичуринск Липецкое шоссе 110,unknown,Wildberries
unknown,wildberries,село Татаново Улица Ленина 195,unknown,Wildberries
unknown,wildberries,Тамбов Советская Улица 123,unknown,Wildberries
unknown,wildberries,Кирсанов Красноармейская Улица 4,unknown,Wildberries
unknown,wildberries,Уварово 1-Й Микрорайон 3,unknown,Wildberries
unknown,wildberries,с Красносвободное Центральная Улица 4,unknown,Wildberries
unknown,wildberries,Моршанск Южная Улица 3,unknown,Wildberries
unknown,wildberries,Тамбовская область Тамбов Набережная улица 74к1,unknown,Wildberries
unknown,wildberries,Моршанск Улица Белинского 1,unknown,Wildberries
unknown,wildberries,село Сампур Советская Улица 77,unknown,Wildberries
unknown,wildberries,Тамбовская область Моршанск Интернациональная улица 70,unknown,Wildberries
unknown,wildberries,Тамбовская область рабочий посёлок Сосновка улица Мичурина 59,unknown,Wildberries
unknown,wildberries,Тамбовская область город Жердевка Первомайская улица 131,unknown,Wildberries
unknown,wildberries,Тамбовская область Рассказово Советская улица 14,unknown,Wildberries
unknown,wildberries,Тамбовская область Моршанск Советская улица 36,unknown,Wildberries
unknown,wildberries,Тамбовская область посёлок Строитель микрорайон Южный 15Б,unknown,Wildberries
unknown,wildberries,Тамбовская область Уварово 2-й микрорайон 5,unknown,Wildberries
unknown,wildberries,Тамбовская область Мичуринск Октябрьская улица 68,unknown,Wildberries
unknown,wildberries,Тамбовская область Тамбов Астраханская улица 190,unknown,Wildberries
unknown,wildberries,Тамбовская область посёлок совхоза Комсомолец Зелёная улица 2В,unknown,Wildberries
unknown,wildberries,посёлок совхоза Комсомолец Центральная Улица 59в,unknown,Wildberries
unknown,wildberries,Тамбовская область рабочий посёлок Токарёвка Советская улица 52Б,unknown,Wildberries
unknown,wildberries,Тамбовская область посёлок городского типа Знаменка улица Мира 14А,unknown,Wildberries
unknown,wildberries,Тамбов Бульвар Энтузиастов 32,unknown,Wildberries
unknown,wildberries,Тамбовская область Тамбов улица Карла Маркса 32,unknown,Wildberries
unknown,wildberries,Тамбовская область Тамбов улица Сенько 24А,unknown,Wildberries
unknown,wildberries,Тамбов Пензенская Улица 67/12,unknown,Wildberries
unknown,wildberries,Тамбовская область посёлок городского типа Знаменка Советская улица 16,unknown,Wildberries
unknown,wildberries,Тамбовская область рабочий посёлок Мордово Пролетарская улица 36,unknown,Wildberries
unknown,wildberries,Тамбовская область посёлок городского типа Инжавино Базарная улица 6А,unknown,Wildberries
unknown,wildberries,Тамбовская область Уварово 2-й микрорайон 21,unknown,Wildberries
unknown,wildberries,Тамбов Астраханская Улица 164а,unknown,Wildberries
unknown,wildberries,Тамбовская область Моршанск улица Дзержинского 8,unknown,Wildberries
unknown,wildberries,Тамбовская область рабочий посёлок Токарёвка Октябрьская улица 2,unknown,Wildberries
unknown,wildberries,село Гавриловка 2-я Советская Улица 4а,unknown,Wildberries
unknown,wildberries,Тамбовская область рабочий посёлок Мучкапский Советская улица 46,unknown,Wildberries
unknown,wildberries,посёлок Строитель Микрорайон Северный 42,unknown,Wildberries
unknown,wildberries,Тамбовская область Мичуринск улица Карла Маркса 12А,unknown,Wildberries
unknown,wildberries,Тамбовская область Рассказово улица Пушкина 64,unknown,Wildberries
unknown,wildberries,Тамбовская область Рассказово улица Лермонтова 32,unknown,Wildberries
unknown,wildberries,село Бондари Кооперативная Улица 6,unknown,Wildberries
unknown,wildberries,Тамбов Пензенская Улица 5,unknown,Wildberries
unknown,wildberries,Тамбовская область Тамбов улица Чичканова 14В,unknown,Wildberries
unknown,wildberries,Тамбовская область деревня Крутые Выселки улица Герасимова 31,unknown,Wildberries
unknown,wildberries,Тамбовская область Тамбов Советская улица 190Бк1,unknown,Wildberries
unknown,wildberries,Тамбовская область Рассказово улица Некрасова 5А,unknown,Wildberries
unknown,wildberries,Тамбовская область село Донское Советская улица 236Б,unknown,Wildberries
unknown,wildberries,посёлок Сатинка Олимпийская Улица 1,unknown,Wildberries
unknown,wildberries,Тамбов Мичуринская Улица 82,unknown,Wildberries
unknown,wildberries,село Стрельцы Улица С.М. Филимонова 10б,unknown,Wildberries
unknown,wildberries,Тамбов Тулиновская Улица 5ас2,unknown,Wildberries
unknown,wildberries,Мичуринск Улица Энгельса 1,unknown,Wildberries
unknown,wildberries,Тамбов Улица Карла Маркса 254,unknown,Wildberries
unknown,wildberries,Тамбовская область Тамбов улица Августа Бебеля 18,unknown,Wildberries
unknown,wildberries,Тамбовская область Тамбов Пушкарская улица 58/1,unknown,Wildberries
unknown,wildberries,Тамбовская область Тамбов улица Рылеева 108Б,unknown,Wildberries
unknown,wildberries,Тамбовская область Тамбов 1-й Школьный проезд 3,unknown,Wildberries
unknown,wildberries,село Кузьмино-Гать Полевая Улица 2а,unknown,Wildberries
unknown,wildberries,Тамбовская область Тамбов Базарная улица 104,unknown,Wildberries
unknown,wildberries,Тамбовская область село Алгасово 1-я Базарная улица 44,unknown,Wildberries
unknown,wildberries,Тамбовская область село Дегтянка Ленинская улица 95,unknown,Wildberries
unknown,wildberries,Тамбов Улица Гастелло 34,unknown,Wildberries
unknown,wildberries,Рассказово Октябрьская Улица 8б,unknown,Wildberries
unknown,wildberries,Тамбовская область Тамбов улица Рылеева 91,unknown,Wildberries
unknown,wildberries,Тамбовская область рабочий посёлок Сосновка Интернациональная улица 199,unknown,Wildberries
unknown,wildberries,Тамбовская область Моршанск Пролетарская улица 31,unknown,Wildberries
unknown,wildberries,Тамбовская область рабочий посёлок Мордово 2-я Революционная улица 65Б,unknown,Wildberries
unknown,wildberries,Тамбовская область Уварово 1-й микрорайон 30,unknown,Wildberries
unknown,wildberries,Тамбовская область Тамбов Селезнёвская улица 2Б,unknown,Wildberries
unknown,wildberries,Тамбовская область Тамбов Свободная улица 6,unknown,Wildberries
unknown,wildberries,Тамбовская область Кирсанов Школьная улица 26А,unknown,Wildberries
