Ref,Spider,Name,Address,City,State,Zipcode,Country,Phone,Website,Hours,Brand,WikiData
INDA31102,audi,Audi Mumbai West,"Andheri Link Road, Andheri Neo Vikram, Sahakar Nagar, 400053 Mumbai",Mumbai,Maharashtra,,IN,+91 22 4153 1111,,,Audi,Q23317
8985143,baskin_robbins_in,Baskin Robbins,"Shop 16, Ground Floor, Embassy Building, Andheri Lokhandwala, Andheri West, Mumbai",Mumbai,Maharashtra,,IN,+91 90827 38399,,,Baskin Robbins,Q584601
7167358,chaayos_in,Chaayos - Kokilaben Hospital,"Achutrao Patwardhan Marg, Sahayog Nagar, Four Bungalows, Andheri West, Mumbai, Maharashtra 400053, India",Mumbai,Maharashtra,,IN,,,,Chaayos,Q117235235
https://www.dominos.co.in/store-locations/mumbai/unit-nov6-versova-station-metro-station,dominos_pizza_in,Dominos Pizza Unit No.V6 Versova Station (Metro Station),"Unit No.V6, Versova Station (Metro Station), Mumbai, Maharashtra",Mumbai,Maharashtra,,IN,+91 22 2632 6699,https://www.dominos.co.in/store-locations/mumbai/unit-nov6-versova-station-metro-station,,Domino's Pizza,Q839466
https://www.dominos.co.in/store-locations/mumbai/unit-noaz3-azad-nagar-station-metro-station,dominos_pizza_in,Dominos Pizza Unit No.AZ3 Azad Nagar Station (Metro Station),"Unit No.AZ3, Azad Nagar Station (Metro Station), Mumbai, Maharashtra",Mumbai,Maharashtra,,IN,+91 22 2632 6699,https://www.dominos.co.in/store-locations/mumbai/unit-noaz3-azad-nagar-station-metro-station,,Domino's Pizza,Q839466
https://www.dominos.co.in/store-locations/mumbai/unit-no-d5-dnnagar-station-metro-station,dominos_pizza_in,Dominos Pizza Unit No. D5 D.N.Nagar Station (Metro Station),"Unit No. D5, D.N.Nagar Station (Metro Station), Mumbai, Maharashtra",Mumbai,Maharashtra,,IN,+91 22 2632 6699,https://www.dominos.co.in/store-locations/mumbai/unit-no-d5-dnnagar-station-metro-station,,Domino's Pizza,Q839466
https://www.dominos.co.in/store-locations/mumbai/lokhandwala,dominos_pizza_in,Dominos Pizza LOKHANDWALA,"12 13, Kamdhenu Shopping Complex, Lokhandwala, MUMBAI, Maharashtra - 400053",Mumbai,Maharashtra,,IN,+91 22 2632 6699,https://www.dominos.co.in/store-locations/mumbai/lokhandwala,,Domino's Pizza,Q839466
https://local.fedex.com/#11612021,fedex,FedEx World Service Center,,Mumbai,Maharashtra,,IN,+91 1800 22 6161,https://local.fedex.com/en-in/mh/mumbai/bomad,,FedEx,Q459477
170702,just_watches_in,MUMBAI- ANDHERI,"Just Watches, Unit No.15, Ground Floor",Andheri West,Maharashtra,,IN,+91 22 4978 3281,,,Just Watches,Q117822349
GS0016662,mercedes_benz,Auto Hangar (India) Private Limited,,Mumbai,Maharashtra,,IN,+91 22 6710 6660,https://www.autohangar.mercedes-benz.co.in,Mo-Sa 09:30-18:30; Su 10:30-18:30,Mercedes-Benz,Q36008
TIMBE-SN37PGFIMI,timberland,Timberland - India,,Mumbai,Maharashtra,,IN,+91 22 4295 0732,,,Timberland,Q1539185
787a1c0d5d0d611da46a10d7613038f3,western_union,JAINSON FOREX PRIVATE LIMITED,,Mumbai,MAHARASHTRA,,IN,+91 98199 73575,https://location.westernunion.com/in/maharashtra/mumbai/787a1c0d5d0d611da46a10d7613038f3,Mo-Su 09:00-21:00,Western Union,Q861042
b1c48558410e0b60c9da4e0255171657,western_union,ASRA TOURS AND TRAVELS,,Mumbai Suburban,MAHARASHTRA,,IN,+91 80800 07565,https://location.westernunion.com/in/maharashtra/mumbai-suburban/b1c48558410e0b60c9da4e0255171657,Mo-Su 08:00-20:00,Western Union,Q861042
