City,Place Name,Zipcode,Name
Saint-Pierre-d'Irube,footlocker,,unknown,"Foot Locker in Saint-Pierre-d'Irube: Saint-Pierre-d'Irube, Aquitaine | Approved | Own It"
Pau,footlocker,,unknown,"Foot Locker in Pau: Pau, Aquitaine | Approved | Own It"
Mérignac,footlocker,,unknown,"Foot Locker in Mérignac: Mérignac, Aquitaine | Approved | Own It"
Lormont,footlocker,,unknown,"Foot Locker in Lormont: Lormont, Aquitaine | Approved | Own It"
Bordeaux,footlocker,,unknown,"Foot Locker in Bordeaux: Bordeaux, Aquitaine | Approved | Own It"
Begles,footlocker,,unknown,"Foot Locker in Begles: Begles, Aquitaine | Approved | Own It"
