Ref,Spider,Name,Address,City,State,Zipcode,Country,Phone,Website,Hours,Brand,WikiData
397,engen,Engen Hippo Park Convenience Centre,,Newlands East,,,ZA,+27 73 270 8381,,,Engen,Q3054251
673,engen,Engen New Park Convenience Centre,,Newlands East,,,ZA,+27 31 577 8557,,,Engen,Q3054251
677,engen,Engen Newlands Convenience Centre,,Newlands East,,,ZA,+27 31 577 8414,,,Engen,Q3054251
893,engen,Engen Sea Cow Lake Convenience Centre,,Newlands West,,,ZA,+27 31 577 1250,,,Engen,Q3054251
ZA111S0067,totalenergies,PETROPORT RIVERHORSE,,Newlands East,,,ZA,0270828478119,https://store.totalenergies.fr/en_EN/ZA111S0067,,TotalEnergies,Q154037
