Ref,Spider,Name,Address,City,State,Zipcode,Country,Phone,Website,Hours,Brand,WikiData
40457750,bp,STANTON ST. QUINTON SSTN PS118,,CHIPPENHAM,,,GB,+44 1666 330466,,24/7,BP,Q152057
bde8ee69-0797-eb11-b1ac-000d3a2ed0d4,costa_coffee_gg_gb_im_je,Peregrine Retail Ltd @ Stanton St Quintin,,Chippenham,,,GB,,,24/7,Costa Express,Q113556385
6d5f4a05-dd96-eb11-b1ac-000d3a2ed776,costa_coffee_gg_gb_im_je,MFG / PRL Stanton St Quintin,,Chippenham,,,GB,,,Mo-Fr 06:00-18:00; Sa-Su 07:00-17:00,Costa Coffee,Q608845
gcnmpewncrn4,gov_cma_fuel_gb,BP,"PRL Stanton St. Quintin, Lower Stanton St Quintin, Chippenham",,,,GB,,,,BP,Q152057
GB_EXT_00927,totalenergies,Stanton St. Quinton SStn FS118,,CHIPPENHAM,,,GB,+44 1666 837161,https://store.totalenergies.fr/en_EN/GB_EXT_00927,,BP,Q152057
