Ref,Spider,Name,Address,City,State,Zipcode,Country,Phone,Website,Hours,Brand,WikiData
1254,bq,B&Q Uttoxeter,"Uttoxeter Retail Park, Towns Meadow Way, Uttoxeter, Staffordshire",,,,GB,+44 1889 561640,https://www.diy.com/store/1254,Mo-Sa 08:00-20:00; Su 10:00-16:00,B&Q,Q707602
39eb7b0e-d296-eb11-b1ac-000d3a2ed776,costa_coffee_gg_gb_im_je,Uttoxeter Dovefields RP,,Uttoexter,,,GB,,,Mo-Sa 07:00-19:00; Su 09:00-17:00,Costa Coffee,Q608845
5687,greggs_gb,"Uttoxeter, UR1 Dovefields RP",,Uttoxeter,,,GB,+44 1889 223275,https://www.greggs.co.uk/shop-finder?shop-code=5687,Mo-Sa 06:00-19:00; Su 08:00-17:00,Greggs,Q3403981
/services/dentist/mr-bason-and-mr-gathercole/V014654,nhs_england_gb,Mr Bason and Mr Gathercole,"Dental Surgery, Town Meadows Way, Uttoxeter",,,,GB,+44 1889 564565,https://www.uttoxeterdentalpractice.co.uk,"Mo-Th 08:30-13:00,14:00-17:00; Fr 08:30-13:00",NHS England,Q16251481
369,puregym_gb,Uttoxeter,"Unit 1, Town Meadows Way, UTTOXETER ST14 8AZ",,,,GB,+44 344 477 0005,https://www.puregym.com/gyms/uttoxeter/,,PureGym,Q18345898
