Ref,Spider,Name,Address,City,State,Zipcode,Country,Phone,Website,Hours,Brand,WikiData
73620475,moneygram,NAM TAU DUNG GOLD SHOP PRIVATE COMPANY -,,DONG THAP,,,VN,+84 277 3630 313,,Mo-Su 07:00-23:00,MoneyGram,Q1944412
73655314,moneygram,PHAT THANG GOLD SHOP PRIVATE COMPANY - #,,DONG THAP,,,VN,+84 277 3622 079,,Mo-Su 07:00-23:00,MoneyGram,Q1944412
73705646,moneygram,KIM DUNG AN LONG PRIVATE COMPANY - #MW9,,DONG THAP,,,VN,+84 277 3981 227,,Mo-Su 07:00-23:00,MoneyGram,Q1944412
74273944,moneygram,BRANCH OF LAI VUNG-HUONG HOANG DUNG GOLD,,DONG THAP,,,VN,+84 277 3655 086,,Mo-Su 07:00-23:00,MoneyGram,Q1944412
74275780,moneygram,HONG HOA GOLD SHOP PRIVATE COMPANY - #NH,,DONG THAP,,,VN,+84 277 3862 580,,Mo-Su 07:00-23:00,MoneyGram,Q1944412
71753470,moneygram,HDBANK - #259 - DONG THAP - THAP MUOI,,DONG THAP,,,VN,+84 277 3908 966,,Mo-Fr 07:30-17:00; Sa-Su 00:00-24:00,MoneyGram,Q1944412
