Ref,Spider,Name,Address,City,State,Zipcode,Country,Phone,Website,Hours,Brand,WikiData
155078,lukoil,AZS № 48770,"Russia, Lipetsk region, Zadonsk, road M4 Don, 417km, righ",Zadonsk,Lipetsk,,RU,,,24/7,Лукойл,Q329347
155077,lukoil,AZS № 48760,"Russia, Lipetsk Oblast, Yelets, road Orel-Tambov",Yelets,Lipetsk,,RU,,,24/7,Лукойл,Q329347
155076,lukoil,AZS № 48762,"Russia, Lipetsk Oblast, Yelets, st. Zadonskaya",Yelets,Lipetsk,,RU,,,24/7,Лукойл,Q329347
41,wildberries,Wildberries,"Липецкая область, Липецк, Первомайская улица, 78",,Lipetsk,,RU,,,Mo-Su 08:00-22:00,Wildberries,Q24933714
1911,wildberries,Wildberries,"г. Елец (Липецкая обл.), ул. Коммунаров, 41",,Lipetsk,,RU,,,Mo-Su 10:00-21:00,Wildberries,Q24933714
1999,wildberries,Wildberries,"Липецкая область, Липецк, улица Н.Г. Славянова, 1",,Lipetsk,,RU,,,Mo-Su 10:00-21:00,Wildberries,Q24933714
2074,wildberries,Wildberries,"Липецкая область, Липецк, улица Космонавтов, 88",,Lipetsk,,RU,,,Mo-Su 10:00-21:00,Wildberries,Q24933714
2098,wildberries,Wildberries,"г. Липецк (Липецкая область), проспект Мира, д. 4",,Lipetsk,,RU,,,Mo-Su 10:00-21:00,Wildberries,Q24933714
2160,wildberries,Wildberries,"Липецкая область, Липецк, Интернациональная улица, 41",,Lipetsk,,RU,,,Mo-Su 08:00-22:00,Wildberries,Q24933714
2216,wildberries,Wildberries,"г. Данков (Липецкая область), улица Мира, д. 1",,Lipetsk,,RU,,,Mo-Su 10:00-21:00,Wildberries,Q24933714
2240,wildberries,Wildberries,"г. Елец (Липецкая область), улица Яна Фабрициуса, д. 22",,Lipetsk,,RU,,,Mo-Su 10:00-21:00,Wildberries,Q24933714
2251,wildberries,Wildberries,"Липецкая область, Липецк, улица П.И. Смородина, 11",,Lipetsk,,RU,,,Mo-Su 08:00-22:00,Wildberries,Q24933714
2406,wildberries,Wildberries,"г. Лебедянь (Липецкая область), улица Карла Маркса, д. 22",,Lipetsk,,RU,,,Mo-Su 10:00-21:00,Wildberries,Q24933714
2659,wildberries,Wildberries,"Липецкая область, Грязи, улица Революции 1905 года, 17Б",,Lipetsk,,RU,,,Mo-Su 10:00-21:00,Wildberries,Q24933714
2921,wildberries,Wildberries,"г. Липецк (Липецкая область), проспект Победы, д. 65А",,Lipetsk,,RU,,,Mo-Su 10:00-21:00,Wildberries,Q24933714
3105,wildberries,Wildberries,"г. Елец (Липецкая область), Юбилейная улица, д. 9",,Lipetsk,,RU,,,Mo-Su 10:00-21:00,Wildberries,Q24933714
3117,wildberries,Wildberries,"г. Липецк (Липецкая область), улица Космонавтов, д. 30",,Lipetsk,,RU,,,Mo-Su 08:00-22:00,Wildberries,Q24933714
3258,wildberries,Wildberries,"г. Елец (Липецкая область), улица Пушкина, д. 87",,Lipetsk,,RU,,,Mo-Su 10:00-21:00,Wildberries,Q24933714
3272,wildberries,Wildberries,"г. Липецк (Липецкая область), Юношеская улица, д. 18",,Lipetsk,,RU,,,Mo-Su 08:00-22:00,Wildberries,Q24933714
3450,wildberries,Wildberries,"г. Липецк (Липецкая область), Октябрьская улица, д. 3",,Lipetsk,,RU,,,Mo-Su 10:00-21:00,Wildberries,Q24933714
3540,wildberries,Wildberries,"г. Липецк (Липецкая область), улица Осканова, д. 6",,Lipetsk,,RU,,,Mo-Su 10:00-21:00,Wildberries,Q24933714
3988,wildberries,Wildberries,"село Тербуны (Липецкая область), Октябрьская улица, д. 41/43",,Lipetsk,,RU,,,Mo-Su 08:00-22:00,Wildberries,Q24933714
4042,wildberries,Wildberries,"Липецкая область, Липецк, улица С.Ф. Балмочных, 38А",,Lipetsk,,RU,,,Mo-Su 10:00-21:00,Wildberries,Q24933714
4061,wildberries,Wildberries,"г. Усмань (Липецкая область), улица Исполатова, д. 1",,Lipetsk,,RU,,,Mo-Su 10:00-21:00,Wildberries,Q24933714
4095,wildberries,Wildberries,"г. Задонск (Липецкая область), Советская улица, д. 65",,Lipetsk,,RU,,,Mo-Su 10:00-21:00,Wildberries,Q24933714
5099,wildberries,Wildberries,"г. Липецк (Липецкая область), улица Катукова, д. 27А",,Lipetsk,,RU,,,Mo-Su 08:00-22:00,Wildberries,Q24933714
5107,wildberries,Wildberries,"Липецкая область, Липецк, улица 40 лет Октября, 1А",,Lipetsk,,RU,,,Mo-Su 08:00-22:00,Wildberries,Q24933714
5160,wildberries,Wildberries,"посёлок Лев Толстой (Липецкая область), Коммунистическая улица, д. 12Г",,Lipetsk,,RU,,,Mo-Su 10:00-21:00,Wildberries,Q24933714
5164,wildberries,Wildberries,"Липецкая область, посёлок Добринка, улица Максима Горького, 12",,Lipetsk,,RU,,,Mo-Su 10:00-21:00,Wildberries,Q24933714
5200,wildberries,Wildberries,"г. Липецк (Липецкая область), улица Гагарина, д. 91",,Lipetsk,,RU,,,Mo-Su 10:00-21:00,Wildberries,Q24933714
5206,wildberries,Wildberries,"г. Липецк (Липецкая область), бульвар Шубина, д. 2Б",,Lipetsk,,RU,,,Mo-Su 08:00-22:00,Wildberries,Q24933714
5252,wildberries,Wildberries,"Липецкая область, Липецк, улица имени Мичурина, 48",,Lipetsk,,RU,,,Mo-Su 08:00-22:00,Wildberries,Q24933714
5538,wildberries,Wildberries,"г Липецк, Студеновская  15",,Lipetsk,,RU,,,Mo-Su 10:00-21:00,Wildberries,Q24933714
5681,wildberries,Wildberries,"Липецкая область, Елец, Александровская улица, 1Б",,Lipetsk,,RU,,,Mo-Su 10:00-21:00,Wildberries,Q24933714
101349,wildberries,Wildberries,"Липецкая область, Липецк, Боевой проезд, 39",,Lipetsk,,RU,,,Mo-Su 08:00-22:00,Wildberries,Q24933714
101370,wildberries,Wildberries,"Липецкая область, Липецк, улица Героя России Эдуарда Белана, 12",,Lipetsk,,RU,,,Mo-Su 08:00-22:00,Wildberries,Q24933714
102427,wildberries,Wildberries,"г Липецк, Проспект Победы 128",,Lipetsk,,RU,,,Mo-Su 10:00-21:00,Wildberries,Q24933714
102527,wildberries,Wildberries,"Липецкая область, Чаплыгин, улица Горького, 4А",,Lipetsk,,RU,,,Mo-Su 08:00-22:00,Wildberries,Q24933714
103277,wildberries,Wildberries,г. Липецк (Липецкая обл.) Циолковского 35а,,Lipetsk,,RU,,,Mo-Su 08:00-22:00,Wildberries,Q24933714
104593,wildberries,Wildberries,"Липецкая область, Елец, Радиотехническая улица, 28Б",,Lipetsk,,RU,,,Mo-Su 10:00-21:00,Wildberries,Q24933714
104702,wildberries,Wildberries,г. Липецк (Липецкая обл) Ленинградская 4,,Lipetsk,,RU,,,Mo-Su 08:00-22:00,Wildberries,Q24933714
106921,wildberries,Wildberries,"г Грязи (Россия, Липецкая обл, Грязинский р-н) Гагарина 2ж",,Lipetsk,,RU,,,Mo-Su 10:00-21:00,Wildberries,Q24933714
108244,wildberries,Wildberries,"г Липецк, Свиридова 6",,Lipetsk,,RU,,,Mo-Su 10:00-21:00,Wildberries,Q24933714
108266,wildberries,Wildberries,"Липецкая область, Липецк, Московская улица, 91",,Lipetsk,,RU,,,Mo-Su 08:00-22:00,Wildberries,Q24933714
108488,wildberries,Wildberries,"Липецкая область, Елец, улица Коммунаров, 119",,Lipetsk,,RU,,,Mo-Su 10:00-21:00,Wildberries,Q24933714
108657,wildberries,Wildberries,"г Лебедянь (Россия, Липецкая обл, Лебедянский р-н) Ленина 44а",,Lipetsk,,RU,,,Mo-Su 10:00-21:00,Wildberries,Q24933714
108884,wildberries,Wildberries,"г Данков Россия, Липецкая обл, Данковский р-н К.Маркса 35А",,Lipetsk,,RU,,,Mo-Su 10:00-21:00,Wildberries,Q24933714
109534,wildberries,Wildberries,"г Липецк, Водопьянова 14",,Lipetsk,,RU,,,Mo-Su 10:00-21:00,Wildberries,Q24933714
110595,wildberries,Wildberries,"Липецкая область, село Становое, улица Ленина, 5",,Lipetsk,,RU,,,Mo-Su 10:00-21:00,Wildberries,Q24933714
112422,wildberries,Wildberries,"Хлевное Липецкая область, Хлевенский район улица Свободы 47А",,Lipetsk,,RU,,,Mo-Su 10:00-21:00,Wildberries,Q24933714
113193,wildberries,Wildberries,"Липецкая область, Липецк, улица Гагарина, 55/1",,Lipetsk,,RU,,,Mo-Su 10:00-21:00,Wildberries,Q24933714
114488,wildberries,Wildberries,"Липецкая область, село Боринское, улица Луначарского, 1",,Lipetsk,,RU,,,Mo-Su 10:00-21:00,Wildberries,Q24933714
121311,wildberries,Wildberries,"г Липецк, Улица Бехтеева 4",,Lipetsk,,RU,,,Mo-Su 09:00-21:00,Wildberries,Q24933714
122249,wildberries,Wildberries,"г Липецк, Бульвар Есенина 3",,Lipetsk,,RU,,,Mo-Su 10:00-21:00,Wildberries,Q24933714
122584,wildberries,Wildberries,"г Липецк, Улица М.И. Неделина 12",,Lipetsk,,RU,,,Mo-Su 10:00-21:00,Wildberries,Q24933714
123253,wildberries,Wildberries,"г Липецк, Проспект Имени 60-Летия СССР 21",,Lipetsk,,RU,,,Mo-Su 10:00-21:00,Wildberries,Q24933714
123263,wildberries,Wildberries,"с Долгоруково, Улица Ленина 35",,Lipetsk,,RU,,,Mo-Su 09:00-21:00,Wildberries,Q24933714
123425,wildberries,Wildberries,"г Липецк, Улица Стаханова 2",,Lipetsk,,RU,,,Mo-Su 09:00-21:00,Wildberries,Q24933714
123735,wildberries,Wildberries,"г Лебедянь, Улица Машиностроителей 10",,Lipetsk,,RU,,,Mo-Su 09:00-21:00,Wildberries,Q24933714
123868,wildberries,Wildberries,"г Липецк, Московская Улица 57б",,Lipetsk,,RU,,,Mo-Su 10:00-21:00,Wildberries,Q24933714
123969,wildberries,Wildberries,"г Усмань, Улица Ленина 79",,Lipetsk,,RU,,,Mo-Su 10:00-21:00,Wildberries,Q24933714
124061,wildberries,Wildberries,"г Липецк, Ангарская Улица 23а",,Lipetsk,,RU,,,Mo-Su 10:00-21:00,Wildberries,Q24933714
124325,wildberries,Wildberries,"г Липецк, Улица Зегеля 23",,Lipetsk,,RU,,,Mo-Su 10:00-21:00,Wildberries,Q24933714
124474,wildberries,Wildberries,"с Доброе, Советский Переулок 3",,Lipetsk,,RU,,,Mo-Su 09:00-21:00,Wildberries,Q24933714
125028,wildberries,Wildberries,"г Елец, Улица Гагарина 18",,Lipetsk,,RU,,,Mo-Su 10:00-21:00,Wildberries,Q24933714
125063,wildberries,Wildberries,"с Долгоруково, Улица Тимирязева 24а",,Lipetsk,,RU,,,Mo-Su 09:00-21:00,Wildberries,Q24933714
125136,wildberries,Wildberries,"с Подгорное, Октябрьская Улица 4а",,Lipetsk,,RU,,,Mo-Su 09:00-21:00,Wildberries,Q24933714
126013,wildberries,Wildberries,"Липецкая область, Елец, улица Вермишева, 21",,Lipetsk,,RU,,,Mo-Su 10:00-21:00,Wildberries,Q24933714
126514,wildberries,Wildberries,"Липецкая область, Елец, улица Яна Фабрициуса, 4",,Lipetsk,,RU,,,Mo-Su 10:00-21:00,Wildberries,Q24933714
127532,wildberries,Wildberries,"Липецкая область, село Тербуны, Юбилейная улица, 2А",,Lipetsk,,RU,,,Mo-Su 10:00-21:00,Wildberries,Q24933714
127701,wildberries,Wildberries,"с Косыревка, Советская Улица 9",,Lipetsk,,RU,,,Mo-Su 10:00-21:00,Wildberries,Q24933714
128489,wildberries,Wildberries,"Россия, Липецкая обл, Чаплыгинский р-н, г Чаплыгин, Московская Улица 30",,Lipetsk,,RU,,,Mo-Su 09:00-21:00,Wildberries,Q24933714
128713,wildberries,Wildberries,"г Липецк, Улица Шерстобитова 10",,Lipetsk,,RU,,,Mo-Su 09:00-21:00,Wildberries,Q24933714
128933,wildberries,Wildberries,"с Измалково, Октябрьская Улица 20",,Lipetsk,,RU,,,Mo-Su 10:00-21:00,Wildberries,Q24933714
130260,wildberries,Wildberries,"г Липецк, Улица Валентины Терешковой 13б",,Lipetsk,,RU,,,Mo-Su 10:00-21:00,Wildberries,Q24933714
130264,wildberries,Wildberries,"г Усмань, Улица Ленина 148",,Lipetsk,,RU,,,Mo-Su 10:00-21:00,Wildberries,Q24933714
131080,wildberries,Wildberries,"г Липецк, Улица Хорошавина 11",,Lipetsk,,RU,,,Mo-Su 10:00-21:00,Wildberries,Q24933714
131631,wildberries,Wildberries,"г Липецк, Тамбовская Улица 6",,Lipetsk,,RU,,,Mo-Su 09:00-21:00,Wildberries,Q24933714
132569,wildberries,Wildberries,"г Данков, Улица Ленина 16",,Lipetsk,,RU,,,Mo-Su 10:00-21:00,Wildberries,Q24933714
132995,wildberries,Wildberries,"г Липецк, Улица Теперика 1",,Lipetsk,,RU,,,Mo-Su 09:00-21:00,Wildberries,Q24933714
133377,wildberries,Wildberries,"Чаплыгин Липецкая область, Чаплыгинский район Советская улица 36",,Lipetsk,,RU,,,Mo-Su 10:00-21:00,Wildberries,Q24933714
134689,wildberries,Wildberries,"г Липецк, Улица Ворошилова 3",,Lipetsk,,RU,,,Mo-Su 10:00-21:00,Wildberries,Q24933714
135403,wildberries,Wildberries,"Липецкая область, Липецк, улица Доватора, 12",,Lipetsk,,RU,,,Mo-Su 10:00-21:00,Wildberries,Q24933714
135623,wildberries,Wildberries,"Липецкая область, Липецк, улица Вермишева, 4",,Lipetsk,,RU,,,Mo-Su 10:00-21:00,Wildberries,Q24933714
135783,wildberries,Wildberries,Липецк Липецкая обл Лебедянское шоссе 4А,,Lipetsk,,RU,,,Mo-Su 08:00-22:00,Wildberries,Q24933714
135926,wildberries,Wildberries,Липецк Липецкая обл проспект Победы 19А,,Lipetsk,,RU,,,Mo-Su 10:00-21:00,Wildberries,Q24933714
136496,wildberries,Wildberries,"Липецкая область, Елец, улица Костенко, 5",,Lipetsk,,RU,,,Mo-Su 10:00-21:00,Wildberries,Q24933714
136621,wildberries,Wildberries,"Липецкая область, Елец, улица Кротевича, 22",,Lipetsk,,RU,,,Mo-Su 10:00-21:00,Wildberries,Q24933714
136782,wildberries,Wildberries,"г Липецк, Улица Кочеткова 4а",,Lipetsk,,RU,,,Mo-Su 09:00-21:00,Wildberries,Q24933714
137340,wildberries,Wildberries,Липецк Липецкая обл улица Фрунзе 30,,Lipetsk,,RU,,,Mo-Su 10:00-21:00,Wildberries,Q24933714
137381,wildberries,Wildberries,"г Липецк, Проспект Победы 4",,Lipetsk,,RU,,,Mo-Su 10:00-21:00,Wildberries,Q24933714
137879,wildberries,Wildberries,"Липецкая область, Липецк, улица С.С. Бехтеева, 3",,Lipetsk,,RU,,,Mo-Su 10:00-21:00,Wildberries,Q24933714
138175,wildberries,Wildberries,"Липецкая область, Липецк, Архангельская улица, 8",,Lipetsk,,RU,,,Mo-Su 10:00-21:00,Wildberries,Q24933714
138461,wildberries,Wildberries,"г Грязи, Станционная Улица 27а",,Lipetsk,,RU,,,Mo-Su 09:00-20:00,Wildberries,Q24933714
138716,wildberries,Wildberries,"г Липецк, Улица Плеханова 34",,Lipetsk,,RU,,,Mo-Su 10:00-21:00,Wildberries,Q24933714
138844,wildberries,Wildberries,"г Данков, Улица Ленина 1",,Lipetsk,,RU,,,Mo-Su 10:00-21:00,Wildberries,Q24933714
138875,wildberries,Wildberries,"с Октябрьское, Проспект Революции 83",,Lipetsk,,RU,,,Mo-Su 10:00-21:00,Wildberries,Q24933714
138948,wildberries,Wildberries,"г Липецк, Улица Лутова 16а",,Lipetsk,,RU,,,Mo-Su 10:00-21:00,Wildberries,Q24933714
139072,wildberries,Wildberries,"г Грязи, Улица Осоавиахима 2к2",,Lipetsk,,RU,,,Mo-Su 09:00-21:00,Wildberries,Q24933714
139510,wildberries,Wildberries,"г Липецк, Улица Свиридова 20к3",,Lipetsk,,RU,,,Mo-Su 10:00-21:00,Wildberries,Q24933714
139628,wildberries,Wildberries,"г Елец, Улица Коммунаров 103",,Lipetsk,,RU,,,Mo-Su 10:00-21:00,Wildberries,Q24933714
139889,wildberries,Wildberries,"г Липецк, Улица Им. Хорошавина А.И. 2",,Lipetsk,,RU,,,Mo-Su 10:00-21:00,Wildberries,Q24933714
139901,wildberries,Wildberries,"г Липецк, Улица Гагарина 30",,Lipetsk,,RU,,,Mo-Su 10:00-21:00,Wildberries,Q24933714
139920,wildberries,Wildberries,"г Липецк, Проспект Мира 21",,Lipetsk,,RU,,,Mo-Su 10:00-21:00,Wildberries,Q24933714
140305,wildberries,Wildberries,"г Лебедянь, Улица Машиностроителей 17",,Lipetsk,,RU,,,Mo-Su 09:00-21:00,Wildberries,Q24933714
140733,wildberries,Wildberries,"г Липецк, Елецкое Шоссе 3",,Lipetsk,,RU,,,Mo-Su 10:00-21:00,Wildberries,Q24933714
140798,wildberries,Wildberries,"г Липецк, Физкультурная Улица 17в",,Lipetsk,,RU,,,Mo-Su 09:00-21:00,Wildberries,Q24933714
140992,wildberries,Wildberries,"г Липецк, Улица Космонавтов 44/1",,Lipetsk,,RU,,,Mo-Su 10:00-21:00,Wildberries,Q24933714
141838,wildberries,Wildberries,"г Липецк, Улица Хренникова 1",,Lipetsk,,RU,,,Mo-Su 10:00-21:00,Wildberries,Q24933714
143395,wildberries,Wildberries,"Липецкая область, Липецк, улица Л. Толстого, 40",,Lipetsk,,RU,,,Mo-Su 10:00-21:00,Wildberries,Q24933714
143396,wildberries,Wildberries,"Липецк, улица А.Г. Стаханова 71",,Lipetsk,,RU,,,Mo-Su 10:00-21:00,Wildberries,Q24933714
143597,wildberries,Wildberries,"г Чаплыгин, Советская Улица 1а",,Lipetsk,,RU,,,Mo-Su 10:00-21:00,Wildberries,Q24933714
145047,wildberries,Wildberries,"г Липецк, Улица Стаханова 45",,Lipetsk,,RU,,,Mo-Su 10:00-21:00,Wildberries,Q24933714
145945,wildberries,Wildberries,"г Липецк, Улица Бехтеева 10",,Lipetsk,,RU,,,Mo-Su 10:00-21:00,Wildberries,Q24933714
149036,wildberries,Wildberries,"Задонск Липецкая обл, Задонский р-н улица Степанищева 17",,Lipetsk,,RU,,,Mo-Su 10:00-21:00,Wildberries,Q24933714
149628,wildberries,Wildberries,"г Липецк, Проспект Победы 91а",,Lipetsk,,RU,,,Mo-Su 10:00-21:00,Wildberries,Q24933714
150411,wildberries,Wildberries,"г Липецк, Улица Космонавтов 43",,Lipetsk,,RU,,,Mo-Su 10:00-21:00,Wildberries,Q24933714
150427,wildberries,Wildberries,"г Задонск, Улица Карла Маркса 107",,Lipetsk,,RU,,,Mo-Su 09:00-21:00,Wildberries,Q24933714
150522,wildberries,Wildberries,"г Липецк, Звёздная Улица 2/2",,Lipetsk,,RU,,,Mo-Su 10:00-21:00,Wildberries,Q24933714
150903,wildberries,Wildberries,"г Липецк, Улица Стаханова 58",,Lipetsk,,RU,,,Mo-Su 10:00-21:00,Wildberries,Q24933714
150916,wildberries,Wildberries,"г Липецк, Улица Гагарина 137",,Lipetsk,,RU,,,Mo-Su 10:00-21:00,Wildberries,Q24933714
151017,wildberries,Wildberries,"г Липецк, Улица Володи Бачурина 16",,Lipetsk,,RU,,,Mo-Su 10:00-21:00,Wildberries,Q24933714
152058,wildberries,Wildberries,"г Данков, Спортивный Переулок 4",,Lipetsk,,RU,,,Mo-Su 10:00-21:00,Wildberries,Q24933714
152960,wildberries,Wildberries,"г Липецк, Улица М.И. Неделина 15а",,Lipetsk,,RU,,,Mo-Su 10:00-21:00,Wildberries,Q24933714
153289,wildberries,Wildberries,"Липецкая область, Данков, улица Чапаева, 2к1",,Lipetsk,,RU,,,Mo-Su 10:00-21:00,Wildberries,Q24933714
153546,wildberries,Wildberries,"г Липецк, Улица 40 Лет Октября 23",,Lipetsk,,RU,,,Mo-Su 09:00-21:00,Wildberries,Q24933714
153607,wildberries,Wildberries,"г Елец, Улица Коммунаров 143а",,Lipetsk,,RU,,,Mo-Su 10:00-21:00,Wildberries,Q24933714
155192,wildberries,Wildberries,"г Липецк, Улица Водопьянова 31",,Lipetsk,,RU,,,Mo-Su 10:00-21:00,Wildberries,Q24933714
155516,wildberries,Wildberries,"с Волово, Советская Улица 80г",,Lipetsk,,RU,,,Mo-Su 09:00-21:00,Wildberries,Q24933714
156864,wildberries,Wildberries,"Липецкая область, Липецк, Первомайская улица, 77",,Lipetsk,,RU,,,Mo-Su 10:00-21:00,Wildberries,Q24933714
157134,wildberries,Wildberries,"г Липецк, Улица Гагарина 73",,Lipetsk,,RU,,,Mo-Su 10:00-21:00,Wildberries,Q24933714
157275,wildberries,Wildberries,"Липецкая область, Липецк, улица Стаханова, 63",,Lipetsk,,RU,,,Mo-Su 10:00-21:00,Wildberries,Q24933714
157687,wildberries,Wildberries,"г Липецк, Улица Гагарина 147а",,Lipetsk,,RU,,,Mo-Su 10:00-21:00,Wildberries,Q24933714
157889,wildberries,Wildberries,"г Липецк, Улица Пришвина 35с1",,Lipetsk,,RU,,,Mo-Su 10:00-21:00,Wildberries,Q24933714
158043,wildberries,Wildberries,"г Липецк, Улица Валентины Терешковой 20",,Lipetsk,,RU,,,Mo-Su 10:00-21:00,Wildberries,Q24933714
158227,wildberries,Wildberries,"г Грязи, Улица Правды 52",,Lipetsk,,RU,,,Mo-Su 09:00-21:00,Wildberries,Q24933714
158288,wildberries,Wildberries,"г Липецк, Административная Улица 4",,Lipetsk,,RU,,,Mo-Su 09:00-21:00,Wildberries,Q24933714
158542,wildberries,Wildberries,"г Липецк, Улица Свиридова 14",,Lipetsk,,RU,,,Mo-Su 10:00-21:00,Wildberries,Q24933714
158606,wildberries,Wildberries,"г Липецк, Улица Игнатьева 32",,Lipetsk,,RU,,,Mo-Su 10:00-21:00,Wildberries,Q24933714
159422,wildberries,Wildberries,"г Грязи, Улица Крылова 6г",,Lipetsk,,RU,,,Mo-Su 09:00-21:00,Wildberries,Q24933714
159495,wildberries,Wildberries,"г Липецк, Улица Водопьянова 1",,Lipetsk,,RU,,,Mo-Su 09:00-20:00,Wildberries,Q24933714
159734,wildberries,Wildberries,"г Липецк, Улица Меркулова 10а",,Lipetsk,,RU,,,Mo-Su 10:00-21:00,Wildberries,Q24933714
160369,wildberries,Wildberries,"с Тербуны, Октябрьская Улица 40ж",,Lipetsk,,RU,,,Mo-Su 09:00-21:00,Wildberries,Q24933714
161793,wildberries,Wildberries,"г Липецк, Улица Петра Смородина 5",,Lipetsk,,RU,,,Mo-Su 10:00-21:00,Wildberries,Q24933714
162018,wildberries,Wildberries,"г Липецк, Улица Космонавтов 66",,Lipetsk,,RU,,,Mo-Su 10:00-21:00,Wildberries,Q24933714
162134,wildberries,Wildberries,"с Сселки, Улица Ленина 176",,Lipetsk,,RU,,,Mo-Su 09:00-21:00,Wildberries,Q24933714
162276,wildberries,Wildberries,"г Елец, Советская Улица 51",,Lipetsk,,RU,,,Mo-Su 10:00-21:00,Wildberries,Q24933714
162307,wildberries,Wildberries,"г Липецк, Московская Улица 63а",,Lipetsk,,RU,,,Mo-Su 10:00-21:00,Wildberries,Q24933714
162382,wildberries,Wildberries,"п Газопровод, Мирная Улица 4",,Lipetsk,,RU,,,Mo-Su 10:00-21:00,Wildberries,Q24933714
162979,wildberries,Wildberries,"п Лев Толстой, Коммунистическая Улица 17",,Lipetsk,,RU,,,Mo-Su 10:00-21:00,Wildberries,Q24933714
163504,wildberries,Wildberries,"Липецкая область, Грязи, улица Семашко, 21",,Lipetsk,,RU,,,Mo-Su 10:00-21:00,Wildberries,Q24933714
164519,wildberries,Wildberries,"железнодорожная станция Плавица, улица Строителей 8",,Lipetsk,,RU,,,Mo-Su 08:00-20:00,Wildberries,Q24933714
167343,wildberries,Wildberries,"п Лев Толстой, Молодёжная Улица 7",,Lipetsk,,RU,,,Mo-Su 10:00-21:00,Wildberries,Q24933714
168837,wildberries,Wildberries,"Липецкая область, Елец, Юбилейная улица, 17А",,Lipetsk,,RU,,,Mo-Su 10:00-21:00,Wildberries,Q24933714
168842,wildberries,Wildberries,"Липецкая область, посёлок Краснинский, улица Газовиков 23",,Lipetsk,,RU,,,Mo-Su 10:00-21:00,Wildberries,Q24933714
171752,wildberries,Wildberries,"с Казинка, Улица Ленина 1/1",,Lipetsk,,RU,,,Mo-Su 10:00-21:00,Wildberries,Q24933714
172661,wildberries,Wildberries,"г Липецк, Проспект Мира 18",,Lipetsk,,RU,,,Mo-Su 09:00-21:00,Wildberries,Q24933714
172886,wildberries,Wildberries,"г Лебедянь, Улица Тургенева 7а",,Lipetsk,,RU,,,Mo-Su 10:00-21:00,Wildberries,Q24933714
200300,wildberries,Wildberries,"с Донское, Ленинская Улица 14а",,Lipetsk,,RU,,,Mo-Su 10:00-21:00,Wildberries,Q24933714
201130,wildberries,Wildberries,"г Липецк, Улица Стаханова 19",,Lipetsk,,RU,,,Mo-Su 10:00-21:00,Wildberries,Q24933714
202550,wildberries,Wildberries,"Липецкая область, Елец, улица Коммунаров, 5",,Lipetsk,,RU,,,Mo-Su 10:00-21:00,Wildberries,Q24933714
203013,wildberries,Wildberries,"село Ярлуково, Советская Улица 10",,Lipetsk,,RU,,,Mo-Su 10:00-21:00,Wildberries,Q24933714
203030,wildberries,Wildberries,"Липецк, 15-Й Микрорайон 1/2",,Lipetsk,,RU,,,Mo-Su 10:00-21:00,Wildberries,Q24933714
203126,wildberries,Wildberries,"Липецк, Улица Им. Хорошавина А.И. 29",,Lipetsk,,RU,,,Mo-Su 10:00-21:00,Wildberries,Q24933714
204263,wildberries,Wildberries,"Грязи, Песковатская Улица 1б",,Lipetsk,,RU,,,Mo-Su 10:00-22:00,Wildberries,Q24933714
204556,wildberries,Wildberries,"Липецк, Улица Катукова 34а",,Lipetsk,,RU,,,Mo-Su 10:00-21:00,Wildberries,Q24933714
