City,Place Name,Zipcode,Name
廿日市市,akachan_jp,,unknown,アカチャンホンポ ゆめタウン廿日市店
福山市,akachan_jp,,unknown,アカチャンホンポ ゆめタウン福山店
広島市 安佐南区,akachan_jp,,unknown,アカチャンホンポ フジグラン緑井店
広島市 南区,akachan_jp,,unknown,アカチャンホンポ ゆめタウンみゆき店
広島市,anytime_fitness,,unknown,エニタイムフィットネス
広島市東区,kfc_jp,広島県広島市東区矢賀新町3-2-10,unknown,広島府中店
広島市佐伯区,kfc_jp,広島県広島市佐伯区楽々園2-1-19,unknown,広島五日市店
東広島市,kfc_jp,広島県東広島市西条町大字寺家有吉5478-2,unknown,西条店
福山市,kfc_jp,広島県福山市南蔵王町5-17-46,unknown,福山蔵王店
広島市安佐南区,kfc_jp,広島県広島市安佐南区大町西3-3-22,unknown,広島安古市店
広島市南区,kfc_jp,広島県広島市南区東雲2-18-25,unknown,広島東雲店
広島市中区,kfc_jp,広島県広島市中区紙屋町2-2-7,unknown,広島紙屋町店
広島市安佐南区,kfc_jp,広島県広島市安佐南区西原5-19-44,unknown,ゆめテラス祇園店
三原市,kfc_jp,広島県三原市皆実1-14-1,unknown,三原店
福山市,kfc_jp,広島県福山市御門町3-2-10,unknown,福山ばら公園前店
廿日市市,kfc_jp,広島県廿日市市下平良2-2-1,unknown,ゆめタウン廿日市店
広島市南区,kfc_jp,広島県広島市南区皆実町2-8-17,unknown,ゆめタウン広島店
福山市,kfc_jp,広島県福山市神辺町大字新道上字二丁目10番26号　フジグラン神辺敷地駐車場内,unknown,フジグラン神辺店
広島市西区,kfc_jp,広島県広島市西区横川町3-2-36,unknown,フレスタ横川店
東広島市,kfc_jp,広島県東広島市西条町御薗宇4405,unknown,東広島フジグラン店
呉市,kfc_jp,広島県呉市中央1-6-10,unknown,呉店
尾道市,kfc_jp,広島県尾道市栗原町6050-1,unknown,尾道店
広島市安佐南区,kfc_jp,広島県広島市安佐南区八木2-13-14,unknown,広島八木店
広島市,nike,,unknown,ナイキファクトリーストア 広島 - Nike Factory Store Hiroshima
