Ref,Spider,Name,Address,City,State,Zipcode,Country,Phone,Website,Hours,Brand,WikiData
166468,sparkasse_de,Sparkasse Ingolstadt Eichstätt Geldautomat Kipfenberg,,Kipfenberg,,,DE,+49 841 3044040,https://www.sparkasse.de/standorte/geldautomaten/sparkasse-ingolstadt-eichstaett-geldautomat-kipfenberg-166468,24/7,Sparkasse,Q13601825
11371,sparkasse_de,Sparkasse Ingolstadt Eichstätt Geschäftsstelle Kipfenberg,,Kipfenberg,,,DE,+49 841 3044040,https://www.sparkasse.de/standorte/filialen/sparkasse-ingolstadt-eichstaett-geschaeftsstelle-kipfenberg-11371,"Mo 09:30-12:30,14:00-16:00; We 09:30-12:30; Fr 09:30-12:30,14:00-16:00",Sparkasse,Q13601825
166474,sparkasse_de,Sparkasse Ingolstadt Eichstätt Geldautomat Schelldorf,,Schelldorf,,,DE,+49 841 3044040,https://www.sparkasse.de/standorte/geldautomaten/sparkasse-ingolstadt-eichstaett-geldautomat-schelldorf-166474,,Sparkasse,Q13601825
11372,sparkasse_de,Sparkasse Ingolstadt Eichstätt SB-Stelle Schelldorf,,Schelldorf,,,DE,+49 841 3044040,https://www.sparkasse.de/standorte/filialen/sparkasse-ingolstadt-eichstaett-sb-stelle-schelldorf-11372,,Sparkasse,Q13601825
,visa,,,KIPFENBERG,,,DE,,,,,
https://www.vr.de/standorte/K/volksbank-raiffeisenbank-bayern-mitte-eg-filiale-kipfenberg-4423.html,vr_bank,Volksbank Raiffeisenbank Bayern Mitte eG Filiale Kipfenberg,,Kipfenberg,,,DE,+49 8465 94050,https://www.vr-bayernmitte.de,Fr 08:30-12:00,,
