City,Place Name,Zipcode,Name
Trapani,footlocker,,unknown,"Foot Locker in Trapani: Trapani, Sicilia | Approved | Own It"
SAN CATALDO,footlocker,,unknown,"Foot Locker in Caltanissetta: SAN CATALDO, Sicilia | Approved | Own It"
Palermo,footlocker,,unknown,"Foot Locker in Palermo: Palermo, Sicilia | Approved | Own It"
Misterbianco,footlocker,,unknown,"Foot Locker in Misterbianco: Misterbianco, Sicilia | Approved | Own It"
MILAZZO,footlocker,,unknown,"Foot Locker in : MILAZZO, Sicilia | Approved | Own It"
Messina,footlocker,,unknown,"Foot Locker in Messina: Messina, Sicilia | Approved | Own It"
Melilli,footlocker,,unknown,"Foot Locker in Melilli (siracusa): Melilli, Sicilia | Approved | Own It"
Catania,footlocker,,unknown,"Foot Locker in Catania: Catania, Sicilia | Approved | Own It"
Bicocca Catania,footlocker,,unknown,"Foot Locker in Bicocca Catania: Bicocca Catania, Sicilia | Approved | Own It"
