Ref,Spider,Name,Address,City,State,Zipcode,Country,Phone,Website,Hours,Brand,WikiData
613692,beev_gb,"Car Park by Daliburgh School, Isle of South Uist",,Car Park by Daliburgh School,,,GB,,,24/7,Be.EV,Q118263083
621122,charge_place_scotland_gb,"Car Park by Daliburgh School, Isle of South Uist",,Car Park by Daliburgh School,,,GB,,https://chargeplacescotland.org/cpmap/chargepoint/621122/,,ChargePlace Scotland,Q105359316
/store-finder/HS8-5SS/292-daliburgh,coop_food_gb,Uist - Daliburgh,,Daliburgh,,,GB,+44 1878 700326,https://www.coop.co.uk/store-finder/HS8-5SS/292-daliburgh,Mo-Sa 07:00-22:00; Su 12:30-22:00,Co-op Food,Q3277439
https://www.nhsinform.scot/scotlands-service-directory/gp-practices/2675%201wis1116,nhs_scotland_gb,South Uist Medical Practice (Isle of South Uist),"The Surgery, Daliburgh, Benbecula, Isle of South Uist, HS8 5SS",,,,GB,,https://southuistmedicalpractice.gp.scot/,Mo 08:00-17:30; Tu 08:00-13:00; We-Fr 08:00-17:30,,
,visa,,,SOUTH UIST,,,GB,,,,,
