City,Place Name,Zipcode,Name
Vitória,nissan_europe,,unknown,KOBE VITORIA
Vila Velha,nissan_europe,,unknown,KOBE VILA VELHA SHOPPING
Linhares,nissan_europe,,unknown,KOBE LINHARES
Cachoeiro de Itapemirim,nissan_europe,,unknown,KOBE CACHOEIRO DO ITAPEMIRIM
VILA VELHA,shell,,unknown,DIRCEU COM REPRESENTACOES LTDA
CARIACICA,shell,,unknown,ARARA AZUL REDE DE POSTOS LTDA
VITORIA,shell,,unknown,POSTO TRILHA LTDA
VIANA,shell,,unknown,FLECHA SA TURISMO COM E IND
SERRA,shell,,unknown,POSTO DE COMBUS OTAVIO EIRELI
DOMINGOS MARTINS,shell,,unknown,AUTO POSTO PARAJU LTDA
MARECHAL FLORIANO,shell,,unknown,R E HOFFMAM
ALFREDO CHAVES,shell,,unknown,POSTO LEVY KAR LTDA
GUARAPARI,shell,,unknown,POSTO VERANO LTDA
VARGEM ALTA,shell,,unknown,POSTO VARGEM ALTA LTDA
SANTA TERESA,shell,,unknown,POSTO FERRARI SANTA TERESA LTDA
GUACUI,shell,,unknown,AUTO POSTO CANTAO LTDA
ALEGRE,shell,,unknown,AUTO POSTO PEDRA DO POMBAL LTDA
DORES DO RIO PRETO,shell,,unknown,AUTO POSTO FRONTEIRA LTDA
SAO JOSE DO CALCADO,shell,,unknown,POSTO RESENDE LTDA
JERONIMO MONTEIRO,shell,,unknown,POSTO SETE IRMAOS LTDA ME
BOM JESUS DO NORTE,shell,,unknown,AUTO POSTO 2000 LTDA
MUQUI,shell,,unknown,POSTO S E B DOS SANTOS LTDA
IUNA,shell,,unknown,PETROLINA COM E REPRESENTACOES LTDA
CASTELO,shell,,unknown,PEISINO & FREZZA LTDA
CACHOEIRO DE ITAPEMIRIM,shell,,unknown,POSTO DUAS BARRAS LTDA
VENDA NOVA DO IMIGRANTE,shell,,unknown,AUTO POSTO ESMIG LTDA
RIO NOVO DO SUL,shell,,unknown,POSTO DIAMANTE NEGRO LTDA
JAGUARE,shell,,unknown,POSTO JAGUAR LTDA
SAO MATEUS,shell,,unknown,POSTO DE COMBUSTIVEL SAO MATEUS LTD
SOORETAMA,shell,,unknown,AUTO POSTO RZ EIRELI
VILA VALERIO,shell,,unknown,POSTO SAO CRISTOVAO LTDA
BOA ESPERANCA,shell,,unknown,AUTO POSTO 4 RODAS LTDA
RIO BANANAL,shell,,unknown,V C COMBUSTIVEIS E LUBRIFICANTES LT
SAO GABRIEL DA PALHA,shell,,unknown,AUTO POSTO SHALOM LTDA
CONCEICAO DA BARRA,shell,,unknown,POSTO COMB FERRARI BRACO DO RIO LTD
LINHARES,shell,,unknown,AUTO POSTO TRES PONTOS LTDA
GOVERNADOR LINDENBERG,shell,,unknown,POSTO BELA VISTA LTDA
PINHEIROS,shell,,unknown,COOPERATIVA AGRO CENTRO SERRANA
SAO DOMINGOS DO NORTE,shell,,unknown,POSTO GENTIL SAO DOMINGOS LTDA
VILA PAVAO,shell,,unknown,POSTO SW LTDA
BARRA DE SAO FRANCISCO,shell,,unknown,POSTO MILENIUM LTDA ME
COLATINA,shell,,unknown,POSTO DE GASOLINA SAO MIGUEL LTDA
PEDRO CANARIO,shell,,unknown,AUTO POSTO ZEZERE LTDA
JOAO NEIVA,shell,,unknown,POSTO DE COMBUSTIVEIS JN 3 LTDA
ARACRUZ,shell,,unknown,A P SER ARACRUZ COL BELA VISTA LTDA
IBIRACU,shell,,unknown,POSTO DE COMB IBIRACU LTDA
BAIXO GUANDU,shell,,unknown,POSTO E AUTO SERVICO PINHO LTDA
ITAGUACU,shell,,unknown,SL POSTO BEIRA RIO LTDA
MARATAIZES,shell,,unknown,POSTO ECLIPSE REV & SERV LTDA
ICONHA,shell,,unknown,AUTO POSTO CENTRAL LTDA
ITARANA,shell,,unknown,POSTO SANTA EDWIGES LTDA
