Ref,Spider,Name,Address,City,State,Zipcode,Country,Phone,Website,Hours,Brand,WikiData
22177_3,bmw_group,Schwarz GmbH,,Altenmarkt,,,DE,+49 8621 98590,https://www.schwarz.bmw,,BMW,Q26678
10895,sparkasse_de,Kreissparkasse Traunstein-Trostberg SB-Filiale Altenmarkt,,Altenmarkt,,,DE,+49 861 660,https://www.sparkasse.de/standorte/filialen/kreissparkasse-traunstein-trostberg-sb-filiale-altenmarkt-10895,24/7,Sparkasse,Q13601825
29670,sparkasse_de,Kreissparkasse Traunstein-Trostberg Geldautomat Altenmarkt,,Altenmarkt,,,DE,+49 861 663500,https://www.sparkasse.de/standorte/geldautomaten/kreissparkasse-traunstein-trostberg-geldautomat-altenmarkt-29670,24/7,Sparkasse,Q13601825
https://www.vlh.de/bst/8156/Oeffnungszeiten.html,vhl_de,VLH-Beraterin Elisabeth Scherbauer in Altenmarkt,,Altenmarkt,,,DE,+49 8621 6498134,https://www.vlh.de/bst/8156/,,Vereinigte Lohnsteuerhilfe e.V.,Q15852617
,visa,,,ALTENMARKT,,,DE,,,,,
https://www.vr.de/standorte/A/meine-volksbank-raiffeisenbank-eg-altenmarkt-12607.html,vr_bank,"meine Volksbank Raiffeisenbank eG, Altenmarkt",,Altenmarkt an der Alz,,,DE,+49 8031 18539700,https://www.vb-rb.de,"Tu 08:30-12:00,14:00-17:00; Th 08:30-12:00,14:00-17:00",,
