Ref,Spider,Name,Address,City,State,Zipcode,Country,Phone,Website,Hours,Brand,WikiData
792,adairs,Adairs Rosebud,"Shop R007-007, Rosebud Plaza Shopping Centre, Boneo Road, Rosebud, VIC, 3939, Australia",,,,AU,+61 3 5923 1009,https://www.adairs.com.au/stores/rosebud/,Mo-Th 09:00-17:30; Fr 09:00-19:00; Sa 09:00-17:00; Su 11:00-16:00,Adairs,Q109626904
485,country_fire_authority_au,Boneo,,Boneo,,,AU,,,,,
518,country_fire_authority_au,Rosebud,,Rosebud,,,AU,,,,,
59427,little_free_library,Waterfall Gully Pre-School Little Free Library #59427 Rosebud,,Rosebud,,,AU,,,,Little Free Library,Q6650101
au8cd03c97,pandora,Pandora Jewellery Authorized Retailer Hoskings Rosebud,,Rosebud,,,AU,+61 3 5986 7777,https://stores.pandora.net/au-vic/rosebud/pandora-jewellery-au8cd03c97.html,Mo-We 09:00-17:30; Th 09:00-18:00; Fr 09:00-19:00; Sa 09:00-17:00; Su 10:00-15:00,Pandora,Q2241604
