Ref,Spider,Name,Address,City,State,Zipcode,Country,Phone,Website,Hours,Brand,WikiData
f25c7f2d-bfc9-4599-9399-6ef4b8f35ef9,travelex,Shin Chitose  Int LS Dep South,"3F Shinchitose Airport Int'l Terminal, Bibi, Chitose-shi, 066-0012","Chitose-shi,",Hokkaido,,JP,+81 123-21-9163,shin-chitose-int-ls-dep-south/6159,,Travelex,Q2337964
8ce2a81d-3cd8-4784-b6e4-cb00caab22e9,travelex,SHIN CHITOSE INT ARR LOBBY,"2F Shinchitose Airport Int'l Terminal, Bibi, Chitose-shi, 066-0012","Chitose-shi,",Hokkaido,,JP,+81 123-45-2790,shin-chitose-int-arr-lobby/6047,,Travelex,Q2337964
7ae5b13f-34ac-4420-9dcf-0b1339bd8aaa,travelex,Shin Chitose Int Aside Departure Gate,"3F Airside Shin-Chitose Airport Int'l Terminal, Chitose-shi, 066-0012",Chitose-shi,Hokkaido,,JP,,shin-chitose-int-aside-departure-gate/6160,,Travelex,Q2337964
554d6c2e-f11f-4cac-9d3c-0a6b6a31839c,travelex,SHIN CHITOSE INT DEP GATE,"3F Airside Shinchitose Airport Int'l Terminal, Bibi, Chitose-shi, Hokkaido  066-0012","Chitose-shi,",Hokkaido,,JP,+81 123-45-2785,shin-chitose-int-dep-gate/6052,,Travelex,Q2337964
e626b2f2-d344-4e19-98aa-bbaa51a204b1,travelex,SHIN CHITOSE INT DEP LOBBY,"3F Shinchitose Airport Int'l Terminal, Bibi, Chitose-shi, 066-0012","Chitose-shi,",Hokkaido,,JP,+81 123-45-2765,shin-chitose-int-dep-lobby/6046,,Travelex,Q2337964
cabf9bac-5850-4e8f-a8f0-331ccff1491c,travelex,Shinchitose Airport Domestic Arrival Lobby (JAL),"1F Shinchitose Airport Domestic Terminal, Bibi, Chitose-shi, 066-0012","Chitose-shi,",Hokkaido,,JP,+81 123-45-5656,shinchitose-airport-domestic-arrival-lobby-jal/6124,,Travelex,Q2337964
df0078a7-74b6-4103-9dd7-e387663d919d,travelex,SHINCHITOSE DOMESTIC ARRIVAL LOBBY (ANA),"1F Shinchitose Airport Domestic Terminal, Bibi, Chitose-shi, 066-0012","Chitose-shi,",Hokkaido,,JP,+81 123-46-3311,shinchitose-airport-domestic-arrival-lobby-ana/6025,,Travelex,Q2337964
,visa,,,CHITOSE,HOKKAIDO,,JP,,,,,
