City,Place Name,Zipcode,Name
Krasnoyarsk,audi,Partizana Zheleznyaka 46G 660022 Krasnoyarsk,unknown,Audi Center Krasnoyarsk
Дудинка,coffee_like,ул. Островского 6,unknown,Coffee Like
Krasnoyarsk,lukoil,Russia 660052 Krasnoyarsk Territory Krasnoyarsk st. Montazhnikov 24B,unknown,AZS № 24404
g. Krasnoyarsk,lukoil,Russia 660100 Krasnoyarsk Territory g. Krasnoyarsk ul. Lado Ketskhoveli d.45,unknown,AZS No 24403.
PGT Berezovka,lukoil,Russia 662520 Krasnoyarsk Territory PGT Berezovka ul. Kirova d.56A,unknown,AZS No 24402
unknown,lukoil,Russia 660122 Krasnoyarsk Territory Krasnoyarsk 60 let Oktyabrya st. 161g,unknown,AZS № 24401
unknown,wildberries,г. Ачинск (Красноярский край) 4-й мкр д. 9,unknown,Wildberries
unknown,wildberries,г. Канск (Красноярский край) улица Эйдемана д. 18,unknown,Wildberries
unknown,wildberries,г. Норильск (Красноярский край) ул. Орджоникидзе 1Б,unknown,Wildberries
unknown,wildberries,Красноярский край Красноярск улица Кирова 37,unknown,Wildberries
unknown,wildberries,Красноярский край Норильск улица Строителей 25,unknown,Wildberries
unknown,wildberries,Красноярский край Красноярск улица Авиаторов 41,unknown,Wildberries
unknown,wildberries,г. Красноярск (Красноярский край) ул. Затонская д.3,unknown,Wildberries
unknown,wildberries,г. Минусинск (Красноярский край) ул. Гагарина д. 13 пом. 65,unknown,Wildberries
unknown,wildberries,г. Норильск (Красноярский край) ул. Школьная  д. 16,unknown,Wildberries
unknown,wildberries,г. Железногорск (Красноярский край) улица Ленина д. 30,unknown,Wildberries
unknown,wildberries,г. Назарово (Красноярский край) улица 30 лет ВЛКСМ д. 70  помещение 33,unknown,Wildberries
unknown,wildberries,г. Ачинск (Красноярский край) 8-й микрорайон д. 7,unknown,Wildberries
unknown,wildberries,г. Красноярск (Красноярский край) Краснодарская улица д. 22А,unknown,Wildberries
unknown,wildberries,г. Красноярск (Красноярский край) Аэровокзальная улица д. 7,unknown,Wildberries
unknown,wildberries,г. Красноярск (Красноярский край) улица Батурина ул. 19,unknown,Wildberries
unknown,wildberries,г. Ачинск (Красноярский край) 3-й Привокзальный микрорайон д. 2,unknown,Wildberries
unknown,wildberries,г. Красноярск (Красноярский край) улица Крупской д. 4А,unknown,Wildberries
unknown,wildberries,г. Енисейск (Красноярский край) улица Кирова д. 87,unknown,Wildberries
unknown,wildberries,г. Железногорск (Красноярский край) Ленинградский проспект 35,unknown,Wildberries
unknown,wildberries,г. Красноярск (Красноярский край) Свободный проспект д. 28,unknown,Wildberries
unknown,wildberries,г. Шарыпово (Красноярский край) 1-й мкр д. 2,unknown,Wildberries
unknown,wildberries,г. Минусинск (Красноярский край) Народная улица д. 15,unknown,Wildberries
unknown,wildberries,г. посёлок городского типа Курагино (Красноярский край) Партизанская улица д. 134,unknown,Wildberries
unknown,wildberries,г. Канск (Красноярский край) улица 40 лет Октября д. 46,unknown,Wildberries
unknown,wildberries,г. Боготол (Красноярский край) Советская улица д. 13,unknown,Wildberries
unknown,wildberries,г. Ачинск (Красноярский край) Юго-Восточный микр-он д. 62,unknown,Wildberries
unknown,wildberries,г. Ачинск (Красноярский край) 1 мкр  д. 42А,unknown,Wildberries
unknown,wildberries,г. Красноярск (Красноярский край) улица Космонавтов д. 17А,unknown,Wildberries
unknown,wildberries,г. Бородино (Красноярский край) улица Ленина Д. 54А,unknown,Wildberries
unknown,wildberries,г. Сосновоборск (Красноярский край) улица Юности д. 53,unknown,Wildberries
unknown,wildberries,г. Лесосибирск (Красноярский край) улица 60 лет ВЛКСМ д. 6,unknown,Wildberries
unknown,wildberries,г. Железногорск (Красноярский край) проспект Курчатова д. 16А,unknown,Wildberries
unknown,wildberries,г. Красноярск (Красноярский край) улица 9 Мая д. 83,unknown,Wildberries
unknown,wildberries,г. Красноярск (Красноярский край) проспект имени Газеты Красноярский Рабочий д. 63Б,unknown,Wildberries
unknown,wildberries,село Богучаны (Красноярский край) Октябрьская улица д. 77,unknown,Wildberries
unknown,wildberries,г. Железногорск (Красноярский край) Октябрьская улица д. 4,unknown,Wildberries
unknown,wildberries,г. Красноярск (Красноярский край) улица Академика Киренского д 25Б,unknown,Wildberries
unknown,wildberries,г. Красноярск (Красноярский край) Взлётная улица д. 7Ж,unknown,Wildberries
unknown,wildberries,г. Красноярск (Красноярский край) Новосибирская улица д. 1,unknown,Wildberries
unknown,wildberries,г. Минусинск (Красноярский край) улица Бограда д. 2,unknown,Wildberries
unknown,wildberries,г. Красноярск (Красноярский край) улица Петра Ломако д. 2,unknown,Wildberries
unknown,wildberries,г. Кодинск (Красноярский край) улица Гидростроителей д. 7,unknown,Wildberries
unknown,wildberries,г. Красноярск (Красноярский край) улица Водопьянова д. 19,unknown,Wildberries
unknown,wildberries,Красноярский край посёлок городского типа Шушенское 3-й микрорайон 6А,unknown,Wildberries
unknown,wildberries,г. Красноярск (Красноярский край) улица Мичурина д. 8,unknown,Wildberries
unknown,wildberries,г. Ужур (Красноярский край) Советская улица д. 12А,unknown,Wildberries
unknown,wildberries,г. Шарыпово (Красноярский край) Пионерный микрорайон д. 26,unknown,Wildberries
unknown,wildberries,Красноярский край Железногорск Таёжная улица 66,unknown,Wildberries
unknown,wildberries,п. Таежный (Красноярский край) Карабульская  11,unknown,Wildberries
unknown,wildberries,г. Ачинск (Красноярский край) 5 микрорайон д. 19,unknown,Wildberries
unknown,wildberries,Красноярский край Норильск Комсомольская улица 39,unknown,Wildberries
unknown,wildberries,г. Иланский (Красноярский край) Коммунистическая улица д. 43,unknown,Wildberries
unknown,wildberries,г. Норильск (Красноярский край) Рудная  3,unknown,Wildberries
unknown,wildberries,г. Красноярск (Красноярский край) Новосибирская улица д. 41,unknown,Wildberries
unknown,wildberries,г. Зеленогорск (Красноярский край) Мира улица  36А,unknown,Wildberries
unknown,wildberries,г. Назарово (Красноярский край) Арбузова 116 Б,unknown,Wildberries
unknown,wildberries,г. Уяр (Красноярский край) Ленина 172/10,unknown,Wildberries
unknown,wildberries,г. Минусинск (Красноярский край) Ботаническая 31Б,unknown,Wildberries
unknown,wildberries,г. Красноярск (Красноярский край) улица Марковского д. 19,unknown,Wildberries
unknown,wildberries,г. Красноярск (Красноярский край) Линейная улица д. 122,unknown,Wildberries
unknown,wildberries,пгт. Емельяново (Красноярский край) Новая 9Г,unknown,Wildberries
unknown,wildberries,г Зеленогорск (Красноярский край) улица Заводская 6,unknown,Wildberries
unknown,wildberries,Красноярский край Кодинск улица Михайлова 6А,unknown,Wildberries
unknown,wildberries,г Красноярск (Россия Красноярский край) улица Мате Залки 24,unknown,Wildberries
unknown,wildberries,г Канск (Россия Красноярский край) мкрн. Северный 26,unknown,Wildberries
unknown,wildberries,г Красноярск (Россия Красноярский край) Норильская 16И,unknown,Wildberries
unknown,wildberries,г Красноярск (Красноярский край городской округ Красноярск) улица Шевченко 28А,unknown,Wildberries
unknown,wildberries,г Лесосибирск Красноярский край городской округ Лесосибирск ул. Дзержинского 6,unknown,Wildberries
unknown,wildberries,п Солнечный (Красноярский край) Солнечная улица 25А,unknown,Wildberries
unknown,wildberries,г Красноярск  улица Вильского 22,unknown,Wildberries
unknown,wildberries,г Красноярск Воронова 14/6,unknown,Wildberries
unknown,wildberries,с Ермаковское (Красноярский край) Ленина 82А,unknown,Wildberries
unknown,wildberries,Красноярский край Норильск Комсомольская улица 23А,unknown,Wildberries
unknown,wildberries,Козулька (Красноярский край) Вокзальная улица 9,unknown,Wildberries
unknown,wildberries,Сосновоборск Красноярский край городской округ Сосновоборск улица Энтузиастов 20а,unknown,Wildberries
unknown,wildberries,г Красноярск (Красноярский край) Елены Стасовой 38Г,unknown,Wildberries
unknown,wildberries,Красноярский край Красноярск улица Чернышева 4,unknown,Wildberries
unknown,wildberries,г Красноярск (Красноярский край) улица Мичурина 2Ж,unknown,Wildberries
unknown,wildberries,г Минусинск (Красноярский край) улица Тимирязева 17А,unknown,Wildberries
unknown,wildberries,Шарыпово (Красноярский край) 6 микрорайон 13,unknown,Wildberries
unknown,wildberries,Железногорск улица 60 лет ВЛКСМ д. 54,unknown,Wildberries
unknown,wildberries,г Красноярск (Красноярский край) улица Ады Лебедевой 141,unknown,Wildberries
unknown,wildberries,г Красноярск Улица Мате Залки 31,unknown,Wildberries
unknown,wildberries,г Дивногорск Комсомольская Улица 19,unknown,Wildberries
unknown,wildberries,г Красноярск Улица Академгородок 66г,unknown,Wildberries
unknown,wildberries,г Енисейск Улица Фефелова 94,unknown,Wildberries
unknown,wildberries,г Железногорск Улица Советской Армии 30,unknown,Wildberries
unknown,wildberries,г Красноярск Улица Александра Матросова 12,unknown,Wildberries
unknown,wildberries,г Красноярск Улица 78-Й Добровольческой Бригады 4,unknown,Wildberries
unknown,wildberries,г Красноярск Улица Партизана Железняка 11б,unknown,Wildberries
unknown,wildberries,г Красноярск Улица Калинина 70а,unknown,Wildberries
unknown,wildberries,г Красноярск Улица Карамзина 20,unknown,Wildberries
unknown,wildberries,г Красноярск Норильская Улица 4,unknown,Wildberries
unknown,wildberries,пгт Берёзовка Заводская Улица 58,unknown,Wildberries
unknown,wildberries,Богучаны Красноярский край Богучанский район переулок Островского 8Гс2,unknown,Wildberries
unknown,wildberries,Ачинск Красноярский край улица Кирова 38,unknown,Wildberries
unknown,wildberries,г Красноярск Комсомольский Проспект 3,unknown,Wildberries
unknown,wildberries,Канск Красноярский край городской округ Канск Московская улица 66,unknown,Wildberries
unknown,wildberries,г Красноярск Улица Мужества 14,unknown,Wildberries
unknown,wildberries,г Красноярск Линейная Улица 97,unknown,Wildberries
unknown,wildberries,г Красноярск Улица Тельмана 15б,unknown,Wildberries
unknown,wildberries,г Красноярск Улица Воронова 29,unknown,Wildberries
unknown,wildberries,г Красноярск Судостроительная Улица 27а,unknown,Wildberries
unknown,wildberries,г Красноярск Проспект Имени Газеты Красноярский Рабочий 159,unknown,Wildberries
unknown,wildberries,Дивногорск Красноярский край улица 30 лет Победы 1,unknown,Wildberries
unknown,wildberries,Красноярск Красноярский край городской округ Красноярск улица Дмитрия Мартынова 33,unknown,Wildberries
unknown,wildberries,г Красноярск Ярыгинская Набережная 9,unknown,Wildberries
unknown,wildberries,Шушенское Красноярский край Шушенский район 1 микрайон 8,unknown,Wildberries
unknown,wildberries,г Красноярск Улица Дмитрия Мартынова 25,unknown,Wildberries
unknown,wildberries,Красноярск Красноярский край Апрельская улица 3,unknown,Wildberries
unknown,wildberries,Красноярск Красноярский край улица Кутузова 77А,unknown,Wildberries
unknown,wildberries,п Кедровый Улица Павлова 6а,unknown,Wildberries
unknown,wildberries,г Лесосибирск (Красноярский край) ул Горького д 24 ,unknown,Wildberries
unknown,wildberries,Красноярск Красноярский край улица Академика Киренского 56А,unknown,Wildberries
unknown,wildberries,г Лесосибирск 5-Й Микрорайон 26в,unknown,Wildberries
unknown,wildberries,г Красноярск Улица Авиаторов 44,unknown,Wildberries
unknown,wildberries,Красноярск Красноярский край улица Сергея Лазо 8А,unknown,Wildberries
unknown,wildberries,Красноярский край г Красноярск ул Микуцкого д 12 ,unknown,Wildberries
unknown,wildberries,г Красноярск Судостроительная Улица 62,unknown,Wildberries
unknown,wildberries,п Абан Улица Пушкина 18,unknown,Wildberries
unknown,wildberries,Ачинск Красноярский край 3 микрорайон 14,unknown,Wildberries
unknown,wildberries,г Лесосибирск Улица Ломоносова 62б,unknown,Wildberries
unknown,wildberries,г Красноярск Взлётная Улица 6,unknown,Wildberries
unknown,wildberries,г Красноярск Взлётная Улица 26г,unknown,Wildberries
unknown,wildberries,Красноярск Красноярский край Ярыгинская набережная 13А,unknown,Wildberries
unknown,wildberries,г Лесосибирск Промышленная Улица 50,unknown,Wildberries
unknown,wildberries,г Красноярск Улица Тельмана 26,unknown,Wildberries
unknown,wildberries,г Красноярск Судостроительная Улица 37а,unknown,Wildberries
unknown,wildberries,г Красноярск Молодёжный Проспект 19,unknown,Wildberries
unknown,wildberries,Сосновоборск Красноярский край городской округ Сосновоборск проспект Мира 15,unknown,Wildberries
unknown,wildberries,Красноярский край г Зеленогорск ул Парковая д 17 ,unknown,Wildberries
unknown,wildberries,г Красноярск Северный Проезд 4,unknown,Wildberries
unknown,wildberries,г Красноярск Улица Весны 5,unknown,Wildberries
unknown,wildberries,г Красноярск Улица 26 Бакинских Комиссаров 17,unknown,Wildberries
unknown,wildberries,Норильск Красноярский край городской округ Норильск Дудинская улица 11,unknown,Wildberries
unknown,wildberries,г Лесосибирск 6-Й Квартал 16,unknown,Wildberries
unknown,wildberries,пгт Емельяново Почтовый Переулок 7а,unknown,Wildberries
unknown,wildberries,г Сосновоборск Весенняя Улица 8,unknown,Wildberries
unknown,wildberries,г Сосновоборск Улица Ленинского Комсомола 11,unknown,Wildberries
unknown,wildberries,Дудинка Красноярский край улица Бегичева 8,unknown,Wildberries
unknown,wildberries,Красноярский край Норильск Ленинградская улица 3Б,unknown,Wildberries
unknown,wildberries,г Красноярск Улица Водопьянова 6,unknown,Wildberries
unknown,wildberries,Норильск Красноярский край городской округ Норильск Первомайская улица 52А,unknown,Wildberries
unknown,wildberries,г Енисейск Рабоче-Крестьянская Улица 184,unknown,Wildberries
unknown,wildberries,г Ачинск 2-Й Юго-Восточный Микрорайон 31,unknown,Wildberries
unknown,wildberries,г Сосновоборск Улица Ленинского Комсомола 18,unknown,Wildberries
unknown,wildberries,г Железногорск Советская Улица 30б,unknown,Wildberries
unknown,wildberries,г Ачинск 5-Й Микрорайон 5,unknown,Wildberries
unknown,wildberries,г Красноярск Улица Партизана Железняка 48е,unknown,Wildberries
unknown,wildberries,г Красноярск Улица Академика Киренского 43,unknown,Wildberries
unknown,wildberries,г Красноярск Улица Ладо Кецховели 75,unknown,Wildberries
unknown,wildberries,г Канск Микрорайон Северо-Западный 41,unknown,Wildberries
unknown,wildberries,г Красноярск Улица Кутузова 48,unknown,Wildberries
unknown,wildberries,Красноярский край Красноярск улица Лесников 27,unknown,Wildberries
unknown,wildberries,Красноярский край Красноярск улица Академика Киренского 22,unknown,Wildberries
unknown,wildberries,Красноярский край Минусинск Абаканская улица 43,unknown,Wildberries
unknown,wildberries,Красноярский край посёлок городского типа Нижняя Пойма микрорайон Спутник 18,unknown,Wildberries
unknown,wildberries,г Красноярск Малаховская Улица 2,unknown,Wildberries
unknown,wildberries,г Красноярск Проспект Имени Газеты Красноярский Рабочий 39,unknown,Wildberries
unknown,wildberries,Красноярск Красноярский край улица Борисевича 20,unknown,Wildberries
unknown,wildberries,г Назарово Улица 30 Лет ВЛКСМ 49,unknown,Wildberries
unknown,wildberries,г Ачинск 3-Й Микрорайон 2,unknown,Wildberries
unknown,wildberries,с Богучаны Подгорная Улица 2д,unknown,Wildberries
unknown,wildberries,Красноярск Красноярский край Комсомольский проспект 22/2,unknown,Wildberries
unknown,wildberries,г Красноярск Улица Партизана Железняка 57,unknown,Wildberries
unknown,wildberries,г Красноярск Проспект Имени Газеты Красноярский Рабочий 118,unknown,Wildberries
unknown,wildberries,г Красноярск (Красноярский край) Ярыгинская набережная 25,unknown,Wildberries
unknown,wildberries,Красноярский край Красноярск улица Карамзина 4,unknown,Wildberries
unknown,wildberries,Красноярский край Красноярск Лесопарковая улица 33,unknown,Wildberries
unknown,wildberries,г Красноярск Улица Партизана Железняка 59,unknown,Wildberries
unknown,wildberries,г Красноярск Улица 9 Мая 73,unknown,Wildberries
unknown,wildberries,г Красноярск Соколовская Улица 72а,unknown,Wildberries
unknown,wildberries,г Железногорск Парковая Улица 16,unknown,Wildberries
unknown,wildberries,г Енисейск Рабоче-Крестьянская Улица 198/4,unknown,Wildberries
unknown,wildberries,г Красноярск Улица Александра Матросова 32,unknown,Wildberries
unknown,wildberries,г солонцы Улица Новостроек 4а,unknown,Wildberries
unknown,wildberries,г Красноярск Улица 9 Мая 45,unknown,Wildberries
unknown,wildberries,г Красноярск Улица 9 Мая 49,unknown,Wildberries
unknown,wildberries,Дудинка Красноярский край улица Горького 46,unknown,Wildberries
unknown,wildberries,г Красноярск Линейная Улица 105,unknown,Wildberries
unknown,wildberries,г Лесосибирск Улица Победы 8а,unknown,Wildberries
unknown,wildberries,г Красноярск Улица Авиаторов 25а,unknown,Wildberries
unknown,wildberries,г Минусинск Абаканская Улица 56,unknown,Wildberries
unknown,wildberries,г Красноярск Проспект Имени Газеты Красноярский Рабочий 94,unknown,Wildberries
unknown,wildberries,г Красноярск Улица Тотмина 11,unknown,Wildberries
unknown,wildberries,г Минусинск Улица Ленина 58,unknown,Wildberries
unknown,wildberries,г Красноярск Караульная Улица 42,unknown,Wildberries
unknown,wildberries,г Красноярск Улица 78-Й Добровольческой Бригады 7,unknown,Wildberries
unknown,wildberries,г Красноярск Улица Петра Ломако 12,unknown,Wildberries
unknown,wildberries,г Красноярск Улица Ладо Кецховели 22а,unknown,Wildberries
unknown,wildberries,г Красноярск Улица Шумяцкого 6,unknown,Wildberries
unknown,wildberries,с Сухобузимское Комсомольская Улица 29,unknown,Wildberries
unknown,wildberries,Красноярский край Железногорск улица Ленина 51,unknown,Wildberries
unknown,wildberries,пгт Балахта Юбилейный Переулок 1,unknown,Wildberries
unknown,wildberries,г Красноярск Улица Чернышевского 75а,unknown,Wildberries
unknown,wildberries,г Красноярск Новгородская Улица 2,unknown,Wildberries
unknown,wildberries,г Ачинск Улица Калинина 6,unknown,Wildberries
unknown,wildberries,г Красноярск Амурская Улица 16г,unknown,Wildberries
unknown,wildberries,Красноярский край г Красноярск Улица Шевченко 70,unknown,Wildberries
unknown,wildberries,г Красноярск Улица Железнодорожников 22д,unknown,Wildberries
unknown,wildberries,г Канск Улица 40 Лет Октября 62/4,unknown,Wildberries
unknown,wildberries,г Красноярск Светлогорская Улица 35ак2,unknown,Wildberries
unknown,wildberries,г Сосновоборск Весенняя Улица 34,unknown,Wildberries
unknown,wildberries,г Боготол Улица 40 Лет Октября 15а,unknown,Wildberries
unknown,wildberries,г Железногорск Ленинградский Проспект 7/1,unknown,Wildberries
unknown,wildberries,Красноярский край Ачинск 1-й Юго-Восточный микрорайон 26,unknown,Wildberries
