City,Place Name,Zipcode,Name
unknown,wildberries,с Тюхтет Улица Кирова 44,unknown,Wildberries
unknown,wildberries,с Шалинское Улица Ленина 30,unknown,Wildberries
unknown,wildberries,г Красноярск Судостроительная Улица 161,unknown,Wildberries
unknown,wildberries,Красноярский край Красноярск улица Ладо Кецховели 37,unknown,Wildberries
unknown,wildberries,г Красноярск Проспект Имени Газеты Красноярский Рабочий 175,unknown,Wildberries
unknown,wildberries,Красноярский край Бородино улица Ленина 61А,unknown,Wildberries
unknown,wildberries,г Железногорск Улица Ленина 50,unknown,Wildberries
unknown,wildberries,г Назарово Улица Арбузова 96,unknown,Wildberries
unknown,wildberries,снт Звезда 2 Тихая Улица 1,unknown,Wildberries
unknown,wildberries,г Железногорск Улица Свердлова 33,unknown,Wildberries
unknown,wildberries,г Красноярск Улица Урванцева 12,unknown,Wildberries
unknown,wildberries,г Красноярск Улица Курчатова 4,unknown,Wildberries
unknown,wildberries,г Красноярск Улица Калинина 17,unknown,Wildberries
unknown,wildberries,п Подгорный Лесная Улица 9,unknown,Wildberries
unknown,wildberries,г Железногорск Ленинградский Проспект 73,unknown,Wildberries
unknown,wildberries,г Зеленогорск Улица Мира 6/1,unknown,Wildberries
unknown,wildberries,г Красноярск Улица Петра Подзолкова 3в,unknown,Wildberries
unknown,wildberries,г Красноярск Норильская Улица 34,unknown,Wildberries
unknown,wildberries,г Красноярск Улица Копылова 76,unknown,Wildberries
unknown,wildberries,г Красноярск Переулок Маяковского 18,unknown,Wildberries
unknown,wildberries,г Ачинск Индустриальная Улица 16,unknown,Wildberries
unknown,wildberries,г Красноярск Улица Забобонова 8,unknown,Wildberries
unknown,wildberries,Красноярский край Ачинск 5-й микрорайон 40,unknown,Wildberries
unknown,wildberries,г Красноярск Красномосковская Улица 34,unknown,Wildberries
unknown,wildberries,г Красноярск Заводская Улица 4,unknown,Wildberries
unknown,wildberries,Красноярский край Шарыпово 2-й микрорайон 1,unknown,Wildberries
unknown,wildberries,г Железногорск Восточная Улица 49/1,unknown,Wildberries
unknown,wildberries,г Красноярск Улица Академгородок 17б,unknown,Wildberries
unknown,wildberries,г Боготол Комсомольская Улица 148,unknown,Wildberries
unknown,wildberries,г Красноярск Улица Парижской Коммуны 3,unknown,Wildberries
unknown,wildberries,г Железногорск Улица Ленина 22,unknown,Wildberries
unknown,wildberries,г Красноярск Улица Диктатуры Пролетариата 6,unknown,Wildberries
unknown,wildberries,Красноярск Красноярский край Львовская улица 33А,unknown,Wildberries
unknown,wildberries,г Красноярск Улица Молокова 1а,unknown,Wildberries
unknown,wildberries,г Красноярск Улица Академика Вавилова 52,unknown,Wildberries
unknown,wildberries,с Дзержинское Садовый Переулок 14,unknown,Wildberries
unknown,wildberries,пгт Большая Мурта Советская Улица 15,unknown,Wildberries
unknown,wildberries,г Зеленогорск Улица Диктатуры Пролетариата 1,unknown,Wildberries
unknown,wildberries,пгт Нижний Ингаш Улица Красная Площадь 51,unknown,Wildberries
unknown,wildberries,г Красноярск Улица Чернышевского 120,unknown,Wildberries
unknown,wildberries,с Черемшанка Садовая Улица 1,unknown,Wildberries
unknown,wildberries,г Красноярск Улица Ады Лебедевой 91,unknown,Wildberries
unknown,wildberries,с Большой Улуй Советская Улица 125,unknown,Wildberries
unknown,wildberries,г Красноярск Проспект 60 Лет Образования СССР 28,unknown,Wildberries
unknown,wildberries,г Иланский Школьная Улица 27,unknown,Wildberries
unknown,wildberries,г Красноярск Улица Елены Стасовой 50д,unknown,Wildberries
unknown,wildberries,г Канск Шоссейная Улица 50,unknown,Wildberries
unknown,wildberries,г Ачинск Квартал 7Б 8а,unknown,Wildberries
unknown,wildberries,г Норильск Надеждинская Улица 12,unknown,Wildberries
unknown,wildberries,г Красноярск Норильская Улица 4д,unknown,Wildberries
unknown,wildberries,пгт Курагино Улица Ленина 59,unknown,Wildberries
unknown,wildberries,г Красноярск Улица Устиновича 28а,unknown,Wildberries
unknown,wildberries,с Новоселово Улица Максима Горького 2,unknown,Wildberries
unknown,wildberries,г Красноярск 2-Я Ботаническая Улица 1а,unknown,Wildberries
unknown,wildberries,г Красноярск Регатная Улица 1,unknown,Wildberries
unknown,wildberries,Красноярский край Красноярск Свердловская улица 101А,unknown,Wildberries
unknown,wildberries,Красноярский край Красноярск Свердловская улица 9А,unknown,Wildberries
unknown,wildberries,г Красноярск Свободный Проспект 29,unknown,Wildberries
unknown,wildberries,г Минусинск Скворцовская Улица 71,unknown,Wildberries
unknown,wildberries,г Минусинск Улица Чайковского 60,unknown,Wildberries
unknown,wildberries,г Красноярск 2-Я Огородная Улица 24,unknown,Wildberries
unknown,wildberries,г Красноярск Улица Алексеева 93,unknown,Wildberries
unknown,wildberries,г Красноярск Улица Белопольского 2а,unknown,Wildberries
unknown,wildberries,п Копьево Партизанская Улица 19,unknown,Wildberries
unknown,wildberries,г Красноярск Свободная Улица 7б,unknown,Wildberries
unknown,wildberries,г Красноярск Улица Мате Залки 10,unknown,Wildberries
unknown,wildberries,пгт Курагино Партизанская Улица 50п,unknown,Wildberries
unknown,wildberries,г Красноярск Проспект Металлургов 22,unknown,Wildberries
unknown,wildberries,г Красноярск Ястынская Улица 19,unknown,Wildberries
unknown,wildberries,г Зеленогорск Набережная Улица 62,unknown,Wildberries
unknown,wildberries,г Красноярск Ястынская Улица 2д,unknown,Wildberries
unknown,wildberries,Красноярский край Красноярск Судостроительная улица 90,unknown,Wildberries
unknown,wildberries,Красноярский край Уяр улица Ленина 83В,unknown,Wildberries
unknown,wildberries,Красноярский край Бородино улица Маяковского 40,unknown,Wildberries
unknown,wildberries,Красноярский край посёлок городского типа Шушенское улица Тельмана 26,unknown,Wildberries
unknown,wildberries,с Партизанское Советская Улица 30,unknown,Wildberries
unknown,wildberries,Ачинск 8-Й Микрорайон 16б,unknown,Wildberries
unknown,wildberries,с Тесь Улица Строителей 19,unknown,Wildberries
unknown,wildberries,Канск Улица 40 Лет Октября 47,unknown,Wildberries
unknown,wildberries,пгт Емельяново Московская Улица 238а,unknown,Wildberries
unknown,wildberries,Красноярск Улица Петра Словцова 3а,unknown,Wildberries
unknown,wildberries,г Зеленогорск Улица Ленина 1,unknown,Wildberries
unknown,wildberries,Красноярский край Красноярск улица 60 лет Октября 25,unknown,Wildberries
unknown,wildberries,Красноярский край Кодинск проспект Ленинского Комсомола 10,unknown,Wildberries
unknown,wildberries,село Ирбейское Интернациональная Улица 95/4,unknown,Wildberries
unknown,wildberries,село Ермаковское Улица Карла Маркса 61,unknown,Wildberries
unknown,wildberries,село Тасеево Улица Зелёная Роща 19,unknown,Wildberries
unknown,wildberries,г Красноярск Улица Молокова 40,unknown,Wildberries
unknown,wildberries,Красноярск Улица Александра Матросова 5,unknown,Wildberries
unknown,wildberries,посёлок городского типа Большая Ирба Улица Бочкарёва 20а,unknown,Wildberries
unknown,wildberries,Красноярск Улица Дмитрия Мартынова 15,unknown,Wildberries
unknown,wildberries,Красноярск Улица Щорса 85г,unknown,Wildberries
unknown,wildberries,Красноярск Улица Урванцева 15,unknown,Wildberries
unknown,wildberries,Красноярск Парусная Улица 8,unknown,Wildberries
unknown,wildberries,Красноярск Улица Калинина 177а,unknown,Wildberries
unknown,wildberries,Ачинск Улица Свердлова 19,unknown,Wildberries
unknown,wildberries,Красноярск Улица Калинина 185,unknown,Wildberries
unknown,wildberries,посёлок городского типа Краснокаменск Центральная Улица 13,unknown,Wildberries
unknown,wildberries,Красноярский край село Каратузское Советская улица 26Г,unknown,Wildberries
unknown,wildberries,Красноярск Парусная Улица 9,unknown,Wildberries
unknown,wildberries,Красноярск Семафорная Улица 191,unknown,Wildberries
unknown,wildberries,Зеленогорск Парковая Улица 62г,unknown,Wildberries
unknown,wildberries,село Новобирилюссы Кооперативная Улица 2а,unknown,Wildberries
unknown,wildberries,Красноярск Проспект 60 Лет Образования СССР 56,unknown,Wildberries
unknown,wildberries,Красноярский край городской поселок Дубинино Комсомольская улица 28,unknown,Wildberries
unknown,wildberries,посёлок Элита Озёрная Улица 8,unknown,Wildberries
unknown,wildberries,Минусинск Народная Улица 7в,unknown,Wildberries
unknown,wildberries,село Дрокино Московская Улица 1а,unknown,Wildberries
unknown,wildberries,Красноярск Улица Алексеева 19,unknown,Wildberries
unknown,wildberries,Красноярский край Красноярск улица Королёва 5А,unknown,Wildberries
unknown,wildberries,Красноярск Улица Белинского 1,unknown,Wildberries
unknown,wildberries,Ачинск Улица Кирова 23,unknown,Wildberries
unknown,wildberries,село Агинское Советская Улица 113,unknown,Wildberries
unknown,wildberries,Красноярский край село Ермаковское улица Карла Маркса 43,unknown,Wildberries
unknown,wildberries,село Казачинское Советская Улица 42а,unknown,Wildberries
unknown,wildberries,Красноярск Улица Академика Киренского 67,unknown,Wildberries
unknown,wildberries,Красноярск Улица Академика Киренского 32,unknown,Wildberries
unknown,wildberries,Красноярск Лесопарковая Улица 21,unknown,Wildberries
unknown,wildberries,село Казачинское Советская Улица 89,unknown,Wildberries
unknown,wildberries,Красноярск Вербная Улица 6,unknown,Wildberries
unknown,wildberries,Красноярск Ястынская Улица 19д,unknown,Wildberries
unknown,wildberries,Красноярск Проспект 60 Лет Образования СССР 40б,unknown,Wildberries
unknown,wildberries,Красноярский край Дивногорск Комсомольская улица 3,unknown,Wildberries
unknown,wildberries,Красноярск Улица Тельмана 30а,unknown,Wildberries
unknown,wildberries,Красноярский край Шарыпово 2-й микрорайон 15А,unknown,Wildberries
unknown,wildberries,Красноярский край Красноярск улица Тотмина 9,unknown,Wildberries
unknown,wildberries,посёлок городского типа Балахта Советская Улица 45,unknown,Wildberries
unknown,wildberries,Красноярский край Канск Московская улица 73,unknown,Wildberries
unknown,wildberries,посёлок городского типа Березовка Центральная Улица 32,unknown,Wildberries
unknown,wildberries,Красноярск улица им. Карбышева 24б,unknown,Wildberries
unknown,wildberries,село Новая Солянка Октябрьская Улица 69а,unknown,Wildberries
unknown,wildberries,Красноярский край Канск 6-й Северо-Западный микрорайон 6,unknown,Wildberries
unknown,wildberries,Ачинск Улица Дружбы Народов с10,unknown,Wildberries
unknown,wildberries,Красноярск Ольховая Улица 6,unknown,Wildberries
unknown,wildberries,Красноярск Свердловская Улица 17б,unknown,Wildberries
unknown,wildberries,Красноярск Улица Тотмина 12а,unknown,Wildberries
unknown,wildberries,Красноярский край Красноярск Даурская улица 16/4,unknown,Wildberries
unknown,wildberries,Канск Улица Некрасова 10/2,unknown,Wildberries
unknown,wildberries,Красноярский край Назарово улица Труда 13,unknown,Wildberries
unknown,wildberries,Красноярск Ширинская Улица 1,unknown,Wildberries
unknown,wildberries,Красноярск Улица Красной Армии 15,unknown,Wildberries
unknown,wildberries,Дивногорск Улица Хулиана Гримау 23а/2,unknown,Wildberries
unknown,wildberries,Красноярск Улица Весны 3,unknown,Wildberries
unknown,wildberries,Лесосибирск Улица Белинского 5б,unknown,Wildberries
unknown,wildberries,посёлок Таёжный Лесовозная Улица 9м,unknown,Wildberries
unknown,wildberries,Красноярск Норильская Улица 52а,unknown,Wildberries
unknown,wildberries,Красноярск Проспект Имени Газеты Красноярский Рабочий 79,unknown,Wildberries
unknown,wildberries,деревня Минино Улица Внуковых 10,unknown,Wildberries
unknown,wildberries,Красноярский край посёлок Солнечный Солнечная улица 15с1,unknown,Wildberries
unknown,wildberries,Минусинск Улица Тимирязева 24,unknown,Wildberries
unknown,wildberries,Красноярск Якорный Переулок 10,unknown,Wildberries
unknown,wildberries,Красноярский край Ужур улица Кирова 40Г,unknown,Wildberries
unknown,wildberries,Сосновоборск Улица Ленинского Комсомола 37,unknown,Wildberries
unknown,wildberries,Красноярский край Красноярск Джамбульская улица 19А,unknown,Wildberries
unknown,wildberries,Красноярский край Красноярск улица Анатолия Гладкова 25Г,unknown,Wildberries
unknown,wildberries,Красноярск Улица 9 Мая 60г,unknown,Wildberries
unknown,wildberries,Красноярский край Канск 4-й Центральный микрорайон 19,unknown,Wildberries
unknown,wildberries,Красноярск Улица Академика Павлова 54,unknown,Wildberries
unknown,wildberries,Красноярский край Канск улица Эйдемана 12,unknown,Wildberries
unknown,wildberries,Красноярск Апрельская Улица 1,unknown,Wildberries
unknown,wildberries,Красноярский край Норильск Талнахская улица 30,unknown,Wildberries
unknown,wildberries,Красноярский край Норильск улица Орджоникидзе 2,unknown,Wildberries
unknown,wildberries,Железногорск Ленинградский Проспект 89а,unknown,Wildberries
unknown,wildberries,Красноярский край Бородино улица Ленина 45Б,unknown,Wildberries
unknown,wildberries,посёлок Солонцы Кедровая Улица 5,unknown,Wildberries
unknown,wildberries,Сосновоборск Улица Энтузиастов 7,unknown,Wildberries
unknown,wildberries,Красноярский край Лесосибирск 7-й микрорайон 1,unknown,Wildberries
unknown,wildberries,Красноярск Улица Алексеева 22,unknown,Wildberries
unknown,wildberries,Енисейск Улица Доры Кваш 18,unknown,Wildberries
unknown,wildberries,Красноярский край Норильск Югославская улица 30,unknown,Wildberries
unknown,wildberries,Красноярск Улица Щорса 14,unknown,Wildberries
unknown,wildberries,Красноярский край Дивногорск улица Чкалова 61,unknown,Wildberries
unknown,wildberries,Красноярский край Дивногорск набережная имени В.И. Ленина 51,unknown,Wildberries
unknown,wildberries,посёлок городского типа Березовка Советская Улица 51а,unknown,Wildberries
unknown,wildberries,Красноярский край Красноярск Волгоградская улица 21,unknown,Wildberries
unknown,wildberries,посёлок Гремучий Студенческая Улица 3т,unknown,Wildberries
unknown,wildberries,Заозёрный Улица Ленина 14,unknown,Wildberries
unknown,wildberries,Красноярский край Минусинск Ботаническая улица 37,unknown,Wildberries
unknown,wildberries,Красноярский край посёлок Ангарский Полярная улица 23,unknown,Wildberries
unknown,wildberries,Красноярск Улица Партизана Железняка 6а,unknown,Wildberries
unknown,wildberries,Красноярский край Красноярск улица 60 лет Октября 35,unknown,Wildberries
unknown,wildberries,посёлок Абан Советская Улица 64,unknown,Wildberries
unknown,wildberries,Красноярский край Норильск Ленинский проспект 13,unknown,Wildberries
unknown,wildberries,село Пировское Улица Ленина 33,unknown,Wildberries
unknown,wildberries,Красноярский край Красноярск улица Ленина 28,unknown,Wildberries
unknown,wildberries,село Ирбейское Улица Ленина 57,unknown,Wildberries
unknown,wildberries,Красноярск Новосибирская Улица 3,unknown,Wildberries
unknown,wildberries,Красноярский край Красноярск улица Мечникова 41,unknown,Wildberries
unknown,wildberries,Ачинск Улица Дружбы Народов 10,unknown,Wildberries
unknown,wildberries,Зеленогорск Первомайская Улица 7,unknown,Wildberries
unknown,wildberries,Красноярский край Красноярск проспект 60 лет Образования СССР 26,unknown,Wildberries
unknown,wildberries,Красноярский край город Боготол Садовая улица 65А,unknown,Wildberries
unknown,wildberries,Красноярский край Красноярск улица Ломоносова 98,unknown,Wildberries
unknown,wildberries,посёлок Саянский Улица Лукашевича 18,unknown,Wildberries
unknown,wildberries,Минусинск Улица Тимирязева 8,unknown,Wildberries
unknown,wildberries,Канск Улица Горького 46,unknown,Wildberries
unknown,wildberries,Красноярск Улица Республики 42,unknown,Wildberries
unknown,wildberries,село Бархатово Улица Ленина 5а,unknown,Wildberries
unknown,wildberries,Красноярский край Красноярск улица 40 лет Победы 18,unknown,Wildberries
unknown,wildberries,поселок Малиновка Квартал 1 2,unknown,Wildberries
unknown,wildberries,Красноярский край Ачинск 1-й Юго-Восточный микрорайон 13,unknown,Wildberries
unknown,wildberries,Красноярский край Красноярск Апрельская улица 4,unknown,Wildberries
unknown,wildberries,Красноярск Проспект Металлургов 28а,unknown,Wildberries
unknown,wildberries,Красноярский край Норильск Комсомольская улица 33,unknown,Wildberries
unknown,wildberries,Красноярск Свердловская Улица 49а,unknown,Wildberries
unknown,wildberries,Красноярск Улица Щорса 30,unknown,Wildberries
unknown,wildberries,Красноярский край Красноярск проспект имени Газеты Красноярский Рабочий 26,unknown,Wildberries
unknown,wildberries,Красноярский край Красноярск Свободный проспект 10,unknown,Wildberries
unknown,wildberries,Красноярский край Норильск улица Космонавтов 39,unknown,Wildberries
unknown,wildberries,Иланский Улица 40 Лет ВЛКСМ 2д,unknown,Wildberries
unknown,wildberries,Красноярск Улица 40 Лет Победы 9,unknown,Wildberries
unknown,wildberries,Красноярск Улица Любы Шевцовой 84,unknown,Wildberries
unknown,wildberries,Минусинск Улица Трегубенко 58,unknown,Wildberries
unknown,wildberries,Красноярский край Норильск Талнахская улица 55,unknown,Wildberries
unknown,wildberries,Красноярск Улица Чернышевского 63,unknown,Wildberries
unknown,wildberries,село Ирбейское Трактовая Улица 26и,unknown,Wildberries
unknown,wildberries,Красноярский край Шарыпово 3-й микрорайон 17,unknown,Wildberries
unknown,wildberries,Красноярск Свободный Проспект 57,unknown,Wildberries
unknown,wildberries,Красноярск Сибирский Переулок 8,unknown,Wildberries
unknown,wildberries,Красноярский край Лесосибирск улица Горького 72,unknown,Wildberries
unknown,wildberries,Зеленогорск Улица Диктатуры Пролетариата 6,unknown,Wildberries
unknown,wildberries,Красноярский край Шарыпово 2-й микрорайон 4/6,unknown,Wildberries
unknown,wildberries,Красноярский край Лесосибирск 5-й микрорайон 4,unknown,Wildberries
unknown,wildberries,Красноярск Улица Академика Киренского 2и,unknown,Wildberries
unknown,wildberries,Красноярский край Ачинск 6-й микрорайон 19,unknown,Wildberries
unknown,wildberries,Красноярский край Лесосибирск 9-й микрорайон 3А,unknown,Wildberries
unknown,wildberries,Красноярск Ярыгинская Набережная 41,unknown,Wildberries
unknown,wildberries,Красноярский край Норильск Рудная улица 31,unknown,Wildberries
unknown,wildberries,Заозёрный Улица Карла Маркса 12,unknown,Wildberries
unknown,wildberries,Красноярск Улица Петра Подзолкова 26,unknown,Wildberries
unknown,wildberries,Красноярский край Ачинск 3-й Привокзальный микрорайон 37,unknown,Wildberries
unknown,wildberries,Красноярский край Кодинск улица Гайнулина 8/8,unknown,Wildberries
unknown,wildberries,Красноярск Улица Бограда 111,unknown,Wildberries
unknown,wildberries,Красноярский край Норильск улица Орджоникидзе 20с1,unknown,Wildberries
unknown,wildberries,Красноярск Улица Урванцева 5,unknown,Wildberries
unknown,wildberries,Красноярск Улица Мате Залки 11а,unknown,Wildberries
