Ref,Spider,Name,Address,City,State,Zipcode,Country,Phone,Website,Hours,Brand,WikiData
1176,coffee_like,Coffee Like,"ул. Островского, 6",Дудинка,Krasnoyarskiy,,RU,,,Mo-Su 09:00-21:00,Coffee Like,Q55662627
7,wildberries,Wildberries,"г. Ачинск (Красноярский край), 4-й мкр, д. 9",,Krasnoyarskiy,,RU,,,Mo-Su 10:00-21:00,Wildberries,Q24933714
144,wildberries,Wildberries,"г. Канск (Красноярский край), улица Эйдемана, д. 18",,Krasnoyarskiy,,RU,,,Mo-Su 10:00-21:00,Wildberries,Q24933714
173,wildberries,Wildberries,"г. Норильск (Красноярский край), ул. Орджоникидзе, 1Б",,Krasnoyarskiy,,RU,,,Mo-Su 08:00-22:00,Wildberries,Q24933714
501,wildberries,Wildberries,"Красноярский край, Красноярск, улица Кирова, 37",,Krasnoyarskiy,,RU,,,Mo-Su 10:00-21:00,Wildberries,Q24933714
801,wildberries,Wildberries,"Красноярский край, Норильск, улица Строителей, 25",,Krasnoyarskiy,,RU,,,Mo-Su 10:00-21:00,Wildberries,Q24933714
919,wildberries,Wildberries,"Красноярский край, Красноярск, улица Авиаторов, 41",,Krasnoyarskiy,,RU,,,Mo-Su 08:00-22:00,Wildberries,Q24933714
1007,wildberries,Wildberries,"г. Красноярск (Красноярский край), ул. Затонская, д.3",,Krasnoyarskiy,,RU,,,Mo-Su 08:00-22:00,Wildberries,Q24933714
1111,wildberries,Wildberries,г. Минусинск (Красноярский край) ул. Гагарина д. 13 пом. 65,,Krasnoyarskiy,,RU,,,Mo-Su 10:00-21:00,Wildberries,Q24933714
1281,wildberries,Wildberries,"г. Норильск (Красноярский край), ул. Школьная , д. 16",,Krasnoyarskiy,,RU,,,Mo-Su 10:00-21:00,Wildberries,Q24933714
1326,wildberries,Wildberries,"г. Железногорск (Красноярский край), улица Ленина, д. 30",,Krasnoyarskiy,,RU,,,Mo-Su 10:00-21:00,Wildberries,Q24933714
1806,wildberries,Wildberries,"г. Назарово (Красноярский край), улица 30 лет ВЛКСМ, д. 70  помещение 33",,Krasnoyarskiy,,RU,,,Mo-Su 10:00-21:00,Wildberries,Q24933714
1965,wildberries,Wildberries,"г. Ачинск (Красноярский край), 8-й микрорайон, д. 7",,Krasnoyarskiy,,RU,,,Mo-Su 10:00-21:00,Wildberries,Q24933714
2207,wildberries,Wildberries,"г. Красноярск (Красноярский край), Краснодарская улица, д. 22А",,Krasnoyarskiy,,RU,,,Mo-Su 08:00-22:00,Wildberries,Q24933714
2235,wildberries,Wildberries,"г. Красноярск (Красноярский край), Аэровокзальная улица, д. 7",,Krasnoyarskiy,,RU,,,Mo-Su 08:00-22:00,Wildberries,Q24933714
2267,wildberries,Wildberries,"г. Красноярск (Красноярский край), улица Батурина, ул. 19",,Krasnoyarskiy,,RU,,,Mo-Su 08:00-22:00,Wildberries,Q24933714
2461,wildberries,Wildberries,"г. Ачинск (Красноярский край), 3-й Привокзальный микрорайон, д. 2",,Krasnoyarskiy,,RU,,,Mo-Su 10:00-21:00,Wildberries,Q24933714
2521,wildberries,Wildberries,"г. Красноярск (Красноярский край), улица Крупской, д. 4А",,Krasnoyarskiy,,RU,,,Mo-Su 08:00-22:00,Wildberries,Q24933714
2797,wildberries,Wildberries,"г. Енисейск (Красноярский край), улица Кирова, д. 87",,Krasnoyarskiy,,RU,,,Mo-Su 10:00-21:00,Wildberries,Q24933714
3089,wildberries,Wildberries,г. Железногорск (Красноярский край) Ленинградский проспект 35,,Krasnoyarskiy,,RU,,,Mo-Su 08:00-22:00,Wildberries,Q24933714
3151,wildberries,Wildberries,"г. Красноярск (Красноярский край), Свободный проспект, д. 28",,Krasnoyarskiy,,RU,,,Mo-Su 08:00-22:00,Wildberries,Q24933714
3192,wildberries,Wildberries,"г. Шарыпово (Красноярский край), 1-й мкр, д. 2",,Krasnoyarskiy,,RU,,,Mo-Su 10:00-21:00,Wildberries,Q24933714
3275,wildberries,Wildberries,"г. Минусинск (Красноярский край), Народная улица, д. 15",,Krasnoyarskiy,,RU,,,Mo-Su 08:00-22:00,Wildberries,Q24933714
3293,wildberries,Wildberries,"г. посёлок городского типа Курагино (Красноярский край), Партизанская улица, д. 134",,Krasnoyarskiy,,RU,,,Mo-Su 08:00-22:00,Wildberries,Q24933714
3469,wildberries,Wildberries,"г. Канск (Красноярский край), улица 40 лет Октября, д. 46",,Krasnoyarskiy,,RU,,,Mo-Su 10:00-21:00,Wildberries,Q24933714
3658,wildberries,Wildberries,"г. Боготол (Красноярский край), Советская улица, д. 13",,Krasnoyarskiy,,RU,,,Mo-Su 10:00-21:00,Wildberries,Q24933714
3740,wildberries,Wildberries,"г. Ачинск (Красноярский край), Юго-Восточный микр-он, д. 62",,Krasnoyarskiy,,RU,,,Mo-Su 10:00-21:00,Wildberries,Q24933714
3940,wildberries,Wildberries,"г. Ачинск (Красноярский край), 1 мкр , д. 42А",,Krasnoyarskiy,,RU,,,Mo-Su 10:00-21:00,Wildberries,Q24933714
3955,wildberries,Wildberries,"г. Красноярск (Красноярский край), улица Космонавтов, д. 17А",,Krasnoyarskiy,,RU,,,Mo-Su 10:00-21:00,Wildberries,Q24933714
3956,wildberries,Wildberries,"г. Бородино (Красноярский край), улица Ленина, Д. 54А",,Krasnoyarskiy,,RU,,,Mo-Su 10:00-21:00,Wildberries,Q24933714
4048,wildberries,Wildberries,"г. Сосновоборск (Красноярский край), улица Юности, д. 53",,Krasnoyarskiy,,RU,,,Mo-Su 10:00-21:00,Wildberries,Q24933714
4050,wildberries,Wildberries,"г. Лесосибирск (Красноярский край), улица 60 лет ВЛКСМ, д. 6",,Krasnoyarskiy,,RU,,,Mo-Su 10:00-21:00,Wildberries,Q24933714
4091,wildberries,Wildberries,"г. Железногорск (Красноярский край), проспект Курчатова, д. 16А",,Krasnoyarskiy,,RU,,,Mo-Su 10:00-21:00,Wildberries,Q24933714
4148,wildberries,Wildberries,"г. Красноярск (Красноярский край), улица 9 Мая, д. 83",,Krasnoyarskiy,,RU,,,Mo-Su 08:00-22:00,Wildberries,Q24933714
4171,wildberries,Wildberries,"г. Красноярск (Красноярский край), проспект имени Газеты Красноярский Рабочий, д. 63Б",,Krasnoyarskiy,,RU,,,Mo-Su 10:00-21:00,Wildberries,Q24933714
5152,wildberries,Wildberries,"село Богучаны (Красноярский край), Октябрьская улица, д. 77",,Krasnoyarskiy,,RU,,,Mo-Su 08:00-22:00,Wildberries,Q24933714
5157,wildberries,Wildberries,"г. Железногорск (Красноярский край), Октябрьская улица, д. 4",,Krasnoyarskiy,,RU,,,Mo-Su 10:00-21:00,Wildberries,Q24933714
5270,wildberries,Wildberries,"г. Красноярск (Красноярский край), улица Академика Киренского, д 25Б",,Krasnoyarskiy,,RU,,,Mo-Su 10:00-21:00,Wildberries,Q24933714
5408,wildberries,Wildberries,"г. Красноярск (Красноярский край), Взлётная улица, д. 7Ж",,Krasnoyarskiy,,RU,,,Mo-Su 08:00-22:00,Wildberries,Q24933714
5425,wildberries,Wildberries,"г. Красноярск (Красноярский край), Новосибирская улица, д. 1",,Krasnoyarskiy,,RU,,,Mo-Su 10:00-21:00,Wildberries,Q24933714
5431,wildberries,Wildberries,"г. Минусинск (Красноярский край), улица Бограда, д. 2",,Krasnoyarskiy,,RU,,,Mo-Su 10:00-21:00,Wildberries,Q24933714
5477,wildberries,Wildberries,"г. Красноярск (Красноярский край), улица Петра Ломако, д. 2",,Krasnoyarskiy,,RU,,,Mo-Su 08:00-22:00,Wildberries,Q24933714
5553,wildberries,Wildberries,"г. Кодинск (Красноярский край), улица Гидростроителей, д. 7",,Krasnoyarskiy,,RU,,,Mo-Su 08:00-22:00,Wildberries,Q24933714
5639,wildberries,Wildberries,"г. Красноярск (Красноярский край), улица Водопьянова, д. 19",,Krasnoyarskiy,,RU,,,Mo-Su 08:00-22:00,Wildberries,Q24933714
6024,wildberries,Wildberries,"Красноярский край, посёлок городского типа Шушенское, 3-й микрорайон, 6А",,Krasnoyarskiy,,RU,,,Mo-Su 10:00-21:00,Wildberries,Q24933714
6092,wildberries,Wildberries,"г. Красноярск (Красноярский край), улица Мичурина, д. 8",,Krasnoyarskiy,,RU,,,Mo-Su 08:00-22:00,Wildberries,Q24933714
100372,wildberries,Wildberries,"г. Ужур (Красноярский край), Советская улица, д. 12А",,Krasnoyarskiy,,RU,,,Mo-Su 10:00-21:00,Wildberries,Q24933714
102587,wildberries,Wildberries,"г. Шарыпово (Красноярский край), Пионерный микрорайон, д. 26",,Krasnoyarskiy,,RU,,,Mo-Su 10:00-21:00,Wildberries,Q24933714
103114,wildberries,Wildberries,"Красноярский край, Железногорск, Таёжная улица, 66",,Krasnoyarskiy,,RU,,,Mo-Su 10:00-21:00,Wildberries,Q24933714
103516,wildberries,Wildberries,п. Таежный (Красноярский край) Карабульская  11,,Krasnoyarskiy,,RU,,,Mo-Su 08:00-22:00,Wildberries,Q24933714
103832,wildberries,Wildberries,"г. Ачинск (Красноярский край), 5 микрорайон, д. 19",,Krasnoyarskiy,,RU,,,Mo-Su 10:00-21:00,Wildberries,Q24933714
103846,wildberries,Wildberries,"Красноярский край, Норильск, Комсомольская улица, 39",,Krasnoyarskiy,,RU,,,Mo-Su 08:00-22:00,Wildberries,Q24933714
104397,wildberries,Wildberries,"г. Иланский (Красноярский край), Коммунистическая улица, д. 43",,Krasnoyarskiy,,RU,,,Mo-Su 10:00-21:00,Wildberries,Q24933714
104761,wildberries,Wildberries,г. Норильск (Красноярский край) Рудная  3,,Krasnoyarskiy,,RU,,,Mo-Su 10:00-21:00,Wildberries,Q24933714
104871,wildberries,Wildberries,"г. Красноярск (Красноярский край), Новосибирская улица, д. 41",,Krasnoyarskiy,,RU,,,Mo-Su 08:00-22:00,Wildberries,Q24933714
104944,wildberries,Wildberries,г. Зеленогорск (Красноярский край) Мира улица  36А,,Krasnoyarskiy,,RU,,,Mo-Su 10:00-21:00,Wildberries,Q24933714
105731,wildberries,Wildberries,г. Назарово (Красноярский край) Арбузова 116 Б,,Krasnoyarskiy,,RU,,,Mo-Su 10:00-21:00,Wildberries,Q24933714
106012,wildberries,Wildberries,г. Уяр (Красноярский край) Ленина 172/10,,Krasnoyarskiy,,RU,,,Mo-Su 10:00-21:00,Wildberries,Q24933714
106025,wildberries,Wildberries,г. Минусинск (Красноярский край) Ботаническая 31Б,,Krasnoyarskiy,,RU,,,Mo-Su 10:00-21:00,Wildberries,Q24933714
106316,wildberries,Wildberries,"г. Красноярск (Красноярский край), улица Марковского, д. 19",,Krasnoyarskiy,,RU,,,Mo-Su 08:00-22:00,Wildberries,Q24933714
106368,wildberries,Wildberries,"г. Красноярск (Красноярский край), Линейная улица, д. 122",,Krasnoyarskiy,,RU,,,Mo-Su 08:00-22:00,Wildberries,Q24933714
106580,wildberries,Wildberries,пгт. Емельяново (Красноярский край) Новая 9Г,,Krasnoyarskiy,,RU,,,Mo-Su 10:00-21:00,Wildberries,Q24933714
108816,wildberries,Wildberries,"г Зеленогорск (Красноярский край), улица Заводская 6",,Krasnoyarskiy,,RU,,,Mo-Su 08:00-22:00,Wildberries,Q24933714
108948,wildberries,Wildberries,"Красноярский край, Кодинск, улица Михайлова, 6А",,Krasnoyarskiy,,RU,,,Mo-Su 08:00-22:00,Wildberries,Q24933714
109482,wildberries,Wildberries,"г Красноярск (Россия, Красноярский край) улица Мате Залки 24",,Krasnoyarskiy,,RU,,,Mo-Su 10:00-21:00,Wildberries,Q24933714
109630,wildberries,Wildberries,"г Канск (Россия, Красноярский край) мкрн. Северный 26",,Krasnoyarskiy,,RU,,,Mo-Su 10:00-21:00,Wildberries,Q24933714
109733,wildberries,Wildberries,"г Красноярск (Россия, Красноярский край) Норильская 16И",,Krasnoyarskiy,,RU,,,Mo-Su 10:00-21:00,Wildberries,Q24933714
109836,wildberries,Wildberries,"г Красноярск (Красноярский край, городской округ Красноярск) улица Шевченко 28А",,Krasnoyarskiy,,RU,,,Mo-Su 08:00-22:00,Wildberries,Q24933714
110270,wildberries,Wildberries,"г Лесосибирск Красноярский край, городской округ Лесосибирск ул. Дзержинского 6",,Krasnoyarskiy,,RU,,,Mo-Su 10:00-21:00,Wildberries,Q24933714
110391,wildberries,Wildberries,п Солнечный (Красноярский край) Солнечная улица 25А,,Krasnoyarskiy,,RU,,,Mo-Su 08:00-22:00,Wildberries,Q24933714
110426,wildberries,Wildberries,г Красноярск  улица Вильского 22,,Krasnoyarskiy,,RU,,,Mo-Su 08:00-22:00,Wildberries,Q24933714
110430,wildberries,Wildberries,"г Красноярск, Воронова 14/6",,Krasnoyarskiy,,RU,,,Mo-Su 09:00-21:00,Wildberries,Q24933714
110931,wildberries,Wildberries,с Ермаковское (Красноярский край) Ленина 82А,,Krasnoyarskiy,,RU,,,Mo-Su 10:00-21:00,Wildberries,Q24933714
111051,wildberries,Wildberries,"Красноярский край, Норильск, Комсомольская улица, 23А",,Krasnoyarskiy,,RU,,,Mo-Su 08:00-22:00,Wildberries,Q24933714
111319,wildberries,Wildberries,Козулька (Красноярский край) Вокзальная улица 9,,Krasnoyarskiy,,RU,,,Mo-Su 10:00-21:00,Wildberries,Q24933714
111784,wildberries,Wildberries,"Сосновоборск Красноярский край, городской округ Сосновоборск улица Энтузиастов 20а",,Krasnoyarskiy,,RU,,,Mo-Su 10:00-21:00,Wildberries,Q24933714
112222,wildberries,Wildberries,г Красноярск (Красноярский край) Елены Стасовой 38Г,,Krasnoyarskiy,,RU,,,Mo-Su 08:00-22:00,Wildberries,Q24933714
112224,wildberries,Wildberries,"Красноярский край, Красноярск, улица Чернышева, 4",,Krasnoyarskiy,,RU,,,Mo-Su 08:00-22:00,Wildberries,Q24933714
112463,wildberries,Wildberries,г Красноярск (Красноярский край) улица Мичурина 2Ж,,Krasnoyarskiy,,RU,,,Mo-Su 08:00-22:00,Wildberries,Q24933714
112716,wildberries,Wildberries,г Минусинск (Красноярский край) улица Тимирязева 17А,,Krasnoyarskiy,,RU,,,Mo-Su 10:00-21:00,Wildberries,Q24933714
114088,wildberries,Wildberries,"Шарыпово (Красноярский край), 6 микрорайон 13",,Krasnoyarskiy,,RU,,,Mo-Su 10:00-21:00,Wildberries,Q24933714
115332,wildberries,Wildberries,Железногорск улица 60 лет ВЛКСМ д. 54,,Krasnoyarskiy,,RU,,,Mo-Su 10:00-21:00,Wildberries,Q24933714
115790,wildberries,Wildberries,"г Красноярск (Красноярский край), улица Ады Лебедевой 141",,Krasnoyarskiy,,RU,,,Mo-Su 10:00-21:00,Wildberries,Q24933714
121470,wildberries,Wildberries,"г Красноярск, Улица Мате Залки 31",,Krasnoyarskiy,,RU,,,Mo-Su 10:00-22:00,Wildberries,Q24933714
121474,wildberries,Wildberries,"г Дивногорск, Комсомольская Улица 19",,Krasnoyarskiy,,RU,,,Mo-Su 09:00-21:00,Wildberries,Q24933714
121904,wildberries,Wildberries,"г Красноярск, Улица Академгородок 66г",,Krasnoyarskiy,,RU,,,Mo-Su 10:00-21:00,Wildberries,Q24933714
122198,wildberries,Wildberries,"г Енисейск, Улица Фефелова 94",,Krasnoyarskiy,,RU,,,Mo-Su 10:00-21:00,Wildberries,Q24933714
122297,wildberries,Wildberries,"г Железногорск, Улица Советской Армии 30",,Krasnoyarskiy,,RU,,,Mo-Su 10:00-21:00,Wildberries,Q24933714
123115,wildberries,Wildberries,"г Красноярск, Улица Александра Матросова 12",,Krasnoyarskiy,,RU,,,Mo-Su 10:00-22:00,Wildberries,Q24933714
123755,wildberries,Wildberries,"г Красноярск, Улица 78-Й Добровольческой Бригады 4",,Krasnoyarskiy,,RU,,,Mo-Su 10:00-22:00,Wildberries,Q24933714
124132,wildberries,Wildberries,"г Красноярск, Улица Партизана Железняка 11б",,Krasnoyarskiy,,RU,,,Mo-Su 10:00-21:00,Wildberries,Q24933714
124133,wildberries,Wildberries,"г Красноярск, Улица Калинина 70а",,Krasnoyarskiy,,RU,,,Mo-Su 10:00-21:00,Wildberries,Q24933714
124188,wildberries,Wildberries,"г Красноярск, Улица Карамзина 20",,Krasnoyarskiy,,RU,,,Mo-Su 10:00-21:00,Wildberries,Q24933714
124539,wildberries,Wildberries,"г Красноярск, Норильская Улица 4",,Krasnoyarskiy,,RU,,,Mo-Su 10:00-21:00,Wildberries,Q24933714
124862,wildberries,Wildberries,"пгт Берёзовка, Заводская Улица 58",,Krasnoyarskiy,,RU,,,Mo-Su 10:00-21:00,Wildberries,Q24933714
125397,wildberries,Wildberries,"Богучаны Красноярский край, Богучанский район переулок Островского 8Гс2",,Krasnoyarskiy,,RU,,,Mo-Su 10:00-21:00,Wildberries,Q24933714
126244,wildberries,Wildberries,Ачинск Красноярский край улица Кирова 38,,Krasnoyarskiy,,RU,,,Mo-Su 10:00-21:00,Wildberries,Q24933714
126330,wildberries,Wildberries,"г Красноярск, Комсомольский Проспект 3",,Krasnoyarskiy,,RU,,,Mo-Su 10:00-21:00,Wildberries,Q24933714
127511,wildberries,Wildberries,"Канск Красноярский край, городской округ Канск Московская улица 66",,Krasnoyarskiy,,RU,,,Mo-Su 10:00-21:00,Wildberries,Q24933714
129304,wildberries,Wildberries,"г Красноярск, Улица Мужества 14",,Krasnoyarskiy,,RU,,,Mo-Su 10:00-21:00,Wildberries,Q24933714
129906,wildberries,Wildberries,"г Красноярск, Линейная Улица 97",,Krasnoyarskiy,,RU,,,Mo-Su 09:00-21:00,Wildberries,Q24933714
130142,wildberries,Wildberries,"г Красноярск, Улица Тельмана 15б",,Krasnoyarskiy,,RU,,,Mo-Su 10:00-21:00,Wildberries,Q24933714
130189,wildberries,Wildberries,"г Красноярск, Улица Воронова 29",,Krasnoyarskiy,,RU,,,Mo-Su 09:00-21:00,Wildberries,Q24933714
130458,wildberries,Wildberries,"г Красноярск, Судостроительная Улица 27а",,Krasnoyarskiy,,RU,,,Mo-Su 10:00-21:00,Wildberries,Q24933714
130473,wildberries,Wildberries,"г Красноярск, Проспект Имени Газеты Красноярский Рабочий 159",,Krasnoyarskiy,,RU,,,Mo-Su 10:00-21:00,Wildberries,Q24933714
130818,wildberries,Wildberries,Дивногорск Красноярский край улица 30 лет Победы 1,,Krasnoyarskiy,,RU,,,Mo-Su 10:00-21:00,Wildberries,Q24933714
132120,wildberries,Wildberries,"Красноярск Красноярский край, городской округ Красноярск улица Дмитрия Мартынова 33",,Krasnoyarskiy,,RU,,,Mo-Su 10:00-21:00,Wildberries,Q24933714
132486,wildberries,Wildberries,"г Красноярск, Ярыгинская Набережная 9",,Krasnoyarskiy,,RU,,,Mo-Su 10:00-22:00,Wildberries,Q24933714
132613,wildberries,Wildberries,"Шушенское Красноярский край, Шушенский район 1 микрайон 8",,Krasnoyarskiy,,RU,,,Mo-Su 10:00-21:00,Wildberries,Q24933714
132944,wildberries,Wildberries,"г Красноярск, Улица Дмитрия Мартынова 25",,Krasnoyarskiy,,RU,,,Mo-Su 10:00-21:00,Wildberries,Q24933714
134827,wildberries,Wildberries,Красноярск Красноярский край Апрельская улица 3,,Krasnoyarskiy,,RU,,,Mo-Su 08:00-22:00,Wildberries,Q24933714
135100,wildberries,Wildberries,Красноярск Красноярский край улица Кутузова 77А,,Krasnoyarskiy,,RU,,,Mo-Su 08:00-22:00,Wildberries,Q24933714
135181,wildberries,Wildberries,"п Кедровый, Улица Павлова 6а",,Krasnoyarskiy,,RU,,,Mo-Su 09:00-21:00,Wildberries,Q24933714
135272,wildberries,Wildberries,"г Лесосибирск (Красноярский край), ул Горького, д 24 ",,Krasnoyarskiy,,RU,,,Mo-Su 10:00-21:00,Wildberries,Q24933714
135462,wildberries,Wildberries,Красноярск Красноярский край улица Академика Киренского 56А,,Krasnoyarskiy,,RU,,,Mo-Su 08:00-22:00,Wildberries,Q24933714
135681,wildberries,Wildberries,"г Лесосибирск, 5-Й Микрорайон 26в",,Krasnoyarskiy,,RU,,,Mo-Su 09:00-21:00,Wildberries,Q24933714
136012,wildberries,Wildberries,"г Красноярск, Улица Авиаторов 44",,Krasnoyarskiy,,RU,,,Mo-Su 09:00-21:00,Wildberries,Q24933714
136208,wildberries,Wildberries,Красноярск Красноярский край улица Сергея Лазо 8А,,Krasnoyarskiy,,RU,,,Mo-Su 10:00-21:00,Wildberries,Q24933714
137064,wildberries,Wildberries,"Красноярский край, г Красноярск, ул Микуцкого, д 12 ",,Krasnoyarskiy,,RU,,,Mo-Su 10:00-21:00,Wildberries,Q24933714
137833,wildberries,Wildberries,"г Красноярск, Судостроительная Улица 62",,Krasnoyarskiy,,RU,,,Mo-Su 10:00-21:00,Wildberries,Q24933714
138278,wildberries,Wildberries,"п Абан, Улица Пушкина 18",,Krasnoyarskiy,,RU,,,Mo-Su 09:00-21:00,Wildberries,Q24933714
138394,wildberries,Wildberries,Ачинск Красноярский край 3 микрорайон 14,,Krasnoyarskiy,,RU,,,Mo-Su 10:00-21:00,Wildberries,Q24933714
138438,wildberries,Wildberries,"г Лесосибирск, Улица Ломоносова 62б",,Krasnoyarskiy,,RU,,,Mo-Su 09:00-21:00,Wildberries,Q24933714
138462,wildberries,Wildberries,"г Красноярск, Взлётная Улица 6",,Krasnoyarskiy,,RU,,,Mo-Su 10:00-21:00,Wildberries,Q24933714
138584,wildberries,Wildberries,"г Красноярск, Взлётная Улица 26г",,Krasnoyarskiy,,RU,,,Mo-Su 10:00-21:00,Wildberries,Q24933714
138791,wildberries,Wildberries,Красноярск Красноярский край Ярыгинская набережная 13А,,Krasnoyarskiy,,RU,,,Mo-Su 08:00-22:00,Wildberries,Q24933714
139382,wildberries,Wildberries,"г Лесосибирск, Промышленная Улица 50",,Krasnoyarskiy,,RU,,,Mo-Su 10:00-22:00,Wildberries,Q24933714
140914,wildberries,Wildberries,"г Красноярск, Улица Тельмана 26",,Krasnoyarskiy,,RU,,,Mo-Su 10:00-22:00,Wildberries,Q24933714
141079,wildberries,Wildberries,"г Красноярск, Судостроительная Улица 37а",,Krasnoyarskiy,,RU,,,Mo-Su 10:00-21:00,Wildberries,Q24933714
141107,wildberries,Wildberries,"г Красноярск, Молодёжный Проспект 19",,Krasnoyarskiy,,RU,,,Mo-Su 10:00-21:00,Wildberries,Q24933714
141381,wildberries,Wildberries,"Сосновоборск Красноярский край, городской округ Сосновоборск проспект Мира 15",,Krasnoyarskiy,,RU,,,Mo-Su 10:00-21:00,Wildberries,Q24933714
141739,wildberries,Wildberries,"Красноярский край, г Зеленогорск, ул Парковая, д 17 ",,Krasnoyarskiy,,RU,,,Mo-Su 10:00-21:00,Wildberries,Q24933714
141886,wildberries,Wildberries,"г Красноярск, Северный Проезд 4",,Krasnoyarskiy,,RU,,,Mo-Su 10:00-22:00,Wildberries,Q24933714
141923,wildberries,Wildberries,"г Красноярск, Улица Весны 5",,Krasnoyarskiy,,RU,,,Mo-Su 10:00-21:00,Wildberries,Q24933714
142770,wildberries,Wildberries,"г Красноярск, Улица 26 Бакинских Комиссаров 17",,Krasnoyarskiy,,RU,,,Mo-Su 10:00-22:00,Wildberries,Q24933714
144334,wildberries,Wildberries,"Норильск Красноярский край, городской округ Норильск Дудинская улица 11",,Krasnoyarskiy,,RU,,,Mo-Su 10:00-21:00,Wildberries,Q24933714
145946,wildberries,Wildberries,"г Лесосибирск, 6-Й Квартал 16",,Krasnoyarskiy,,RU,,,Mo-Su 09:00-21:00,Wildberries,Q24933714
145986,wildberries,Wildberries,"пгт Емельяново, Почтовый Переулок 7а",,Krasnoyarskiy,,RU,,,Mo-Su 09:00-21:00,Wildberries,Q24933714
146173,wildberries,Wildberries,"г Сосновоборск, Весенняя Улица 8",,Krasnoyarskiy,,RU,,,Mo-Su 10:00-21:00,Wildberries,Q24933714
146296,wildberries,Wildberries,"г Сосновоборск, Улица Ленинского Комсомола 11",,Krasnoyarskiy,,RU,,,Mo-Su 10:00-21:00,Wildberries,Q24933714
146486,wildberries,Wildberries,Дудинка Красноярский край улица Бегичева 8,,Krasnoyarskiy,,RU,,,Mo-Su 10:00-21:00,Wildberries,Q24933714
146580,wildberries,Wildberries,"Красноярский край, Норильск, Ленинградская улица, 3Б",,Krasnoyarskiy,,RU,,,Mo-Su 10:00-21:00,Wildberries,Q24933714
