Ref,Spider,Name,Address,City,State,Zipcode,Country,Phone,Website,Hours,Brand,WikiData
146754,wildberries,Wildberries,"г Красноярск, Улица Водопьянова 6",,Krasnoyarskiy,,RU,,,Mo-Su 09:00-21:00,Wildberries,Q24933714
146845,wildberries,Wildberries,"Норильск Красноярский край, городской округ Норильск Первомайская улица 52А",,Krasnoyarskiy,,RU,,,Mo-Su 10:00-21:00,Wildberries,Q24933714
149611,wildberries,Wildberries,"г Енисейск, Рабоче-Крестьянская Улица 184",,Krasnoyarskiy,,RU,,,Mo-Su 10:00-21:00,Wildberries,Q24933714
150245,wildberries,Wildberries,"г Ачинск, 2-Й Юго-Восточный Микрорайон 31",,Krasnoyarskiy,,RU,,,Mo-Su 09:00-21:00,Wildberries,Q24933714
150277,wildberries,Wildberries,"г Сосновоборск, Улица Ленинского Комсомола 18",,Krasnoyarskiy,,RU,,,Mo-Su 10:00-21:00,Wildberries,Q24933714
150283,wildberries,Wildberries,"г Железногорск, Советская Улица 30б",,Krasnoyarskiy,,RU,,,Mo-Su 10:00-21:00,Wildberries,Q24933714
150438,wildberries,Wildberries,"г Ачинск, 5-Й Микрорайон 5",,Krasnoyarskiy,,RU,,,Mo-Su 10:00-21:00,Wildberries,Q24933714
150453,wildberries,Wildberries,"г Красноярск, Улица Партизана Железняка 48е",,Krasnoyarskiy,,RU,,,Mo-Su 09:00-21:00,Wildberries,Q24933714
150616,wildberries,Wildberries,"г Красноярск, Улица Академика Киренского 43",,Krasnoyarskiy,,RU,,,Mo-Su 09:00-21:00,Wildberries,Q24933714
150823,wildberries,Wildberries,"г Красноярск, Улица Ладо Кецховели 75",,Krasnoyarskiy,,RU,,,Mo-Su 09:00-21:00,Wildberries,Q24933714
151022,wildberries,Wildberries,"г Канск, Микрорайон Северо-Западный 41",,Krasnoyarskiy,,RU,,,Mo-Su 10:00-21:00,Wildberries,Q24933714
151055,wildberries,Wildberries,"г Красноярск, Улица Кутузова 48",,Krasnoyarskiy,,RU,,,Mo-Su 10:00-21:00,Wildberries,Q24933714
152263,wildberries,Wildberries,"Красноярский край, Красноярск, улица Лесников, 27",,Krasnoyarskiy,,RU,,,Mo-Su 10:00-21:00,Wildberries,Q24933714
152269,wildberries,Wildberries,"Красноярский край, Красноярск, улица Академика Киренского, 22",,Krasnoyarskiy,,RU,,,Mo-Su 10:00-21:00,Wildberries,Q24933714
152649,wildberries,Wildberries,"Красноярский край, Минусинск, Абаканская улица, 43",,Krasnoyarskiy,,RU,,,Mo-Su 10:00-21:00,Wildberries,Q24933714
153153,wildberries,Wildberries,"Красноярский край, посёлок городского типа Нижняя Пойма, микрорайон Спутник, 18",,Krasnoyarskiy,,RU,,,Mo-Su 10:00-21:00,Wildberries,Q24933714
153300,wildberries,Wildberries,"г Красноярск, Малаховская Улица 2",,Krasnoyarskiy,,RU,,,Mo-Su 10:00-21:00,Wildberries,Q24933714
153302,wildberries,Wildberries,"г Красноярск, Проспект Имени Газеты Красноярский Рабочий 39",,Krasnoyarskiy,,RU,,,Mo-Su 10:00-22:00,Wildberries,Q24933714
154031,wildberries,Wildberries,Красноярск Красноярский край улица Борисевича 20,,Krasnoyarskiy,,RU,,,Mo-Su 08:00-22:00,Wildberries,Q24933714
154196,wildberries,Wildberries,"г Назарово, Улица 30 Лет ВЛКСМ 49",,Krasnoyarskiy,,RU,,,Mo-Su 10:00-21:00,Wildberries,Q24933714
154202,wildberries,Wildberries,"г Ачинск, 3-Й Микрорайон 2",,Krasnoyarskiy,,RU,,,Mo-Su 10:00-21:00,Wildberries,Q24933714
155080,wildberries,Wildberries,"с Богучаны, Подгорная Улица 2д",,Krasnoyarskiy,,RU,,,Mo-Su 10:00-21:00,Wildberries,Q24933714
155253,wildberries,Wildberries,Красноярск Красноярский край Комсомольский проспект 22/2,,Krasnoyarskiy,,RU,,,Mo-Su 08:00-22:00,Wildberries,Q24933714
155257,wildberries,Wildberries,"г Красноярск, Улица Партизана Железняка 57",,Krasnoyarskiy,,RU,,,Mo-Su 10:00-21:00,Wildberries,Q24933714
156914,wildberries,Wildberries,"г Красноярск, Проспект Имени Газеты Красноярский Рабочий 118",,Krasnoyarskiy,,RU,,,Mo-Su 10:00-21:00,Wildberries,Q24933714
157290,wildberries,Wildberries,"г Красноярск (Красноярский край), Ярыгинская набережная, 25",,Krasnoyarskiy,,RU,,,Mo-Su 10:00-21:00,Wildberries,Q24933714
157291,wildberries,Wildberries,"Красноярский край, Красноярск, улица Карамзина, 4",,Krasnoyarskiy,,RU,,,Mo-Su 10:00-21:00,Wildberries,Q24933714
157298,wildberries,Wildberries,"Красноярский край, Красноярск, Лесопарковая улица, 33",,Krasnoyarskiy,,RU,,,Mo-Su 10:00-21:00,Wildberries,Q24933714
157503,wildberries,Wildberries,"г Красноярск, Улица Партизана Железняка 59",,Krasnoyarskiy,,RU,,,Mo-Su 10:00-21:00,Wildberries,Q24933714
157578,wildberries,Wildberries,"г Красноярск, Улица 9 Мая 73",,Krasnoyarskiy,,RU,,,Mo-Su 10:00-21:00,Wildberries,Q24933714
157700,wildberries,Wildberries,"г Красноярск, Соколовская Улица 72а",,Krasnoyarskiy,,RU,,,Mo-Su 09:00-21:00,Wildberries,Q24933714
158045,wildberries,Wildberries,"г Железногорск, Парковая Улица 16",,Krasnoyarskiy,,RU,,,Mo-Su 10:00-21:00,Wildberries,Q24933714
158127,wildberries,Wildberries,"г Енисейск, Рабоче-Крестьянская Улица 198/4",,Krasnoyarskiy,,RU,,,Mo-Su 10:00-21:00,Wildberries,Q24933714
158231,wildberries,Wildberries,"г Красноярск, Улица Александра Матросова 32",,Krasnoyarskiy,,RU,,,Mo-Su 10:00-21:00,Wildberries,Q24933714
158249,wildberries,Wildberries,"г солонцы, Улица Новостроек 4а",,Krasnoyarskiy,,RU,,,Mo-Su 10:00-21:00,Wildberries,Q24933714
158428,wildberries,Wildberries,"г Красноярск, Улица 9 Мая 45",,Krasnoyarskiy,,RU,,,Mo-Su 09:00-21:00,Wildberries,Q24933714
158650,wildberries,Wildberries,"г Красноярск, Улица 9 Мая 49",,Krasnoyarskiy,,RU,,,Mo-Su 10:00-21:00,Wildberries,Q24933714
158806,wildberries,Wildberries,Дудинка Красноярский край улица Горького 46,,Krasnoyarskiy,,RU,,,Mo-Su 10:00-21:00,Wildberries,Q24933714
159127,wildberries,Wildberries,"г Красноярск, Линейная Улица 105",,Krasnoyarskiy,,RU,,,Mo-Su 09:00-21:00,Wildberries,Q24933714
159142,wildberries,Wildberries,"г Лесосибирск, Улица Победы 8а",,Krasnoyarskiy,,RU,,,Mo-Su 10:00-21:00,Wildberries,Q24933714
159354,wildberries,Wildberries,"г Красноярск, Улица Авиаторов 25а",,Krasnoyarskiy,,RU,,,Mo-Su 10:00-21:00,Wildberries,Q24933714
159452,wildberries,Wildberries,"г Минусинск, Абаканская Улица 56",,Krasnoyarskiy,,RU,,,Mo-Su 10:00-21:00,Wildberries,Q24933714
159507,wildberries,Wildberries,"г Красноярск, Проспект Имени Газеты Красноярский Рабочий 94",,Krasnoyarskiy,,RU,,,Mo-Su 10:00-21:00,Wildberries,Q24933714
159509,wildberries,Wildberries,"г Красноярск, Улица Тотмина 11",,Krasnoyarskiy,,RU,,,Mo-Su 09:00-21:00,Wildberries,Q24933714
159602,wildberries,Wildberries,"г Минусинск, Улица Ленина 58",,Krasnoyarskiy,,RU,,,Mo-Su 10:00-22:00,Wildberries,Q24933714
159719,wildberries,Wildberries,"г Красноярск, Караульная Улица 42",,Krasnoyarskiy,,RU,,,Mo-Su 09:00-21:00,Wildberries,Q24933714
159872,wildberries,Wildberries,"г Красноярск, Улица 78-Й Добровольческой Бригады 7",,Krasnoyarskiy,,RU,,,Mo-Su 10:00-21:00,Wildberries,Q24933714
160145,wildberries,Wildberries,"г Красноярск, Улица Петра Ломако 12",,Krasnoyarskiy,,RU,,,Mo-Su 09:00-21:00,Wildberries,Q24933714
160417,wildberries,Wildberries,"г Красноярск, Улица Ладо Кецховели 22а",,Krasnoyarskiy,,RU,,,Mo-Su 10:00-21:00,Wildberries,Q24933714
160541,wildberries,Wildberries,"г Красноярск, Улица Шумяцкого 6",,Krasnoyarskiy,,RU,,,Mo-Su 10:00-22:00,Wildberries,Q24933714
160874,wildberries,Wildberries,"с Сухобузимское, Комсомольская Улица 29",,Krasnoyarskiy,,RU,,,Mo-Su 09:00-21:00,Wildberries,Q24933714
161343,wildberries,Wildberries,"Красноярский край, Железногорск, улица Ленина, 51",,Krasnoyarskiy,,RU,,,Mo-Su 10:00-21:00,Wildberries,Q24933714
161431,wildberries,Wildberries,"пгт Балахта, Юбилейный Переулок 1",,Krasnoyarskiy,,RU,,,Mo-Su 10:00-21:00,Wildberries,Q24933714
161444,wildberries,Wildberries,"г Красноярск, Улица Чернышевского 75а",,Krasnoyarskiy,,RU,,,Mo-Su 10:00-21:00,Wildberries,Q24933714
161601,wildberries,Wildberries,"г Красноярск, Новгородская Улица 2",,Krasnoyarskiy,,RU,,,Mo-Su 10:00-21:00,Wildberries,Q24933714
161610,wildberries,Wildberries,"г Ачинск, Улица Калинина 6",,Krasnoyarskiy,,RU,,,Mo-Su 10:00-21:00,Wildberries,Q24933714
161810,wildberries,Wildberries,"г Красноярск, Амурская Улица 16г",,Krasnoyarskiy,,RU,,,Mo-Su 09:00-21:00,Wildberries,Q24933714
161908,wildberries,Wildberries,"Красноярский край, г Красноярск, Улица Шевченко, 70",,Krasnoyarskiy,,RU,,,Mo-Su 10:00-21:00,Wildberries,Q24933714
161984,wildberries,Wildberries,"г Красноярск, Улица Железнодорожников 22д",,Krasnoyarskiy,,RU,,,Mo-Su 10:00-21:00,Wildberries,Q24933714
162022,wildberries,Wildberries,"г Канск, Улица 40 Лет Октября 62/4",,Krasnoyarskiy,,RU,,,Mo-Su 09:00-20:00,Wildberries,Q24933714
162059,wildberries,Wildberries,"г Красноярск, Светлогорская Улица 35ак2",,Krasnoyarskiy,,RU,,,Mo-Su 10:00-21:00,Wildberries,Q24933714
162178,wildberries,Wildberries,"г Сосновоборск, Весенняя Улица 34",,Krasnoyarskiy,,RU,,,Mo-Su 09:00-21:00,Wildberries,Q24933714
162282,wildberries,Wildberries,"г Боготол, Улица 40 Лет Октября 15а",,Krasnoyarskiy,,RU,,,Mo-Su 09:00-21:00,Wildberries,Q24933714
162326,wildberries,Wildberries,"г Железногорск, Ленинградский Проспект 7/1",,Krasnoyarskiy,,RU,,,Mo-Su 10:00-21:00,Wildberries,Q24933714
162411,wildberries,Wildberries,"Красноярский край, Ачинск, 1-й Юго-Восточный микрорайон, 26",,Krasnoyarskiy,,RU,,,Mo-Su 10:00-21:00,Wildberries,Q24933714
162453,wildberries,Wildberries,"с Тюхтет, Улица Кирова 44",,Krasnoyarskiy,,RU,,,Mo-Su 10:00-22:00,Wildberries,Q24933714
162477,wildberries,Wildberries,"с Шалинское, Улица Ленина 30",,Krasnoyarskiy,,RU,,,Mo-Su 09:00-21:00,Wildberries,Q24933714
162537,wildberries,Wildberries,"г Красноярск, Судостроительная Улица 161",,Krasnoyarskiy,,RU,,,Mo-Su 10:00-21:00,Wildberries,Q24933714
162817,wildberries,Wildberries,"Красноярский край, Красноярск, улица Ладо Кецховели, 37",,Krasnoyarskiy,,RU,,,Mo-Su 10:00-21:00,Wildberries,Q24933714
162966,wildberries,Wildberries,"г Красноярск, Проспект Имени Газеты Красноярский Рабочий 175",,Krasnoyarskiy,,RU,,,Mo-Su 10:00-21:00,Wildberries,Q24933714
163013,wildberries,Wildberries,"Красноярский край, Бородино, улица Ленина, 61А",,Krasnoyarskiy,,RU,,,Mo-Su 10:00-21:00,Wildberries,Q24933714
163218,wildberries,Wildberries,"г Железногорск, Улица Ленина 50",,Krasnoyarskiy,,RU,,,Mo-Su 10:00-21:00,Wildberries,Q24933714
163275,wildberries,Wildberries,"г Назарово, Улица Арбузова 96",,Krasnoyarskiy,,RU,,,Mo-Su 10:00-22:00,Wildberries,Q24933714
163417,wildberries,Wildberries,"снт Звезда 2, Тихая Улица 1",,Krasnoyarskiy,,RU,,,Mo-Su 09:00-21:00,Wildberries,Q24933714
163467,wildberries,Wildberries,"г Железногорск, Улица Свердлова 33",,Krasnoyarskiy,,RU,,,Mo-Su 09:00-21:00,Wildberries,Q24933714
163574,wildberries,Wildberries,"г Красноярск, Улица Урванцева 12",,Krasnoyarskiy,,RU,,,Mo-Su 10:00-21:00,Wildberries,Q24933714
163579,wildberries,Wildberries,"г Красноярск, Улица Курчатова 4",,Krasnoyarskiy,,RU,,,Mo-Su 09:00-21:00,Wildberries,Q24933714
163609,wildberries,Wildberries,"г Красноярск, Улица Калинина 17",,Krasnoyarskiy,,RU,,,Mo-Su 10:00-22:00,Wildberries,Q24933714
163660,wildberries,Wildberries,"п Подгорный, Лесная Улица 9",,Krasnoyarskiy,,RU,,,Mo-Su 09:00-21:00,Wildberries,Q24933714
163886,wildberries,Wildberries,"г Железногорск, Ленинградский Проспект 73",,Krasnoyarskiy,,RU,,,Mo-Su 10:00-21:00,Wildberries,Q24933714
163887,wildberries,Wildberries,"г Зеленогорск, Улица Мира 6/1",,Krasnoyarskiy,,RU,,,Mo-Su 10:00-21:00,Wildberries,Q24933714
163989,wildberries,Wildberries,"г Красноярск, Улица Петра Подзолкова 3в",,Krasnoyarskiy,,RU,,,Mo-Su 10:00-21:00,Wildberries,Q24933714
164025,wildberries,Wildberries,"г Красноярск, Норильская Улица 34",,Krasnoyarskiy,,RU,,,Mo-Su 10:00-22:00,Wildberries,Q24933714
164213,wildberries,Wildberries,"г Красноярск, Улица Копылова 76",,Krasnoyarskiy,,RU,,,Mo-Su 10:00-21:00,Wildberries,Q24933714
164302,wildberries,Wildberries,"г Красноярск, Переулок Маяковского 18",,Krasnoyarskiy,,RU,,,Mo-Su 09:00-21:00,Wildberries,Q24933714
164422,wildberries,Wildberries,"г Ачинск, Индустриальная Улица 16",,Krasnoyarskiy,,RU,,,Mo-Su 10:00-21:00,Wildberries,Q24933714
164854,wildberries,Wildberries,"г Красноярск, Улица Забобонова 8",,Krasnoyarskiy,,RU,,,Mo-Su 10:00-21:00,Wildberries,Q24933714
165167,wildberries,Wildberries,"Красноярский край, Ачинск, 5-й микрорайон, 40",,Krasnoyarskiy,,RU,,,Mo-Su 10:00-21:00,Wildberries,Q24933714
165168,wildberries,Wildberries,"г Красноярск, Красномосковская Улица 34",,Krasnoyarskiy,,RU,,,Mo-Su 10:00-21:00,Wildberries,Q24933714
165169,wildberries,Wildberries,"г Красноярск, Заводская Улица 4",,Krasnoyarskiy,,RU,,,Mo-Su 08:00-22:00,Wildberries,Q24933714
165236,wildberries,Wildberries,"Красноярский край, Шарыпово, 2-й микрорайон, 1",,Krasnoyarskiy,,RU,,,Mo-Su 10:00-21:00,Wildberries,Q24933714
165898,wildberries,Wildberries,"г Железногорск, Восточная Улица 49/1",,Krasnoyarskiy,,RU,,,Mo-Su 09:00-21:00,Wildberries,Q24933714
166256,wildberries,Wildberries,"г Красноярск, Улица Академгородок 17б",,Krasnoyarskiy,,RU,,,Mo-Su 10:00-21:00,Wildberries,Q24933714
166709,wildberries,Wildberries,"г Боготол, Комсомольская Улица 148",,Krasnoyarskiy,,RU,,,Mo-Su 10:00-21:00,Wildberries,Q24933714
166718,wildberries,Wildberries,"г Красноярск, Улица Парижской Коммуны 3",,Krasnoyarskiy,,RU,,,Mo-Su 08:00-22:00,Wildberries,Q24933714
166719,wildberries,Wildberries,"г Железногорск, Улица Ленина 22",,Krasnoyarskiy,,RU,,,Mo-Su 10:00-21:00,Wildberries,Q24933714
166868,wildberries,Wildberries,"г Красноярск, Улица Диктатуры Пролетариата 6",,Krasnoyarskiy,,RU,,,Mo-Su 10:00-21:00,Wildberries,Q24933714
167197,wildberries,Wildberries,Красноярск Красноярский край Львовская улица 33А,,Krasnoyarskiy,,RU,,,Mo-Su 08:00-22:00,Wildberries,Q24933714
167307,wildberries,Wildberries,"г Красноярск, Улица Молокова 1а",,Krasnoyarskiy,,RU,,,Mo-Su 10:00-21:00,Wildberries,Q24933714
167430,wildberries,Wildberries,"г Красноярск, Улица Академика Вавилова 52",,Krasnoyarskiy,,RU,,,Mo-Su 09:00-21:00,Wildberries,Q24933714
167647,wildberries,Wildberries,"с Дзержинское, Садовый Переулок 14",,Krasnoyarskiy,,RU,,,Mo-Su 09:00-21:00,Wildberries,Q24933714
167916,wildberries,Wildberries,"пгт Большая Мурта, Советская Улица 15",,Krasnoyarskiy,,RU,,,Mo-Su 09:00-21:00,Wildberries,Q24933714
168731,wildberries,Wildberries,"г Зеленогорск, Улица Диктатуры Пролетариата 1",,Krasnoyarskiy,,RU,,,Mo-Su 10:00-21:00,Wildberries,Q24933714
168777,wildberries,Wildberries,"пгт Нижний Ингаш, Улица Красная Площадь 51",,Krasnoyarskiy,,RU,,,Mo-Su 09:00-21:00,Wildberries,Q24933714
168824,wildberries,Wildberries,"г Красноярск, Улица Чернышевского 120",,Krasnoyarskiy,,RU,,,Mo-Su 09:00-21:00,Wildberries,Q24933714
169053,wildberries,Wildberries,"с Черемшанка, Садовая Улица 1",,Krasnoyarskiy,,RU,,,Mo-Su 09:00-21:00,Wildberries,Q24933714
169080,wildberries,Wildberries,"г Красноярск, Улица Ады Лебедевой 91",,Krasnoyarskiy,,RU,,,Mo-Su 10:00-21:00,Wildberries,Q24933714
169538,wildberries,Wildberries,"с Большой Улуй, Советская Улица 125",,Krasnoyarskiy,,RU,,,Mo-Su 10:00-21:00,Wildberries,Q24933714
169729,wildberries,Wildberries,"г Красноярск, Проспект 60 Лет Образования СССР 28",,Krasnoyarskiy,,RU,,,Mo-Su 10:00-21:00,Wildberries,Q24933714
170138,wildberries,Wildberries,"г Иланский, Школьная Улица 27",,Krasnoyarskiy,,RU,,,Mo-Su 10:00-21:00,Wildberries,Q24933714
170157,wildberries,Wildberries,"г Красноярск, Улица Елены Стасовой 50д",,Krasnoyarskiy,,RU,,,Mo-Su 09:00-21:00,Wildberries,Q24933714
170350,wildberries,Wildberries,"г Канск, Шоссейная Улица 50",,Krasnoyarskiy,,RU,,,Mo-Su 09:00-21:00,Wildberries,Q24933714
170528,wildberries,Wildberries,"г Ачинск, Квартал 7Б 8а",,Krasnoyarskiy,,RU,,,Mo-Su 10:00-21:00,Wildberries,Q24933714
171121,wildberries,Wildberries,"г Норильск, Надеждинская Улица 12",,Krasnoyarskiy,,RU,,,Mo-Su 09:00-21:00,Wildberries,Q24933714
171128,wildberries,Wildberries,"г Красноярск, Норильская Улица 4д",,Krasnoyarskiy,,RU,,,Mo-Su 10:00-21:00,Wildberries,Q24933714
171143,wildberries,Wildberries,"пгт Курагино, Улица Ленина 59",,Krasnoyarskiy,,RU,,,Mo-Su 10:00-22:00,Wildberries,Q24933714
171181,wildberries,Wildberries,"г Красноярск, Улица Устиновича 28а",,Krasnoyarskiy,,RU,,,Mo-Su 10:00-22:00,Wildberries,Q24933714
171675,wildberries,Wildberries,"с Новоселово, Улица Максима Горького 2",,Krasnoyarskiy,,RU,,,Mo-Su 10:00-22:00,Wildberries,Q24933714
171807,wildberries,Wildberries,"г Красноярск, 2-Я Ботаническая Улица 1а",,Krasnoyarskiy,,RU,,,Mo-Su 09:00-21:00,Wildberries,Q24933714
171892,wildberries,Wildberries,"г Красноярск, Регатная Улица 1",,Krasnoyarskiy,,RU,,,Mo-Su 10:00-21:00,Wildberries,Q24933714
171911,wildberries,Wildberries,"Красноярский край, Красноярск, Свердловская улица, 101А",,Krasnoyarskiy,,RU,,,Mo-Su 10:00-21:00,Wildberries,Q24933714
171912,wildberries,Wildberries,"Красноярский край, Красноярск, Свердловская улица, 9А",,Krasnoyarskiy,,RU,,,Mo-Su 10:00-21:00,Wildberries,Q24933714
171946,wildberries,Wildberries,"г Красноярск, Свободный Проспект 29",,Krasnoyarskiy,,RU,,,Mo-Su 10:00-21:00,Wildberries,Q24933714
172288,wildberries,Wildberries,"г Минусинск, Скворцовская Улица 71",,Krasnoyarskiy,,RU,,,Mo-Su 09:00-20:00,Wildberries,Q24933714
172333,wildberries,Wildberries,"г Минусинск, Улица Чайковского 60",,Krasnoyarskiy,,RU,,,Mo-Su 09:00-21:00,Wildberries,Q24933714
172408,wildberries,Wildberries,"г Красноярск, 2-Я Огородная Улица 24",,Krasnoyarskiy,,RU,,,Mo-Su 10:00-21:00,Wildberries,Q24933714
172541,wildberries,Wildberries,"г Красноярск, Улица Алексеева 93",,Krasnoyarskiy,,RU,,,Mo-Su 09:00-21:00,Wildberries,Q24933714
172839,wildberries,Wildberries,"г Красноярск, Улица Белопольского 2а",,Krasnoyarskiy,,RU,,,Mo-Su 10:00-21:00,Wildberries,Q24933714
173040,wildberries,Wildberries,"п Копьево, Партизанская Улица 19",,Krasnoyarskiy,,RU,,,Mo-Su 10:00-21:00,Wildberries,Q24933714
200255,wildberries,Wildberries,"г Красноярск, Свободная Улица 7б",,Krasnoyarskiy,,RU,,,Mo-Su 09:00-21:00,Wildberries,Q24933714
200264,wildberries,Wildberries,"г Красноярск, Улица Мате Залки 10",,Krasnoyarskiy,,RU,,,Mo-Su 10:00-21:00,Wildberries,Q24933714
200289,wildberries,Wildberries,"пгт Курагино, Партизанская Улица 50п",,Krasnoyarskiy,,RU,,,Mo-Su 09:00-21:00,Wildberries,Q24933714
200544,wildberries,Wildberries,"г Красноярск, Проспект Металлургов 22",,Krasnoyarskiy,,RU,,,Mo-Su 10:00-21:00,Wildberries,Q24933714
201054,wildberries,Wildberries,"г Красноярск, Ястынская Улица 19",,Krasnoyarskiy,,RU,,,Mo-Su 10:00-21:00,Wildberries,Q24933714
201170,wildberries,Wildberries,"г Зеленогорск, Набережная Улица 62",,Krasnoyarskiy,,RU,,,Mo-Su 10:00-21:00,Wildberries,Q24933714
201213,wildberries,Wildberries,"г Красноярск, Ястынская Улица 2д",,Krasnoyarskiy,,RU,,,Mo-Su 10:00-21:00,Wildberries,Q24933714
201299,wildberries,Wildberries,"Красноярский край, Красноярск, Судостроительная улица, 90",,Krasnoyarskiy,,RU,,,Mo-Su 10:00-21:00,Wildberries,Q24933714
201427,wildberries,Wildberries,"Красноярский край, Уяр, улица Ленина, 83В",,Krasnoyarskiy,,RU,,,Mo-Su 10:00-21:00,Wildberries,Q24933714
201428,wildberries,Wildberries,"Красноярский край, Бородино, улица Маяковского, 40",,Krasnoyarskiy,,RU,,,Mo-Su 10:00-21:00,Wildberries,Q24933714
202383,wildberries,Wildberries,"Красноярский край, посёлок городского типа Шушенское, улица Тельмана, 26",,Krasnoyarskiy,,RU,,,Mo-Su 10:00-21:00,Wildberries,Q24933714
202429,wildberries,Wildberries,"с Партизанское, Советская Улица 30",,Krasnoyarskiy,,RU,,,Mo-Su 10:00-22:00,Wildberries,Q24933714
202705,wildberries,Wildberries,"Ачинск, 8-Й Микрорайон 16б",,Krasnoyarskiy,,RU,,,Mo-Su 10:00-21:00,Wildberries,Q24933714
202749,wildberries,Wildberries,"с Тесь, Улица Строителей 19",,Krasnoyarskiy,,RU,,,Mo-Su 09:00-20:00,Wildberries,Q24933714
202800,wildberries,Wildberries,"Канск, Улица 40 Лет Октября 47",,Krasnoyarskiy,,RU,,,Mo-Su 09:00-21:00,Wildberries,Q24933714
202834,wildberries,Wildberries,"пгт Емельяново, Московская Улица 238а",,Krasnoyarskiy,,RU,,,Mo-Su 10:00-22:00,Wildberries,Q24933714
203223,wildberries,Wildberries,"Красноярск, Улица Петра Словцова 3а",,Krasnoyarskiy,,RU,,,Mo-Su 10:00-22:00,Wildberries,Q24933714
203517,wildberries,Wildberries,"г Зеленогорск, Улица Ленина 1",,Krasnoyarskiy,,RU,,,Mo-Su 10:00-21:00,Wildberries,Q24933714
203734,wildberries,Wildberries,"Красноярский край, Красноярск, улица 60 лет Октября, 25",,Krasnoyarskiy,,RU,,,Mo-Su 10:00-21:00,Wildberries,Q24933714
203863,wildberries,Wildberries,"Красноярский край, Кодинск, проспект Ленинского Комсомола, 10",,Krasnoyarskiy,,RU,,,Mo-Su 10:00-21:00,Wildberries,Q24933714
204030,wildberries,Wildberries,"село Ирбейское, Интернациональная Улица 95/4",,Krasnoyarskiy,,RU,,,Mo-Su 10:00-21:00,Wildberries,Q24933714
204072,wildberries,Wildberries,"село Ермаковское, Улица Карла Маркса 61",,Krasnoyarskiy,,RU,,,Mo-Su 10:00-21:00,Wildberries,Q24933714
204141,wildberries,Wildberries,"село Тасеево, Улица Зелёная Роща 19",,Krasnoyarskiy,,RU,,,Mo-Su 10:00-21:00,Wildberries,Q24933714
204162,wildberries,Wildberries,"г Красноярск, Улица Молокова 40",,Krasnoyarskiy,,RU,,,Mo-Su 10:00-21:00,Wildberries,Q24933714
204657,wildberries,Wildberries,"Красноярск, Улица Александра Матросова 5",,Krasnoyarskiy,,RU,,,Mo-Su 10:00-21:00,Wildberries,Q24933714
204822,wildberries,Wildberries,"посёлок городского типа Большая Ирба, Улица Бочкарёва 20а",,Krasnoyarskiy,,RU,,,Mo-Su 09:00-21:00,Wildberries,Q24933714
204955,wildberries,Wildberries,"Красноярск, Улица Дмитрия Мартынова 15",,Krasnoyarskiy,,RU,,,Mo-Su 10:00-21:00,Wildberries,Q24933714
205229,wildberries,Wildberries,"Красноярск, Улица Щорса 85г",,Krasnoyarskiy,,RU,,,Mo-Su 09:00-21:00,Wildberries,Q24933714
205281,wildberries,Wildberries,"Красноярск, Улица Урванцева 15",,Krasnoyarskiy,,RU,,,Mo-Su 10:00-21:00,Wildberries,Q24933714
