Ref,Spider,Name,Address,City,State,Zipcode,Country,Phone,Website,Hours,Brand,WikiData
106483,little_free_library,Frost Community Center Library #106483 Frost TX,,Frost,TX,,US,,,,Little Free Library,Q6650101
106484,little_free_library,Frost City Park Gazebo Library #106484 Frost TX,,Frost,TX,,US,,,,Little Free Library,Q6650101
1364212,usps,FROST,,FROST,TX,,US,+1 903-682-3661,,"Mo-Fr 08:00-12:15,13:15-15:00; Sa 08:00-09:45",United States Postal Service,Q668687
7664100002,usps_collection_boxes,USPS COLLECTION BOX - PO LOBBY,301 N GARITTY ST,FROST,TX,,US,,,,United States Postal Service,Q668687
7664100004,usps_collection_boxes,USPS COLLECTION BOX - PO LOBBY,301 N GARITTY ST,FROST,TX,,US,,,,United States Postal Service,Q668687
,visa,,,FROST,TX,,US,,,,,
