Ref,Spider,Name,Address,City,State,Zipcode,Country,Phone,Website,Hours,Brand,WikiData
https://vertretung.allianz.de/agentur.katzer/,allianz_de,Allianz Versicherung Jürgen Katzer GENERALVERTRETUNG,,Röttenbach,,,DE,+49 9195 92980,https://vertretung.allianz.de/agentur.katzer/,Mo-Th 08:30-17:30; Fr 08:30-15:00,Allianz SE,Q487292
49.66122_10.9172999,norma_de,NORMA,,Röttenbach,,,DE,,,Mo-Sa 07:00-20:00,Norma,Q450180
38722,sparkasse_de,Stadt- und Kreissparkasse Erlangen Höchstadt Herzogenaurach Geldautomat Röttenbach,,Röttenbach,,,DE,+49 9131 8243560,https://www.sparkasse.de/standorte/geldautomaten/stadt-und-kreissparkasse-erlangen-hoechstadt-herzogenaurach-geldautomat-roettenbach-38722,Mo-Su 06:00-24:00,Sparkasse,Q13601825
35993,sparkasse_de,Stadt- und Kreissparkasse Erlangen Höchstadt Herzogenaurach Geschäftsstelle Röttenbach,,Röttenbach,,,DE,+49 9131 8243560,https://www.sparkasse.de/standorte/filialen/stadt-und-kreissparkasse-erlangen-hoechstadt-herzogenaurach-geschaeftsstelle-roettenbach-35993,"Mo 09:30-12:30,14:00-16:00; Tu-We 09:30-12:30; Th 09:30-12:30,14:30-17:30; Fr 09:30-12:30,14:00-16:00",Sparkasse,Q13601825
,visa,,,ROETTENBACH,,,DE,,,,,
https://www.vr.de/standorte/R/raiffeisenbank-dreifranken-eg-geschaeftsstelle-roettenbach-7436.html,vr_bank,"Raiffeisenbank DreiFranken eG, Geschäftsstelle Röttenbach",,Röttenbach,,,DE,+49 9135 719700,https://www.rb-dreifranken.de,,,
