Ref,Spider,Name,Address,City,State,Zipcode,Country,Phone,Website,Hours,Brand,WikiData
4476,church_of_england_gb,"Chebsey S.Luke, Norton Bridge","Norton Bridge, Chebsey, Stafford",,,,GB,+44 1785 282829,https://www.achurchnearyou.com/church/4476/,,,
4475,church_of_england_gb,Seighford S.Chad,"centre of the village, Seighford, Stafford",,,,GB,+44 1785 282829,https://www.achurchnearyou.com/church/4475/,,,
4313,church_of_england_gb,Ranton All Saints,"in the village, Ranton, Stafford",,,,GB,+44 1785 282829,https://www.achurchnearyou.com/church/4313/,,,
4477,church_of_england_gb,Chebsey All Saints,"centre of the village, Chebsey, Stafford",,,,GB,+44 1785 282829,https://www.achurchnearyou.com/church/4477/,,,
4478,church_of_england_gb,Ellenhall S.Mary,"top end of the village, Ellenhall, Stafford",,,,GB,+44 1785 282829,https://www.achurchnearyou.com/church/4478/,,,
