City,Place Name,Zipcode,Name
Tashkent,audi,Salar Buyi Street 47 100052 Tashkent,unknown,Sayor Motors Ltd.
unknown,wildberries,Ташкент Ташкент улица Буюк Ипак Йули 77,unknown,Wildberries
unknown,wildberries,Ташкент Ташкент 2-й квартал 51,unknown,Wildberries
unknown,wildberries,Ташкент Ташкент 2-й квартал 6,unknown,Wildberries
unknown,wildberries,Ташкент Ташкент улица Мирзо Улугбека 89,unknown,Wildberries
unknown,wildberries,Ташкент Ташкент улица Буюк Ипак Йули 103,unknown,Wildberries
unknown,wildberries,Ташкент Ташкент улица Паркент 9,unknown,Wildberries
unknown,wildberries,Ташкент Ташкент 1-й квартал 15,unknown,Wildberries
unknown,wildberries,Ташкент Ташкент улица Богишамол 33А,unknown,Wildberries
unknown,wildberries,Ташкент Ташкент улица Янгишахар 10,unknown,Wildberries
unknown,wildberries,Ташкент Ташкент улица Аккурган 29,unknown,Wildberries
unknown,wildberries,Ташкент Ташкент 13-й квартал 2,unknown,Wildberries
unknown,wildberries,Ташкент Ташкент 4-й квартал 14,unknown,Wildberries
unknown,wildberries,Ташкентская область Чирчик улица Осипенко 3,unknown,Wildberries
unknown,wildberries,Ташкент Ташкент 13-й квартал 16,unknown,Wildberries
unknown,wildberries,Ташкентская область Алмалык проспект Примкулова 16,unknown,Wildberries
unknown,wildberries,Ташкент Ташкент улица Олтинтепа 175,unknown,Wildberries
unknown,wildberries,Ташкент Ташкент улица Исмаилата 31,unknown,Wildberries
unknown,wildberries,Ташкентская область Алмалык улица Шарафа Рашидова 16,unknown,Wildberries
unknown,wildberries,Ангрен Улица Профессора Чикрызова 49,unknown,Wildberries
unknown,wildberries,Ташкент Ташкент улица Мирзо Улугбека 3,unknown,Wildberries
unknown,wildberries,Ташкент Ташкент улица Махтумкули 136,unknown,Wildberries
unknown,wildberries,Ташкент Ташкент улица Авайхон,unknown,Wildberries
unknown,wildberries,Ташкент Ташкент улица Шахриабад 53,unknown,Wildberries
unknown,wildberries,Ташкентская область Алмалык улица Ипак Йули 40,unknown,Wildberries
unknown,wildberries,Чирчик Проспект Алишера Навои 160,unknown,Wildberries
unknown,wildberries,Ангрен Улица Узбекистон Мустакиллиги 34а,unknown,Wildberries
unknown,wildberries,Ташкентская область городской посёлок Кибрай Отсутствует Узгариш14а ,unknown,Wildberries
unknown,wildberries,Ташкент Ташкент 19-й квартал 44,unknown,Wildberries
unknown,wildberries,Газалкент Улица Эльдара Асанова 46a,unknown,Wildberries
unknown,wildberries,Ахангаран 2-Й Квартал 2,unknown,Wildberries
