City,Place Name,Zipcode,Name
Yerevan,audi,Adm. Isakov 32 / 1 0004 Yerevan,unknown,Slav Motors CJSC
unknown,wildberries,г. Ереван улица Раффи д. 39,unknown,Wildberries
unknown,wildberries,Арарат Араратская область улица Шаумяна 18,unknown,Wildberries
unknown,wildberries,Веди Араратская область ул.Араратян 56/14,unknown,Wildberries
unknown,wildberries,Арташат Араратская область улица Харазяна 26,unknown,Wildberries
unknown,wildberries,Ереван  1-я улица Шаумяна 16/1,unknown,Wildberries
unknown,wildberries,Ереван  улица Себастия 6/7,unknown,Wildberries
unknown,wildberries,Ереван  Ачапняк Квартал Г-3 (Назарбекян квартал) 21,unknown,Wildberries
unknown,wildberries,Ереван Ереван улица Зоравара Андраника 87,unknown,Wildberries
unknown,wildberries,г Ереван улица Оганова д 26,unknown,Wildberries
unknown,wildberries,г Ереван Андраника 44/3,unknown,Wildberries
unknown,wildberries,г Ереван Улица Зоравара Андраника 27,unknown,Wildberries
unknown,wildberries,г Ереван Улица Ширака 18,unknown,Wildberries
unknown,wildberries,г Ереван Улица Арно Бабаджаняна 159,unknown,Wildberries
unknown,wildberries,г Ереван 5-Й Переулок Улицы Ширака 2/1а,unknown,Wildberries
unknown,wildberries,г Арташат Улица Адмирала Исакова 72,unknown,Wildberries
unknown,wildberries,г Ереван О. Овсепяна 31,unknown,Wildberries
unknown,wildberries,Аргаванд Араратская обл улица Кентронакан 13,unknown,Wildberries
unknown,wildberries,г Масис Квартал Нор 28,unknown,Wildberries
unknown,wildberries,Ереван 12-Я Улица Норагавита 32,unknown,Wildberries
unknown,wildberries,Масис Улица Анрапетутюн 11/1,unknown,Wildberries
unknown,wildberries,село Арарат Улица Араратян 21,unknown,Wildberries
unknown,wildberries,село Геганист Улица Кентронакан 89,unknown,Wildberries
unknown,wildberries,Ереван Улица Себастия 123,unknown,Wildberries
unknown,wildberries,Араратская область село Шаумян улица Октемберяна 24/1,unknown,Wildberries
unknown,wildberries,село Нор Харберт Ереванское Шоссе 51/5,unknown,Wildberries
unknown,wildberries,Ереван Улица Ованнеса Шираза 10,unknown,Wildberries
unknown,wildberries,Арташат Улица 23 Августа 41,unknown,Wildberries
unknown,wildberries,Ереван Улица Арно Бабаджаняна 23/2,unknown,Wildberries
unknown,wildberries,Арташат Улица Спандаряна 40,unknown,Wildberries
unknown,wildberries,Ереван Ереван улица Ленинградян 50,unknown,Wildberries
unknown,wildberries,Веди Улица Араратян 40,unknown,Wildberries
unknown,wildberries,село Нор Харберт 20-Я Улица 6,unknown,Wildberries
unknown,wildberries,Арарат Улица Степана Шаумяна 41/2,unknown,Wildberries
unknown,wildberries,село Айгестан Улица Баграмяна 12,unknown,Wildberries
unknown,wildberries,Араратская область село Аревабуйр шоссе Арташат 24,unknown,Wildberries
unknown,wildberries,село Ншаван Улица Ленина 14,unknown,Wildberries
unknown,wildberries,село Мармарашен Ереванское Шоссе 1,unknown,Wildberries
unknown,wildberries,Масис 3-Й Квартал 13,unknown,Wildberries
unknown,wildberries,село Мхчян Арташатское Шоссе 30,unknown,Wildberries
unknown,wildberries,Араратская область Арташат Ереванская улица 9,unknown,Wildberries
unknown,wildberries,Ереван Ереван проспект Адмирала Исакова 63,unknown,Wildberries
unknown,wildberries,село Верин Арташат Улица Алекаснадра Таманяна 43/5,unknown,Wildberries
unknown,wildberries,Ереван Улица Шарури 9,unknown,Wildberries
unknown,wildberries,Ереван 3-Я Улица Неркин Чарбаха 31/4,unknown,Wildberries
unknown,wildberries,Ереван Ереван улица Оганова 58/1,unknown,Wildberries
unknown,wildberries,Ереван 5-Й Переулок Улицы Ширака 4/6,unknown,Wildberries
unknown,wildberries,село Овташен Улица Барекамутюн 8,unknown,Wildberries
unknown,wildberries,Ереван Ереван улица Багратуняц 7,unknown,Wildberries
unknown,wildberries,Ереван Улица Чехова 43,unknown,Wildberries
unknown,wildberries,село Воскетап Ереванское Шоссе 58,unknown,Wildberries
unknown,wildberries,Арташат Улица Араза 21,unknown,Wildberries
unknown,wildberries,Ереван 11-Я Улица Неркин Шенгавита 1,unknown,Wildberries
unknown,wildberries,Ереван Улица Арташисян 41,unknown,Wildberries
unknown,wildberries,Ереван Ереван улица Себастия 29,unknown,Wildberries
unknown,wildberries,село Масис Улица Арташатян 34,unknown,Wildberries
unknown,wildberries,село Таперакан Улица Маштоца 1/1,unknown,Wildberries
unknown,wildberries,Ереван Улица Кургиняна 7,unknown,Wildberries
unknown,wildberries,Ереван 11-Я Улица Нубарашена 14/1,unknown,Wildberries
unknown,wildberries,Араратская область Веди улица Саркиса Касьяна 26/11,unknown,Wildberries
unknown,wildberries,Ереван Улица Гусана Шерама 53/1,unknown,Wildberries
unknown,wildberries,село Воскетап Ереванское Шоссе 9,unknown,Wildberries
unknown,wildberries,Ереван 11-Я Улица Нубарашена 15/8,unknown,Wildberries
unknown,wildberries,село Зорак Улица Тиграна Меца 1/2,unknown,Wildberries
unknown,wildberries,Ереван 4-Я Улица Шаумяна 73/3,unknown,Wildberries
unknown,wildberries,село Вардашен Улица Нар-Доса 33,unknown,Wildberries
unknown,wildberries,село Аревшат Улица Хачатура Абовяна 12/1,unknown,Wildberries
unknown,wildberries,Ереван 1-Я Улица Норагавита 87,unknown,Wildberries
unknown,wildberries,село Баграмян Арташатское Шоссе 4/4,unknown,Wildberries
unknown,wildberries,село Урцадзор Տիգրան Մեծ Փողոց 32,unknown,Wildberries
unknown,wildberries,Ереван Улица Зоравара Андраника 119,unknown,Wildberries
unknown,wildberries,село Зангакатун Улица Паруйр Севака 52,unknown,Wildberries
unknown,wildberries,село Даракерт Улица Кентронакан 57,unknown,Wildberries
unknown,wildberries,Ереван Улица Ованнес Ованнисяна 50/1,unknown,Wildberries
unknown,wildberries,Арташат Улица Степана Шаумяна 14,unknown,Wildberries
unknown,wildberries,село Аралез Село Аралез 19/1,unknown,Wildberries
unknown,wildberries,Ереван Микрорайон Назарбекян 1/6,unknown,Wildberries
