Ref,Spider,Name,Address,City,State,Zipcode,Country,Phone,Website,Hours,Brand,WikiData
0001049824,ecco,ECCO DFO BRISBANE (OUTLET),,Brisbane Airport,,,AU,+61 7 3114 1144,,Mo-Su 10:00-18:00,Ecco,Q1280255
BNET61,enterprise,Brisbane Domestic Airport,,Brisbane,,,AU,+61 7 3187 4450,,,Enterprise Rent-A-Car,Q17085454
BNEC62,enterprise,Brisbane International Airport,,Brisbane,,,AU,+61 7 3187 4450,,,Enterprise Rent-A-Car,Q17085454
https://rolld.com.au/location/brisbane-domestic-airport/,rolld_au,Roll’d Brisbane Domestic Airport,"Level 2, Domestic Airport Qantas Terminal Food Court, Dryandra Road, Brisbane Airport, QLD, 4008",,,,AU,+61 7 3188 0284,https://rolld.com.au/location/brisbane-domestic-airport/,,Roll'd,Q113114631
f179a72d-ca65-4633-ad05-8645d2d42e15,scania,Scania Australia Pty Ltd - Pinkenba,,Brisbane,,,AU,+61 7 3712 7900,,Mo-Fr 07:00-20:00; Sa 07:00-12:00,Scania,Q219960
