Ref,Spider,Name,Address,City,State,Zipcode,Country,Phone,Website,Hours,Brand,WikiData
329,davita,DaVita Cornerstone Dialysis,,Southfield,MI,,US,+1 833-309-3477,https://davita.com/locations/329,,DaVita,Q5207184
6004,davita,DaVita Cornerstone At Home,,Southfield,MI,,US,+1 833-404-2672,https://davita.com/locations/6004,,DaVita,Q5207184
9288,davita,DaVita Snf Dialysis At Hartford Nursing & Rehab-cornerstone,,Southfield,MI,,US,+1 800-424-6589,https://davita.com/locations/9288,,DaVita,Q5207184
9328,davita,DaVita Snf Dialysis At Notting Hill W Bloomfield-cornerstone,,Southfield,MI,,US,+1 800-424-6589,https://davita.com/locations/9328,,DaVita,Q5207184
9329,davita,DaVita Snf Dialysis At Regency At Troy-cornerstone,,Southfield,MI,,US,+1 800-424-6589,https://davita.com/locations/9329,,DaVita,Q5207184
,visa,,,SOUTHFIELD,MI,,US,,,,,
