Ref,Spider,Name,Address,City,State,Zipcode,Country,Phone,Website,Hours,Brand,WikiData
49298,seat_de,Autohaus Franz Lutz GmbH & Co. KG,,Mühlhausen,,,DE,+49 9548 92310,https://lutz.seat.de,,SEAT,Q188217
31922,sparkasse_de,Stadt- und Kreissparkasse Erlangen Höchstadt Herzogenaurach Geldautomat Mühlhausen,,Mühlhausen,,,DE,+49 9131 8243510,https://www.sparkasse.de/standorte/geldautomaten/stadt-und-kreissparkasse-erlangen-hoechstadt-herzogenaurach-geldautomat-muehlhausen-31922,Mo-Su 06:00-24:00,Sparkasse,Q13601825
12519,sparkasse_de,Stadt- und Kreissparkasse Erlangen Höchstadt Herzogenaurach Geschäftsstelle Mühlhausen,,Mühlhausen,,,DE,+49 9131 8243510,https://www.sparkasse.de/standorte/filialen/stadt-und-kreissparkasse-erlangen-hoechstadt-herzogenaurach-geschaeftsstelle-muehlhausen-12519,"Mo-Tu 09:30-12:30,14:00-16:00; We 09:30-12:30; Th 09:30-12:30,14:30-17:30; Fr 09:30-12:30",Sparkasse,Q13601825
,visa,,,MUEHLHAUSEN,,,DE,,,,,
https://www.vr.de/standorte/M/raiffeisenbank-dreifranken-eg-geschaeftsstelle-muehlhausen-19517.html,vr_bank,"Raiffeisenbank DreiFranken eG, Geschäftsstelle Mühlhausen",,Mühlhausen,,,DE,+49 9135 7190,https://www.rb-dreifranken.de,"Mo-Tu 08:30-12:00,15:00-17:00; Th 08:30-12:00,15:00-17:00",,
