Ref,Spider,Name,Address,City,State,Zipcode,Country,Phone,Website,Hours,Brand,WikiData
53326,easypay,EasyPay,SADOVO  ul. Yuriy Gagarin № 1,Obshtina Sadovo,Plovdiv,,BG,,,,EasyPay,Q110583289
37831,easypay,EasyPay,SADOVO  ul. Ivan Vazov 4,Obshtina Sadovo,Plovdiv,,BG,,,,EasyPay,Q110583289
53639,easypay,EasyPay,SADOVO kv. Tsentar ul. Aleksandar Stamboliyski 8,Obshtina Sadovo,Plovdiv,,BG,,,,EasyPay,Q110583289
,visa,,,SADOVO,PLOVDIV,,BG,,,,,
df23217145abf9450717926c5af9a470,western_union,CENTRAL COOPERATIVE BANK PLC,,Sadovo,PLOVDIV,,BG,(+359) 3118-82012,https://location.westernunion.com/bg/plovdiv/sadovo/df23217145abf9450717926c5af9a470,Mo-Sa 08:30-17:00,Western Union,Q861042
