Ref,Spider,Name,Address,City,State,Zipcode,Country,Phone,Website,Hours,Brand,WikiData
613071,beev_gb,"Vale of Leven District Hospital, Alexandria",,Main Street,,,GB,,,24/7,Be.EV,Q118263083
622144,charge_place_scotland_gb,"Vale of Leven District Hospital, Alexandria",,Main Street,,,GB,,https://chargeplacescotland.org/cpmap/chargepoint/622144/,,ChargePlace Scotland,Q105359316
https://www.nhsinform.scot/scotlands-service-directory/gp-practices/1527%201wdu1116,nhs_scotland_gb,Oakview Medical Practice,"Main Street, Alexandria, G83 0UA",,,,GB,,https://www.oakviewmedicalpractice.co.uk/,Mo-Fr 08:00-18:00,,
https://www.nhsinform.scot/scotlands-service-directory/aes-and-minor-injuries-units/9301%201wdu1116,nhs_scotland_gb,Vale of Leven District General Hospital (Minor Injuries Unit),"Main Street, Alexandria, G83 0UA",,,,GB,,https://www.nhsggc.scot/your-health/right-care-right-place/minor-injuries-unit/,Mo-Su 08:00-21:00,,
https://www.nhsinform.scot/scotlands-service-directory/hospitals/8997%201wdu1116,nhs_scotland_gb,Vale of Leven District General Hospital,"Main Street, Alexandria, G83 0UA",,,,GB,,https://www.nhsggc.scot/hospitals-services/our-hospitals/,24/7,,
https://www.nhsinform.scot/scotlands-service-directory/dental-services/3320%201wdu1116,nhs_scotland_gb,APCO Dental Care (Alexandria),"Vale Centre for Health & Care, Main Street, Alexandria, G83 0UA",,,,GB,,https://apcodental.co.uk/alexandria,Mo 08:30-17:45; Tu 08:30-19:30; We 08:30-17:45; Th 08:30-19:30; Fr 08:30-17:45,,
