City,Place Name,Zipcode,Name
unknown,wildberries,г. Аштарак (Арагацотнская обл) Г. Нарекаци 100/2,unknown,Wildberries
unknown,wildberries,г Апаран Улица Маршал Баграмяна 24,unknown,Wildberries
unknown,wildberries,село Кош 6-Я Улица 1-Й Переулок 1,unknown,Wildberries
unknown,wildberries,Аштарак Улица Тиграна Меца 43/1,unknown,Wildberries
unknown,wildberries,Талин Улица Степана Шаумяна 1,unknown,Wildberries
unknown,wildberries,Аштарак Улица Вардгеса Петросяна 4,unknown,Wildberries
unknown,wildberries,Аштарак Улица Ереванян 7,unknown,Wildberries
unknown,wildberries,село Ошакан Улица Месропа Маштоца 70,unknown,Wildberries
unknown,wildberries,Апаран Улица Гарегина Нжде 12,unknown,Wildberries
unknown,wildberries,село Норакерт Улица Комитаса 60,unknown,Wildberries
unknown,wildberries,село Цахкаовит Улица Октемберян 7,unknown,Wildberries
unknown,wildberries,село Арагацаван Шоссе Октемберян 74,unknown,Wildberries
unknown,wildberries,село Воскеваз 1-Й Переулок Маштоца 1,unknown,Wildberries
unknown,wildberries,село Шенаван 17-Я Улица 13,unknown,Wildberries
unknown,wildberries,Талин Улица Агаси Ханджяна 19/4,unknown,Wildberries
unknown,wildberries,село Арагац Komitas Street 22,unknown,Wildberries
unknown,wildberries,село Карби 1-Я Улица 49,unknown,Wildberries
unknown,wildberries,село Неркин Базмаберд 1-Й Переулок 3-Й Улицы 7/1,unknown,Wildberries
unknown,wildberries,Армавир Улица Навасардяна 59,unknown,Wildberries
unknown,wildberries,село Парпи Улица Саака Тарасяна 64,unknown,Wildberries
unknown,wildberries,село Карби 4-Я Улица 33,unknown,Wildberries
unknown,wildberries,село Бюракан 31-Я Улица 26,unknown,Wildberries
unknown,wildberries,село Арагац Улица Ахтанаки 15/1,unknown,Wildberries
