Ref,Spider,Name,Address,City,State,Zipcode,Country,Phone,Website,Hours,Brand,WikiData
8984643,baskin_robbins_in,Baskin Robbins Patliputra colony Patna,"M/S Shree Services, Shop No 3, Lgf, Hira Panna Arcade, Plot No 106, Patliputra Colony, Kurji, Patna - 800013",Patna,Bihar,,IN,+91 91379 82311,,,Baskin Robbins,Q584601
https://www.dominos.co.in/store-locations/patna/p-m-mall,dominos_pizza_in,Dominos Pizza P &amp; M MALL,"RTA01, 3rd Floor, Food Court, P &amp; M MallPlot No. C – 20 and C – 21 DighaMainpura, P.S. Patliputra, PATNA-600013PH.NO. 0612-2265449-56",Patna,Bihar,,IN,+91 22 2632 6699,https://www.dominos.co.in/store-locations/patna/p-m-mall,,Domino's Pizza,Q839466
https://www.dominos.co.in/store-locations/patna/boring-road-patna,dominos_pizza_in,Dominos Pizza BORING ROAD (PATNA),"RAJ TOWERGround Floor RAJ TOWER, BORING ROAD CROSSING, PATNA, PATNA, Bihar - 800013",Patna,Bihar,,IN,+91 22 2632 6699,https://www.dominos.co.in/store-locations/patna/boring-road-patna,,Domino's Pizza,Q839466
41069787-8d30-4b7e-b72c-73633c94935b,nike,Nike P&M Patna,,Patna,Bihar,,IN,+91 1800 344 6453,https://www.nike.com/retail/s/nike-p-m-patna,Mo-Su 10:00-21:00,Nike,Q483915
d08e46bb97b84b8ea7f5ec8563c15741,western_union,THE SOUTH INDIAN BANK LTD,,Patna,BIHAR,,IN,+91 612 226 4343,https://location.westernunion.com/in/bihar/patna/d08e46bb97b84b8ea7f5ec8563c15741,Mo-Sa 09:00-18:00,Western Union,Q861042
