Ref,Spider,Name,Address,City,State,Zipcode,Country,Phone,Website,Hours,Brand,WikiData
672df77f-0797-eb11-b1ac-000d3a2ed776,costa_coffee_gg_gb_im_je,Motor Fuel Group @ Murco Teddington Hands SS,,Teddington Hands,,,GB,,,Mo-Su 06:00-23:00,Costa Express,Q113556385
gcnxc4zuk9b2,gov_cma_fuel_gb,Texaco,"MFG Teddington Hands, A435-A438 Roundabout, Teddington Hands",,,,GB,,,,Texaco,Q775060
https://www.londis.co.uk/our-stores/texaco-teddington-service-station,londis_gb,Londis Texaco Teddington Service Station,,Teddington Hands,,,GB,+44 1386 725581,https://www.londis.co.uk/our-stores/texaco-teddington-service-station,,Londis,Q21008564
https://restaurants.subway.com/#14927402,subway,Subway Texaco Gas Station/C-Store,,Teddington Hands Texaco Garage,,,GB,+44 1386 725581,https://restaurants.subway.com/united-kingdom/en/teddington-hands/435-roundabout-texaco-garage,Mo-Su 08:00-19:00,Subway,Q244457
,visa,,,TEWKESBURY,,,GB,,,,,
