City,Place Name,Zipcode,Name
Auto Glass Replacement Shop in Pine Brook,safelite,,unknown,Safelite AutoGlass
Windshield Replacement Shop in Newton,safelite,,unknown,Safelite AutoGlass
Auto Glass Repair Shop In Montville,safelite,,unknown,Safelite AutoGlass
Auto Glass Shop in Hackettstown,safelite,,unknown,Safelite AutoGlass
Windshield Replacement Shop in Hasbrouck Heights,safelite,,unknown,Safelite AutoGlass
Windshield Replacement Shop in Freehold,safelite,,unknown,Safelite AutoGlass
Windshield Repair Shop in Brunswick,safelite,,unknown,Safelite AutoGlass
Auto Glass Shop in Cherry Hill,safelite,,unknown,Safelite AutoGlass
Auto Glass Shop in Bayonne,safelite,,unknown,Safelite AutoGlass
