City,Place Name,Zipcode,Name
unknown,wildberries,область Улытау Жезказган бульвар Гарышкерлер 7,unknown,Wildberries
Qaraghandy Qalasy,wildberries,г. Караганда (Карагандинская обл.) пр-кт. Бухар Жырау 46 /1,unknown,Wildberries
unknown,wildberries,г. Темиртау (Карагандинская область) проспект Металлургов д. 27,unknown,Wildberries
Qaraghandy Qalasy,wildberries,г. Караганда (Карагандинская область) проспект Строителей д. 31,unknown,Wildberries
unknown,wildberries,г. Балхаш (Карагандинская область) улица Уалиханова д. 2,unknown,Wildberries
Qaraghandy Qalasy,wildberries,г. Караганда (Карагандинская область) улица Ленина д. 43,unknown,Wildberries
unknown,wildberries,г.Темиртау (Карагандинская область) 8 мкр д. 109,unknown,Wildberries
Qaraghandy Qalasy,wildberries,г. Караганда (Карагандинская область) улица Гоголя д. 51,unknown,Wildberries
Qaraghandy Qalasy,wildberries,г. Караганда (Карагандинская область) мкр. Мамраева д. 29,unknown,Wildberries
Qaraghandy Qalasy,wildberries,г. Караганда (Карагандинская область) улица Ермекова д. 54/1,unknown,Wildberries
unknown,wildberries,Карагандинская область Абай улица Ержанова 14,unknown,Wildberries
unknown,wildberries,г. Шахтинск (Карагандинская область) Парковая улица д. 24,unknown,Wildberries
unknown,wildberries,г. Сарань ул. Горняк д. 131Б,unknown,Wildberries
unknown,wildberries,г. Сатпаев (Карагандинская обл) Улытауская 90,unknown,Wildberries
unknown,wildberries,г Жезказган (Карагандинская область) улица Пушкина 17,unknown,Wildberries
unknown,wildberries,Карагандинская область Караганда улица Крылова 50,unknown,Wildberries
unknown,wildberries,г Темиртау (Карагандинская обл) улица Калинина 51,unknown,Wildberries
Qaraghandy Qalasy,wildberries,Караганда Карагандинская область городской акимат Караганда улица Зелинского 26/1,unknown,Wildberries
Qaraghandy Qalasy,wildberries,Карагандинская область Караганда проспект Шахтёров 31/4,unknown,Wildberries
unknown,wildberries,Сарань Казахстан улица Абая 3,unknown,Wildberries
unknown,wildberries,г Темиртау Проспект Мира 106,unknown,Wildberries
unknown,wildberries,п Топар Улица Николаева 20,unknown,Wildberries
Qaraghandy Qalasy,wildberries,Караганда Казахстан улица Терешковой 41,unknown,Wildberries
Qaraghandy Qalasy,wildberries,Карагандинская область Караганда проспект Строителей 1,unknown,Wildberries
Qaraghandy Qalasy,wildberries,г Караганда Микрорайон Степной-4 20а,unknown,Wildberries
Qaraghandy Qalasy,wildberries,Карагандинская область Караганда улица Таттимбета 3,unknown,Wildberries
unknown,wildberries,Шахтинск Проспект Абая Кунанбаева 66,unknown,Wildberries
Qaraghandy Qalasy,wildberries,Карагандинская область Караганда улица Ерубаева 35,unknown,Wildberries
unknown,wildberries,Карагандинская область Балхаш улица Казбековой 19А,unknown,Wildberries
unknown,wildberries,Карагандинская область Балхаш улица Сейфуллина 1,unknown,Wildberries
unknown,wildberries,Карагандинская область Темиртау проспект Металлургов 10,unknown,Wildberries
unknown,wildberries,Карагандинская область Балхаш микрорайон Шашубая 8Б,unknown,Wildberries
Qaraghandy Qalasy,wildberries,Карагандинская область Караганда Магнитогорская улица 40,unknown,Wildberries
unknown,wildberries,Карагандинская область Темиртау улица Валиханова 2,unknown,Wildberries
unknown,wildberries,область Улытау Сатпаев улица Абая 58,unknown,Wildberries
Qaraghandy Qalasy,wildberries,Карагандинская область Караганда улица Маметовой 76,unknown,Wildberries
Qaraghandy Qalasy,wildberries,Карагандинская область Караганда 18-й микрорайон 8,unknown,Wildberries
unknown,wildberries,область Улытау Жезказган улица Сейфуллина 54,unknown,Wildberries
unknown,wildberries,Темиртау Проспект Республики 43,unknown,Wildberries
unknown,wildberries,область Улытау Сатпаев улица Ердена 173,unknown,Wildberries
Qaraghandy Qalasy,wildberries,Караганда Улица Байкена Ашимова 15,unknown,Wildberries
unknown,wildberries,Карагандинская область Темиртау улица Сакена Сейфуллина 34,unknown,Wildberries
Qaraghandy Qalasy,wildberries,Караганда Улица Ермекова 52,unknown,Wildberries
Qaraghandy Qalasy,wildberries,Карагандинская область Караганда микрорайон Степной-2 8,unknown,Wildberries
Qaraghandy Qalasy,wildberries,Карагандинская область Караганда улица Ержанова 40,unknown,Wildberries
unknown,wildberries,Темиртау Проспект Бауыржана Момышулы 53 а,unknown,Wildberries
unknown,wildberries,Шахтинск Молодёжная Улица 63\1,unknown,Wildberries
Qaraghandy Qalasy,wildberries,Караганда Улица Гоголя 57,unknown,Wildberries
Qaraghandy Qalasy,wildberries,Карагандинская область Караганда Ударная улица 2,unknown,Wildberries
unknown,wildberries,Караганда Улица Нахимова 46,unknown,Wildberries
Qaraghandy Qalasy,wildberries,Карагандинская область Караганда улица Лободы 25,unknown,Wildberries
Qaraghandy Qalasy,wildberries,Карагандинская область Караганда проспект Шахтёров 52,unknown,Wildberries
unknown,wildberries,Абай Проспект Победы 1/3,unknown,Wildberries
Qaraghandy Qalasy,wildberries,Караганда Методическая Улица 3,unknown,Wildberries
Qaraghandy Qalasy,wildberries,Караганда Улица Зелинского 24/3,unknown,Wildberries
unknown,wildberries,Темиртау 9-Й Микрорайон 3г,unknown,Wildberries
Qaraghandy Qalasy,wildberries,Караганда Улица Камали Дюсембекова 53/8,unknown,Wildberries
unknown,wildberries,Карагандинская область Сарань улица Победы 34,unknown,Wildberries
Qaraghandy Qalasy,wildberries,Караганда Улица Победы 119,unknown,Wildberries
unknown,wildberries,посёлок Новодолинский Центральная Улица 7,unknown,Wildberries
unknown,wildberries,Карагандинская область Шахтинск Казахстанская улица 124,unknown,Wildberries
Qaraghandy Qalasy,wildberries,Карагандинская область Караганда 14-й микрорайон 8,unknown,Wildberries
unknown,wildberries,посёлок Аршалы Улица Жумабека Ташенова 17,unknown,Wildberries
Qaraghandy Qalasy,wildberries,Караганда Улица Сатыбалдина 11/6,unknown,Wildberries
unknown,wildberries,Карагандинская область Абай улица Абая 21,unknown,Wildberries
Qaraghandy Qalasy,wildberries,Караганда Улица Муканова 84,unknown,Wildberries
Qaraghandy Qalasy,wildberries,Караганда Улица Гапеева 17/4,unknown,Wildberries
Qaraghandy Qalasy,wildberries,Караганда Улица Муканова 43/21блокб,unknown,Wildberries
unknown,wildberries,поселок Осакаровка Улица Гагарина 3/1,unknown,Wildberries
Qaraghandy Qalasy,wildberries,Караганда Улица Язева 10,unknown,Wildberries
unknown,wildberries,Караганда Первомайская Улица 12,unknown,Wildberries
unknown,wildberries,посёлок Молодёжный Улица 1-Й Квартал 5,unknown,Wildberries
unknown,wildberries,посёлок Топар Улица Сары Арка 48,unknown,Wildberries
Qaraghandy Qalasy,wildberries,Караганда Улица Гоголя 50/1,unknown,Wildberries
unknown,wildberries,Жезказган Улица Сейфуллина 17,unknown,Wildberries
unknown,wildberries,посёлок Аршалы Улица Митченко 42б,unknown,Wildberries
unknown,wildberries,Темиртау 70-Й Квартал 10,unknown,Wildberries
unknown,wildberries,Шахтинск Проспект Абая Кунанбаева 76,unknown,Wildberries
unknown,wildberries,Темиртау Улица Чернышевского 89,unknown,Wildberries
Qaraghandy Qalasy,wildberries,Караганда Микрорайон Орбита 25/2,unknown,Wildberries
Qaraghandy Qalasy,wildberries,Карагандинская область Караганда микрорайон Степной-1 6/44,unknown,Wildberries
Qaraghandy Qalasy,wildberries,Карагандинская область Караганда микрорайон Степной-1 17,unknown,Wildberries
Qaraghandy Qalasy,wildberries,Карагандинская область Караганда улица Муканова 55Б,unknown,Wildberries
unknown,wildberries,Темиртау Проспект Металлургов 17,unknown,Wildberries
Qaraghandy Qalasy,wildberries,Карагандинская область Караганда 11-й квартал 7А,unknown,Wildberries
unknown,wildberries,Карагандинская область Караганда Анжерская улица 39,unknown,Wildberries
unknown,wildberries,поселок Актас Космическая Улица 9,unknown,Wildberries
Qaraghandy Qalasy,wildberries,Караганда Проспект Нуркена Абдирова 14,unknown,Wildberries
Qaraghandy Qalasy,wildberries,Караганда Проспект Шахтёров 73/1,unknown,Wildberries
unknown,wildberries,поселок Шахан 15-Й Квартал с7/1,unknown,Wildberries
unknown,wildberries,Абай Улица 10 Лет Независимости 24,unknown,Wildberries
Qaraghandy Qalasy,wildberries,Карагандинская область Караганда 12-й микрорайон 26А,unknown,Wildberries
Qaraghandy Qalasy,wildberries,Караганда Улица Касыма Аманжолова 45,unknown,Wildberries
unknown,wildberries,Шахтинск Улица Виктора Хара 5,unknown,Wildberries
unknown,wildberries,Караганда Речная Улица 40/1,unknown,Wildberries
unknown,wildberries,Сатпаев Улица Наурыз 3а,unknown,Wildberries
Qaraghandy Qalasy,wildberries,Карагандинская область Караганда улица Молокова 88,unknown,Wildberries
unknown,wildberries,Темиртау Улица Панфилова 20,unknown,Wildberries
Qaraghandy Qalasy,wildberries,Карагандинская область Караганда проспект Нурсултана Назарбаева 63,unknown,Wildberries
unknown,wildberries,Карагандинская область Караганда улица Мануильского 21,unknown,Wildberries
unknown,wildberries,область Улытау Жезказган улица Абая Кунанбаева 83,unknown,Wildberries
unknown,wildberries,поселок Ботакара Поселок Ботакара 37в,unknown,Wildberries
unknown,wildberries,поселок Жанаарка Проспект Сейфуллина 7,unknown,Wildberries
unknown,wildberries,Карагандинская область Сарань улица Жамбыла 74,unknown,Wildberries
unknown,wildberries,Карагандинская область Караганда Библиотечная улица 37,unknown,Wildberries
Qaraghandy Qalasy,wildberries,Карагандинская область Караганда микрорайон Степной-1 5/8,unknown,Wildberries
unknown,wildberries,Карагандинская область Шахтинск улица 40-летия Победы 44,unknown,Wildberries
Qaraghandy Qalasy,wildberries,Караганда Проспект Нурсултана Назарбаева 14,unknown,Wildberries
unknown,wildberries,Темиртау Микрорайон 3А 4,unknown,Wildberries
unknown,wildberries,посёлок Долинка Улица Жуалы 57/4,unknown,Wildberries
Qaraghandy Qalasy,wildberries,Караганда Штурманская Улица 1/1,unknown,Wildberries
Qaraghandy Qalasy,wildberries,Караганда Микрорайон Голубые Пруды 7,unknown,Wildberries
