Ref,Spider,Name,Address,City,State,Zipcode,Country,Phone,Website,Hours,Brand,WikiData
41990,easypay,EasyPay,NOVI ISKAR  ul. Hristo Botev 49,Stolichna Obshtina,Sofia-Capital,,BG,,,,EasyPay,Q110583289
32608,easypay,EasyPay,NOVI ISKAR  ul.Iskarsko Defile № 255,Stolichna Obshtina,Sofia-Capital,,BG,,,,EasyPay,Q110583289
37555,easypay,EasyPay,NOVI ISKAR kv. Kurilo ul.Targovska 1,Stolichna Obshtina,Sofia-Capital,,BG,,,,EasyPay,Q110583289
52080,easypay,EasyPay,NOVI ISKAR kv. Kurilo ul. Chavdar Voyvoda; teren 26,Stolichna Obshtina,Sofia-Capital,,BG,,,,EasyPay,Q110583289
40551,easypay,EasyPay,NOVI ISKAR kv. kv. Kumaritsa ul. Iskarsko defile 110,Stolichna Obshtina,Sofia-Capital,,BG,,,,EasyPay,Q110583289
43774,easypay,EasyPay,NOVI ISKAR kv. kv.Kumaritsa ul.Iskarsko defile 116,Stolichna Obshtina,Sofia-Capital,,BG,,,,EasyPay,Q110583289
